1449991624.827144 IP localhost.58589 > localhost.http-alt: Flags [S], seq 1411035063, win 43690, options [mss 65495,sackOK,TS val 4983558 ecr 0,nop,wscale 7], length 0
1449991624.827251 IP localhost.http-alt > localhost.58589: Flags [S.], seq 761578339, ack 1411035064, win 43690, options [mss 65495,sackOK,TS val 4983558 ecr 4983558,nop,wscale 7], length 0
1449991624.827323 IP localhost.58589 > localhost.http-alt: Flags [.], ack 1, win 342, options [nop,nop,TS val 4983558 ecr 4983558], length 0
1449991624.827485 IP localhost.58590 > localhost.http-alt: Flags [S], seq 426060105, win 43690, options [mss 65495,sackOK,TS val 4983558 ecr 0,nop,wscale 7], length 0
1449991624.827558 IP localhost.http-alt > localhost.58590: Flags [S.], seq 3814405633, ack 426060106, win 43690, options [mss 65495,sackOK,TS val 4983558 ecr 4983558,nop,wscale 7], length 0
1449991624.827636 IP localhost.58590 > localhost.http-alt: Flags [.], ack 1, win 342, options [nop,nop,TS val 4983558 ecr 4983558], length 0
1449991624.828072 IP localhost.58591 > localhost.http-alt: Flags [S], seq 2732602298, win 43690, options [mss 65495,sackOK,TS val 4983558 ecr 0,nop,wscale 7], length 0
1449991624.828157 IP localhost.http-alt > localhost.58591: Flags [S.], seq 1868906704, ack 2732602299, win 43690, options [mss 65495,sackOK,TS val 4983558 ecr 4983558,nop,wscale 7], length 0
1449991624.828233 IP localhost.58591 > localhost.http-alt: Flags [.], ack 1, win 342, options [nop,nop,TS val 4983558 ecr 4983558], length 0
1449991624.828409 IP localhost.58592 > localhost.http-alt: Flags [S], seq 318630769, win 43690, options [mss 65495,sackOK,TS val 4983558 ecr 0,nop,wscale 7], length 0
1449991624.828473 IP localhost.http-alt > localhost.58592: Flags [S.], seq 3371463674, ack 318630770, win 43690, options [mss 65495,sackOK,TS val 4983558 ecr 4983558,nop,wscale 7], length 0
1449991624.828560 IP localhost.58592 > localhost.http-alt: Flags [.], ack 1, win 342, options [nop,nop,TS val 4983558 ecr 4983558], length 0
1449991624.828714 IP localhost.58593 > localhost.http-alt: Flags [S], seq 2270377433, win 43690, options [mss 65495,sackOK,TS val 4983558 ecr 0,nop,wscale 7], length 0
1449991624.828785 IP localhost.http-alt > localhost.58593: Flags [S.], seq 1459503144, ack 2270377434, win 43690, options [mss 65495,sackOK,TS val 4983558 ecr 4983558,nop,wscale 7], length 0
1449991624.828841 IP localhost.58593 > localhost.http-alt: Flags [.], ack 1, win 342, options [nop,nop,TS val 4983558 ecr 4983558], length 0
1449991624.879052 IP localhost.http-alt > localhost.58589: Flags [P.], seq 1:1027, ack 1, win 342, options [nop,nop,TS val 4983571 ecr 4983558], length 1026
1449991624.879282 IP localhost.58589 > localhost.http-alt: Flags [.], ack 1027, win 358, options [nop,nop,TS val 4983571 ecr 4983571], length 0
1449991624.929068 IP localhost.http-alt > localhost.58590: Flags [P.], seq 1:1027, ack 1, win 342, options [nop,nop,TS val 4983583 ecr 4983558], length 1026
1449991624.929294 IP localhost.58590 > localhost.http-alt: Flags [.], ack 1027, win 358, options [nop,nop,TS val 4983583 ecr 4983583], length 0
1449991624.979047 IP localhost.http-alt > localhost.58591: Flags [P.], seq 1:1027, ack 1, win 342, options [nop,nop,TS val 4983596 ecr 4983558], length 1026
1449991624.979263 IP localhost.58591 > localhost.http-alt: Flags [.], ack 1027, win 358, options [nop,nop,TS val 4983596 ecr 4983596], length 0
1449991625.029048 IP localhost.http-alt > localhost.58592: Flags [P.], seq 1:1027, ack 1, win 342, options [nop,nop,TS val 4983608 ecr 4983558], length 1026
1449991625.029254 IP localhost.58592 > localhost.http-alt: Flags [.], ack 1027, win 358, options [nop,nop,TS val 4983608 ecr 4983608], length 0
1449991625.079048 IP localhost.http-alt > localhost.58593: Flags [P.], seq 1:1027, ack 1, win 342, options [nop,nop,TS val 4983621 ecr 4983558], length 1026
1449991625.079252 IP localhost.58593 > localhost.http-alt: Flags [.], ack 1027, win 358, options [nop,nop,TS val 4983621 ecr 4983621], length 0
1449991625.129082 IP localhost.http-alt > localhost.58589: Flags [P.], seq 1027:2053, ack 1, win 342, options [nop,nop,TS val 4983633 ecr 4983571], length 1026
1449991625.129245 IP localhost.58589 > localhost.http-alt: Flags [.], ack 2053, win 374, options [nop,nop,TS val 4983633 ecr 4983633], length 0
1449991625.179107 IP localhost.http-alt > localhost.58590: Flags [P.], seq 1027:2053, ack 1, win 342, options [nop,nop,TS val 4983646 ecr 4983583], length 1026
1449991625.179373 IP localhost.58590 > localhost.http-alt: Flags [.], ack 2053, win 374, options [nop,nop,TS val 4983646 ecr 4983646], length 0
1449991625.229068 IP localhost.http-alt > localhost.58591: Flags [P.], seq 1027:2053, ack 1, win 342, options [nop,nop,TS val 4983658 ecr 4983596], length 1026
1449991625.229277 IP localhost.58591 > localhost.http-alt: Flags [.], ack 2053, win 374, options [nop,nop,TS val 4983658 ecr 4983658], length 0
1449991625.279036 IP localhost.http-alt > localhost.58592: Flags [P.], seq 1027:2053, ack 1, win 342, options [nop,nop,TS val 4983671 ecr 4983608], length 1026
1449991625.279161 IP localhost.58592 > localhost.http-alt: Flags [.], ack 2053, win 374, options [nop,nop,TS val 4983671 ecr 4983671], length 0
1449991625.329033 IP localhost.http-alt > localhost.58593: Flags [P.], seq 1027:2053, ack 1, win 342, options [nop,nop,TS val 4983683 ecr 4983621], length 1026
1449991625.329155 IP localhost.58593 > localhost.http-alt: Flags [.], ack 2053, win 374, options [nop,nop,TS val 4983683 ecr 4983683], length 0
1449991625.379044 IP localhost.http-alt > localhost.58589: Flags [P.], seq 2053:3079, ack 1, win 342, options [nop,nop,TS val 4983696 ecr 4983633], length 1026
1449991625.379174 IP localhost.58589 > localhost.http-alt: Flags [.], ack 3079, win 390, options [nop,nop,TS val 4983696 ecr 4983696], length 0
1449991625.429033 IP localhost.http-alt > localhost.58590: Flags [P.], seq 2053:3079, ack 1, win 342, options [nop,nop,TS val 4983708 ecr 4983646], length 1026
1449991625.429153 IP localhost.58590 > localhost.http-alt: Flags [.], ack 3079, win 390, options [nop,nop,TS val 4983708 ecr 4983708], length 0
1449991625.479076 IP localhost.http-alt > localhost.58591: Flags [P.], seq 2053:3079, ack 1, win 342, options [nop,nop,TS val 4983721 ecr 4983658], length 1026
1449991625.479258 IP localhost.58591 > localhost.http-alt: Flags [.], ack 3079, win 390, options [nop,nop,TS val 4983721 ecr 4983721], length 0
1449991625.529092 IP localhost.http-alt > localhost.58592: Flags [P.], seq 2053:3079, ack 1, win 342, options [nop,nop,TS val 4983733 ecr 4983671], length 1026
1449991625.529357 IP localhost.58592 > localhost.http-alt: Flags [.], ack 3079, win 390, options [nop,nop,TS val 4983733 ecr 4983733], length 0
1449991625.579042 IP localhost.http-alt > localhost.58593: Flags [P.], seq 2053:3079, ack 1, win 342, options [nop,nop,TS val 4983746 ecr 4983683], length 1026
1449991625.579165 IP localhost.58593 > localhost.http-alt: Flags [.], ack 3079, win 390, options [nop,nop,TS val 4983746 ecr 4983746], length 0
1449991625.629081 IP localhost.http-alt > localhost.58589: Flags [P.], seq 3079:4105, ack 1, win 342, options [nop,nop,TS val 4983758 ecr 4983696], length 1026
1449991625.629318 IP localhost.58589 > localhost.http-alt: Flags [.], ack 4105, win 406, options [nop,nop,TS val 4983758 ecr 4983758], length 0
1449991625.679043 IP localhost.http-alt > localhost.58590: Flags [P.], seq 3079:4105, ack 1, win 342, options [nop,nop,TS val 4983771 ecr 4983708], length 1026
1449991625.679169 IP localhost.58590 > localhost.http-alt: Flags [.], ack 4105, win 406, options [nop,nop,TS val 4983771 ecr 4983771], length 0
1449991625.729026 IP localhost.http-alt > localhost.58591: Flags [P.], seq 3079:4105, ack 1, win 342, options [nop,nop,TS val 4983783 ecr 4983721], length 1026
1449991625.729135 IP localhost.58591 > localhost.http-alt: Flags [.], ack 4105, win 406, options [nop,nop,TS val 4983783 ecr 4983783], length 0
1449991625.779074 IP localhost.http-alt > localhost.58592: Flags [P.], seq 3079:4105, ack 1, win 342, options [nop,nop,TS val 4983796 ecr 4983733], length 1026
1449991625.779296 IP localhost.58592 > localhost.http-alt: Flags [.], ack 4105, win 406, options [nop,nop,TS val 4983796 ecr 4983796], length 0
1449991625.829098 IP localhost.http-alt > localhost.58593: Flags [P.], seq 3079:4105, ack 1, win 342, options [nop,nop,TS val 4983808 ecr 4983746], length 1026
1449991625.829339 IP localhost.58593 > localhost.http-alt: Flags [.], ack 4105, win 406, options [nop,nop,TS val 4983808 ecr 4983808], length 0
1449991625.879033 IP localhost.http-alt > localhost.58589: Flags [P.], seq 4105:5131, ack 1, win 342, options [nop,nop,TS val 4983821 ecr 4983758], length 1026
1449991625.879153 IP localhost.58589 > localhost.http-alt: Flags [.], ack 5131, win 422, options [nop,nop,TS val 4983821 ecr 4983821], length 0
1449991625.929075 IP localhost.http-alt > localhost.58590: Flags [P.], seq 4105:5131, ack 1, win 342, options [nop,nop,TS val 4983833 ecr 4983771], length 1026
1449991625.929303 IP localhost.58590 > localhost.http-alt: Flags [.], ack 5131, win 422, options [nop,nop,TS val 4983833 ecr 4983833], length 0
1449991625.979054 IP localhost.http-alt > localhost.58591: Flags [P.], seq 4105:5131, ack 1, win 342, options [nop,nop,TS val 4983846 ecr 4983783], length 1026
1449991625.979253 IP localhost.58591 > localhost.http-alt: Flags [.], ack 5131, win 422, options [nop,nop,TS val 4983846 ecr 4983846], length 0
1449991626.029039 IP localhost.http-alt > localhost.58592: Flags [P.], seq 4105:5131, ack 1, win 342, options [nop,nop,TS val 4983858 ecr 4983796], length 1026
1449991626.029152 IP localhost.58592 > localhost.http-alt: Flags [.], ack 5131, win 422, options [nop,nop,TS val 4983858 ecr 4983858], length 0
1449991626.079069 IP localhost.http-alt > localhost.58593: Flags [P.], seq 4105:5131, ack 1, win 342, options [nop,nop,TS val 4983871 ecr 4983808], length 1026
1449991626.079283 IP localhost.58593 > localhost.http-alt: Flags [.], ack 5131, win 422, options [nop,nop,TS val 4983871 ecr 4983871], length 0
1449991626.129026 IP localhost.http-alt > localhost.58589: Flags [P.], seq 5131:6157, ack 1, win 342, options [nop,nop,TS val 4983883 ecr 4983821], length 1026
1449991626.129154 IP localhost.58589 > localhost.http-alt: Flags [.], ack 6157, win 438, options [nop,nop,TS val 4983883 ecr 4983883], length 0
1449991626.179049 IP localhost.http-alt > localhost.58590: Flags [P.], seq 5131:6157, ack 1, win 342, options [nop,nop,TS val 4983896 ecr 4983833], length 1026
1449991626.179172 IP localhost.58590 > localhost.http-alt: Flags [.], ack 6157, win 438, options [nop,nop,TS val 4983896 ecr 4983896], length 0
1449991626.229050 IP localhost.http-alt > localhost.58591: Flags [P.], seq 5131:6157, ack 1, win 342, options [nop,nop,TS val 4983908 ecr 4983846], length 1026
1449991626.229221 IP localhost.58591 > localhost.http-alt: Flags [.], ack 6157, win 438, options [nop,nop,TS val 4983908 ecr 4983908], length 0
1449991626.279020 IP localhost.http-alt > localhost.58592: Flags [P.], seq 5131:6157, ack 1, win 342, options [nop,nop,TS val 4983921 ecr 4983858], length 1026
1449991626.279133 IP localhost.58592 > localhost.http-alt: Flags [.], ack 6157, win 438, options [nop,nop,TS val 4983921 ecr 4983921], length 0
1449991626.329052 IP localhost.http-alt > localhost.58593: Flags [P.], seq 5131:6157, ack 1, win 342, options [nop,nop,TS val 4983933 ecr 4983871], length 1026
1449991626.329213 IP localhost.58593 > localhost.http-alt: Flags [.], ack 6157, win 438, options [nop,nop,TS val 4983933 ecr 4983933], length 0
1449991626.379053 IP localhost.http-alt > localhost.58589: Flags [P.], seq 6157:7183, ack 1, win 342, options [nop,nop,TS val 4983946 ecr 4983883], length 1026
1449991626.379153 IP localhost.58589 > localhost.http-alt: Flags [.], ack 7183, win 454, options [nop,nop,TS val 4983946 ecr 4983946], length 0
1449991626.429054 IP localhost.http-alt > localhost.58590: Flags [P.], seq 6157:7183, ack 1, win 342, options [nop,nop,TS val 4983958 ecr 4983896], length 1026
1449991626.429234 IP localhost.58590 > localhost.http-alt: Flags [.], ack 7183, win 454, options [nop,nop,TS val 4983958 ecr 4983958], length 0
1449991626.479121 IP localhost.http-alt > localhost.58591: Flags [P.], seq 6157:7183, ack 1, win 342, options [nop,nop,TS val 4983971 ecr 4983908], length 1026
1449991626.479383 IP localhost.58591 > localhost.http-alt: Flags [.], ack 7183, win 454, options [nop,nop,TS val 4983971 ecr 4983971], length 0
1449991626.529171 IP localhost.http-alt > localhost.58592: Flags [P.], seq 6157:7183, ack 1, win 342, options [nop,nop,TS val 4983983 ecr 4983921], length 1026
1449991626.529423 IP localhost.58592 > localhost.http-alt: Flags [.], ack 7183, win 454, options [nop,nop,TS val 4983983 ecr 4983983], length 0
1449991626.579055 IP localhost.http-alt > localhost.58593: Flags [P.], seq 6157:7183, ack 1, win 342, options [nop,nop,TS val 4983996 ecr 4983933], length 1026
1449991626.579250 IP localhost.58593 > localhost.http-alt: Flags [.], ack 7183, win 454, options [nop,nop,TS val 4983996 ecr 4983996], length 0
1449991626.629083 IP localhost.http-alt > localhost.58589: Flags [P.], seq 7183:8209, ack 1, win 342, options [nop,nop,TS val 4984008 ecr 4983946], length 1026
1449991626.629321 IP localhost.58589 > localhost.http-alt: Flags [.], ack 8209, win 470, options [nop,nop,TS val 4984008 ecr 4984008], length 0
1449991626.679025 IP localhost.http-alt > localhost.58590: Flags [P.], seq 7183:8209, ack 1, win 342, options [nop,nop,TS val 4984021 ecr 4983958], length 1026
1449991626.679210 IP localhost.58590 > localhost.http-alt: Flags [.], ack 8209, win 470, options [nop,nop,TS val 4984021 ecr 4984021], length 0
1449991626.729036 IP localhost.http-alt > localhost.58591: Flags [P.], seq 7183:8209, ack 1, win 342, options [nop,nop,TS val 4984033 ecr 4983971], length 1026
1449991626.729162 IP localhost.58591 > localhost.http-alt: Flags [.], ack 8209, win 470, options [nop,nop,TS val 4984033 ecr 4984033], length 0
1449991626.779108 IP localhost.http-alt > localhost.58592: Flags [P.], seq 7183:8209, ack 1, win 342, options [nop,nop,TS val 4984046 ecr 4983983], length 1026
1449991626.779392 IP localhost.58592 > localhost.http-alt: Flags [.], ack 8209, win 470, options [nop,nop,TS val 4984046 ecr 4984046], length 0
1449991626.829084 IP localhost.http-alt > localhost.58593: Flags [P.], seq 7183:8209, ack 1, win 342, options [nop,nop,TS val 4984058 ecr 4983996], length 1026
1449991626.829318 IP localhost.58593 > localhost.http-alt: Flags [.], ack 8209, win 470, options [nop,nop,TS val 4984058 ecr 4984058], length 0
1449991626.879049 IP localhost.http-alt > localhost.58589: Flags [P.], seq 8209:9235, ack 1, win 342, options [nop,nop,TS val 4984071 ecr 4984008], length 1026
1449991626.879164 IP localhost.58589 > localhost.http-alt: Flags [.], ack 9235, win 486, options [nop,nop,TS val 4984071 ecr 4984071], length 0
1449991626.929074 IP localhost.http-alt > localhost.58590: Flags [P.], seq 8209:9235, ack 1, win 342, options [nop,nop,TS val 4984083 ecr 4984021], length 1026
1449991626.929222 IP localhost.58590 > localhost.http-alt: Flags [.], ack 9235, win 486, options [nop,nop,TS val 4984083 ecr 4984083], length 0
1449991626.979080 IP localhost.http-alt > localhost.58591: Flags [P.], seq 8209:9235, ack 1, win 342, options [nop,nop,TS val 4984096 ecr 4984033], length 1026
1449991626.979265 IP localhost.58591 > localhost.http-alt: Flags [.], ack 9235, win 486, options [nop,nop,TS val 4984096 ecr 4984096], length 0
1449991627.029111 IP localhost.http-alt > localhost.58592: Flags [P.], seq 8209:9235, ack 1, win 342, options [nop,nop,TS val 4984108 ecr 4984046], length 1026
1449991627.029368 IP localhost.58592 > localhost.http-alt: Flags [.], ack 9235, win 486, options [nop,nop,TS val 4984108 ecr 4984108], length 0
1449991627.079064 IP localhost.http-alt > localhost.58593: Flags [P.], seq 8209:9235, ack 1, win 342, options [nop,nop,TS val 4984121 ecr 4984058], length 1026
1449991627.079263 IP localhost.58593 > localhost.http-alt: Flags [.], ack 9235, win 486, options [nop,nop,TS val 4984121 ecr 4984121], length 0
1449991627.129034 IP localhost.http-alt > localhost.58589: Flags [P.], seq 9235:10261, ack 1, win 342, options [nop,nop,TS val 4984133 ecr 4984071], length 1026
1449991627.129126 IP localhost.58589 > localhost.http-alt: Flags [.], ack 10261, win 502, options [nop,nop,TS val 4984133 ecr 4984133], length 0
1449991627.179113 IP localhost.http-alt > localhost.58590: Flags [P.], seq 9235:10261, ack 1, win 342, options [nop,nop,TS val 4984146 ecr 4984083], length 1026
1449991627.179401 IP localhost.58590 > localhost.http-alt: Flags [.], ack 10261, win 502, options [nop,nop,TS val 4984146 ecr 4984146], length 0
1449991627.229064 IP localhost.http-alt > localhost.58591: Flags [P.], seq 9235:10261, ack 1, win 342, options [nop,nop,TS val 4984158 ecr 4984096], length 1026
1449991627.229260 IP localhost.58591 > localhost.http-alt: Flags [.], ack 10261, win 502, options [nop,nop,TS val 4984158 ecr 4984158], length 0
1449991627.279042 IP localhost.http-alt > localhost.58592: Flags [P.], seq 9235:10261, ack 1, win 342, options [nop,nop,TS val 4984171 ecr 4984108], length 1026
1449991627.279166 IP localhost.58592 > localhost.http-alt: Flags [.], ack 10261, win 502, options [nop,nop,TS val 4984171 ecr 4984171], length 0
1449991627.329095 IP localhost.http-alt > localhost.58593: Flags [P.], seq 9235:10261, ack 1, win 342, options [nop,nop,TS val 4984183 ecr 4984121], length 1026
1449991627.329297 IP localhost.58593 > localhost.http-alt: Flags [.], ack 10261, win 502, options [nop,nop,TS val 4984183 ecr 4984183], length 0
1449991627.379140 IP localhost.http-alt > localhost.58589: Flags [P.], seq 10261:11287, ack 1, win 342, options [nop,nop,TS val 4984196 ecr 4984133], length 1026
1449991627.379430 IP localhost.58589 > localhost.http-alt: Flags [.], ack 11287, win 518, options [nop,nop,TS val 4984196 ecr 4984196], length 0
1449991627.429065 IP localhost.http-alt > localhost.58590: Flags [P.], seq 10261:11287, ack 1, win 342, options [nop,nop,TS val 4984208 ecr 4984146], length 1026
1449991627.429189 IP localhost.58590 > localhost.http-alt: Flags [.], ack 11287, win 518, options [nop,nop,TS val 4984208 ecr 4984208], length 0
1449991627.479024 IP localhost.http-alt > localhost.58591: Flags [P.], seq 10261:11287, ack 1, win 342, options [nop,nop,TS val 4984221 ecr 4984158], length 1026
1449991627.479143 IP localhost.58591 > localhost.http-alt: Flags [.], ack 11287, win 518, options [nop,nop,TS val 4984221 ecr 4984221], length 0
1449991627.529025 IP localhost.http-alt > localhost.58592: Flags [P.], seq 10261:11287, ack 1, win 342, options [nop,nop,TS val 4984233 ecr 4984171], length 1026
1449991627.529143 IP localhost.58592 > localhost.http-alt: Flags [.], ack 11287, win 518, options [nop,nop,TS val 4984233 ecr 4984233], length 0
1449991627.579062 IP localhost.http-alt > localhost.58593: Flags [P.], seq 10261:11287, ack 1, win 342, options [nop,nop,TS val 4984246 ecr 4984183], length 1026
1449991627.579195 IP localhost.58593 > localhost.http-alt: Flags [.], ack 11287, win 518, options [nop,nop,TS val 4984246 ecr 4984246], length 0
1449991627.629062 IP localhost.http-alt > localhost.58589: Flags [P.], seq 11287:12313, ack 1, win 342, options [nop,nop,TS val 4984258 ecr 4984196], length 1026
1449991627.629187 IP localhost.58589 > localhost.http-alt: Flags [.], ack 12313, win 534, options [nop,nop,TS val 4984258 ecr 4984258], length 0
1449991627.679056 IP localhost.http-alt > localhost.58590: Flags [P.], seq 11287:12313, ack 1, win 342, options [nop,nop,TS val 4984271 ecr 4984208], length 1026
1449991627.679177 IP localhost.58590 > localhost.http-alt: Flags [.], ack 12313, win 534, options [nop,nop,TS val 4984271 ecr 4984271], length 0
1449991627.729069 IP localhost.http-alt > localhost.58591: Flags [P.], seq 11287:12313, ack 1, win 342, options [nop,nop,TS val 4984283 ecr 4984221], length 1026
1449991627.729323 IP localhost.58591 > localhost.http-alt: Flags [.], ack 12313, win 534, options [nop,nop,TS val 4984283 ecr 4984283], length 0
1449991627.779111 IP localhost.http-alt > localhost.58592: Flags [P.], seq 11287:12313, ack 1, win 342, options [nop,nop,TS val 4984296 ecr 4984233], length 1026
1449991627.779419 IP localhost.58592 > localhost.http-alt: Flags [.], ack 12313, win 534, options [nop,nop,TS val 4984296 ecr 4984296], length 0
1449991627.829039 IP localhost.http-alt > localhost.58593: Flags [P.], seq 11287:12313, ack 1, win 342, options [nop,nop,TS val 4984308 ecr 4984246], length 1026
1449991627.829159 IP localhost.58593 > localhost.http-alt: Flags [.], ack 12313, win 534, options [nop,nop,TS val 4984308 ecr 4984308], length 0
1449991627.879083 IP localhost.http-alt > localhost.58589: Flags [P.], seq 12313:13339, ack 1, win 342, options [nop,nop,TS val 4984321 ecr 4984258], length 1026
1449991627.879324 IP localhost.58589 > localhost.http-alt: Flags [.], ack 13339, win 550, options [nop,nop,TS val 4984321 ecr 4984321], length 0
1449991627.929070 IP localhost.http-alt > localhost.58590: Flags [P.], seq 12313:13339, ack 1, win 342, options [nop,nop,TS val 4984333 ecr 4984271], length 1026
1449991627.929279 IP localhost.58590 > localhost.http-alt: Flags [.], ack 13339, win 550, options [nop,nop,TS val 4984333 ecr 4984333], length 0
1449991627.979176 IP localhost.http-alt > localhost.58591: Flags [P.], seq 12313:13339, ack 1, win 342, options [nop,nop,TS val 4984346 ecr 4984283], length 1026
1449991627.979448 IP localhost.58591 > localhost.http-alt: Flags [.], ack 13339, win 550, options [nop,nop,TS val 4984346 ecr 4984346], length 0
1449991628.029063 IP localhost.http-alt > localhost.58592: Flags [P.], seq 12313:13339, ack 1, win 342, options [nop,nop,TS val 4984358 ecr 4984296], length 1026
1449991628.029258 IP localhost.58592 > localhost.http-alt: Flags [.], ack 13339, win 550, options [nop,nop,TS val 4984358 ecr 4984358], length 0
1449991628.079085 IP localhost.http-alt > localhost.58593: Flags [P.], seq 12313:13339, ack 1, win 342, options [nop,nop,TS val 4984371 ecr 4984308], length 1026
1449991628.079333 IP localhost.58593 > localhost.http-alt: Flags [.], ack 13339, win 550, options [nop,nop,TS val 4984371 ecr 4984371], length 0
1449991628.129061 IP localhost.http-alt > localhost.58589: Flags [P.], seq 13339:14365, ack 1, win 342, options [nop,nop,TS val 4984383 ecr 4984321], length 1026
1449991628.129227 IP localhost.58589 > localhost.http-alt: Flags [.], ack 14365, win 566, options [nop,nop,TS val 4984383 ecr 4984383], length 0
1449991628.179070 IP localhost.http-alt > localhost.58590: Flags [P.], seq 13339:14365, ack 1, win 342, options [nop,nop,TS val 4984396 ecr 4984333], length 1026
1449991628.179216 IP localhost.58590 > localhost.http-alt: Flags [.], ack 14365, win 566, options [nop,nop,TS val 4984396 ecr 4984396], length 0
1449991628.229041 IP localhost.http-alt > localhost.58591: Flags [P.], seq 13339:14365, ack 1, win 342, options [nop,nop,TS val 4984408 ecr 4984346], length 1026
1449991628.229157 IP localhost.58591 > localhost.http-alt: Flags [.], ack 14365, win 566, options [nop,nop,TS val 4984408 ecr 4984408], length 0
1449991628.279073 IP localhost.http-alt > localhost.58592: Flags [P.], seq 13339:14365, ack 1, win 342, options [nop,nop,TS val 4984421 ecr 4984358], length 1026
1449991628.279195 IP localhost.58592 > localhost.http-alt: Flags [.], ack 14365, win 566, options [nop,nop,TS val 4984421 ecr 4984421], length 0
1449991628.329022 IP localhost.http-alt > localhost.58593: Flags [P.], seq 13339:14365, ack 1, win 342, options [nop,nop,TS val 4984433 ecr 4984371], length 1026
1449991628.329138 IP localhost.58593 > localhost.http-alt: Flags [.], ack 14365, win 566, options [nop,nop,TS val 4984433 ecr 4984433], length 0
1449991628.379062 IP localhost.http-alt > localhost.58589: Flags [P.], seq 14365:15391, ack 1, win 342, options [nop,nop,TS val 4984446 ecr 4984383], length 1026
1449991628.379198 IP localhost.58589 > localhost.http-alt: Flags [.], ack 15391, win 582, options [nop,nop,TS val 4984446 ecr 4984446], length 0
1449991628.429048 IP localhost.http-alt > localhost.58590: Flags [P.], seq 14365:15391, ack 1, win 342, options [nop,nop,TS val 4984458 ecr 4984396], length 1026
1449991628.429223 IP localhost.58590 > localhost.http-alt: Flags [.], ack 15391, win 582, options [nop,nop,TS val 4984458 ecr 4984458], length 0
1449991628.479099 IP localhost.http-alt > localhost.58591: Flags [P.], seq 14365:15391, ack 1, win 342, options [nop,nop,TS val 4984471 ecr 4984408], length 1026
1449991628.479267 IP localhost.58591 > localhost.http-alt: Flags [.], ack 15391, win 582, options [nop,nop,TS val 4984471 ecr 4984471], length 0
1449991628.529111 IP localhost.http-alt > localhost.58592: Flags [P.], seq 14365:15391, ack 1, win 342, options [nop,nop,TS val 4984483 ecr 4984421], length 1026
1449991628.529270 IP localhost.58592 > localhost.http-alt: Flags [.], ack 15391, win 582, options [nop,nop,TS val 4984483 ecr 4984483], length 0
1449991628.579146 IP localhost.http-alt > localhost.58593: Flags [P.], seq 14365:15391, ack 1, win 342, options [nop,nop,TS val 4984496 ecr 4984433], length 1026
1449991628.579339 IP localhost.58593 > localhost.http-alt: Flags [.], ack 15391, win 582, options [nop,nop,TS val 4984496 ecr 4984496], length 0
1449991628.629075 IP localhost.http-alt > localhost.58589: Flags [P.], seq 15391:16417, ack 1, win 342, options [nop,nop,TS val 4984508 ecr 4984446], length 1026
1449991628.629267 IP localhost.58589 > localhost.http-alt: Flags [.], ack 16417, win 598, options [nop,nop,TS val 4984508 ecr 4984508], length 0
1449991628.679041 IP localhost.http-alt > localhost.58590: Flags [P.], seq 15391:16417, ack 1, win 342, options [nop,nop,TS val 4984521 ecr 4984458], length 1026
1449991628.679192 IP localhost.58590 > localhost.http-alt: Flags [.], ack 16417, win 598, options [nop,nop,TS val 4984521 ecr 4984521], length 0
1449991628.729030 IP localhost.http-alt > localhost.58591: Flags [P.], seq 15391:16417, ack 1, win 342, options [nop,nop,TS val 4984533 ecr 4984471], length 1026
1449991628.729136 IP localhost.58591 > localhost.http-alt: Flags [.], ack 16417, win 598, options [nop,nop,TS val 4984533 ecr 4984533], length 0
1449991628.779038 IP localhost.http-alt > localhost.58592: Flags [P.], seq 15391:16417, ack 1, win 342, options [nop,nop,TS val 4984546 ecr 4984483], length 1026
1449991628.779178 IP localhost.58592 > localhost.http-alt: Flags [.], ack 16417, win 598, options [nop,nop,TS val 4984546 ecr 4984546], length 0
1449991628.829078 IP localhost.http-alt > localhost.58593: Flags [P.], seq 15391:16417, ack 1, win 342, options [nop,nop,TS val 4984558 ecr 4984496], length 1026
1449991628.829322 IP localhost.58593 > localhost.http-alt: Flags [.], ack 16417, win 598, options [nop,nop,TS val 4984558 ecr 4984558], length 0
1449991628.879040 IP localhost.http-alt > localhost.58589: Flags [P.], seq 16417:17443, ack 1, win 342, options [nop,nop,TS val 4984571 ecr 4984508], length 1026
1449991628.879176 IP localhost.58589 > localhost.http-alt: Flags [.], ack 17443, win 614, options [nop,nop,TS val 4984571 ecr 4984571], length 0
1449991628.929055 IP localhost.http-alt > localhost.58590: Flags [P.], seq 16417:17443, ack 1, win 342, options [nop,nop,TS val 4984583 ecr 4984521], length 1026
1449991628.929185 IP localhost.58590 > localhost.http-alt: Flags [.], ack 17443, win 614, options [nop,nop,TS val 4984583 ecr 4984583], length 0
1449991628.979049 IP localhost.http-alt > localhost.58591: Flags [P.], seq 16417:17443, ack 1, win 342, options [nop,nop,TS val 4984596 ecr 4984533], length 1026
1449991628.979204 IP localhost.58591 > localhost.http-alt: Flags [.], ack 17443, win 614, options [nop,nop,TS val 4984596 ecr 4984596], length 0
1449991629.029111 IP localhost.http-alt > localhost.58592: Flags [P.], seq 16417:17443, ack 1, win 342, options [nop,nop,TS val 4984608 ecr 4984546], length 1026
1449991629.029298 IP localhost.58592 > localhost.http-alt: Flags [.], ack 17443, win 614, options [nop,nop,TS val 4984608 ecr 4984608], length 0
1449991629.079128 IP localhost.http-alt > localhost.58593: Flags [P.], seq 16417:17443, ack 1, win 342, options [nop,nop,TS val 4984621 ecr 4984558], length 1026
1449991629.079368 IP localhost.58593 > localhost.http-alt: Flags [.], ack 17443, win 614, options [nop,nop,TS val 4984621 ecr 4984621], length 0
1449991629.129103 IP localhost.http-alt > localhost.58589: Flags [P.], seq 17443:18469, ack 1, win 342, options [nop,nop,TS val 4984633 ecr 4984571], length 1026
1449991629.129257 IP localhost.58589 > localhost.http-alt: Flags [.], ack 18469, win 630, options [nop,nop,TS val 4984633 ecr 4984633], length 0
1449991629.179033 IP localhost.http-alt > localhost.58590: Flags [P.], seq 17443:18469, ack 1, win 342, options [nop,nop,TS val 4984646 ecr 4984583], length 1026
1449991629.179165 IP localhost.58590 > localhost.http-alt: Flags [.], ack 18469, win 630, options [nop,nop,TS val 4984646 ecr 4984646], length 0
1449991629.229074 IP localhost.http-alt > localhost.58591: Flags [P.], seq 17443:18469, ack 1, win 342, options [nop,nop,TS val 4984658 ecr 4984596], length 1026
1449991629.229259 IP localhost.58591 > localhost.http-alt: Flags [.], ack 18469, win 630, options [nop,nop,TS val 4984658 ecr 4984658], length 0
1449991629.279115 IP localhost.http-alt > localhost.58592: Flags [P.], seq 17443:18469, ack 1, win 342, options [nop,nop,TS val 4984671 ecr 4984608], length 1026
1449991629.279311 IP localhost.58592 > localhost.http-alt: Flags [.], ack 18469, win 630, options [nop,nop,TS val 4984671 ecr 4984671], length 0
1449991629.329167 IP localhost.http-alt > localhost.58593: Flags [P.], seq 17443:18469, ack 1, win 342, options [nop,nop,TS val 4984683 ecr 4984621], length 1026
1449991629.329407 IP localhost.58593 > localhost.http-alt: Flags [.], ack 18469, win 630, options [nop,nop,TS val 4984683 ecr 4984683], length 0
1449991629.379092 IP localhost.http-alt > localhost.58589: Flags [P.], seq 18469:19495, ack 1, win 342, options [nop,nop,TS val 4984696 ecr 4984633], length 1026
1449991629.379275 IP localhost.58589 > localhost.http-alt: Flags [.], ack 19495, win 646, options [nop,nop,TS val 4984696 ecr 4984696], length 0
1449991629.429085 IP localhost.http-alt > localhost.58590: Flags [P.], seq 18469:19495, ack 1, win 342, options [nop,nop,TS val 4984708 ecr 4984646], length 1026
1449991629.429276 IP localhost.58590 > localhost.http-alt: Flags [.], ack 19495, win 646, options [nop,nop,TS val 4984708 ecr 4984708], length 0
1449991629.479143 IP localhost.http-alt > localhost.58591: Flags [P.], seq 18469:19495, ack 1, win 342, options [nop,nop,TS val 4984721 ecr 4984658], length 1026
1449991629.479322 IP localhost.58591 > localhost.http-alt: Flags [.], ack 19495, win 646, options [nop,nop,TS val 4984721 ecr 4984721], length 0
1449991629.529145 IP localhost.http-alt > localhost.58592: Flags [P.], seq 18469:19495, ack 1, win 342, options [nop,nop,TS val 4984733 ecr 4984671], length 1026
1449991629.529419 IP localhost.58592 > localhost.http-alt: Flags [.], ack 19495, win 646, options [nop,nop,TS val 4984733 ecr 4984733], length 0
1449991629.579135 IP localhost.http-alt > localhost.58593: Flags [P.], seq 18469:19495, ack 1, win 342, options [nop,nop,TS val 4984746 ecr 4984683], length 1026
1449991629.579433 IP localhost.58593 > localhost.http-alt: Flags [.], ack 19495, win 646, options [nop,nop,TS val 4984746 ecr 4984746], length 0
1449991629.629089 IP localhost.http-alt > localhost.58589: Flags [P.], seq 19495:20521, ack 1, win 342, options [nop,nop,TS val 4984758 ecr 4984696], length 1026
1449991629.629309 IP localhost.58589 > localhost.http-alt: Flags [.], ack 20521, win 662, options [nop,nop,TS val 4984758 ecr 4984758], length 0
1449991629.679100 IP localhost.http-alt > localhost.58590: Flags [P.], seq 19495:20521, ack 1, win 342, options [nop,nop,TS val 4984771 ecr 4984708], length 1026
1449991629.679320 IP localhost.58590 > localhost.http-alt: Flags [.], ack 20521, win 662, options [nop,nop,TS val 4984771 ecr 4984771], length 0
1449991629.729076 IP localhost.http-alt > localhost.58591: Flags [P.], seq 19495:20521, ack 1, win 342, options [nop,nop,TS val 4984783 ecr 4984721], length 1026
1449991629.729212 IP localhost.58591 > localhost.http-alt: Flags [.], ack 20521, win 662, options [nop,nop,TS val 4984783 ecr 4984783], length 0
1449991629.779080 IP localhost.http-alt > localhost.58592: Flags [P.], seq 19495:20521, ack 1, win 342, options [nop,nop,TS val 4984796 ecr 4984733], length 1026
1449991629.779287 IP localhost.58592 > localhost.http-alt: Flags [.], ack 20521, win 662, options [nop,nop,TS val 4984796 ecr 4984796], length 0
1449991629.829069 IP localhost.http-alt > localhost.58593: Flags [P.], seq 19495:20521, ack 1, win 342, options [nop,nop,TS val 4984808 ecr 4984746], length 1026
1449991629.829273 IP localhost.58593 > localhost.http-alt: Flags [.], ack 20521, win 662, options [nop,nop,TS val 4984808 ecr 4984808], length 0
1449991629.879133 IP localhost.http-alt > localhost.58589: Flags [P.], seq 20521:21547, ack 1, win 342, options [nop,nop,TS val 4984821 ecr 4984758], length 1026
1449991629.879429 IP localhost.58589 > localhost.http-alt: Flags [.], ack 21547, win 678, options [nop,nop,TS val 4984821 ecr 4984821], length 0
1449991629.929092 IP localhost.http-alt > localhost.58590: Flags [P.], seq 20521:21547, ack 1, win 342, options [nop,nop,TS val 4984833 ecr 4984771], length 1026
1449991629.929299 IP localhost.58590 > localhost.http-alt: Flags [.], ack 21547, win 678, options [nop,nop,TS val 4984833 ecr 4984833], length 0
1449991629.979067 IP localhost.http-alt > localhost.58591: Flags [P.], seq 20521:21547, ack 1, win 342, options [nop,nop,TS val 4984846 ecr 4984783], length 1026
1449991629.979298 IP localhost.58591 > localhost.http-alt: Flags [.], ack 21547, win 678, options [nop,nop,TS val 4984846 ecr 4984846], length 0
1449991630.029082 IP localhost.http-alt > localhost.58592: Flags [P.], seq 20521:21547, ack 1, win 342, options [nop,nop,TS val 4984858 ecr 4984796], length 1026
1449991630.029308 IP localhost.58592 > localhost.http-alt: Flags [.], ack 21547, win 678, options [nop,nop,TS val 4984858 ecr 4984858], length 0
1449991630.079026 IP localhost.http-alt > localhost.58593: Flags [P.], seq 20521:21547, ack 1, win 342, options [nop,nop,TS val 4984871 ecr 4984808], length 1026
1449991630.079208 IP localhost.58593 > localhost.http-alt: Flags [.], ack 21547, win 678, options [nop,nop,TS val 4984871 ecr 4984871], length 0
1449991630.129087 IP localhost.http-alt > localhost.58589: Flags [P.], seq 21547:22573, ack 1, win 342, options [nop,nop,TS val 4984883 ecr 4984821], length 1026
1449991630.129261 IP localhost.58589 > localhost.http-alt: Flags [.], ack 22573, win 695, options [nop,nop,TS val 4984883 ecr 4984883], length 0
1449991630.179079 IP localhost.http-alt > localhost.58590: Flags [P.], seq 21547:22573, ack 1, win 342, options [nop,nop,TS val 4984896 ecr 4984833], length 1026
1449991630.179232 IP localhost.58590 > localhost.http-alt: Flags [.], ack 22573, win 695, options [nop,nop,TS val 4984896 ecr 4984896], length 0
1449991630.229091 IP localhost.http-alt > localhost.58591: Flags [P.], seq 21547:22573, ack 1, win 342, options [nop,nop,TS val 4984908 ecr 4984846], length 1026
1449991630.229285 IP localhost.58591 > localhost.http-alt: Flags [.], ack 22573, win 695, options [nop,nop,TS val 4984908 ecr 4984908], length 0
1449991630.279096 IP localhost.http-alt > localhost.58592: Flags [P.], seq 21547:22573, ack 1, win 342, options [nop,nop,TS val 4984921 ecr 4984858], length 1026
1449991630.279284 IP localhost.58592 > localhost.http-alt: Flags [.], ack 22573, win 695, options [nop,nop,TS val 4984921 ecr 4984921], length 0
1449991630.329105 IP localhost.http-alt > localhost.58593: Flags [P.], seq 21547:22573, ack 1, win 342, options [nop,nop,TS val 4984933 ecr 4984871], length 1026
1449991630.329319 IP localhost.58593 > localhost.http-alt: Flags [.], ack 22573, win 695, options [nop,nop,TS val 4984933 ecr 4984933], length 0
1449991630.379182 IP localhost.http-alt > localhost.58589: Flags [P.], seq 22573:23599, ack 1, win 342, options [nop,nop,TS val 4984946 ecr 4984883], length 1026
1449991630.379452 IP localhost.58589 > localhost.http-alt: Flags [.], ack 23599, win 711, options [nop,nop,TS val 4984946 ecr 4984946], length 0
1449991630.429055 IP localhost.http-alt > localhost.58590: Flags [P.], seq 22573:23599, ack 1, win 342, options [nop,nop,TS val 4984958 ecr 4984896], length 1026
1449991630.429193 IP localhost.58590 > localhost.http-alt: Flags [.], ack 23599, win 711, options [nop,nop,TS val 4984958 ecr 4984958], length 0
1449991630.479068 IP localhost.http-alt > localhost.58591: Flags [P.], seq 22573:23599, ack 1, win 342, options [nop,nop,TS val 4984971 ecr 4984908], length 1026
1449991630.479240 IP localhost.58591 > localhost.http-alt: Flags [.], ack 23599, win 711, options [nop,nop,TS val 4984971 ecr 4984971], length 0
1449991630.529120 IP localhost.http-alt > localhost.58592: Flags [P.], seq 22573:23599, ack 1, win 342, options [nop,nop,TS val 4984983 ecr 4984921], length 1026
1449991630.529406 IP localhost.58592 > localhost.http-alt: Flags [.], ack 23599, win 711, options [nop,nop,TS val 4984983 ecr 4984983], length 0
1449991630.579167 IP localhost.http-alt > localhost.58593: Flags [P.], seq 22573:23599, ack 1, win 342, options [nop,nop,TS val 4984996 ecr 4984933], length 1026
1449991630.579517 IP localhost.58593 > localhost.http-alt: Flags [.], ack 23599, win 711, options [nop,nop,TS val 4984996 ecr 4984996], length 0
1449991630.629167 IP localhost.http-alt > localhost.58589: Flags [P.], seq 23599:24625, ack 1, win 342, options [nop,nop,TS val 4985008 ecr 4984946], length 1026
1449991630.629455 IP localhost.58589 > localhost.http-alt: Flags [.], ack 24625, win 727, options [nop,nop,TS val 4985008 ecr 4985008], length 0
1449991630.679170 IP localhost.http-alt > localhost.58590: Flags [P.], seq 23599:24625, ack 1, win 342, options [nop,nop,TS val 4985021 ecr 4984958], length 1026
1449991630.679446 IP localhost.58590 > localhost.http-alt: Flags [.], ack 24625, win 727, options [nop,nop,TS val 4985021 ecr 4985021], length 0
1449991630.729096 IP localhost.http-alt > localhost.58591: Flags [P.], seq 23599:24625, ack 1, win 342, options [nop,nop,TS val 4985033 ecr 4984971], length 1026
1449991630.729322 IP localhost.58591 > localhost.http-alt: Flags [.], ack 24625, win 727, options [nop,nop,TS val 4985033 ecr 4985033], length 0
1449991630.779057 IP localhost.http-alt > localhost.58592: Flags [P.], seq 23599:24625, ack 1, win 342, options [nop,nop,TS val 4985046 ecr 4984983], length 1026
1449991630.779189 IP localhost.58592 > localhost.http-alt: Flags [.], ack 24625, win 727, options [nop,nop,TS val 4985046 ecr 4985046], length 0
1449991630.829113 IP localhost.http-alt > localhost.58593: Flags [P.], seq 23599:24625, ack 1, win 342, options [nop,nop,TS val 4985058 ecr 4984996], length 1026
1449991630.829286 IP localhost.58593 > localhost.http-alt: Flags [.], ack 24625, win 727, options [nop,nop,TS val 4985058 ecr 4985058], length 0
1449991630.879135 IP localhost.http-alt > localhost.58589: Flags [P.], seq 24625:25651, ack 1, win 342, options [nop,nop,TS val 4985071 ecr 4985008], length 1026
1449991630.879387 IP localhost.58589 > localhost.http-alt: Flags [.], ack 25651, win 743, options [nop,nop,TS val 4985071 ecr 4985071], length 0
1449991630.929049 IP localhost.http-alt > localhost.58590: Flags [P.], seq 24625:25651, ack 1, win 342, options [nop,nop,TS val 4985083 ecr 4985021], length 1026
1449991630.929249 IP localhost.58590 > localhost.http-alt: Flags [.], ack 25651, win 743, options [nop,nop,TS val 4985083 ecr 4985083], length 0
1449991630.979050 IP localhost.http-alt > localhost.58591: Flags [P.], seq 24625:25651, ack 1, win 342, options [nop,nop,TS val 4985096 ecr 4985033], length 1026
