1449997373.757145 IP localhost.58862 > localhost.http-alt: Flags [S], seq 3394770650, win 43690, options [mss 65495,sackOK,TS val 6420790 ecr 0,nop,wscale 7], length 0
1449997373.757194 IP localhost.http-alt > localhost.58862: Flags [S.], seq 1664692162, ack 3394770651, win 43690, options [mss 65495,sackOK,TS val 6420790 ecr 6420790,nop,wscale 7], length 0
1449997373.757234 IP localhost.58862 > localhost.http-alt: Flags [.], ack 1, win 342, options [nop,nop,TS val 6420790 ecr 6420790], length 0
1449997373.757472 IP localhost.58863 > localhost.http-alt: Flags [S], seq 2973331545, win 43690, options [mss 65495,sackOK,TS val 6420790 ecr 0,nop,wscale 7], length 0
1449997373.757501 IP localhost.http-alt > localhost.58863: Flags [S.], seq 1298082754, ack 2973331546, win 43690, options [mss 65495,sackOK,TS val 6420790 ecr 6420790,nop,wscale 7], length 0
1449997373.757534 IP localhost.58863 > localhost.http-alt: Flags [.], ack 1, win 342, options [nop,nop,TS val 6420790 ecr 6420790], length 0
1449997373.758116 IP localhost.58864 > localhost.http-alt: Flags [S], seq 3834877245, win 43690, options [mss 65495,sackOK,TS val 6420790 ecr 0,nop,wscale 7], length 0
1449997373.758142 IP localhost.http-alt > localhost.58864: Flags [S.], seq 1277203530, ack 3834877246, win 43690, options [mss 65495,sackOK,TS val 6420790 ecr 6420790,nop,wscale 7], length 0
1449997373.758177 IP localhost.58864 > localhost.http-alt: Flags [.], ack 1, win 342, options [nop,nop,TS val 6420790 ecr 6420790], length 0
1449997373.758390 IP localhost.58865 > localhost.http-alt: Flags [S], seq 1627005676, win 43690, options [mss 65495,sackOK,TS val 6420791 ecr 0,nop,wscale 7], length 0
1449997373.758409 IP localhost.http-alt > localhost.58865: Flags [S.], seq 1411516835, ack 1627005677, win 43690, options [mss 65495,sackOK,TS val 6420791 ecr 6420791,nop,wscale 7], length 0
1449997373.758430 IP localhost.58865 > localhost.http-alt: Flags [.], ack 1, win 342, options [nop,nop,TS val 6420791 ecr 6420791], length 0
1449997373.758533 IP localhost.58866 > localhost.http-alt: Flags [S], seq 400734895, win 43690, options [mss 65495,sackOK,TS val 6420791 ecr 0,nop,wscale 7], length 0
1449997373.758550 IP localhost.http-alt > localhost.58866: Flags [S.], seq 1061088210, ack 400734896, win 43690, options [mss 65495,sackOK,TS val 6420791 ecr 6420791,nop,wscale 7], length 0
1449997373.758572 IP localhost.58866 > localhost.http-alt: Flags [.], ack 1, win 342, options [nop,nop,TS val 6420791 ecr 6420791], length 0
1449997373.808917 IP localhost.http-alt > localhost.58862: Flags [P.], seq 1:1027, ack 1, win 342, options [nop,nop,TS val 6420803 ecr 6420790], length 1026
1449997373.808985 IP localhost.58862 > localhost.http-alt: Flags [.], ack 1027, win 358, options [nop,nop,TS val 6420803 ecr 6420803], length 0
1449997373.858906 IP localhost.http-alt > localhost.58863: Flags [P.], seq 1:1027, ack 1, win 342, options [nop,nop,TS val 6420816 ecr 6420790], length 1026
1449997373.858974 IP localhost.58863 > localhost.http-alt: Flags [.], ack 1027, win 358, options [nop,nop,TS val 6420816 ecr 6420816], length 0
1449997373.908887 IP localhost.http-alt > localhost.58864: Flags [P.], seq 1:1027, ack 1, win 342, options [nop,nop,TS val 6420828 ecr 6420790], length 1026
1449997373.908960 IP localhost.58864 > localhost.http-alt: Flags [.], ack 1027, win 358, options [nop,nop,TS val 6420828 ecr 6420828], length 0
1449997373.958871 IP localhost.http-alt > localhost.58865: Flags [P.], seq 1:1027, ack 1, win 342, options [nop,nop,TS val 6420841 ecr 6420791], length 1026
1449997373.958959 IP localhost.58865 > localhost.http-alt: Flags [.], ack 1027, win 358, options [nop,nop,TS val 6420841 ecr 6420841], length 0
1449997374.008897 IP localhost.http-alt > localhost.58866: Flags [P.], seq 1:1027, ack 1, win 342, options [nop,nop,TS val 6420853 ecr 6420791], length 1026
1449997374.008964 IP localhost.58866 > localhost.http-alt: Flags [.], ack 1027, win 358, options [nop,nop,TS val 6420853 ecr 6420853], length 0
1449997374.058853 IP localhost.http-alt > localhost.58862: Flags [P.], seq 1027:2053, ack 1, win 342, options [nop,nop,TS val 6420866 ecr 6420803], length 1026
1449997374.058905 IP localhost.58862 > localhost.http-alt: Flags [.], ack 2053, win 374, options [nop,nop,TS val 6420866 ecr 6420866], length 0
1449997374.108877 IP localhost.http-alt > localhost.58863: Flags [P.], seq 1027:2053, ack 1, win 342, options [nop,nop,TS val 6420878 ecr 6420816], length 1026
1449997374.108932 IP localhost.58863 > localhost.http-alt: Flags [.], ack 2053, win 374, options [nop,nop,TS val 6420878 ecr 6420878], length 0
1449997374.158889 IP localhost.http-alt > localhost.58864: Flags [P.], seq 1027:2053, ack 1, win 342, options [nop,nop,TS val 6420891 ecr 6420828], length 1026
1449997374.158988 IP localhost.58864 > localhost.http-alt: Flags [.], ack 2053, win 374, options [nop,nop,TS val 6420891 ecr 6420891], length 0
1449997374.208877 IP localhost.http-alt > localhost.58865: Flags [P.], seq 1027:2053, ack 1, win 342, options [nop,nop,TS val 6420903 ecr 6420841], length 1026
1449997374.208937 IP localhost.58865 > localhost.http-alt: Flags [.], ack 2053, win 374, options [nop,nop,TS val 6420903 ecr 6420903], length 0
1449997374.258861 IP localhost.http-alt > localhost.58866: Flags [P.], seq 1027:2053, ack 1, win 342, options [nop,nop,TS val 6420916 ecr 6420853], length 1026
1449997374.258915 IP localhost.58866 > localhost.http-alt: Flags [.], ack 2053, win 374, options [nop,nop,TS val 6420916 ecr 6420916], length 0
1449997374.308832 IP localhost.http-alt > localhost.58862: Flags [P.], seq 2053:3079, ack 1, win 342, options [nop,nop,TS val 6420928 ecr 6420866], length 1026
1449997374.308884 IP localhost.58862 > localhost.http-alt: Flags [.], ack 3079, win 390, options [nop,nop,TS val 6420928 ecr 6420928], length 0
1449997374.358866 IP localhost.http-alt > localhost.58863: Flags [P.], seq 2053:3079, ack 1, win 342, options [nop,nop,TS val 6420941 ecr 6420878], length 1026
1449997374.358923 IP localhost.58863 > localhost.http-alt: Flags [.], ack 3079, win 390, options [nop,nop,TS val 6420941 ecr 6420941], length 0
1449997374.408930 IP localhost.http-alt > localhost.58864: Flags [P.], seq 2053:3079, ack 1, win 342, options [nop,nop,TS val 6420953 ecr 6420891], length 1026
1449997374.408988 IP localhost.58864 > localhost.http-alt: Flags [.], ack 3079, win 390, options [nop,nop,TS val 6420953 ecr 6420953], length 0
1449997374.458918 IP localhost.http-alt > localhost.58865: Flags [P.], seq 2053:3079, ack 1, win 342, options [nop,nop,TS val 6420966 ecr 6420903], length 1026
1449997374.458975 IP localhost.58865 > localhost.http-alt: Flags [.], ack 3079, win 390, options [nop,nop,TS val 6420966 ecr 6420966], length 0
1449997374.508921 IP localhost.http-alt > localhost.58866: Flags [P.], seq 2053:3079, ack 1, win 342, options [nop,nop,TS val 6420978 ecr 6420916], length 1026
1449997374.509021 IP localhost.58866 > localhost.http-alt: Flags [.], ack 3079, win 390, options [nop,nop,TS val 6420978 ecr 6420978], length 0
1449997374.558917 IP localhost.http-alt > localhost.58862: Flags [P.], seq 3079:4105, ack 1, win 342, options [nop,nop,TS val 6420991 ecr 6420928], length 1026
1449997374.559018 IP localhost.58862 > localhost.http-alt: Flags [.], ack 4105, win 406, options [nop,nop,TS val 6420991 ecr 6420991], length 0
1449997374.608918 IP localhost.http-alt > localhost.58863: Flags [P.], seq 3079:4105, ack 1, win 342, options [nop,nop,TS val 6421003 ecr 6420941], length 1026
1449997374.609020 IP localhost.58863 > localhost.http-alt: Flags [.], ack 4105, win 406, options [nop,nop,TS val 6421003 ecr 6421003], length 0
1449997374.658910 IP localhost.http-alt > localhost.58864: Flags [P.], seq 3079:4105, ack 1, win 342, options [nop,nop,TS val 6421016 ecr 6420953], length 1026
1449997374.659010 IP localhost.58864 > localhost.http-alt: Flags [.], ack 4105, win 406, options [nop,nop,TS val 6421016 ecr 6421016], length 0
1449997374.708915 IP localhost.http-alt > localhost.58865: Flags [P.], seq 3079:4105, ack 1, win 342, options [nop,nop,TS val 6421028 ecr 6420966], length 1026
1449997374.708971 IP localhost.58865 > localhost.http-alt: Flags [.], ack 4105, win 406, options [nop,nop,TS val 6421028 ecr 6421028], length 0
1449997374.758913 IP localhost.http-alt > localhost.58866: Flags [P.], seq 3079:4105, ack 1, win 342, options [nop,nop,TS val 6421041 ecr 6420978], length 1026
1449997374.759014 IP localhost.58866 > localhost.http-alt: Flags [.], ack 4105, win 406, options [nop,nop,TS val 6421041 ecr 6421041], length 0
1449997374.808918 IP localhost.http-alt > localhost.58862: Flags [P.], seq 4105:5131, ack 1, win 342, options [nop,nop,TS val 6421053 ecr 6420991], length 1026
1449997374.808994 IP localhost.58862 > localhost.http-alt: Flags [.], ack 5131, win 422, options [nop,nop,TS val 6421053 ecr 6421053], length 0
1449997374.858883 IP localhost.http-alt > localhost.58863: Flags [P.], seq 4105:5131, ack 1, win 342, options [nop,nop,TS val 6421066 ecr 6421003], length 1026
1449997374.858951 IP localhost.58863 > localhost.http-alt: Flags [.], ack 5131, win 422, options [nop,nop,TS val 6421066 ecr 6421066], length 0
1449997374.908880 IP localhost.http-alt > localhost.58864: Flags [P.], seq 4105:5131, ack 1, win 342, options [nop,nop,TS val 6421078 ecr 6421016], length 1026
1449997374.908980 IP localhost.58864 > localhost.http-alt: Flags [.], ack 5131, win 422, options [nop,nop,TS val 6421078 ecr 6421078], length 0
1449997374.958894 IP localhost.http-alt > localhost.58865: Flags [P.], seq 4105:5131, ack 1, win 342, options [nop,nop,TS val 6421091 ecr 6421028], length 1026
1449997374.958998 IP localhost.58865 > localhost.http-alt: Flags [.], ack 5131, win 422, options [nop,nop,TS val 6421091 ecr 6421091], length 0
1449997375.008904 IP localhost.http-alt > localhost.58866: Flags [P.], seq 4105:5131, ack 1, win 342, options [nop,nop,TS val 6421103 ecr 6421041], length 1026
1449997375.008963 IP localhost.58866 > localhost.http-alt: Flags [.], ack 5131, win 422, options [nop,nop,TS val 6421103 ecr 6421103], length 0
1449997375.058909 IP localhost.http-alt > localhost.58862: Flags [P.], seq 5131:6157, ack 1, win 342, options [nop,nop,TS val 6421116 ecr 6421053], length 1026
1449997375.058967 IP localhost.58862 > localhost.http-alt: Flags [.], ack 6157, win 438, options [nop,nop,TS val 6421116 ecr 6421116], length 0
1449997375.108930 IP localhost.http-alt > localhost.58863: Flags [P.], seq 5131:6157, ack 1, win 342, options [nop,nop,TS val 6421128 ecr 6421066], length 1026
1449997375.108986 IP localhost.58863 > localhost.http-alt: Flags [.], ack 6157, win 438, options [nop,nop,TS val 6421128 ecr 6421128], length 0
1449997375.158897 IP localhost.http-alt > localhost.58864: Flags [P.], seq 5131:6157, ack 1, win 342, options [nop,nop,TS val 6421141 ecr 6421078], length 1026
1449997375.158952 IP localhost.58864 > localhost.http-alt: Flags [.], ack 6157, win 438, options [nop,nop,TS val 6421141 ecr 6421141], length 0
1449997375.208864 IP localhost.http-alt > localhost.58865: Flags [P.], seq 5131:6157, ack 1, win 342, options [nop,nop,TS val 6421153 ecr 6421091], length 1026
1449997375.208921 IP localhost.58865 > localhost.http-alt: Flags [.], ack 6157, win 438, options [nop,nop,TS val 6421153 ecr 6421153], length 0
1449997375.258908 IP localhost.http-alt > localhost.58866: Flags [P.], seq 5131:6157, ack 1, win 342, options [nop,nop,TS val 6421166 ecr 6421103], length 1026
1449997375.258966 IP localhost.58866 > localhost.http-alt: Flags [.], ack 6157, win 438, options [nop,nop,TS val 6421166 ecr 6421166], length 0
1449997375.308905 IP localhost.http-alt > localhost.58862: Flags [P.], seq 6157:7183, ack 1, win 342, options [nop,nop,TS val 6421178 ecr 6421116], length 1026
1449997375.308962 IP localhost.58862 > localhost.http-alt: Flags [.], ack 7183, win 454, options [nop,nop,TS val 6421178 ecr 6421178], length 0
1449997375.358847 IP localhost.http-alt > localhost.58863: Flags [P.], seq 6157:7183, ack 1, win 342, options [nop,nop,TS val 6421191 ecr 6421128], length 1026
1449997375.358891 IP localhost.58863 > localhost.http-alt: Flags [.], ack 7183, win 454, options [nop,nop,TS val 6421191 ecr 6421191], length 0
1449997375.408888 IP localhost.http-alt > localhost.58864: Flags [P.], seq 6157:7183, ack 1, win 342, options [nop,nop,TS val 6421203 ecr 6421141], length 1026
1449997375.408945 IP localhost.58864 > localhost.http-alt: Flags [.], ack 7183, win 454, options [nop,nop,TS val 6421203 ecr 6421203], length 0
1449997375.458950 IP localhost.http-alt > localhost.58865: Flags [P.], seq 6157:7183, ack 1, win 342, options [nop,nop,TS val 6421216 ecr 6421153], length 1026
1449997375.459005 IP localhost.58865 > localhost.http-alt: Flags [.], ack 7183, win 454, options [nop,nop,TS val 6421216 ecr 6421216], length 0
1449997375.508897 IP localhost.http-alt > localhost.58866: Flags [P.], seq 6157:7183, ack 1, win 342, options [nop,nop,TS val 6421228 ecr 6421166], length 1026
1449997375.508962 IP localhost.58866 > localhost.http-alt: Flags [.], ack 7183, win 454, options [nop,nop,TS val 6421228 ecr 6421228], length 0
1449997375.558901 IP localhost.http-alt > localhost.58862: Flags [P.], seq 7183:8209, ack 1, win 342, options [nop,nop,TS val 6421241 ecr 6421178], length 1026
1449997375.558968 IP localhost.58862 > localhost.http-alt: Flags [.], ack 8209, win 470, options [nop,nop,TS val 6421241 ecr 6421241], length 0
1449997375.608888 IP localhost.http-alt > localhost.58863: Flags [P.], seq 7183:8209, ack 1, win 342, options [nop,nop,TS val 6421253 ecr 6421191], length 1026
1449997375.608950 IP localhost.58863 > localhost.http-alt: Flags [.], ack 8209, win 470, options [nop,nop,TS val 6421253 ecr 6421253], length 0
1449997375.658897 IP localhost.http-alt > localhost.58864: Flags [P.], seq 7183:8209, ack 1, win 342, options [nop,nop,TS val 6421266 ecr 6421203], length 1026
1449997375.658963 IP localhost.58864 > localhost.http-alt: Flags [.], ack 8209, win 470, options [nop,nop,TS val 6421266 ecr 6421266], length 0
1449997375.708899 IP localhost.http-alt > localhost.58865: Flags [P.], seq 7183:8209, ack 1, win 342, options [nop,nop,TS val 6421278 ecr 6421216], length 1026
1449997375.708963 IP localhost.58865 > localhost.http-alt: Flags [.], ack 8209, win 470, options [nop,nop,TS val 6421278 ecr 6421278], length 0
1449997375.758902 IP localhost.http-alt > localhost.58866: Flags [P.], seq 7183:8209, ack 1, win 342, options [nop,nop,TS val 6421291 ecr 6421228], length 1026
1449997375.758969 IP localhost.58866 > localhost.http-alt: Flags [.], ack 8209, win 470, options [nop,nop,TS val 6421291 ecr 6421291], length 0
1449997375.808927 IP localhost.http-alt > localhost.58862: Flags [P.], seq 8209:9235, ack 1, win 342, options [nop,nop,TS val 6421303 ecr 6421241], length 1026
1449997375.808990 IP localhost.58862 > localhost.http-alt: Flags [.], ack 9235, win 486, options [nop,nop,TS val 6421303 ecr 6421303], length 0
1449997375.858909 IP localhost.http-alt > localhost.58863: Flags [P.], seq 8209:9235, ack 1, win 342, options [nop,nop,TS val 6421316 ecr 6421253], length 1026
1449997375.858968 IP localhost.58863 > localhost.http-alt: Flags [.], ack 9235, win 486, options [nop,nop,TS val 6421316 ecr 6421316], length 0
1449997375.908867 IP localhost.http-alt > localhost.58864: Flags [P.], seq 8209:9235, ack 1, win 342, options [nop,nop,TS val 6421328 ecr 6421266], length 1026
1449997375.908924 IP localhost.58864 > localhost.http-alt: Flags [.], ack 9235, win 486, options [nop,nop,TS val 6421328 ecr 6421328], length 0
1449997375.958883 IP localhost.http-alt > localhost.58865: Flags [P.], seq 8209:9235, ack 1, win 342, options [nop,nop,TS val 6421341 ecr 6421278], length 1026
1449997375.958983 IP localhost.58865 > localhost.http-alt: Flags [.], ack 9235, win 486, options [nop,nop,TS val 6421341 ecr 6421341], length 0
1449997376.008895 IP localhost.http-alt > localhost.58866: Flags [P.], seq 8209:9235, ack 1, win 342, options [nop,nop,TS val 6421353 ecr 6421291], length 1026
1449997376.008959 IP localhost.58866 > localhost.http-alt: Flags [.], ack 9235, win 486, options [nop,nop,TS val 6421353 ecr 6421353], length 0
1449997376.058857 IP localhost.http-alt > localhost.58862: Flags [P.], seq 9235:10261, ack 1, win 342, options [nop,nop,TS val 6421366 ecr 6421303], length 1026
1449997376.058915 IP localhost.58862 > localhost.http-alt: Flags [.], ack 10261, win 502, options [nop,nop,TS val 6421366 ecr 6421366], length 0
1449997376.108899 IP localhost.http-alt > localhost.58863: Flags [P.], seq 9235:10261, ack 1, win 342, options [nop,nop,TS val 6421378 ecr 6421316], length 1026
1449997376.108963 IP localhost.58863 > localhost.http-alt: Flags [.], ack 10261, win 502, options [nop,nop,TS val 6421378 ecr 6421378], length 0
1449997376.158890 IP localhost.http-alt > localhost.58864: Flags [P.], seq 9235:10261, ack 1, win 342, options [nop,nop,TS val 6421391 ecr 6421328], length 1026
1449997376.158956 IP localhost.58864 > localhost.http-alt: Flags [.], ack 10261, win 502, options [nop,nop,TS val 6421391 ecr 6421391], length 0
1449997376.208911 IP localhost.http-alt > localhost.58865: Flags [P.], seq 9235:10261, ack 1, win 342, options [nop,nop,TS val 6421403 ecr 6421341], length 1026
1449997376.208968 IP localhost.58865 > localhost.http-alt: Flags [.], ack 10261, win 502, options [nop,nop,TS val 6421403 ecr 6421403], length 0
1449997376.258913 IP localhost.http-alt > localhost.58866: Flags [P.], seq 9235:10261, ack 1, win 342, options [nop,nop,TS val 6421416 ecr 6421353], length 1026
1449997376.258972 IP localhost.58866 > localhost.http-alt: Flags [.], ack 10261, win 502, options [nop,nop,TS val 6421416 ecr 6421416], length 0
1449997376.308906 IP localhost.http-alt > localhost.58862: Flags [P.], seq 10261:11287, ack 1, win 342, options [nop,nop,TS val 6421428 ecr 6421366], length 1026
1449997376.308963 IP localhost.58862 > localhost.http-alt: Flags [.], ack 11287, win 518, options [nop,nop,TS val 6421428 ecr 6421428], length 0
1449997376.358911 IP localhost.http-alt > localhost.58863: Flags [P.], seq 10261:11287, ack 1, win 342, options [nop,nop,TS val 6421441 ecr 6421378], length 1026
1449997376.358969 IP localhost.58863 > localhost.http-alt: Flags [.], ack 11287, win 518, options [nop,nop,TS val 6421441 ecr 6421441], length 0
1449997376.408884 IP localhost.http-alt > localhost.58864: Flags [P.], seq 10261:11287, ack 1, win 342, options [nop,nop,TS val 6421453 ecr 6421391], length 1026
1449997376.408944 IP localhost.58864 > localhost.http-alt: Flags [.], ack 11287, win 518, options [nop,nop,TS val 6421453 ecr 6421453], length 0
1449997376.458914 IP localhost.http-alt > localhost.58865: Flags [P.], seq 10261:11287, ack 1, win 342, options [nop,nop,TS val 6421466 ecr 6421403], length 1026
1449997376.458970 IP localhost.58865 > localhost.http-alt: Flags [.], ack 11287, win 518, options [nop,nop,TS val 6421466 ecr 6421466], length 0
1449997376.508939 IP localhost.http-alt > localhost.58866: Flags [P.], seq 10261:11287, ack 1, win 342, options [nop,nop,TS val 6421478 ecr 6421416], length 1026
1449997376.508995 IP localhost.58866 > localhost.http-alt: Flags [.], ack 11287, win 518, options [nop,nop,TS val 6421478 ecr 6421478], length 0
1449997376.558884 IP localhost.http-alt > localhost.58862: Flags [P.], seq 11287:12313, ack 1, win 342, options [nop,nop,TS val 6421491 ecr 6421428], length 1026
1449997376.558958 IP localhost.58862 > localhost.http-alt: Flags [.], ack 12313, win 534, options [nop,nop,TS val 6421491 ecr 6421491], length 0
1449997376.608906 IP localhost.http-alt > localhost.58863: Flags [P.], seq 11287:12313, ack 1, win 342, options [nop,nop,TS val 6421503 ecr 6421441], length 1026
1449997376.608986 IP localhost.58863 > localhost.http-alt: Flags [.], ack 12313, win 534, options [nop,nop,TS val 6421503 ecr 6421503], length 0
1449997376.658912 IP localhost.http-alt > localhost.58864: Flags [P.], seq 11287:12313, ack 1, win 342, options [nop,nop,TS val 6421516 ecr 6421453], length 1026
1449997376.658970 IP localhost.58864 > localhost.http-alt: Flags [.], ack 12313, win 534, options [nop,nop,TS val 6421516 ecr 6421516], length 0
1449997376.708831 IP localhost.http-alt > localhost.58865: Flags [P.], seq 11287:12313, ack 1, win 342, options [nop,nop,TS val 6421528 ecr 6421466], length 1026
1449997376.708867 IP localhost.58865 > localhost.http-alt: Flags [.], ack 12313, win 534, options [nop,nop,TS val 6421528 ecr 6421528], length 0
1449997376.758891 IP localhost.http-alt > localhost.58866: Flags [P.], seq 11287:12313, ack 1, win 342, options [nop,nop,TS val 6421541 ecr 6421478], length 1026
1449997376.758961 IP localhost.58866 > localhost.http-alt: Flags [.], ack 12313, win 534, options [nop,nop,TS val 6421541 ecr 6421541], length 0
1449997376.808906 IP localhost.http-alt > localhost.58862: Flags [P.], seq 12313:13339, ack 1, win 342, options [nop,nop,TS val 6421553 ecr 6421491], length 1026
1449997376.808977 IP localhost.58862 > localhost.http-alt: Flags [.], ack 13339, win 550, options [nop,nop,TS val 6421553 ecr 6421553], length 0
1449997376.858937 IP localhost.http-alt > localhost.58863: Flags [P.], seq 12313:13339, ack 1, win 342, options [nop,nop,TS val 6421566 ecr 6421503], length 1026
1449997376.859008 IP localhost.58863 > localhost.http-alt: Flags [.], ack 13339, win 550, options [nop,nop,TS val 6421566 ecr 6421566], length 0
1449997376.908875 IP localhost.http-alt > localhost.58864: Flags [P.], seq 12313:13339, ack 1, win 342, options [nop,nop,TS val 6421578 ecr 6421516], length 1026
1449997376.908976 IP localhost.58864 > localhost.http-alt: Flags [.], ack 13339, win 550, options [nop,nop,TS val 6421578 ecr 6421578], length 0
1449997376.958908 IP localhost.http-alt > localhost.58865: Flags [P.], seq 12313:13339, ack 1, win 342, options [nop,nop,TS val 6421591 ecr 6421528], length 1026
1449997376.958981 IP localhost.58865 > localhost.http-alt: Flags [.], ack 13339, win 550, options [nop,nop,TS val 6421591 ecr 6421591], length 0
1449997377.008910 IP localhost.http-alt > localhost.58866: Flags [P.], seq 12313:13339, ack 1, win 342, options [nop,nop,TS val 6421603 ecr 6421541], length 1026
1449997377.008981 IP localhost.58866 > localhost.http-alt: Flags [.], ack 13339, win 550, options [nop,nop,TS val 6421603 ecr 6421603], length 0
1449997377.058911 IP localhost.http-alt > localhost.58862: Flags [P.], seq 13339:14365, ack 1, win 342, options [nop,nop,TS val 6421616 ecr 6421553], length 1026
1449997377.058986 IP localhost.58862 > localhost.http-alt: Flags [.], ack 14365, win 566, options [nop,nop,TS val 6421616 ecr 6421616], length 0
1449997377.108893 IP localhost.http-alt > localhost.58863: Flags [P.], seq 13339:14365, ack 1, win 342, options [nop,nop,TS val 6421628 ecr 6421566], length 1026
1449997377.108965 IP localhost.58863 > localhost.http-alt: Flags [.], ack 14365, win 566, options [nop,nop,TS val 6421628 ecr 6421628], length 0
1449997377.158876 IP localhost.http-alt > localhost.58864: Flags [P.], seq 13339:14365, ack 1, win 342, options [nop,nop,TS val 6421641 ecr 6421578], length 1026
1449997377.158948 IP localhost.58864 > localhost.http-alt: Flags [.], ack 14365, win 566, options [nop,nop,TS val 6421641 ecr 6421641], length 0
1449997377.208917 IP localhost.http-alt > localhost.58865: Flags [P.], seq 13339:14365, ack 1, win 342, options [nop,nop,TS val 6421653 ecr 6421591], length 1026
1449997377.208990 IP localhost.58865 > localhost.http-alt: Flags [.], ack 14365, win 566, options [nop,nop,TS val 6421653 ecr 6421653], length 0
1449997377.258919 IP localhost.http-alt > localhost.58866: Flags [P.], seq 13339:14365, ack 1, win 342, options [nop,nop,TS val 6421666 ecr 6421603], length 1026
1449997377.259017 IP localhost.58866 > localhost.http-alt: Flags [.], ack 14365, win 566, options [nop,nop,TS val 6421666 ecr 6421666], length 0
1449997377.308910 IP localhost.http-alt > localhost.58862: Flags [P.], seq 14365:15391, ack 1, win 342, options [nop,nop,TS val 6421678 ecr 6421616], length 1026
1449997377.308986 IP localhost.58862 > localhost.http-alt: Flags [.], ack 15391, win 582, options [nop,nop,TS val 6421678 ecr 6421678], length 0
1449997377.358909 IP localhost.http-alt > localhost.58863: Flags [P.], seq 14365:15391, ack 1, win 342, options [nop,nop,TS val 6421691 ecr 6421628], length 1026
1449997377.358982 IP localhost.58863 > localhost.http-alt: Flags [.], ack 15391, win 582, options [nop,nop,TS val 6421691 ecr 6421691], length 0
1449997377.408878 IP localhost.http-alt > localhost.58864: Flags [P.], seq 14365:15391, ack 1, win 342, options [nop,nop,TS val 6421703 ecr 6421641], length 1026
1449997377.408951 IP localhost.58864 > localhost.http-alt: Flags [.], ack 15391, win 582, options [nop,nop,TS val 6421703 ecr 6421703], length 0
1449997377.458912 IP localhost.http-alt > localhost.58865: Flags [P.], seq 14365:15391, ack 1, win 342, options [nop,nop,TS val 6421716 ecr 6421653], length 1026
1449997377.458987 IP localhost.58865 > localhost.http-alt: Flags [.], ack 15391, win 582, options [nop,nop,TS val 6421716 ecr 6421716], length 0
1449997377.508907 IP localhost.http-alt > localhost.58866: Flags [P.], seq 14365:15391, ack 1, win 342, options [nop,nop,TS val 6421728 ecr 6421666], length 1026
1449997377.508981 IP localhost.58866 > localhost.http-alt: Flags [.], ack 15391, win 582, options [nop,nop,TS val 6421728 ecr 6421728], length 0
1449997377.558945 IP localhost.http-alt > localhost.58862: Flags [P.], seq 15391:16417, ack 1, win 342, options [nop,nop,TS val 6421741 ecr 6421678], length 1026
1449997377.559018 IP localhost.58862 > localhost.http-alt: Flags [.], ack 16417, win 598, options [nop,nop,TS val 6421741 ecr 6421741], length 0
1449997377.608910 IP localhost.http-alt > localhost.58863: Flags [P.], seq 15391:16417, ack 1, win 342, options [nop,nop,TS val 6421753 ecr 6421691], length 1026
1449997377.609008 IP localhost.58863 > localhost.http-alt: Flags [.], ack 16417, win 598, options [nop,nop,TS val 6421753 ecr 6421753], length 0
1449997377.658913 IP localhost.http-alt > localhost.58864: Flags [P.], seq 15391:16417, ack 1, win 342, options [nop,nop,TS val 6421766 ecr 6421703], length 1026
1449997377.658986 IP localhost.58864 > localhost.http-alt: Flags [.], ack 16417, win 598, options [nop,nop,TS val 6421766 ecr 6421766], length 0
1449997377.708909 IP localhost.http-alt > localhost.58865: Flags [P.], seq 15391:16417, ack 1, win 342, options [nop,nop,TS val 6421778 ecr 6421716], length 1026
1449997377.708983 IP localhost.58865 > localhost.http-alt: Flags [.], ack 16417, win 598, options [nop,nop,TS val 6421778 ecr 6421778], length 0
1449997377.758906 IP localhost.http-alt > localhost.58866: Flags [P.], seq 15391:16417, ack 1, win 342, options [nop,nop,TS val 6421791 ecr 6421728], length 1026
1449997377.758977 IP localhost.58866 > localhost.http-alt: Flags [.], ack 16417, win 598, options [nop,nop,TS val 6421791 ecr 6421791], length 0
1449997377.808906 IP localhost.http-alt > localhost.58862: Flags [P.], seq 16417:17443, ack 1, win 342, options [nop,nop,TS val 6421803 ecr 6421741], length 1026
1449997377.808979 IP localhost.58862 > localhost.http-alt: Flags [.], ack 17443, win 614, options [nop,nop,TS val 6421803 ecr 6421803], length 0
1449997377.858893 IP localhost.http-alt > localhost.58863: Flags [P.], seq 16417:17443, ack 1, win 342, options [nop,nop,TS val 6421816 ecr 6421753], length 1026
1449997377.858967 IP localhost.58863 > localhost.http-alt: Flags [.], ack 17443, win 614, options [nop,nop,TS val 6421816 ecr 6421816], length 0
1449997377.908886 IP localhost.http-alt > localhost.58864: Flags [P.], seq 16417:17443, ack 1, win 342, options [nop,nop,TS val 6421828 ecr 6421766], length 1026
1449997377.908967 IP localhost.58864 > localhost.http-alt: Flags [.], ack 17443, win 614, options [nop,nop,TS val 6421828 ecr 6421828], length 0
1449997377.958909 IP localhost.http-alt > localhost.58865: Flags [P.], seq 16417:17443, ack 1, win 342, options [nop,nop,TS val 6421841 ecr 6421778], length 1026
1449997377.958967 IP localhost.58865 > localhost.http-alt: Flags [.], ack 17443, win 614, options [nop,nop,TS val 6421841 ecr 6421841], length 0
1449997378.008913 IP localhost.http-alt > localhost.58866: Flags [P.], seq 16417:17443, ack 1, win 342, options [nop,nop,TS val 6421853 ecr 6421791], length 1026
1449997378.008972 IP localhost.58866 > localhost.http-alt: Flags [.], ack 17443, win 614, options [nop,nop,TS val 6421853 ecr 6421853], length 0
1449997378.058847 IP localhost.http-alt > localhost.58862: Flags [P.], seq 17443:18469, ack 1, win 342, options [nop,nop,TS val 6421866 ecr 6421803], length 1026
1449997378.058893 IP localhost.58862 > localhost.http-alt: Flags [.], ack 18469, win 630, options [nop,nop,TS val 6421866 ecr 6421866], length 0
1449997378.108869 IP localhost.http-alt > localhost.58863: Flags [P.], seq 17443:18469, ack 1, win 342, options [nop,nop,TS val 6421878 ecr 6421816], length 1026
1449997378.108926 IP localhost.58863 > localhost.http-alt: Flags [.], ack 18469, win 630, options [nop,nop,TS val 6421878 ecr 6421878], length 0
1449997378.158908 IP localhost.http-alt > localhost.58864: Flags [P.], seq 17443:18469, ack 1, win 342, options [nop,nop,TS val 6421891 ecr 6421828], length 1026
1449997378.158991 IP localhost.58864 > localhost.http-alt: Flags [.], ack 18469, win 630, options [nop,nop,TS val 6421891 ecr 6421891], length 0
1449997378.208877 IP localhost.http-alt > localhost.58865: Flags [P.], seq 17443:18469, ack 1, win 342, options [nop,nop,TS val 6421903 ecr 6421841], length 1026
1449997378.208948 IP localhost.58865 > localhost.http-alt: Flags [.], ack 18469, win 630, options [nop,nop,TS val 6421903 ecr 6421903], length 0
1449997378.258946 IP localhost.http-alt > localhost.58866: Flags [P.], seq 17443:18469, ack 1, win 342, options [nop,nop,TS val 6421916 ecr 6421853], length 1026
1449997378.259019 IP localhost.58866 > localhost.http-alt: Flags [.], ack 18469, win 630, options [nop,nop,TS val 6421916 ecr 6421916], length 0
1449997378.308845 IP localhost.http-alt > localhost.58862: Flags [P.], seq 18469:19495, ack 1, win 342, options [nop,nop,TS val 6421928 ecr 6421866], length 1026
1449997378.308889 IP localhost.58862 > localhost.http-alt: Flags [.], ack 19495, win 646, options [nop,nop,TS val 6421928 ecr 6421928], length 0
1449997378.358833 IP localhost.http-alt > localhost.58863: Flags [P.], seq 18469:19495, ack 1, win 342, options [nop,nop,TS val 6421941 ecr 6421878], length 1026
1449997378.358873 IP localhost.58863 > localhost.http-alt: Flags [.], ack 19495, win 646, options [nop,nop,TS val 6421941 ecr 6421941], length 0
1449997378.408902 IP localhost.http-alt > localhost.58864: Flags [P.], seq 18469:19495, ack 1, win 342, options [nop,nop,TS val 6421953 ecr 6421891], length 1026
1449997378.408960 IP localhost.58864 > localhost.http-alt: Flags [.], ack 19495, win 646, options [nop,nop,TS val 6421953 ecr 6421953], length 0
1449997378.458878 IP localhost.http-alt > localhost.58865: Flags [P.], seq 18469:19495, ack 1, win 342, options [nop,nop,TS val 6421966 ecr 6421903], length 1026
1449997378.458937 IP localhost.58865 > localhost.http-alt: Flags [.], ack 19495, win 646, options [nop,nop,TS val 6421966 ecr 6421966], length 0
1449997378.508860 IP localhost.http-alt > localhost.58866: Flags [P.], seq 18469:19495, ack 1, win 342, options [nop,nop,TS val 6421978 ecr 6421916], length 1026
1449997378.508909 IP localhost.58866 > localhost.http-alt: Flags [.], ack 19495, win 646, options [nop,nop,TS val 6421978 ecr 6421978], length 0
1449997378.558834 IP localhost.http-alt > localhost.58862: Flags [P.], seq 19495:20521, ack 1, win 342, options [nop,nop,TS val 6421991 ecr 6421928], length 1026
1449997378.558873 IP localhost.58862 > localhost.http-alt: Flags [.], ack 20521, win 662, options [nop,nop,TS val 6421991 ecr 6421991], length 0
1449997378.608928 IP localhost.http-alt > localhost.58863: Flags [P.], seq 19495:20521, ack 1, win 342, options [nop,nop,TS val 6422003 ecr 6421941], length 1026
1449997378.608985 IP localhost.58863 > localhost.http-alt: Flags [.], ack 20521, win 662, options [nop,nop,TS val 6422003 ecr 6422003], length 0
1449997378.658917 IP localhost.http-alt > localhost.58864: Flags [P.], seq 19495:20521, ack 1, win 342, options [nop,nop,TS val 6422016 ecr 6421953], length 1026
1449997378.658975 IP localhost.58864 > localhost.http-alt: Flags [.], ack 20521, win 662, options [nop,nop,TS val 6422016 ecr 6422016], length 0
1449997378.708849 IP localhost.http-alt > localhost.58865: Flags [P.], seq 19495:20521, ack 1, win 342, options [nop,nop,TS val 6422028 ecr 6421966], length 1026
1449997378.708895 IP localhost.58865 > localhost.http-alt: Flags [.], ack 20521, win 662, options [nop,nop,TS val 6422028 ecr 6422028], length 0
1449997378.758762 IP localhost.http-alt > localhost.58866: Flags [P.], seq 19495:20521, ack 1, win 342, options [nop,nop,TS val 6422041 ecr 6421978], length 1026
1449997378.758797 IP localhost.58866 > localhost.http-alt: Flags [.], ack 20521, win 662, options [nop,nop,TS val 6422041 ecr 6422041], length 0
1449997378.808896 IP localhost.http-alt > localhost.58862: Flags [P.], seq 20521:21547, ack 1, win 342, options [nop,nop,TS val 6422053 ecr 6421991], length 1026
1449997378.808954 IP localhost.58862 > localhost.http-alt: Flags [.], ack 21547, win 678, options [nop,nop,TS val 6422053 ecr 6422053], length 0
1449997378.858909 IP localhost.http-alt > localhost.58863: Flags [P.], seq 20521:21547, ack 1, win 342, options [nop,nop,TS val 6422066 ecr 6422003], length 1026
1449997378.858967 IP localhost.58863 > localhost.http-alt: Flags [.], ack 21547, win 678, options [nop,nop,TS val 6422066 ecr 6422066], length 0
1449997378.908848 IP localhost.http-alt > localhost.58864: Flags [P.], seq 20521:21547, ack 1, win 342, options [nop,nop,TS val 6422078 ecr 6422016], length 1026
1449997378.908892 IP localhost.58864 > localhost.http-alt: Flags [.], ack 21547, win 678, options [nop,nop,TS val 6422078 ecr 6422078], length 0
1449997378.958853 IP localhost.http-alt > localhost.58865: Flags [P.], seq 20521:21547, ack 1, win 342, options [nop,nop,TS val 6422091 ecr 6422028], length 1026
1449997378.958890 IP localhost.58865 > localhost.http-alt: Flags [.], ack 21547, win 678, options [nop,nop,TS val 6422091 ecr 6422091], length 0
1449997379.008896 IP localhost.http-alt > localhost.58866: Flags [P.], seq 20521:21547, ack 1, win 342, options [nop,nop,TS val 6422103 ecr 6422041], length 1026
1449997379.008955 IP localhost.58866 > localhost.http-alt: Flags [.], ack 21547, win 678, options [nop,nop,TS val 6422103 ecr 6422103], length 0
1449997379.058907 IP localhost.http-alt > localhost.58862: Flags [P.], seq 21547:22573, ack 1, win 342, options [nop,nop,TS val 6422116 ecr 6422053], length 1026
1449997379.058964 IP localhost.58862 > localhost.http-alt: Flags [.], ack 22573, win 695, options [nop,nop,TS val 6422116 ecr 6422116], length 0
1449997379.108851 IP localhost.http-alt > localhost.58863: Flags [P.], seq 21547:22573, ack 1, win 342, options [nop,nop,TS val 6422128 ecr 6422066], length 1026
1449997379.108897 IP localhost.58863 > localhost.http-alt: Flags [.], ack 22573, win 695, options [nop,nop,TS val 6422128 ecr 6422128], length 0
1449997379.158832 IP localhost.http-alt > localhost.58864: Flags [P.], seq 21547:22573, ack 1, win 342, options [nop,nop,TS val 6422141 ecr 6422078], length 1026
1449997379.158871 IP localhost.58864 > localhost.http-alt: Flags [.], ack 22573, win 695, options [nop,nop,TS val 6422141 ecr 6422141], length 0
1449997379.208904 IP localhost.http-alt > localhost.58865: Flags [P.], seq 21547:22573, ack 1, win 342, options [nop,nop,TS val 6422153 ecr 6422091], length 1026
1449997379.208963 IP localhost.58865 > localhost.http-alt: Flags [.], ack 22573, win 695, options [nop,nop,TS val 6422153 ecr 6422153], length 0
1449997379.258913 IP localhost.http-alt > localhost.58866: Flags [P.], seq 21547:22573, ack 1, win 342, options [nop,nop,TS val 6422166 ecr 6422103], length 1026
1449997379.258976 IP localhost.58866 > localhost.http-alt: Flags [.], ack 22573, win 695, options [nop,nop,TS val 6422166 ecr 6422166], length 0
1449997379.308877 IP localhost.http-alt > localhost.58862: Flags [P.], seq 22573:23599, ack 1, win 342, options [nop,nop,TS val 6422178 ecr 6422116], length 1026
1449997379.308921 IP localhost.58862 > localhost.http-alt: Flags [.], ack 23599, win 711, options [nop,nop,TS val 6422178 ecr 6422178], length 0
1449997379.358906 IP localhost.http-alt > localhost.58863: Flags [P.], seq 22573:23599, ack 1, win 342, options [nop,nop,TS val 6422191 ecr 6422128], length 1026
1449997379.358965 IP localhost.58863 > localhost.http-alt: Flags [.], ack 23599, win 711, options [nop,nop,TS val 6422191 ecr 6422191], length 0
1449997379.408908 IP localhost.http-alt > localhost.58864: Flags [P.], seq 22573:23599, ack 1, win 342, options [nop,nop,TS val 6422203 ecr 6422141], length 1026
1449997379.408966 IP localhost.58864 > localhost.http-alt: Flags [.], ack 23599, win 711, options [nop,nop,TS val 6422203 ecr 6422203], length 0
1449997379.458847 IP localhost.http-alt > localhost.58865: Flags [P.], seq 22573:23599, ack 1, win 342, options [nop,nop,TS val 6422216 ecr 6422153], length 1026
1449997379.458892 IP localhost.58865 > localhost.http-alt: Flags [.], ack 23599, win 711, options [nop,nop,TS val 6422216 ecr 6422216], length 0
1449997379.508831 IP localhost.http-alt > localhost.58866: Flags [P.], seq 22573:23599, ack 1, win 342, options [nop,nop,TS val 6422228 ecr 6422166], length 1026
1449997379.508869 IP localhost.58866 > localhost.http-alt: Flags [.], ack 23599, win 711, options [nop,nop,TS val 6422228 ecr 6422228], length 0
1449997379.558910 IP localhost.http-alt > localhost.58862: Flags [P.], seq 23599:24625, ack 1, win 342, options [nop,nop,TS val 6422241 ecr 6422178], length 1026
1449997379.558968 IP localhost.58862 > localhost.http-alt: Flags [.], ack 24625, win 727, options [nop,nop,TS val 6422241 ecr 6422241], length 0
1449997379.608909 IP localhost.http-alt > localhost.58863: Flags [P.], seq 23599:24625, ack 1, win 342, options [nop,nop,TS val 6422253 ecr 6422191], length 1026
1449997379.608967 IP localhost.58863 > localhost.http-alt: Flags [.], ack 24625, win 727, options [nop,nop,TS val 6422253 ecr 6422253], length 0
1449997379.658937 IP localhost.http-alt > localhost.58864: Flags [P.], seq 23599:24625, ack 1, win 342, options [nop,nop,TS val 6422266 ecr 6422203], length 1026
1449997379.658991 IP localhost.58864 > localhost.http-alt: Flags [.], ack 24625, win 727, options [nop,nop,TS val 6422266 ecr 6422266], length 0
1449997379.708858 IP localhost.http-alt > localhost.58865: Flags [P.], seq 23599:24625, ack 1, win 342, options [nop,nop,TS val 6422278 ecr 6422216], length 1026
1449997379.708907 IP localhost.58865 > localhost.http-alt: Flags [.], ack 24625, win 727, options [nop,nop,TS val 6422278 ecr 6422278], length 0
1449997379.758834 IP localhost.http-alt > localhost.58866: Flags [P.], seq 23599:24625, ack 1, win 342, options [nop,nop,TS val 6422291 ecr 6422228], length 1026
1449997379.758878 IP localhost.58866 > localhost.http-alt: Flags [.], ack 24625, win 727, options [nop,nop,TS val 6422291 ecr 6422291], length 0
1449997379.808886 IP localhost.http-alt > localhost.58862: Flags [P.], seq 24625:25651, ack 1, win 342, options [nop,nop,TS val 6422303 ecr 6422241], length 1026
1449997379.808945 IP localhost.58862 > localhost.http-alt: Flags [.], ack 25651, win 743, options [nop,nop,TS val 6422303 ecr 6422303], length 0
1449997379.858911 IP localhost.http-alt > localhost.58863: Flags [P.], seq 24625:25651, ack 1, win 342, options [nop,nop,TS val 6422316 ecr 6422253], length 1026
1449997379.858969 IP localhost.58863 > localhost.http-alt: Flags [.], ack 25651, win 743, options [nop,nop,TS val 6422316 ecr 6422316], length 0
1449997379.908848 IP localhost.http-alt > localhost.58864: Flags [P.], seq 24625:25651, ack 1, win 342, options [nop,nop,TS val 6422328 ecr 6422266], length 1026
