1449991776.508711 IP localhost.58623 > localhost.http-alt: Flags [S], seq 1682269932, win 43690, options [mss 65495,sackOK,TS val 5021478 ecr 0,nop,wscale 7], length 0
1449991776.508879 IP localhost.http-alt > localhost.58623: Flags [S.], seq 3978149295, ack 1682269933, win 43690, options [mss 65495,sackOK,TS val 5021478 ecr 5021478,nop,wscale 7], length 0
1449991776.509032 IP localhost.58623 > localhost.http-alt: Flags [.], ack 1, win 342, options [nop,nop,TS val 5021478 ecr 5021478], length 0
1449991776.559299 IP localhost.http-alt > localhost.58623: Flags [P.], seq 1:1027, ack 1, win 342, options [nop,nop,TS val 5021491 ecr 5021478], length 1026
1449991776.559603 IP localhost.58623 > localhost.http-alt: Flags [.], ack 1027, win 358, options [nop,nop,TS val 5021491 ecr 5021491], length 0
1449991776.609310 IP localhost.http-alt > localhost.58623: Flags [P.], seq 1027:2053, ack 1, win 342, options [nop,nop,TS val 5021503 ecr 5021491], length 1026
1449991776.609604 IP localhost.58623 > localhost.http-alt: Flags [.], ack 2053, win 374, options [nop,nop,TS val 5021503 ecr 5021503], length 0
1449991776.659319 IP localhost.http-alt > localhost.58623: Flags [P.], seq 2053:3079, ack 1, win 342, options [nop,nop,TS val 5021516 ecr 5021503], length 1026
1449991776.659577 IP localhost.58623 > localhost.http-alt: Flags [.], ack 3079, win 390, options [nop,nop,TS val 5021516 ecr 5021516], length 0
1449991776.709310 IP localhost.http-alt > localhost.58623: Flags [P.], seq 3079:4105, ack 1, win 342, options [nop,nop,TS val 5021528 ecr 5021516], length 1026
1449991776.709579 IP localhost.58623 > localhost.http-alt: Flags [.], ack 4105, win 406, options [nop,nop,TS val 5021528 ecr 5021528], length 0
1449991776.759311 IP localhost.http-alt > localhost.58623: Flags [P.], seq 4105:5131, ack 1, win 342, options [nop,nop,TS val 5021541 ecr 5021528], length 1026
1449991776.759584 IP localhost.58623 > localhost.http-alt: Flags [.], ack 5131, win 422, options [nop,nop,TS val 5021541 ecr 5021541], length 0
1449991776.809307 IP localhost.http-alt > localhost.58623: Flags [P.], seq 5131:6157, ack 1, win 342, options [nop,nop,TS val 5021553 ecr 5021541], length 1026
1449991776.809573 IP localhost.58623 > localhost.http-alt: Flags [.], ack 6157, win 438, options [nop,nop,TS val 5021553 ecr 5021553], length 0
1449991776.859330 IP localhost.http-alt > localhost.58623: Flags [P.], seq 6157:7183, ack 1, win 342, options [nop,nop,TS val 5021566 ecr 5021553], length 1026
1449991776.859597 IP localhost.58623 > localhost.http-alt: Flags [.], ack 7183, win 454, options [nop,nop,TS val 5021566 ecr 5021566], length 0
1449991776.909308 IP localhost.http-alt > localhost.58623: Flags [P.], seq 7183:8209, ack 1, win 342, options [nop,nop,TS val 5021578 ecr 5021566], length 1026
1449991776.909565 IP localhost.58623 > localhost.http-alt: Flags [.], ack 8209, win 470, options [nop,nop,TS val 5021578 ecr 5021578], length 0
1449991776.959318 IP localhost.http-alt > localhost.58623: Flags [P.], seq 8209:9235, ack 1, win 342, options [nop,nop,TS val 5021591 ecr 5021578], length 1026
1449991776.959588 IP localhost.58623 > localhost.http-alt: Flags [.], ack 9235, win 486, options [nop,nop,TS val 5021591 ecr 5021591], length 0
1449991777.009309 IP localhost.http-alt > localhost.58623: Flags [P.], seq 9235:10261, ack 1, win 342, options [nop,nop,TS val 5021603 ecr 5021591], length 1026
1449991777.009567 IP localhost.58623 > localhost.http-alt: Flags [.], ack 10261, win 502, options [nop,nop,TS val 5021603 ecr 5021603], length 0
1449991777.059311 IP localhost.http-alt > localhost.58623: Flags [P.], seq 10261:11287, ack 1, win 342, options [nop,nop,TS val 5021616 ecr 5021603], length 1026
1449991777.059579 IP localhost.58623 > localhost.http-alt: Flags [.], ack 11287, win 518, options [nop,nop,TS val 5021616 ecr 5021616], length 0
1449991777.109313 IP localhost.http-alt > localhost.58623: Flags [P.], seq 11287:12313, ack 1, win 342, options [nop,nop,TS val 5021628 ecr 5021616], length 1026
1449991777.109526 IP localhost.58623 > localhost.http-alt: Flags [.], ack 12313, win 534, options [nop,nop,TS val 5021628 ecr 5021628], length 0
1449991777.159308 IP localhost.http-alt > localhost.58623: Flags [P.], seq 12313:13339, ack 1, win 342, options [nop,nop,TS val 5021641 ecr 5021628], length 1026
1449991777.159560 IP localhost.58623 > localhost.http-alt: Flags [.], ack 13339, win 550, options [nop,nop,TS val 5021641 ecr 5021641], length 0
1449991777.209304 IP localhost.http-alt > localhost.58623: Flags [P.], seq 13339:14365, ack 1, win 342, options [nop,nop,TS val 5021653 ecr 5021641], length 1026
1449991777.209548 IP localhost.58623 > localhost.http-alt: Flags [.], ack 14365, win 566, options [nop,nop,TS val 5021653 ecr 5021653], length 0
1449991777.259297 IP localhost.http-alt > localhost.58623: Flags [P.], seq 14365:15391, ack 1, win 342, options [nop,nop,TS val 5021666 ecr 5021653], length 1026
1449991777.259464 IP localhost.58623 > localhost.http-alt: Flags [.], ack 15391, win 582, options [nop,nop,TS val 5021666 ecr 5021666], length 0
1449991777.309295 IP localhost.http-alt > localhost.58623: Flags [P.], seq 15391:16417, ack 1, win 342, options [nop,nop,TS val 5021678 ecr 5021666], length 1026
1449991777.309467 IP localhost.58623 > localhost.http-alt: Flags [.], ack 16417, win 598, options [nop,nop,TS val 5021678 ecr 5021678], length 0
1449991777.359313 IP localhost.http-alt > localhost.58623: Flags [P.], seq 16417:17443, ack 1, win 342, options [nop,nop,TS val 5021691 ecr 5021678], length 1026
1449991777.359580 IP localhost.58623 > localhost.http-alt: Flags [.], ack 17443, win 614, options [nop,nop,TS val 5021691 ecr 5021691], length 0
1449991777.409380 IP localhost.http-alt > localhost.58623: Flags [P.], seq 17443:18469, ack 1, win 342, options [nop,nop,TS val 5021703 ecr 5021691], length 1026
1449991777.409771 IP localhost.58623 > localhost.http-alt: Flags [.], ack 18469, win 630, options [nop,nop,TS val 5021703 ecr 5021703], length 0
1449991777.459385 IP localhost.http-alt > localhost.58623: Flags [P.], seq 18469:19495, ack 1, win 342, options [nop,nop,TS val 5021716 ecr 5021703], length 1026
1449991777.459716 IP localhost.58623 > localhost.http-alt: Flags [.], ack 19495, win 646, options [nop,nop,TS val 5021716 ecr 5021716], length 0
1449991777.509381 IP localhost.http-alt > localhost.58623: Flags [P.], seq 19495:20521, ack 1, win 342, options [nop,nop,TS val 5021728 ecr 5021716], length 1026
1449991777.509782 IP localhost.58623 > localhost.http-alt: Flags [.], ack 20521, win 662, options [nop,nop,TS val 5021728 ecr 5021728], length 0
1449991777.559353 IP localhost.http-alt > localhost.58623: Flags [P.], seq 20521:21547, ack 1, win 342, options [nop,nop,TS val 5021741 ecr 5021728], length 1026
1449991777.559615 IP localhost.58623 > localhost.http-alt: Flags [.], ack 21547, win 678, options [nop,nop,TS val 5021741 ecr 5021741], length 0
1449991777.609310 IP localhost.http-alt > localhost.58623: Flags [P.], seq 21547:22573, ack 1, win 342, options [nop,nop,TS val 5021753 ecr 5021741], length 1026
1449991777.609584 IP localhost.58623 > localhost.http-alt: Flags [.], ack 22573, win 695, options [nop,nop,TS val 5021753 ecr 5021753], length 0
1449991777.659314 IP localhost.http-alt > localhost.58623: Flags [P.], seq 22573:23599, ack 1, win 342, options [nop,nop,TS val 5021766 ecr 5021753], length 1026
1449991777.659583 IP localhost.58623 > localhost.http-alt: Flags [.], ack 23599, win 711, options [nop,nop,TS val 5021766 ecr 5021766], length 0
1449991777.709319 IP localhost.http-alt > localhost.58623: Flags [P.], seq 23599:24625, ack 1, win 342, options [nop,nop,TS val 5021778 ecr 5021766], length 1026
1449991777.709616 IP localhost.58623 > localhost.http-alt: Flags [.], ack 24625, win 727, options [nop,nop,TS val 5021778 ecr 5021778], length 0
1449991777.759301 IP localhost.http-alt > localhost.58623: Flags [P.], seq 24625:25651, ack 1, win 342, options [nop,nop,TS val 5021791 ecr 5021778], length 1026
1449991777.759571 IP localhost.58623 > localhost.http-alt: Flags [.], ack 25651, win 743, options [nop,nop,TS val 5021791 ecr 5021791], length 0
1449991777.809308 IP localhost.http-alt > localhost.58623: Flags [P.], seq 25651:26677, ack 1, win 342, options [nop,nop,TS val 5021803 ecr 5021791], length 1026
1449991777.809545 IP localhost.58623 > localhost.http-alt: Flags [.], ack 26677, win 759, options [nop,nop,TS val 5021803 ecr 5021803], length 0
1449991777.859317 IP localhost.http-alt > localhost.58623: Flags [P.], seq 26677:27703, ack 1, win 342, options [nop,nop,TS val 5021816 ecr 5021803], length 1026
1449991777.859604 IP localhost.58623 > localhost.http-alt: Flags [.], ack 27703, win 775, options [nop,nop,TS val 5021816 ecr 5021816], length 0
1449991777.909337 IP localhost.http-alt > localhost.58623: Flags [P.], seq 27703:28729, ack 1, win 342, options [nop,nop,TS val 5021828 ecr 5021816], length 1026
1449991777.909594 IP localhost.58623 > localhost.http-alt: Flags [.], ack 28729, win 791, options [nop,nop,TS val 5021828 ecr 5021828], length 0
1449991777.959279 IP localhost.http-alt > localhost.58623: Flags [P.], seq 28729:29755, ack 1, win 342, options [nop,nop,TS val 5021841 ecr 5021828], length 1026
1449991777.959530 IP localhost.58623 > localhost.http-alt: Flags [.], ack 29755, win 807, options [nop,nop,TS val 5021841 ecr 5021841], length 0
1449991778.009305 IP localhost.http-alt > localhost.58623: Flags [P.], seq 29755:30781, ack 1, win 342, options [nop,nop,TS val 5021853 ecr 5021841], length 1026
1449991778.009567 IP localhost.58623 > localhost.http-alt: Flags [.], ack 30781, win 823, options [nop,nop,TS val 5021853 ecr 5021853], length 0
1449991778.059380 IP localhost.http-alt > localhost.58623: Flags [P.], seq 30781:31807, ack 1, win 342, options [nop,nop,TS val 5021866 ecr 5021853], length 1026
1449991778.059751 IP localhost.58623 > localhost.http-alt: Flags [.], ack 31807, win 839, options [nop,nop,TS val 5021866 ecr 5021866], length 0
1449991778.109329 IP localhost.http-alt > localhost.58623: Flags [P.], seq 31807:32833, ack 1, win 342, options [nop,nop,TS val 5021878 ecr 5021866], length 1026
1449991778.109577 IP localhost.58623 > localhost.http-alt: Flags [.], ack 32833, win 855, options [nop,nop,TS val 5021878 ecr 5021878], length 0
1449991778.159409 IP localhost.http-alt > localhost.58623: Flags [P.], seq 32833:33859, ack 1, win 342, options [nop,nop,TS val 5021891 ecr 5021878], length 1026
1449991778.159819 IP localhost.58623 > localhost.http-alt: Flags [.], ack 33859, win 871, options [nop,nop,TS val 5021891 ecr 5021891], length 0
1449991778.209396 IP localhost.http-alt > localhost.58623: Flags [P.], seq 33859:34885, ack 1, win 342, options [nop,nop,TS val 5021903 ecr 5021891], length 1026
1449991778.209769 IP localhost.58623 > localhost.http-alt: Flags [.], ack 34885, win 887, options [nop,nop,TS val 5021903 ecr 5021903], length 0
1449991778.259325 IP localhost.http-alt > localhost.58623: Flags [P.], seq 34885:35911, ack 1, win 342, options [nop,nop,TS val 5021916 ecr 5021903], length 1026
1449991778.259582 IP localhost.58623 > localhost.http-alt: Flags [.], ack 35911, win 903, options [nop,nop,TS val 5021916 ecr 5021916], length 0
1449991778.309341 IP localhost.http-alt > localhost.58623: Flags [P.], seq 35911:36937, ack 1, win 342, options [nop,nop,TS val 5021928 ecr 5021916], length 1026
1449991778.309516 IP localhost.58623 > localhost.http-alt: Flags [.], ack 36937, win 919, options [nop,nop,TS val 5021928 ecr 5021928], length 0
1449991778.359321 IP localhost.http-alt > localhost.58623: Flags [P.], seq 36937:37963, ack 1, win 342, options [nop,nop,TS val 5021941 ecr 5021928], length 1026
1449991778.359513 IP localhost.58623 > localhost.http-alt: Flags [.], ack 37963, win 935, options [nop,nop,TS val 5021941 ecr 5021941], length 0
1449991778.409301 IP localhost.http-alt > localhost.58623: Flags [P.], seq 37963:38989, ack 1, win 342, options [nop,nop,TS val 5021953 ecr 5021941], length 1026
1449991778.409525 IP localhost.58623 > localhost.http-alt: Flags [.], ack 38989, win 951, options [nop,nop,TS val 5021953 ecr 5021953], length 0
1449991778.459310 IP localhost.http-alt > localhost.58623: Flags [P.], seq 38989:40015, ack 1, win 342, options [nop,nop,TS val 5021966 ecr 5021953], length 1026
1449991778.459458 IP localhost.58623 > localhost.http-alt: Flags [.], ack 40015, win 967, options [nop,nop,TS val 5021966 ecr 5021966], length 0
1449991778.509307 IP localhost.http-alt > localhost.58623: Flags [P.], seq 40015:41041, ack 1, win 342, options [nop,nop,TS val 5021978 ecr 5021966], length 1026
1449991778.509448 IP localhost.58623 > localhost.http-alt: Flags [.], ack 41041, win 983, options [nop,nop,TS val 5021978 ecr 5021978], length 0
1449991778.559317 IP localhost.http-alt > localhost.58623: Flags [P.], seq 41041:42067, ack 1, win 342, options [nop,nop,TS val 5021991 ecr 5021978], length 1026
1449991778.559519 IP localhost.58623 > localhost.http-alt: Flags [.], ack 42067, win 999, options [nop,nop,TS val 5021991 ecr 5021991], length 0
1449991778.609325 IP localhost.http-alt > localhost.58623: Flags [P.], seq 42067:43093, ack 1, win 342, options [nop,nop,TS val 5022003 ecr 5021991], length 1026
1449991778.609507 IP localhost.58623 > localhost.http-alt: Flags [.], ack 43093, win 1015, options [nop,nop,TS val 5022003 ecr 5022003], length 0
1449991778.659323 IP localhost.http-alt > localhost.58623: Flags [P.], seq 43093:44119, ack 1, win 342, options [nop,nop,TS val 5022016 ecr 5022003], length 1026
1449991778.659548 IP localhost.58623 > localhost.http-alt: Flags [.], ack 44119, win 1031, options [nop,nop,TS val 5022016 ecr 5022016], length 0
1449991778.709381 IP localhost.http-alt > localhost.58623: Flags [P.], seq 44119:45145, ack 1, win 342, options [nop,nop,TS val 5022028 ecr 5022016], length 1026
1449991778.709735 IP localhost.58623 > localhost.http-alt: Flags [.], ack 45145, win 1047, options [nop,nop,TS val 5022028 ecr 5022028], length 0
1449991778.759396 IP localhost.http-alt > localhost.58623: Flags [P.], seq 45145:46171, ack 1, win 342, options [nop,nop,TS val 5022041 ecr 5022028], length 1026
1449991778.759736 IP localhost.58623 > localhost.http-alt: Flags [.], ack 46171, win 1063, options [nop,nop,TS val 5022041 ecr 5022041], length 0
1449991778.809352 IP localhost.http-alt > localhost.58623: Flags [P.], seq 46171:47197, ack 1, win 342, options [nop,nop,TS val 5022053 ecr 5022041], length 1026
1449991778.809606 IP localhost.58623 > localhost.http-alt: Flags [.], ack 47197, win 1079, options [nop,nop,TS val 5022053 ecr 5022053], length 0
1449991778.859382 IP localhost.http-alt > localhost.58623: Flags [P.], seq 47197:48223, ack 1, win 342, options [nop,nop,TS val 5022066 ecr 5022053], length 1026
1449991778.859716 IP localhost.58623 > localhost.http-alt: Flags [.], ack 48223, win 1095, options [nop,nop,TS val 5022066 ecr 5022066], length 0
1449991778.909364 IP localhost.http-alt > localhost.58623: Flags [P.], seq 48223:49249, ack 1, win 342, options [nop,nop,TS val 5022078 ecr 5022066], length 1026
1449991778.909681 IP localhost.58623 > localhost.http-alt: Flags [.], ack 49249, win 1111, options [nop,nop,TS val 5022078 ecr 5022078], length 0
1449991778.959387 IP localhost.http-alt > localhost.58623: Flags [P.], seq 49249:50275, ack 1, win 342, options [nop,nop,TS val 5022091 ecr 5022078], length 1026
1449991778.959698 IP localhost.58623 > localhost.http-alt: Flags [.], ack 50275, win 1127, options [nop,nop,TS val 5022091 ecr 5022091], length 0
1449991779.009352 IP localhost.http-alt > localhost.58623: Flags [P.], seq 50275:51301, ack 1, win 342, options [nop,nop,TS val 5022103 ecr 5022091], length 1026
1449991779.009664 IP localhost.58623 > localhost.http-alt: Flags [.], ack 51301, win 1143, options [nop,nop,TS val 5022103 ecr 5022103], length 0
1449991779.059307 IP localhost.http-alt > localhost.58623: Flags [P.], seq 51301:52327, ack 1, win 342, options [nop,nop,TS val 5022116 ecr 5022103], length 1026
1449991779.059482 IP localhost.58623 > localhost.http-alt: Flags [.], ack 52327, win 1159, options [nop,nop,TS val 5022116 ecr 5022116], length 0
1449991779.109346 IP localhost.http-alt > localhost.58623: Flags [P.], seq 52327:53353, ack 1, win 342, options [nop,nop,TS val 5022128 ecr 5022116], length 1026
1449991779.109639 IP localhost.58623 > localhost.http-alt: Flags [.], ack 53353, win 1175, options [nop,nop,TS val 5022128 ecr 5022128], length 0
1449991779.159299 IP localhost.http-alt > localhost.58623: Flags [P.], seq 53353:54379, ack 1, win 342, options [nop,nop,TS val 5022141 ecr 5022128], length 1026
1449991779.159455 IP localhost.58623 > localhost.http-alt: Flags [.], ack 54379, win 1191, options [nop,nop,TS val 5022141 ecr 5022141], length 0
1449991779.209345 IP localhost.http-alt > localhost.58623: Flags [P.], seq 54379:55405, ack 1, win 342, options [nop,nop,TS val 5022153 ecr 5022141], length 1026
1449991779.209623 IP localhost.58623 > localhost.http-alt: Flags [.], ack 55405, win 1208, options [nop,nop,TS val 5022153 ecr 5022153], length 0
1449991779.259342 IP localhost.http-alt > localhost.58623: Flags [P.], seq 55405:56431, ack 1, win 342, options [nop,nop,TS val 5022166 ecr 5022153], length 1026
1449991779.259616 IP localhost.58623 > localhost.http-alt: Flags [.], ack 56431, win 1224, options [nop,nop,TS val 5022166 ecr 5022166], length 0
1449991779.309359 IP localhost.http-alt > localhost.58623: Flags [P.], seq 56431:57457, ack 1, win 342, options [nop,nop,TS val 5022178 ecr 5022166], length 1026
1449991779.309625 IP localhost.58623 > localhost.http-alt: Flags [.], ack 57457, win 1240, options [nop,nop,TS val 5022178 ecr 5022178], length 0
1449991779.359344 IP localhost.http-alt > localhost.58623: Flags [P.], seq 57457:58483, ack 1, win 342, options [nop,nop,TS val 5022191 ecr 5022178], length 1026
1449991779.359619 IP localhost.58623 > localhost.http-alt: Flags [.], ack 58483, win 1256, options [nop,nop,TS val 5022191 ecr 5022191], length 0
1449991779.409341 IP localhost.http-alt > localhost.58623: Flags [P.], seq 58483:59509, ack 1, win 342, options [nop,nop,TS val 5022203 ecr 5022191], length 1026
1449991779.409622 IP localhost.58623 > localhost.http-alt: Flags [.], ack 59509, win 1272, options [nop,nop,TS val 5022203 ecr 5022203], length 0
1449991779.459380 IP localhost.http-alt > localhost.58623: Flags [P.], seq 59509:60535, ack 1, win 342, options [nop,nop,TS val 5022216 ecr 5022203], length 1026
1449991779.459679 IP localhost.58623 > localhost.http-alt: Flags [.], ack 60535, win 1288, options [nop,nop,TS val 5022216 ecr 5022216], length 0
1449991779.509372 IP localhost.http-alt > localhost.58623: Flags [P.], seq 60535:61561, ack 1, win 342, options [nop,nop,TS val 5022228 ecr 5022216], length 1026
1449991779.509678 IP localhost.58623 > localhost.http-alt: Flags [.], ack 61561, win 1304, options [nop,nop,TS val 5022228 ecr 5022228], length 0
1449991779.559319 IP localhost.http-alt > localhost.58623: Flags [P.], seq 61561:62587, ack 1, win 342, options [nop,nop,TS val 5022241 ecr 5022228], length 1026
1449991779.559594 IP localhost.58623 > localhost.http-alt: Flags [.], ack 62587, win 1320, options [nop,nop,TS val 5022241 ecr 5022241], length 0
1449991779.609312 IP localhost.http-alt > localhost.58623: Flags [P.], seq 62587:63613, ack 1, win 342, options [nop,nop,TS val 5022253 ecr 5022241], length 1026
1449991779.609581 IP localhost.58623 > localhost.http-alt: Flags [.], ack 63613, win 1336, options [nop,nop,TS val 5022253 ecr 5022253], length 0
1449991779.659335 IP localhost.http-alt > localhost.58623: Flags [P.], seq 63613:64639, ack 1, win 342, options [nop,nop,TS val 5022266 ecr 5022253], length 1026
1449991779.659604 IP localhost.58623 > localhost.http-alt: Flags [.], ack 64639, win 1352, options [nop,nop,TS val 5022266 ecr 5022266], length 0
1449991779.709347 IP localhost.http-alt > localhost.58623: Flags [P.], seq 64639:65665, ack 1, win 342, options [nop,nop,TS val 5022278 ecr 5022266], length 1026
1449991779.709617 IP localhost.58623 > localhost.http-alt: Flags [.], ack 65665, win 1368, options [nop,nop,TS val 5022278 ecr 5022278], length 0
1449991779.759315 IP localhost.http-alt > localhost.58623: Flags [P.], seq 65665:66691, ack 1, win 342, options [nop,nop,TS val 5022291 ecr 5022278], length 1026
1449991779.759521 IP localhost.58623 > localhost.http-alt: Flags [.], ack 66691, win 1384, options [nop,nop,TS val 5022291 ecr 5022291], length 0
1449991779.809291 IP localhost.http-alt > localhost.58623: Flags [P.], seq 66691:67717, ack 1, win 342, options [nop,nop,TS val 5022303 ecr 5022291], length 1026
1449991779.809579 IP localhost.58623 > localhost.http-alt: Flags [.], ack 67717, win 1400, options [nop,nop,TS val 5022303 ecr 5022303], length 0
1449991779.859421 IP localhost.http-alt > localhost.58623: Flags [P.], seq 67717:68743, ack 1, win 342, options [nop,nop,TS val 5022316 ecr 5022303], length 1026
1449991779.859831 IP localhost.58623 > localhost.http-alt: Flags [.], ack 68743, win 1416, options [nop,nop,TS val 5022316 ecr 5022316], length 0
1449991779.909349 IP localhost.http-alt > localhost.58623: Flags [P.], seq 68743:69769, ack 1, win 342, options [nop,nop,TS val 5022328 ecr 5022316], length 1026
1449991779.909728 IP localhost.58623 > localhost.http-alt: Flags [.], ack 69769, win 1432, options [nop,nop,TS val 5022328 ecr 5022328], length 0
1449991779.959402 IP localhost.http-alt > localhost.58623: Flags [P.], seq 69769:70795, ack 1, win 342, options [nop,nop,TS val 5022341 ecr 5022328], length 1026
1449991779.959771 IP localhost.58623 > localhost.http-alt: Flags [.], ack 70795, win 1448, options [nop,nop,TS val 5022341 ecr 5022341], length 0
1449991780.009381 IP localhost.http-alt > localhost.58623: Flags [P.], seq 70795:71821, ack 1, win 342, options [nop,nop,TS val 5022353 ecr 5022341], length 1026
1449991780.009688 IP localhost.58623 > localhost.http-alt: Flags [.], ack 71821, win 1464, options [nop,nop,TS val 5022353 ecr 5022353], length 0
1449991780.059326 IP localhost.http-alt > localhost.58623: Flags [P.], seq 71821:72847, ack 1, win 342, options [nop,nop,TS val 5022366 ecr 5022353], length 1026
1449991780.059526 IP localhost.58623 > localhost.http-alt: Flags [.], ack 72847, win 1480, options [nop,nop,TS val 5022366 ecr 5022366], length 0
1449991780.109302 IP localhost.http-alt > localhost.58623: Flags [P.], seq 72847:73873, ack 1, win 342, options [nop,nop,TS val 5022378 ecr 5022366], length 1026
1449991780.109425 IP localhost.58623 > localhost.http-alt: Flags [.], ack 73873, win 1496, options [nop,nop,TS val 5022378 ecr 5022378], length 0
1449991780.159297 IP localhost.http-alt > localhost.58623: Flags [P.], seq 73873:74899, ack 1, win 342, options [nop,nop,TS val 5022391 ecr 5022378], length 1026
1449991780.159462 IP localhost.58623 > localhost.http-alt: Flags [.], ack 74899, win 1512, options [nop,nop,TS val 5022391 ecr 5022391], length 0
1449991780.209345 IP localhost.http-alt > localhost.58623: Flags [P.], seq 74899:75925, ack 1, win 342, options [nop,nop,TS val 5022403 ecr 5022391], length 1026
1449991780.209651 IP localhost.58623 > localhost.http-alt: Flags [.], ack 75925, win 1528, options [nop,nop,TS val 5022403 ecr 5022403], length 0
1449991780.259309 IP localhost.http-alt > localhost.58623: Flags [P.], seq 75925:76951, ack 1, win 342, options [nop,nop,TS val 5022416 ecr 5022403], length 1026
1449991780.259475 IP localhost.58623 > localhost.http-alt: Flags [.], ack 76951, win 1544, options [nop,nop,TS val 5022416 ecr 5022416], length 0
1449991780.309306 IP localhost.http-alt > localhost.58623: Flags [P.], seq 76951:77977, ack 1, win 342, options [nop,nop,TS val 5022428 ecr 5022416], length 1026
1449991780.309486 IP localhost.58623 > localhost.http-alt: Flags [.], ack 77977, win 1560, options [nop,nop,TS val 5022428 ecr 5022428], length 0
1449991780.359322 IP localhost.http-alt > localhost.58623: Flags [P.], seq 77977:79003, ack 1, win 342, options [nop,nop,TS val 5022441 ecr 5022428], length 1026
1449991780.359508 IP localhost.58623 > localhost.http-alt: Flags [.], ack 79003, win 1576, options [nop,nop,TS val 5022441 ecr 5022441], length 0
1449991780.409327 IP localhost.http-alt > localhost.58623: Flags [P.], seq 79003:80029, ack 1, win 342, options [nop,nop,TS val 5022453 ecr 5022441], length 1026
1449991780.409478 IP localhost.58623 > localhost.http-alt: Flags [.], ack 80029, win 1592, options [nop,nop,TS val 5022453 ecr 5022453], length 0
1449991780.459367 IP localhost.http-alt > localhost.58623: Flags [P.], seq 80029:81055, ack 1, win 342, options [nop,nop,TS val 5022466 ecr 5022453], length 1026
1449991780.459615 IP localhost.58623 > localhost.http-alt: Flags [.], ack 81055, win 1608, options [nop,nop,TS val 5022466 ecr 5022466], length 0
1449991780.509404 IP localhost.http-alt > localhost.58623: Flags [P.], seq 81055:82081, ack 1, win 342, options [nop,nop,TS val 5022478 ecr 5022466], length 1026
1449991780.509766 IP localhost.58623 > localhost.http-alt: Flags [.], ack 82081, win 1624, options [nop,nop,TS val 5022478 ecr 5022478], length 0
1449991780.559311 IP localhost.http-alt > localhost.58623: Flags [P.], seq 82081:83107, ack 1, win 342, options [nop,nop,TS val 5022491 ecr 5022478], length 1026
1449991780.559554 IP localhost.58623 > localhost.http-alt: Flags [.], ack 83107, win 1640, options [nop,nop,TS val 5022491 ecr 5022491], length 0
1449991780.609313 IP localhost.http-alt > localhost.58623: Flags [P.], seq 83107:84133, ack 1, win 342, options [nop,nop,TS val 5022503 ecr 5022491], length 1026
1449991780.609548 IP localhost.58623 > localhost.http-alt: Flags [.], ack 84133, win 1656, options [nop,nop,TS val 5022503 ecr 5022503], length 0
1449991780.659292 IP localhost.http-alt > localhost.58623: Flags [P.], seq 84133:85159, ack 1, win 342, options [nop,nop,TS val 5022516 ecr 5022503], length 1026
1449991780.659472 IP localhost.58623 > localhost.http-alt: Flags [.], ack 85159, win 1672, options [nop,nop,TS val 5022516 ecr 5022516], length 0
1449991780.709319 IP localhost.http-alt > localhost.58623: Flags [P.], seq 85159:86185, ack 1, win 342, options [nop,nop,TS val 5022528 ecr 5022516], length 1026
1449991780.709570 IP localhost.58623 > localhost.http-alt: Flags [.], ack 86185, win 1688, options [nop,nop,TS val 5022528 ecr 5022528], length 0
1449991780.759359 IP localhost.http-alt > localhost.58623: Flags [P.], seq 86185:87211, ack 1, win 342, options [nop,nop,TS val 5022541 ecr 5022528], length 1026
1449991780.759666 IP localhost.58623 > localhost.http-alt: Flags [.], ack 87211, win 1704, options [nop,nop,TS val 5022541 ecr 5022541], length 0
1449991780.809315 IP localhost.http-alt > localhost.58623: Flags [P.], seq 87211:88237, ack 1, win 342, options [nop,nop,TS val 5022553 ecr 5022541], length 1026
1449991780.809484 IP localhost.58623 > localhost.http-alt: Flags [.], ack 88237, win 1721, options [nop,nop,TS val 5022553 ecr 5022553], length 0
1449991780.859301 IP localhost.http-alt > localhost.58623: Flags [P.], seq 88237:89263, ack 1, win 342, options [nop,nop,TS val 5022566 ecr 5022553], length 1026
1449991780.859488 IP localhost.58623 > localhost.http-alt: Flags [.], ack 89263, win 1737, options [nop,nop,TS val 5022566 ecr 5022566], length 0
1449991780.909311 IP localhost.http-alt > localhost.58623: Flags [P.], seq 89263:90289, ack 1, win 342, options [nop,nop,TS val 5022578 ecr 5022566], length 1026
1449991780.909488 IP localhost.58623 > localhost.http-alt: Flags [.], ack 90289, win 1753, options [nop,nop,TS val 5022578 ecr 5022578], length 0
1449991780.959325 IP localhost.http-alt > localhost.58623: Flags [P.], seq 90289:91315, ack 1, win 342, options [nop,nop,TS val 5022591 ecr 5022578], length 1026
1449991780.959588 IP localhost.58623 > localhost.http-alt: Flags [.], ack 91315, win 1769, options [nop,nop,TS val 5022591 ecr 5022591], length 0
1449991781.009281 IP localhost.http-alt > localhost.58623: Flags [P.], seq 91315:92341, ack 1, win 342, options [nop,nop,TS val 5022603 ecr 5022591], length 1026
1449991781.009450 IP localhost.58623 > localhost.http-alt: Flags [.], ack 92341, win 1785, options [nop,nop,TS val 5022603 ecr 5022603], length 0
1449991781.059316 IP localhost.http-alt > localhost.58623: Flags [P.], seq 92341:93367, ack 1, win 342, options [nop,nop,TS val 5022616 ecr 5022603], length 1026
1449991781.059485 IP localhost.58623 > localhost.http-alt: Flags [.], ack 93367, win 1801, options [nop,nop,TS val 5022616 ecr 5022616], length 0
1449991781.109323 IP localhost.http-alt > localhost.58623: Flags [P.], seq 93367:94393, ack 1, win 342, options [nop,nop,TS val 5022628 ecr 5022616], length 1026
1449991781.109504 IP localhost.58623 > localhost.http-alt: Flags [.], ack 94393, win 1817, options [nop,nop,TS val 5022628 ecr 5022628], length 0
1449991781.159303 IP localhost.http-alt > localhost.58623: Flags [P.], seq 94393:95419, ack 1, win 342, options [nop,nop,TS val 5022641 ecr 5022628], length 1026
1449991781.159484 IP localhost.58623 > localhost.http-alt: Flags [.], ack 95419, win 1833, options [nop,nop,TS val 5022641 ecr 5022641], length 0
1449991781.209283 IP localhost.http-alt > localhost.58623: Flags [P.], seq 95419:96445, ack 1, win 342, options [nop,nop,TS val 5022653 ecr 5022641], length 1026
1449991781.209446 IP localhost.58623 > localhost.http-alt: Flags [.], ack 96445, win 1849, options [nop,nop,TS val 5022653 ecr 5022653], length 0
1449991781.259279 IP localhost.http-alt > localhost.58623: Flags [P.], seq 96445:97471, ack 1, win 342, options [nop,nop,TS val 5022666 ecr 5022653], length 1026
1449991781.259497 IP localhost.58623 > localhost.http-alt: Flags [.], ack 97471, win 1865, options [nop,nop,TS val 5022666 ecr 5022666], length 0
1449991781.309281 IP localhost.http-alt > localhost.58623: Flags [P.], seq 97471:98497, ack 1, win 342, options [nop,nop,TS val 5022678 ecr 5022666], length 1026
1449991781.309537 IP localhost.58623 > localhost.http-alt: Flags [.], ack 98497, win 1881, options [nop,nop,TS val 5022678 ecr 5022678], length 0
1449991781.359317 IP localhost.http-alt > localhost.58623: Flags [P.], seq 98497:99523, ack 1, win 342, options [nop,nop,TS val 5022691 ecr 5022678], length 1026
1449991781.359511 IP localhost.58623 > localhost.http-alt: Flags [.], ack 99523, win 1897, options [nop,nop,TS val 5022691 ecr 5022691], length 0
1449991781.409327 IP localhost.http-alt > localhost.58623: Flags [P.], seq 99523:100549, ack 1, win 342, options [nop,nop,TS val 5022703 ecr 5022691], length 1026
1449991781.409487 IP localhost.58623 > localhost.http-alt: Flags [.], ack 100549, win 1913, options [nop,nop,TS val 5022703 ecr 5022703], length 0
1449991781.459314 IP localhost.http-alt > localhost.58623: Flags [P.], seq 100549:101575, ack 1, win 342, options [nop,nop,TS val 5022716 ecr 5022703], length 1026
1449991781.459442 IP localhost.58623 > localhost.http-alt: Flags [.], ack 101575, win 1929, options [nop,nop,TS val 5022716 ecr 5022716], length 0
1449991781.509345 IP localhost.http-alt > localhost.58623: Flags [P.], seq 101575:102601, ack 1, win 342, options [nop,nop,TS val 5022728 ecr 5022716], length 1026
1449991781.509622 IP localhost.58623 > localhost.http-alt: Flags [.], ack 102601, win 1945, options [nop,nop,TS val 5022728 ecr 5022728], length 0
1449991781.559323 IP localhost.http-alt > localhost.58623: Flags [P.], seq 102601:103627, ack 1, win 342, options [nop,nop,TS val 5022741 ecr 5022728], length 1026
1449991781.559500 IP localhost.58623 > localhost.http-alt: Flags [.], ack 103627, win 1961, options [nop,nop,TS val 5022741 ecr 5022741], length 0
1449991781.609322 IP localhost.http-alt > localhost.58623: Flags [P.], seq 103627:104653, ack 1, win 342, options [nop,nop,TS val 5022753 ecr 5022741], length 1026
1449991781.609546 IP localhost.58623 > localhost.http-alt: Flags [.], ack 104653, win 1977, options [nop,nop,TS val 5022753 ecr 5022753], length 0
1449991781.659328 IP localhost.http-alt > localhost.58623: Flags [P.], seq 104653:105679, ack 1, win 342, options [nop,nop,TS val 5022766 ecr 5022753], length 1026
1449991781.659549 IP localhost.58623 > localhost.http-alt: Flags [.], ack 105679, win 1993, options [nop,nop,TS val 5022766 ecr 5022766], length 0
1449991781.709298 IP localhost.http-alt > localhost.58623: Flags [P.], seq 105679:106705, ack 1, win 342, options [nop,nop,TS val 5022778 ecr 5022766], length 1026
1449991781.709489 IP localhost.58623 > localhost.http-alt: Flags [.], ack 106705, win 2009, options [nop,nop,TS val 5022778 ecr 5022778], length 0
1449991781.759297 IP localhost.http-alt > localhost.58623: Flags [P.], seq 106705:107731, ack 1, win 342, options [nop,nop,TS val 5022791 ecr 5022778], length 1026
1449991781.759485 IP localhost.58623 > localhost.http-alt: Flags [.], ack 107731, win 2025, options [nop,nop,TS val 5022791 ecr 5022791], length 0
1449991781.809373 IP localhost.http-alt > localhost.58623: Flags [P.], seq 107731:108757, ack 1, win 342, options [nop,nop,TS val 5022803 ecr 5022791], length 1026
1449991781.809777 IP localhost.58623 > localhost.http-alt: Flags [.], ack 108757, win 2041, options [nop,nop,TS val 5022803 ecr 5022803], length 0
1449991781.859340 IP localhost.http-alt > localhost.58623: Flags [P.], seq 108757:109783, ack 1, win 342, options [nop,nop,TS val 5022816 ecr 5022803], length 1026
1449991781.859597 IP localhost.58623 > localhost.http-alt: Flags [.], ack 109783, win 2057, options [nop,nop,TS val 5022816 ecr 5022816], length 0
1449991781.909313 IP localhost.http-alt > localhost.58623: Flags [P.], seq 109783:110809, ack 1, win 342, options [nop,nop,TS val 5022828 ecr 5022816], length 1026
1449991781.909572 IP localhost.58623 > localhost.http-alt: Flags [.], ack 110809, win 2073, options [nop,nop,TS val 5022828 ecr 5022828], length 0
1449991781.959312 IP localhost.http-alt > localhost.58623: Flags [P.], seq 110809:111835, ack 1, win 342, options [nop,nop,TS val 5022841 ecr 5022828], length 1026
1449991781.959564 IP localhost.58623 > localhost.http-alt: Flags [.], ack 111835, win 2089, options [nop,nop,TS val 5022841 ecr 5022841], length 0
1449991782.009310 IP localhost.http-alt > localhost.58623: Flags [P.], seq 111835:112861, ack 1, win 342, options [nop,nop,TS val 5022853 ecr 5022841], length 1026
1449991782.009549 IP localhost.58623 > localhost.http-alt: Flags [.], ack 112861, win 2105, options [nop,nop,TS val 5022853 ecr 5022853], length 0
1449991782.059315 IP localhost.http-alt > localhost.58623: Flags [P.], seq 112861:113887, ack 1, win 342, options [nop,nop,TS val 5022866 ecr 5022853], length 1026
1449991782.059564 IP localhost.58623 > localhost.http-alt: Flags [.], ack 113887, win 2121, options [nop,nop,TS val 5022866 ecr 5022866], length 0
1449991782.109406 IP localhost.http-alt > localhost.58623: Flags [P.], seq 113887:114913, ack 1, win 342, options [nop,nop,TS val 5022878 ecr 5022866], length 1026
1449991782.109730 IP localhost.58623 > localhost.http-alt: Flags [.], ack 114913, win 2137, options [nop,nop,TS val 5022878 ecr 5022878], length 0
1449991782.159329 IP localhost.http-alt > localhost.58623: Flags [P.], seq 114913:115939, ack 1, win 342, options [nop,nop,TS val 5022891 ecr 5022878], length 1026
1449991782.159616 IP localhost.58623 > localhost.http-alt: Flags [.], ack 115939, win 2153, options [nop,nop,TS val 5022891 ecr 5022891], length 0
1449991782.209330 IP localhost.http-alt > localhost.58623: Flags [P.], seq 115939:116965, ack 1, win 342, options [nop,nop,TS val 5022903 ecr 5022891], length 1026
1449991782.209645 IP localhost.58623 > localhost.http-alt: Flags [.], ack 116965, win 2169, options [nop,nop,TS val 5022903 ecr 5022903], length 0
1449991782.259381 IP localhost.http-alt > localhost.58623: Flags [P.], seq 116965:117991, ack 1, win 342, options [nop,nop,TS val 5022916 ecr 5022903], length 1026
1449991782.259762 IP localhost.58623 > localhost.http-alt: Flags [.], ack 117991, win 2185, options [nop,nop,TS val 5022916 ecr 5022916], length 0
1449991782.309308 IP localhost.http-alt > localhost.58623: Flags [P.], seq 117991:119017, ack 1, win 342, options [nop,nop,TS val 5022928 ecr 5022916], length 1026
1449991782.309501 IP localhost.58623 > localhost.http-alt: Flags [.], ack 119017, win 2201, options [nop,nop,TS val 5022928 ecr 5022928], length 0
1449991782.359327 IP localhost.http-alt > localhost.58623: Flags [P.], seq 119017:120043, ack 1, win 342, options [nop,nop,TS val 5022941 ecr 5022928], length 1026
1449991782.359523 IP localhost.58623 > localhost.http-alt: Flags [.], ack 120043, win 2217, options [nop,nop,TS val 5022941 ecr 5022941], length 0
1449991782.409318 IP localhost.http-alt > localhost.58623: Flags [P.], seq 120043:121069, ack 1, win 342, options [nop,nop,TS val 5022953 ecr 5022941], length 1026
1449991782.409502 IP localhost.58623 > localhost.http-alt: Flags [.], ack 121069, win 2234, options [nop,nop,TS val 5022953 ecr 5022953], length 0
1449991782.459331 IP localhost.http-alt > localhost.58623: Flags [P.], seq 121069:122095, ack 1, win 342, options [nop,nop,TS val 5022966 ecr 5022953], length 1026
1449991782.459554 IP localhost.58623 > localhost.http-alt: Flags [.], ack 122095, win 2250, options [nop,nop,TS val 5022966 ecr 5022966], length 0
1449991782.509339 IP localhost.http-alt > localhost.58623: Flags [P.], seq 122095:123121, ack 1, win 342, options [nop,nop,TS val 5022978 ecr 5022966], length 1026
1449991782.509743 IP localhost.58623 > localhost.http-alt: Flags [.], ack 123121, win 2266, options [nop,nop,TS val 5022978 ecr 5022978], length 0
1449991782.559326 IP localhost.http-alt > localhost.58623: Flags [P.], seq 123121:124147, ack 1, win 342, options [nop,nop,TS val 5022991 ecr 5022978], length 1026
1449991782.559609 IP localhost.58623 > localhost.http-alt: Flags [.], ack 124147, win 2282, options [nop,nop,TS val 5022991 ecr 5022991], length 0
1449991782.609311 IP localhost.http-alt > localhost.58623: Flags [P.], seq 124147:125173, ack 1, win 342, options [nop,nop,TS val 5023003 ecr 5022991], length 1026
1449991782.609568 IP localhost.58623 > localhost.http-alt: Flags [.], ack 125173, win 2298, options [nop,nop,TS val 5023003 ecr 5023003], length 0
1449991782.659307 IP localhost.http-alt > localhost.58623: Flags [P.], seq 125173:126199, ack 1, win 342, options [nop,nop,TS val 5023016 ecr 5023003], length 1026
1449991782.659571 IP localhost.58623 > localhost.http-alt: Flags [.], ack 126199, win 2314, options [nop,nop,TS val 5023016 ecr 5023016], length 0
1449991782.709306 IP localhost.http-alt > localhost.58623: Flags [P.], seq 126199:127225, ack 1, win 342, options [nop,nop,TS val 5023028 ecr 5023016], length 1026
1449991782.709544 IP localhost.58623 > localhost.http-alt: Flags [.], ack 127225, win 2330, options [nop,nop,TS val 5023028 ecr 5023028], length 0
1449991782.759306 IP localhost.http-alt > localhost.58623: Flags [P.], seq 127225:128251, ack 1, win 342, options [nop,nop,TS val 5023041 ecr 5023028], length 1026
1449991782.759582 IP localhost.58623 > localhost.http-alt: Flags [.], ack 128251, win 2346, options [nop,nop,TS val 5023041 ecr 5023041], length 0
1449991782.809329 IP localhost.http-alt > localhost.58623: Flags [P.], seq 128251:129277, ack 1, win 342, options [nop,nop,TS val 5023053 ecr 5023041], length 1026
1449991782.809547 IP localhost.58623 > localhost.http-alt: Flags [.], ack 129277, win 2362, options [nop,nop,TS val 5023053 ecr 5023053], length 0
1449991782.859339 IP localhost.http-alt > localhost.58623: Flags [P.], seq 129277:130303, ack 1, win 342, options [nop,nop,TS val 5023066 ecr 5023053], length 1026
1449991782.859652 IP localhost.58623 > localhost.http-alt: Flags [.], ack 130303, win 2378, options [nop,nop,TS val 5023066 ecr 5023066], length 0
1449991782.909341 IP localhost.http-alt > localhost.58623: Flags [P.], seq 130303:131329, ack 1, win 342, options [nop,nop,TS val 5023078 ecr 5023066], length 1026
1449991782.909568 IP localhost.58623 > localhost.http-alt: Flags [.], ack 131329, win 2394, options [nop,nop,TS val 5023078 ecr 5023078], length 0
