1449997343.439944 IP localhost.58860 > localhost.http-alt: Flags [S], seq 45746939, win 43690, options [mss 65495,sackOK,TS val 6413211 ecr 0,nop,wscale 7], length 0
1449997343.439969 IP localhost.http-alt > localhost.58860: Flags [S.], seq 2621319096, ack 45746940, win 43690, options [mss 65495,sackOK,TS val 6413211 ecr 6413211,nop,wscale 7], length 0
1449997343.439995 IP localhost.58860 > localhost.http-alt: Flags [.], ack 1, win 342, options [nop,nop,TS val 6413211 ecr 6413211], length 0
1449997343.490251 IP localhost.http-alt > localhost.58860: Flags [P.], seq 1:1027, ack 1, win 342, options [nop,nop,TS val 6413223 ecr 6413211], length 1026
1449997343.490309 IP localhost.58860 > localhost.http-alt: Flags [.], ack 1027, win 358, options [nop,nop,TS val 6413224 ecr 6413223], length 0
1449997343.540220 IP localhost.http-alt > localhost.58860: Flags [P.], seq 1027:2053, ack 1, win 342, options [nop,nop,TS val 6413236 ecr 6413224], length 1026
1449997343.540259 IP localhost.58860 > localhost.http-alt: Flags [.], ack 2053, win 374, options [nop,nop,TS val 6413236 ecr 6413236], length 0
1449997343.590353 IP localhost.http-alt > localhost.58860: Flags [P.], seq 2053:3079, ack 1, win 342, options [nop,nop,TS val 6413249 ecr 6413236], length 1026
1449997343.590400 IP localhost.58860 > localhost.http-alt: Flags [.], ack 3079, win 390, options [nop,nop,TS val 6413249 ecr 6413249], length 0
1449997343.640309 IP localhost.http-alt > localhost.58860: Flags [P.], seq 3079:4105, ack 1, win 342, options [nop,nop,TS val 6413261 ecr 6413249], length 1026
1449997343.640361 IP localhost.58860 > localhost.http-alt: Flags [.], ack 4105, win 406, options [nop,nop,TS val 6413261 ecr 6413261], length 0
1449997343.690346 IP localhost.http-alt > localhost.58860: Flags [P.], seq 4105:5131, ack 1, win 342, options [nop,nop,TS val 6413274 ecr 6413261], length 1026
1449997343.690405 IP localhost.58860 > localhost.http-alt: Flags [.], ack 5131, win 422, options [nop,nop,TS val 6413274 ecr 6413274], length 0
1449997343.740575 IP localhost.http-alt > localhost.58860: Flags [P.], seq 5131:6157, ack 1, win 342, options [nop,nop,TS val 6413286 ecr 6413274], length 1026
1449997343.740622 IP localhost.58860 > localhost.http-alt: Flags [.], ack 6157, win 438, options [nop,nop,TS val 6413286 ecr 6413286], length 0
1449997343.790349 IP localhost.http-alt > localhost.58860: Flags [P.], seq 6157:7183, ack 1, win 342, options [nop,nop,TS val 6413299 ecr 6413286], length 1026
1449997343.790397 IP localhost.58860 > localhost.http-alt: Flags [.], ack 7183, win 454, options [nop,nop,TS val 6413299 ecr 6413299], length 0
1449997343.840268 IP localhost.http-alt > localhost.58860: Flags [P.], seq 7183:8209, ack 1, win 342, options [nop,nop,TS val 6413311 ecr 6413299], length 1026
1449997343.840333 IP localhost.58860 > localhost.http-alt: Flags [.], ack 8209, win 470, options [nop,nop,TS val 6413311 ecr 6413311], length 0
1449997343.890261 IP localhost.http-alt > localhost.58860: Flags [P.], seq 8209:9235, ack 1, win 342, options [nop,nop,TS val 6413323 ecr 6413311], length 1026
1449997343.890325 IP localhost.58860 > localhost.http-alt: Flags [.], ack 9235, win 486, options [nop,nop,TS val 6413324 ecr 6413323], length 0
1449997343.940209 IP localhost.http-alt > localhost.58860: Flags [P.], seq 9235:10261, ack 1, win 342, options [nop,nop,TS val 6413336 ecr 6413324], length 1026
1449997343.940237 IP localhost.58860 > localhost.http-alt: Flags [.], ack 10261, win 502, options [nop,nop,TS val 6413336 ecr 6413336], length 0
1449997343.990337 IP localhost.http-alt > localhost.58860: Flags [P.], seq 10261:11287, ack 1, win 342, options [nop,nop,TS val 6413349 ecr 6413336], length 1026
1449997343.990379 IP localhost.58860 > localhost.http-alt: Flags [.], ack 11287, win 518, options [nop,nop,TS val 6413349 ecr 6413349], length 0
1449997344.040331 IP localhost.http-alt > localhost.58860: Flags [P.], seq 11287:12313, ack 1, win 342, options [nop,nop,TS val 6413361 ecr 6413349], length 1026
1449997344.040381 IP localhost.58860 > localhost.http-alt: Flags [.], ack 12313, win 534, options [nop,nop,TS val 6413361 ecr 6413361], length 0
1449997344.090336 IP localhost.http-alt > localhost.58860: Flags [P.], seq 12313:13339, ack 1, win 342, options [nop,nop,TS val 6413374 ecr 6413361], length 1026
1449997344.090385 IP localhost.58860 > localhost.http-alt: Flags [.], ack 13339, win 550, options [nop,nop,TS val 6413374 ecr 6413374], length 0
1449997344.140477 IP localhost.http-alt > localhost.58860: Flags [P.], seq 13339:14365, ack 1, win 342, options [nop,nop,TS val 6413386 ecr 6413374], length 1026
1449997344.140536 IP localhost.58860 > localhost.http-alt: Flags [.], ack 14365, win 566, options [nop,nop,TS val 6413386 ecr 6413386], length 0
1449997344.190238 IP localhost.http-alt > localhost.58860: Flags [P.], seq 14365:15391, ack 1, win 342, options [nop,nop,TS val 6413398 ecr 6413386], length 1026
1449997344.190263 IP localhost.58860 > localhost.http-alt: Flags [.], ack 15391, win 582, options [nop,nop,TS val 6413398 ecr 6413398], length 0
1449997344.240230 IP localhost.http-alt > localhost.58860: Flags [P.], seq 15391:16417, ack 1, win 342, options [nop,nop,TS val 6413411 ecr 6413398], length 1026
1449997344.240275 IP localhost.58860 > localhost.http-alt: Flags [.], ack 16417, win 598, options [nop,nop,TS val 6413411 ecr 6413411], length 0
1449997344.290349 IP localhost.http-alt > localhost.58860: Flags [P.], seq 16417:17443, ack 1, win 342, options [nop,nop,TS val 6413424 ecr 6413411], length 1026
1449997344.290394 IP localhost.58860 > localhost.http-alt: Flags [.], ack 17443, win 614, options [nop,nop,TS val 6413424 ecr 6413424], length 0
1449997344.340261 IP localhost.http-alt > localhost.58860: Flags [P.], seq 17443:18469, ack 1, win 342, options [nop,nop,TS val 6413436 ecr 6413424], length 1026
1449997344.340303 IP localhost.58860 > localhost.http-alt: Flags [.], ack 18469, win 630, options [nop,nop,TS val 6413436 ecr 6413436], length 0
1449997344.390225 IP localhost.http-alt > localhost.58860: Flags [P.], seq 18469:19495, ack 1, win 342, options [nop,nop,TS val 6413448 ecr 6413436], length 1026
1449997344.390267 IP localhost.58860 > localhost.http-alt: Flags [.], ack 19495, win 646, options [nop,nop,TS val 6413448 ecr 6413448], length 0
1449997344.440305 IP localhost.http-alt > localhost.58860: Flags [P.], seq 19495:20521, ack 1, win 342, options [nop,nop,TS val 6413461 ecr 6413448], length 1026
1449997344.440370 IP localhost.58860 > localhost.http-alt: Flags [.], ack 20521, win 662, options [nop,nop,TS val 6413461 ecr 6413461], length 0
1449997344.490260 IP localhost.http-alt > localhost.58860: Flags [P.], seq 20521:21547, ack 1, win 342, options [nop,nop,TS val 6413473 ecr 6413461], length 1026
1449997344.490323 IP localhost.58860 > localhost.http-alt: Flags [.], ack 21547, win 678, options [nop,nop,TS val 6413474 ecr 6413473], length 0
1449997344.540274 IP localhost.http-alt > localhost.58860: Flags [P.], seq 21547:22573, ack 1, win 342, options [nop,nop,TS val 6413486 ecr 6413474], length 1026
1449997344.540321 IP localhost.58860 > localhost.http-alt: Flags [.], ack 22573, win 695, options [nop,nop,TS val 6413486 ecr 6413486], length 0
1449997344.590208 IP localhost.http-alt > localhost.58860: Flags [P.], seq 22573:23599, ack 1, win 342, options [nop,nop,TS val 6413498 ecr 6413486], length 1026
1449997344.590242 IP localhost.58860 > localhost.http-alt: Flags [.], ack 23599, win 711, options [nop,nop,TS val 6413498 ecr 6413498], length 0
1449997344.640254 IP localhost.http-alt > localhost.58860: Flags [P.], seq 23599:24625, ack 1, win 342, options [nop,nop,TS val 6413511 ecr 6413498], length 1026
1449997344.640299 IP localhost.58860 > localhost.http-alt: Flags [.], ack 24625, win 727, options [nop,nop,TS val 6413511 ecr 6413511], length 0
1449997344.690336 IP localhost.http-alt > localhost.58860: Flags [P.], seq 24625:25651, ack 1, win 342, options [nop,nop,TS val 6413524 ecr 6413511], length 1026
1449997344.690381 IP localhost.58860 > localhost.http-alt: Flags [.], ack 25651, win 743, options [nop,nop,TS val 6413524 ecr 6413524], length 0
1449997344.740292 IP localhost.http-alt > localhost.58860: Flags [P.], seq 25651:26677, ack 1, win 342, options [nop,nop,TS val 6413536 ecr 6413524], length 1026
1449997344.740341 IP localhost.58860 > localhost.http-alt: Flags [.], ack 26677, win 759, options [nop,nop,TS val 6413536 ecr 6413536], length 0
1449997344.790259 IP localhost.http-alt > localhost.58860: Flags [P.], seq 26677:27703, ack 1, win 342, options [nop,nop,TS val 6413548 ecr 6413536], length 1026
1449997344.790331 IP localhost.58860 > localhost.http-alt: Flags [.], ack 27703, win 775, options [nop,nop,TS val 6413549 ecr 6413548], length 0
1449997344.840306 IP localhost.http-alt > localhost.58860: Flags [P.], seq 27703:28729, ack 1, win 342, options [nop,nop,TS val 6413561 ecr 6413549], length 1026
1449997344.840354 IP localhost.58860 > localhost.http-alt: Flags [.], ack 28729, win 791, options [nop,nop,TS val 6413561 ecr 6413561], length 0
1449997344.890197 IP localhost.http-alt > localhost.58860: Flags [P.], seq 28729:29755, ack 1, win 342, options [nop,nop,TS val 6413573 ecr 6413561], length 1026
1449997344.890233 IP localhost.58860 > localhost.http-alt: Flags [.], ack 29755, win 807, options [nop,nop,TS val 6413573 ecr 6413573], length 0
1449997344.940307 IP localhost.http-alt > localhost.58860: Flags [P.], seq 29755:30781, ack 1, win 342, options [nop,nop,TS val 6413586 ecr 6413573], length 1026
1449997344.940355 IP localhost.58860 > localhost.http-alt: Flags [.], ack 30781, win 823, options [nop,nop,TS val 6413586 ecr 6413586], length 0
1449997344.990331 IP localhost.http-alt > localhost.58860: Flags [P.], seq 30781:31807, ack 1, win 342, options [nop,nop,TS val 6413599 ecr 6413586], length 1026
1449997344.990377 IP localhost.58860 > localhost.http-alt: Flags [.], ack 31807, win 839, options [nop,nop,TS val 6413599 ecr 6413599], length 0
1449997345.040266 IP localhost.http-alt > localhost.58860: Flags [P.], seq 31807:32833, ack 1, win 342, options [nop,nop,TS val 6413611 ecr 6413599], length 1026
1449997345.040316 IP localhost.58860 > localhost.http-alt: Flags [.], ack 32833, win 855, options [nop,nop,TS val 6413611 ecr 6413611], length 0
1449997345.090348 IP localhost.http-alt > localhost.58860: Flags [P.], seq 32833:33859, ack 1, win 342, options [nop,nop,TS val 6413624 ecr 6413611], length 1026
1449997345.090392 IP localhost.58860 > localhost.http-alt: Flags [.], ack 33859, win 871, options [nop,nop,TS val 6413624 ecr 6413624], length 0
1449997345.140300 IP localhost.http-alt > localhost.58860: Flags [P.], seq 33859:34885, ack 1, win 342, options [nop,nop,TS val 6413636 ecr 6413624], length 1026
1449997345.140353 IP localhost.58860 > localhost.http-alt: Flags [.], ack 34885, win 887, options [nop,nop,TS val 6413636 ecr 6413636], length 0
1449997345.190346 IP localhost.http-alt > localhost.58860: Flags [P.], seq 34885:35911, ack 1, win 342, options [nop,nop,TS val 6413649 ecr 6413636], length 1026
1449997345.190404 IP localhost.58860 > localhost.http-alt: Flags [.], ack 35911, win 903, options [nop,nop,TS val 6413649 ecr 6413649], length 0
1449997345.240262 IP localhost.http-alt > localhost.58860: Flags [P.], seq 35911:36937, ack 1, win 342, options [nop,nop,TS val 6413661 ecr 6413649], length 1026
1449997345.240301 IP localhost.58860 > localhost.http-alt: Flags [.], ack 36937, win 919, options [nop,nop,TS val 6413661 ecr 6413661], length 0
1449997345.290321 IP localhost.http-alt > localhost.58860: Flags [P.], seq 36937:37963, ack 1, win 342, options [nop,nop,TS val 6413674 ecr 6413661], length 1026
1449997345.290365 IP localhost.58860 > localhost.http-alt: Flags [.], ack 37963, win 935, options [nop,nop,TS val 6413674 ecr 6413674], length 0
1449997345.340234 IP localhost.http-alt > localhost.58860: Flags [P.], seq 37963:38989, ack 1, win 342, options [nop,nop,TS val 6413686 ecr 6413674], length 1026
1449997345.340276 IP localhost.58860 > localhost.http-alt: Flags [.], ack 38989, win 951, options [nop,nop,TS val 6413686 ecr 6413686], length 0
1449997345.390341 IP localhost.http-alt > localhost.58860: Flags [P.], seq 38989:40015, ack 1, win 342, options [nop,nop,TS val 6413699 ecr 6413686], length 1026
1449997345.390387 IP localhost.58860 > localhost.http-alt: Flags [.], ack 40015, win 967, options [nop,nop,TS val 6413699 ecr 6413699], length 0
1449997345.440276 IP localhost.http-alt > localhost.58860: Flags [P.], seq 40015:41041, ack 1, win 342, options [nop,nop,TS val 6413711 ecr 6413699], length 1026
1449997345.440323 IP localhost.58860 > localhost.http-alt: Flags [.], ack 41041, win 983, options [nop,nop,TS val 6413711 ecr 6413711], length 0
1449997345.490328 IP localhost.http-alt > localhost.58860: Flags [P.], seq 41041:42067, ack 1, win 342, options [nop,nop,TS val 6413724 ecr 6413711], length 1026
1449997345.490373 IP localhost.58860 > localhost.http-alt: Flags [.], ack 42067, win 999, options [nop,nop,TS val 6413724 ecr 6413724], length 0
1449997345.540288 IP localhost.http-alt > localhost.58860: Flags [P.], seq 42067:43093, ack 1, win 342, options [nop,nop,TS val 6413736 ecr 6413724], length 1026
1449997345.540334 IP localhost.58860 > localhost.http-alt: Flags [.], ack 43093, win 1015, options [nop,nop,TS val 6413736 ecr 6413736], length 0
1449997345.590323 IP localhost.http-alt > localhost.58860: Flags [P.], seq 43093:44119, ack 1, win 342, options [nop,nop,TS val 6413749 ecr 6413736], length 1026
1449997345.590367 IP localhost.58860 > localhost.http-alt: Flags [.], ack 44119, win 1031, options [nop,nop,TS val 6413749 ecr 6413749], length 0
1449997345.640286 IP localhost.http-alt > localhost.58860: Flags [P.], seq 44119:45145, ack 1, win 342, options [nop,nop,TS val 6413761 ecr 6413749], length 1026
1449997345.640331 IP localhost.58860 > localhost.http-alt: Flags [.], ack 45145, win 1047, options [nop,nop,TS val 6413761 ecr 6413761], length 0
1449997345.690316 IP localhost.http-alt > localhost.58860: Flags [P.], seq 45145:46171, ack 1, win 342, options [nop,nop,TS val 6413774 ecr 6413761], length 1026
1449997345.690361 IP localhost.58860 > localhost.http-alt: Flags [.], ack 46171, win 1063, options [nop,nop,TS val 6413774 ecr 6413774], length 0
1449997345.740286 IP localhost.http-alt > localhost.58860: Flags [P.], seq 46171:47197, ack 1, win 342, options [nop,nop,TS val 6413786 ecr 6413774], length 1026
1449997345.740332 IP localhost.58860 > localhost.http-alt: Flags [.], ack 47197, win 1079, options [nop,nop,TS val 6413786 ecr 6413786], length 0
1449997345.790320 IP localhost.http-alt > localhost.58860: Flags [P.], seq 47197:48223, ack 1, win 342, options [nop,nop,TS val 6413799 ecr 6413786], length 1026
1449997345.790365 IP localhost.58860 > localhost.http-alt: Flags [.], ack 48223, win 1095, options [nop,nop,TS val 6413799 ecr 6413799], length 0
1449997345.840281 IP localhost.http-alt > localhost.58860: Flags [P.], seq 48223:49249, ack 1, win 342, options [nop,nop,TS val 6413811 ecr 6413799], length 1026
1449997345.840328 IP localhost.58860 > localhost.http-alt: Flags [.], ack 49249, win 1111, options [nop,nop,TS val 6413811 ecr 6413811], length 0
1449997345.890323 IP localhost.http-alt > localhost.58860: Flags [P.], seq 49249:50275, ack 1, win 342, options [nop,nop,TS val 6413824 ecr 6413811], length 1026
1449997345.890368 IP localhost.58860 > localhost.http-alt: Flags [.], ack 50275, win 1127, options [nop,nop,TS val 6413824 ecr 6413824], length 0
1449997345.940281 IP localhost.http-alt > localhost.58860: Flags [P.], seq 50275:51301, ack 1, win 342, options [nop,nop,TS val 6413836 ecr 6413824], length 1026
1449997345.940327 IP localhost.58860 > localhost.http-alt: Flags [.], ack 51301, win 1143, options [nop,nop,TS val 6413836 ecr 6413836], length 0
1449997345.990263 IP localhost.http-alt > localhost.58860: Flags [P.], seq 51301:52327, ack 1, win 342, options [nop,nop,TS val 6413848 ecr 6413836], length 1026
1449997345.990330 IP localhost.58860 > localhost.http-alt: Flags [.], ack 52327, win 1159, options [nop,nop,TS val 6413849 ecr 6413848], length 0
1449997346.040255 IP localhost.http-alt > localhost.58860: Flags [P.], seq 52327:53353, ack 1, win 342, options [nop,nop,TS val 6413861 ecr 6413849], length 1026
1449997346.040315 IP localhost.58860 > localhost.http-alt: Flags [.], ack 53353, win 1175, options [nop,nop,TS val 6413861 ecr 6413861], length 0
1449997346.090355 IP localhost.http-alt > localhost.58860: Flags [P.], seq 53353:54379, ack 1, win 342, options [nop,nop,TS val 6413874 ecr 6413861], length 1026
1449997346.090411 IP localhost.58860 > localhost.http-alt: Flags [.], ack 54379, win 1191, options [nop,nop,TS val 6413874 ecr 6413874], length 0
1449997346.140274 IP localhost.http-alt > localhost.58860: Flags [P.], seq 54379:55405, ack 1, win 342, options [nop,nop,TS val 6413886 ecr 6413874], length 1026
1449997346.140329 IP localhost.58860 > localhost.http-alt: Flags [.], ack 55405, win 1208, options [nop,nop,TS val 6413886 ecr 6413886], length 0
1449997346.190268 IP localhost.http-alt > localhost.58860: Flags [P.], seq 55405:56431, ack 1, win 342, options [nop,nop,TS val 6413898 ecr 6413886], length 1026
1449997346.190350 IP localhost.58860 > localhost.http-alt: Flags [.], ack 56431, win 1224, options [nop,nop,TS val 6413899 ecr 6413898], length 0
1449997346.240308 IP localhost.http-alt > localhost.58860: Flags [P.], seq 56431:57457, ack 1, win 342, options [nop,nop,TS val 6413911 ecr 6413899], length 1026
1449997346.240361 IP localhost.58860 > localhost.http-alt: Flags [.], ack 57457, win 1240, options [nop,nop,TS val 6413911 ecr 6413911], length 0
1449997346.290350 IP localhost.http-alt > localhost.58860: Flags [P.], seq 57457:58483, ack 1, win 342, options [nop,nop,TS val 6413924 ecr 6413911], length 1026
1449997346.290393 IP localhost.58860 > localhost.http-alt: Flags [.], ack 58483, win 1256, options [nop,nop,TS val 6413924 ecr 6413924], length 0
1449997346.340256 IP localhost.http-alt > localhost.58860: Flags [P.], seq 58483:59509, ack 1, win 342, options [nop,nop,TS val 6413936 ecr 6413924], length 1026
1449997346.340303 IP localhost.58860 > localhost.http-alt: Flags [.], ack 59509, win 1272, options [nop,nop,TS val 6413936 ecr 6413936], length 0
1449997346.390337 IP localhost.http-alt > localhost.58860: Flags [P.], seq 59509:60535, ack 1, win 342, options [nop,nop,TS val 6413949 ecr 6413936], length 1026
1449997346.390382 IP localhost.58860 > localhost.http-alt: Flags [.], ack 60535, win 1288, options [nop,nop,TS val 6413949 ecr 6413949], length 0
1449997346.440340 IP localhost.http-alt > localhost.58860: Flags [P.], seq 60535:61561, ack 1, win 342, options [nop,nop,TS val 6413961 ecr 6413949], length 1026
1449997346.440390 IP localhost.58860 > localhost.http-alt: Flags [.], ack 61561, win 1304, options [nop,nop,TS val 6413961 ecr 6413961], length 0
1449997346.490344 IP localhost.http-alt > localhost.58860: Flags [P.], seq 61561:62587, ack 1, win 342, options [nop,nop,TS val 6413974 ecr 6413961], length 1026
1449997346.490388 IP localhost.58860 > localhost.http-alt: Flags [.], ack 62587, win 1320, options [nop,nop,TS val 6413974 ecr 6413974], length 0
1449997346.540296 IP localhost.http-alt > localhost.58860: Flags [P.], seq 62587:63613, ack 1, win 342, options [nop,nop,TS val 6413986 ecr 6413974], length 1026
1449997346.540347 IP localhost.58860 > localhost.http-alt: Flags [.], ack 63613, win 1336, options [nop,nop,TS val 6413986 ecr 6413986], length 0
1449997346.590344 IP localhost.http-alt > localhost.58860: Flags [P.], seq 63613:64639, ack 1, win 342, options [nop,nop,TS val 6413999 ecr 6413986], length 1026
1449997346.590388 IP localhost.58860 > localhost.http-alt: Flags [.], ack 64639, win 1352, options [nop,nop,TS val 6413999 ecr 6413999], length 0
1449997346.640292 IP localhost.http-alt > localhost.58860: Flags [P.], seq 64639:65665, ack 1, win 342, options [nop,nop,TS val 6414011 ecr 6413999], length 1026
1449997346.640343 IP localhost.58860 > localhost.http-alt: Flags [.], ack 65665, win 1368, options [nop,nop,TS val 6414011 ecr 6414011], length 0
1449997346.690260 IP localhost.http-alt > localhost.58860: Flags [P.], seq 65665:66691, ack 1, win 342, options [nop,nop,TS val 6414023 ecr 6414011], length 1026
1449997346.690339 IP localhost.58860 > localhost.http-alt: Flags [.], ack 66691, win 1384, options [nop,nop,TS val 6414024 ecr 6414023], length 0
1449997346.740277 IP localhost.http-alt > localhost.58860: Flags [P.], seq 66691:67717, ack 1, win 342, options [nop,nop,TS val 6414036 ecr 6414024], length 1026
1449997346.740331 IP localhost.58860 > localhost.http-alt: Flags [.], ack 67717, win 1400, options [nop,nop,TS val 6414036 ecr 6414036], length 0
1449997346.790351 IP localhost.http-alt > localhost.58860: Flags [P.], seq 67717:68743, ack 1, win 342, options [nop,nop,TS val 6414049 ecr 6414036], length 1026
1449997346.790409 IP localhost.58860 > localhost.http-alt: Flags [.], ack 68743, win 1416, options [nop,nop,TS val 6414049 ecr 6414049], length 0
1449997346.840281 IP localhost.http-alt > localhost.58860: Flags [P.], seq 68743:69769, ack 1, win 342, options [nop,nop,TS val 6414061 ecr 6414049], length 1026
1449997346.840336 IP localhost.58860 > localhost.http-alt: Flags [.], ack 69769, win 1432, options [nop,nop,TS val 6414061 ecr 6414061], length 0
1449997346.890326 IP localhost.http-alt > localhost.58860: Flags [P.], seq 69769:70795, ack 1, win 342, options [nop,nop,TS val 6414074 ecr 6414061], length 1026
1449997346.890383 IP localhost.58860 > localhost.http-alt: Flags [.], ack 70795, win 1448, options [nop,nop,TS val 6414074 ecr 6414074], length 0
1449997346.940278 IP localhost.http-alt > localhost.58860: Flags [P.], seq 70795:71821, ack 1, win 342, options [nop,nop,TS val 6414086 ecr 6414074], length 1026
1449997346.940328 IP localhost.58860 > localhost.http-alt: Flags [.], ack 71821, win 1464, options [nop,nop,TS val 6414086 ecr 6414086], length 0
1449997346.990348 IP localhost.http-alt > localhost.58860: Flags [P.], seq 71821:72847, ack 1, win 342, options [nop,nop,TS val 6414099 ecr 6414086], length 1026
1449997346.990392 IP localhost.58860 > localhost.http-alt: Flags [.], ack 72847, win 1480, options [nop,nop,TS val 6414099 ecr 6414099], length 0
1449997347.040259 IP localhost.http-alt > localhost.58860: Flags [P.], seq 72847:73873, ack 1, win 342, options [nop,nop,TS val 6414111 ecr 6414099], length 1026
1449997347.040310 IP localhost.58860 > localhost.http-alt: Flags [.], ack 73873, win 1496, options [nop,nop,TS val 6414111 ecr 6414111], length 0
1449997347.090344 IP localhost.http-alt > localhost.58860: Flags [P.], seq 73873:74899, ack 1, win 342, options [nop,nop,TS val 6414124 ecr 6414111], length 1026
1449997347.090388 IP localhost.58860 > localhost.http-alt: Flags [.], ack 74899, win 1512, options [nop,nop,TS val 6414124 ecr 6414124], length 0
1449997347.140327 IP localhost.http-alt > localhost.58860: Flags [P.], seq 74899:75925, ack 1, win 342, options [nop,nop,TS val 6414136 ecr 6414124], length 1026
1449997347.140380 IP localhost.58860 > localhost.http-alt: Flags [.], ack 75925, win 1528, options [nop,nop,TS val 6414136 ecr 6414136], length 0
1449997347.190343 IP localhost.http-alt > localhost.58860: Flags [P.], seq 75925:76951, ack 1, win 342, options [nop,nop,TS val 6414149 ecr 6414136], length 1026
1449997347.190390 IP localhost.58860 > localhost.http-alt: Flags [.], ack 76951, win 1544, options [nop,nop,TS val 6414149 ecr 6414149], length 0
1449997347.240295 IP localhost.http-alt > localhost.58860: Flags [P.], seq 76951:77977, ack 1, win 342, options [nop,nop,TS val 6414161 ecr 6414149], length 1026
1449997347.240346 IP localhost.58860 > localhost.http-alt: Flags [.], ack 77977, win 1560, options [nop,nop,TS val 6414161 ecr 6414161], length 0
1449997347.290344 IP localhost.http-alt > localhost.58860: Flags [P.], seq 77977:79003, ack 1, win 342, options [nop,nop,TS val 6414174 ecr 6414161], length 1026
1449997347.290388 IP localhost.58860 > localhost.http-alt: Flags [.], ack 79003, win 1576, options [nop,nop,TS val 6414174 ecr 6414174], length 0
1449997347.340227 IP localhost.http-alt > localhost.58860: Flags [P.], seq 79003:80029, ack 1, win 342, options [nop,nop,TS val 6414186 ecr 6414174], length 1026
1449997347.340273 IP localhost.58860 > localhost.http-alt: Flags [.], ack 80029, win 1592, options [nop,nop,TS val 6414186 ecr 6414186], length 0
1449997347.390341 IP localhost.http-alt > localhost.58860: Flags [P.], seq 80029:81055, ack 1, win 342, options [nop,nop,TS val 6414199 ecr 6414186], length 1026
1449997347.390386 IP localhost.58860 > localhost.http-alt: Flags [.], ack 81055, win 1608, options [nop,nop,TS val 6414199 ecr 6414199], length 0
1449997347.440295 IP localhost.http-alt > localhost.58860: Flags [P.], seq 81055:82081, ack 1, win 342, options [nop,nop,TS val 6414211 ecr 6414199], length 1026
1449997347.440348 IP localhost.58860 > localhost.http-alt: Flags [.], ack 82081, win 1624, options [nop,nop,TS val 6414211 ecr 6414211], length 0
1449997347.490357 IP localhost.http-alt > localhost.58860: Flags [P.], seq 82081:83107, ack 1, win 342, options [nop,nop,TS val 6414224 ecr 6414211], length 1026
1449997347.490403 IP localhost.58860 > localhost.http-alt: Flags [.], ack 83107, win 1640, options [nop,nop,TS val 6414224 ecr 6414224], length 0
1449997347.540295 IP localhost.http-alt > localhost.58860: Flags [P.], seq 83107:84133, ack 1, win 342, options [nop,nop,TS val 6414236 ecr 6414224], length 1026
1449997347.540346 IP localhost.58860 > localhost.http-alt: Flags [.], ack 84133, win 1656, options [nop,nop,TS val 6414236 ecr 6414236], length 0
1449997347.590261 IP localhost.http-alt > localhost.58860: Flags [P.], seq 84133:85159, ack 1, win 342, options [nop,nop,TS val 6414248 ecr 6414236], length 1026
1449997347.590341 IP localhost.58860 > localhost.http-alt: Flags [.], ack 85159, win 1672, options [nop,nop,TS val 6414249 ecr 6414248], length 0
1449997347.640265 IP localhost.http-alt > localhost.58860: Flags [P.], seq 85159:86185, ack 1, win 342, options [nop,nop,TS val 6414261 ecr 6414249], length 1026
1449997347.640320 IP localhost.58860 > localhost.http-alt: Flags [.], ack 86185, win 1688, options [nop,nop,TS val 6414261 ecr 6414261], length 0
1449997347.690323 IP localhost.http-alt > localhost.58860: Flags [P.], seq 86185:87211, ack 1, win 342, options [nop,nop,TS val 6414274 ecr 6414261], length 1026
1449997347.690378 IP localhost.58860 > localhost.http-alt: Flags [.], ack 87211, win 1704, options [nop,nop,TS val 6414274 ecr 6414274], length 0
1449997347.740294 IP localhost.http-alt > localhost.58860: Flags [P.], seq 87211:88237, ack 1, win 342, options [nop,nop,TS val 6414286 ecr 6414274], length 1026
1449997347.740347 IP localhost.58860 > localhost.http-alt: Flags [.], ack 88237, win 1721, options [nop,nop,TS val 6414286 ecr 6414286], length 0
1449997347.790345 IP localhost.http-alt > localhost.58860: Flags [P.], seq 88237:89263, ack 1, win 342, options [nop,nop,TS val 6414299 ecr 6414286], length 1026
1449997347.790389 IP localhost.58860 > localhost.http-alt: Flags [.], ack 89263, win 1737, options [nop,nop,TS val 6414299 ecr 6414299], length 0
1449997347.840320 IP localhost.http-alt > localhost.58860: Flags [P.], seq 89263:90289, ack 1, win 342, options [nop,nop,TS val 6414311 ecr 6414299], length 1026
1449997347.840373 IP localhost.58860 > localhost.http-alt: Flags [.], ack 90289, win 1753, options [nop,nop,TS val 6414311 ecr 6414311], length 0
1449997347.890260 IP localhost.http-alt > localhost.58860: Flags [P.], seq 90289:91315, ack 1, win 342, options [nop,nop,TS val 6414323 ecr 6414311], length 1026
1449997347.890336 IP localhost.58860 > localhost.http-alt: Flags [.], ack 91315, win 1769, options [nop,nop,TS val 6414324 ecr 6414323], length 0
1449997347.940284 IP localhost.http-alt > localhost.58860: Flags [P.], seq 91315:92341, ack 1, win 342, options [nop,nop,TS val 6414336 ecr 6414324], length 1026
1449997347.940338 IP localhost.58860 > localhost.http-alt: Flags [.], ack 92341, win 1785, options [nop,nop,TS val 6414336 ecr 6414336], length 0
1449997347.990324 IP localhost.http-alt > localhost.58860: Flags [P.], seq 92341:93367, ack 1, win 342, options [nop,nop,TS val 6414349 ecr 6414336], length 1026
1449997347.990379 IP localhost.58860 > localhost.http-alt: Flags [.], ack 93367, win 1801, options [nop,nop,TS val 6414349 ecr 6414349], length 0
1449997348.040299 IP localhost.http-alt > localhost.58860: Flags [P.], seq 93367:94393, ack 1, win 342, options [nop,nop,TS val 6414361 ecr 6414349], length 1026
1449997348.040351 IP localhost.58860 > localhost.http-alt: Flags [.], ack 94393, win 1817, options [nop,nop,TS val 6414361 ecr 6414361], length 0
1449997348.090340 IP localhost.http-alt > localhost.58860: Flags [P.], seq 94393:95419, ack 1, win 342, options [nop,nop,TS val 6414374 ecr 6414361], length 1026
1449997348.090385 IP localhost.58860 > localhost.http-alt: Flags [.], ack 95419, win 1833, options [nop,nop,TS val 6414374 ecr 6414374], length 0
1449997348.140263 IP localhost.http-alt > localhost.58860: Flags [P.], seq 95419:96445, ack 1, win 342, options [nop,nop,TS val 6414386 ecr 6414374], length 1026
1449997348.140313 IP localhost.58860 > localhost.http-alt: Flags [.], ack 96445, win 1849, options [nop,nop,TS val 6414386 ecr 6414386], length 0
1449997348.190364 IP localhost.http-alt > localhost.58860: Flags [P.], seq 96445:97471, ack 1, win 342, options [nop,nop,TS val 6414399 ecr 6414386], length 1026
1449997348.190417 IP localhost.58860 > localhost.http-alt: Flags [.], ack 97471, win 1865, options [nop,nop,TS val 6414399 ecr 6414399], length 0
1449997348.240297 IP localhost.http-alt > localhost.58860: Flags [P.], seq 97471:98497, ack 1, win 342, options [nop,nop,TS val 6414411 ecr 6414399], length 1026
1449997348.240351 IP localhost.58860 > localhost.http-alt: Flags [.], ack 98497, win 1881, options [nop,nop,TS val 6414411 ecr 6414411], length 0
1449997348.290339 IP localhost.http-alt > localhost.58860: Flags [P.], seq 98497:99523, ack 1, win 342, options [nop,nop,TS val 6414424 ecr 6414411], length 1026
1449997348.290385 IP localhost.58860 > localhost.http-alt: Flags [.], ack 99523, win 1897, options [nop,nop,TS val 6414424 ecr 6414424], length 0
1449997348.340232 IP localhost.http-alt > localhost.58860: Flags [P.], seq 99523:100549, ack 1, win 342, options [nop,nop,TS val 6414436 ecr 6414424], length 1026
1449997348.340283 IP localhost.58860 > localhost.http-alt: Flags [.], ack 100549, win 1913, options [nop,nop,TS val 6414436 ecr 6414436], length 0
1449997348.390355 IP localhost.http-alt > localhost.58860: Flags [P.], seq 100549:101575, ack 1, win 342, options [nop,nop,TS val 6414449 ecr 6414436], length 1026
1449997348.390404 IP localhost.58860 > localhost.http-alt: Flags [.], ack 101575, win 1929, options [nop,nop,TS val 6414449 ecr 6414449], length 0
1449997348.440307 IP localhost.http-alt > localhost.58860: Flags [P.], seq 101575:102601, ack 1, win 342, options [nop,nop,TS val 6414461 ecr 6414449], length 1026
1449997348.440379 IP localhost.58860 > localhost.http-alt: Flags [.], ack 102601, win 1945, options [nop,nop,TS val 6414461 ecr 6414461], length 0
1449997348.490349 IP localhost.http-alt > localhost.58860: Flags [P.], seq 102601:103627, ack 1, win 342, options [nop,nop,TS val 6414474 ecr 6414461], length 1026
1449997348.490416 IP localhost.58860 > localhost.http-alt: Flags [.], ack 103627, win 1961, options [nop,nop,TS val 6414474 ecr 6414474], length 0
1449997348.540339 IP localhost.http-alt > localhost.58860: Flags [P.], seq 103627:104653, ack 1, win 342, options [nop,nop,TS val 6414486 ecr 6414474], length 1026
1449997348.540409 IP localhost.58860 > localhost.http-alt: Flags [.], ack 104653, win 1977, options [nop,nop,TS val 6414486 ecr 6414486], length 0
1449997348.590354 IP localhost.http-alt > localhost.58860: Flags [P.], seq 104653:105679, ack 1, win 342, options [nop,nop,TS val 6414499 ecr 6414486], length 1026
1449997348.590410 IP localhost.58860 > localhost.http-alt: Flags [.], ack 105679, win 1993, options [nop,nop,TS val 6414499 ecr 6414499], length 0
1449997348.640299 IP localhost.http-alt > localhost.58860: Flags [P.], seq 105679:106705, ack 1, win 342, options [nop,nop,TS val 6414511 ecr 6414499], length 1026
1449997348.640366 IP localhost.58860 > localhost.http-alt: Flags [.], ack 106705, win 2009, options [nop,nop,TS val 6414511 ecr 6414511], length 0
1449997348.690336 IP localhost.http-alt > localhost.58860: Flags [P.], seq 106705:107731, ack 1, win 342, options [nop,nop,TS val 6414524 ecr 6414511], length 1026
1449997348.690381 IP localhost.58860 > localhost.http-alt: Flags [.], ack 107731, win 2025, options [nop,nop,TS val 6414524 ecr 6414524], length 0
1449997348.740291 IP localhost.http-alt > localhost.58860: Flags [P.], seq 107731:108757, ack 1, win 342, options [nop,nop,TS val 6414536 ecr 6414524], length 1026
1449997348.740341 IP localhost.58860 > localhost.http-alt: Flags [.], ack 108757, win 2041, options [nop,nop,TS val 6414536 ecr 6414536], length 0
1449997348.790308 IP localhost.http-alt > localhost.58860: Flags [P.], seq 108757:109783, ack 1, win 342, options [nop,nop,TS val 6414549 ecr 6414536], length 1026
1449997348.790360 IP localhost.58860 > localhost.http-alt: Flags [.], ack 109783, win 2057, options [nop,nop,TS val 6414549 ecr 6414549], length 0
1449997348.840258 IP localhost.http-alt > localhost.58860: Flags [P.], seq 109783:110809, ack 1, win 342, options [nop,nop,TS val 6414561 ecr 6414549], length 1026
1449997348.840311 IP localhost.58860 > localhost.http-alt: Flags [.], ack 110809, win 2073, options [nop,nop,TS val 6414561 ecr 6414561], length 0
1449997348.890333 IP localhost.http-alt > localhost.58860: Flags [P.], seq 110809:111835, ack 1, win 342, options [nop,nop,TS val 6414574 ecr 6414561], length 1026
1449997348.890377 IP localhost.58860 > localhost.http-alt: Flags [.], ack 111835, win 2089, options [nop,nop,TS val 6414574 ecr 6414574], length 0
1449997348.940296 IP localhost.http-alt > localhost.58860: Flags [P.], seq 111835:112861, ack 1, win 342, options [nop,nop,TS val 6414586 ecr 6414574], length 1026
1449997348.940348 IP localhost.58860 > localhost.http-alt: Flags [.], ack 112861, win 2105, options [nop,nop,TS val 6414586 ecr 6414586], length 0
1449997348.990340 IP localhost.http-alt > localhost.58860: Flags [P.], seq 112861:113887, ack 1, win 342, options [nop,nop,TS val 6414599 ecr 6414586], length 1026
1449997348.990386 IP localhost.58860 > localhost.http-alt: Flags [.], ack 113887, win 2121, options [nop,nop,TS val 6414599 ecr 6414599], length 0
1449997349.040258 IP localhost.http-alt > localhost.58860: Flags [P.], seq 113887:114913, ack 1, win 342, options [nop,nop,TS val 6414611 ecr 6414599], length 1026
1449997349.040330 IP localhost.58860 > localhost.http-alt: Flags [.], ack 114913, win 2137, options [nop,nop,TS val 6414611 ecr 6414611], length 0
1449997349.090256 IP localhost.http-alt > localhost.58860: Flags [P.], seq 114913:115939, ack 1, win 342, options [nop,nop,TS val 6414623 ecr 6414611], length 1026
1449997349.090331 IP localhost.58860 > localhost.http-alt: Flags [.], ack 115939, win 2153, options [nop,nop,TS val 6414624 ecr 6414623], length 0
1449997349.140298 IP localhost.http-alt > localhost.58860: Flags [P.], seq 115939:116965, ack 1, win 342, options [nop,nop,TS val 6414636 ecr 6414624], length 1026
1449997349.140363 IP localhost.58860 > localhost.http-alt: Flags [.], ack 116965, win 2169, options [nop,nop,TS val 6414636 ecr 6414636], length 0
1449997349.190350 IP localhost.http-alt > localhost.58860: Flags [P.], seq 116965:117991, ack 1, win 342, options [nop,nop,TS val 6414649 ecr 6414636], length 1026
1449997349.190394 IP localhost.58860 > localhost.http-alt: Flags [.], ack 117991, win 2185, options [nop,nop,TS val 6414649 ecr 6414649], length 0
1449997349.240338 IP localhost.http-alt > localhost.58860: Flags [P.], seq 117991:119017, ack 1, win 342, options [nop,nop,TS val 6414661 ecr 6414649], length 1026
1449997349.240389 IP localhost.58860 > localhost.http-alt: Flags [.], ack 119017, win 2201, options [nop,nop,TS val 6414661 ecr 6414661], length 0
1449997349.290340 IP localhost.http-alt > localhost.58860: Flags [P.], seq 119017:120043, ack 1, win 342, options [nop,nop,TS val 6414674 ecr 6414661], length 1026
1449997349.290384 IP localhost.58860 > localhost.http-alt: Flags [.], ack 120043, win 2217, options [nop,nop,TS val 6414674 ecr 6414674], length 0
1449997349.340235 IP localhost.http-alt > localhost.58860: Flags [P.], seq 120043:121069, ack 1, win 342, options [nop,nop,TS val 6414686 ecr 6414674], length 1026
1449997349.340281 IP localhost.58860 > localhost.http-alt: Flags [.], ack 121069, win 2234, options [nop,nop,TS val 6414686 ecr 6414686], length 0
1449997349.390340 IP localhost.http-alt > localhost.58860: Flags [P.], seq 121069:122095, ack 1, win 342, options [nop,nop,TS val 6414699 ecr 6414686], length 1026
1449997349.390384 IP localhost.58860 > localhost.http-alt: Flags [.], ack 122095, win 2250, options [nop,nop,TS val 6414699 ecr 6414699], length 0
1449997349.440298 IP localhost.http-alt > localhost.58860: Flags [P.], seq 122095:123121, ack 1, win 342, options [nop,nop,TS val 6414711 ecr 6414699], length 1026
1449997349.440349 IP localhost.58860 > localhost.http-alt: Flags [.], ack 123121, win 2266, options [nop,nop,TS val 6414711 ecr 6414711], length 0
1449997349.490338 IP localhost.http-alt > localhost.58860: Flags [P.], seq 123121:124147, ack 1, win 342, options [nop,nop,TS val 6414724 ecr 6414711], length 1026
1449997349.490383 IP localhost.58860 > localhost.http-alt: Flags [.], ack 124147, win 2282, options [nop,nop,TS val 6414724 ecr 6414724], length 0
1449997349.540261 IP localhost.http-alt > localhost.58860: Flags [P.], seq 124147:125173, ack 1, win 342, options [nop,nop,TS val 6414736 ecr 6414724], length 1026
1449997349.540310 IP localhost.58860 > localhost.http-alt: Flags [.], ack 125173, win 2298, options [nop,nop,TS val 6414736 ecr 6414736], length 0
1449997349.590343 IP localhost.http-alt > localhost.58860: Flags [P.], seq 125173:126199, ack 1, win 342, options [nop,nop,TS val 6414749 ecr 6414736], length 1026
1449997349.590387 IP localhost.58860 > localhost.http-alt: Flags [.], ack 126199, win 2314, options [nop,nop,TS val 6414749 ecr 6414749], length 0
1449997349.640293 IP localhost.http-alt > localhost.58860: Flags [P.], seq 126199:127225, ack 1, win 342, options [nop,nop,TS val 6414761 ecr 6414749], length 1026
1449997349.640345 IP localhost.58860 > localhost.http-alt: Flags [.], ack 127225, win 2330, options [nop,nop,TS val 6414761 ecr 6414761], length 0
1449997349.690337 IP localhost.http-alt > localhost.58860: Flags [P.], seq 127225:128251, ack 1, win 342, options [nop,nop,TS val 6414774 ecr 6414761], length 1026
1449997349.690382 IP localhost.58860 > localhost.http-alt: Flags [.], ack 128251, win 2346, options [nop,nop,TS val 6414774 ecr 6414774], length 0
1449997349.740246 IP localhost.http-alt > localhost.58860: Flags [P.], seq 128251:129277, ack 1, win 342, options [nop,nop,TS val 6414786 ecr 6414774], length 1026
1449997349.740297 IP localhost.58860 > localhost.http-alt: Flags [.], ack 129277, win 2362, options [nop,nop,TS val 6414786 ecr 6414786], length 0
1449997349.790266 IP localhost.http-alt > localhost.58860: Flags [P.], seq 129277:130303, ack 1, win 342, options [nop,nop,TS val 6414798 ecr 6414786], length 1026
1449997349.790348 IP localhost.58860 > localhost.http-alt: Flags [.], ack 130303, win 2378, options [nop,nop,TS val 6414799 ecr 6414798], length 0
1449997349.840298 IP localhost.http-alt > localhost.58860: Flags [P.], seq 130303:131329, ack 1, win 342, options [nop,nop,TS val 6414811 ecr 6414799], length 1026
1449997349.840350 IP localhost.58860 > localhost.http-alt: Flags [.], ack 131329, win 2394, options [nop,nop,TS val 6414811 ecr 6414811], length 0
