1449991958.501503 IP localhost.58643 > localhost.http-alt: Flags [S], seq 1990095667, win 43690, options [mss 65495,sackOK,TS val 5066976 ecr 0,nop,wscale 7], length 0
1449991958.501743 IP localhost.http-alt > localhost.58643: Flags [S.], seq 4294413695, ack 1990095668, win 43690, options [mss 65495,sackOK,TS val 5066976 ecr 5066976,nop,wscale 7], length 0
1449991958.501997 IP localhost.58643 > localhost.http-alt: Flags [.], ack 1, win 342, options [nop,nop,TS val 5066976 ecr 5066976], length 0
1449991958.552326 IP localhost.http-alt > localhost.58643: Flags [P.], seq 1:1027, ack 1, win 342, options [nop,nop,TS val 5066989 ecr 5066976], length 1026
1449991958.552704 IP localhost.58643 > localhost.http-alt: Flags [.], ack 1027, win 358, options [nop,nop,TS val 5066989 ecr 5066989], length 0
1449991958.602332 IP localhost.http-alt > localhost.58643: Flags [P.], seq 1027:2053, ack 1, win 342, options [nop,nop,TS val 5067002 ecr 5066989], length 1026
1449991958.602534 IP localhost.58643 > localhost.http-alt: Flags [.], ack 2053, win 374, options [nop,nop,TS val 5067002 ecr 5067002], length 0
1449991958.652336 IP localhost.http-alt > localhost.58643: Flags [P.], seq 2053:3079, ack 1, win 342, options [nop,nop,TS val 5067014 ecr 5067002], length 1026
1449991958.652576 IP localhost.58643 > localhost.http-alt: Flags [.], ack 3079, win 390, options [nop,nop,TS val 5067014 ecr 5067014], length 0
1449991958.702334 IP localhost.http-alt > localhost.58643: Flags [P.], seq 3079:4105, ack 1, win 342, options [nop,nop,TS val 5067027 ecr 5067014], length 1026
1449991958.702716 IP localhost.58643 > localhost.http-alt: Flags [.], ack 4105, win 406, options [nop,nop,TS val 5067027 ecr 5067027], length 0
1449991958.752304 IP localhost.http-alt > localhost.58643: Flags [P.], seq 4105:5131, ack 1, win 342, options [nop,nop,TS val 5067039 ecr 5067027], length 1026
1449991958.752533 IP localhost.58643 > localhost.http-alt: Flags [.], ack 5131, win 422, options [nop,nop,TS val 5067039 ecr 5067039], length 0
1449991958.802328 IP localhost.http-alt > localhost.58643: Flags [P.], seq 5131:6157, ack 1, win 342, options [nop,nop,TS val 5067052 ecr 5067039], length 1026
1449991958.802661 IP localhost.58643 > localhost.http-alt: Flags [.], ack 6157, win 438, options [nop,nop,TS val 5067052 ecr 5067052], length 0
1449991958.852328 IP localhost.http-alt > localhost.58643: Flags [P.], seq 6157:7183, ack 1, win 342, options [nop,nop,TS val 5067064 ecr 5067052], length 1026
1449991958.852637 IP localhost.58643 > localhost.http-alt: Flags [.], ack 7183, win 454, options [nop,nop,TS val 5067064 ecr 5067064], length 0
1449991958.902302 IP localhost.http-alt > localhost.58643: Flags [P.], seq 7183:8209, ack 1, win 342, options [nop,nop,TS val 5067077 ecr 5067064], length 1026
1449991958.902599 IP localhost.58643 > localhost.http-alt: Flags [.], ack 8209, win 470, options [nop,nop,TS val 5067077 ecr 5067077], length 0
1449991958.952279 IP localhost.http-alt > localhost.58643: Flags [P.], seq 8209:9235, ack 1, win 342, options [nop,nop,TS val 5067089 ecr 5067077], length 1026
1449991958.952427 IP localhost.58643 > localhost.http-alt: Flags [.], ack 9235, win 486, options [nop,nop,TS val 5067089 ecr 5067089], length 0
1449991959.002302 IP localhost.http-alt > localhost.58643: Flags [P.], seq 9235:10261, ack 1, win 342, options [nop,nop,TS val 5067102 ecr 5067089], length 1026
1449991959.002471 IP localhost.58643 > localhost.http-alt: Flags [.], ack 10261, win 502, options [nop,nop,TS val 5067102 ecr 5067102], length 0
1449991959.052341 IP localhost.http-alt > localhost.58643: Flags [P.], seq 10261:11287, ack 1, win 342, options [nop,nop,TS val 5067114 ecr 5067102], length 1026
1449991959.052712 IP localhost.58643 > localhost.http-alt: Flags [.], ack 11287, win 518, options [nop,nop,TS val 5067114 ecr 5067114], length 0
1449991959.102409 IP localhost.http-alt > localhost.58643: Flags [P.], seq 11287:12313, ack 1, win 342, options [nop,nop,TS val 5067127 ecr 5067114], length 1026
1449991959.102931 IP localhost.58643 > localhost.http-alt: Flags [.], ack 12313, win 534, options [nop,nop,TS val 5067127 ecr 5067127], length 0
1449991959.152372 IP localhost.http-alt > localhost.58643: Flags [P.], seq 12313:13339, ack 1, win 342, options [nop,nop,TS val 5067139 ecr 5067127], length 1026
1449991959.152830 IP localhost.58643 > localhost.http-alt: Flags [.], ack 13339, win 550, options [nop,nop,TS val 5067139 ecr 5067139], length 0
1449991959.202449 IP localhost.http-alt > localhost.58643: Flags [P.], seq 13339:14365, ack 1, win 342, options [nop,nop,TS val 5067152 ecr 5067139], length 1026
1449991959.202936 IP localhost.58643 > localhost.http-alt: Flags [.], ack 14365, win 566, options [nop,nop,TS val 5067152 ecr 5067152], length 0
1449991959.252333 IP localhost.http-alt > localhost.58643: Flags [P.], seq 14365:15391, ack 1, win 342, options [nop,nop,TS val 5067164 ecr 5067152], length 1026
1449991959.252702 IP localhost.58643 > localhost.http-alt: Flags [.], ack 15391, win 582, options [nop,nop,TS val 5067164 ecr 5067164], length 0
1449991959.302299 IP localhost.http-alt > localhost.58643: Flags [P.], seq 15391:16417, ack 1, win 342, options [nop,nop,TS val 5067177 ecr 5067164], length 1026
1449991959.302615 IP localhost.58643 > localhost.http-alt: Flags [.], ack 16417, win 598, options [nop,nop,TS val 5067177 ecr 5067177], length 0
1449991959.352274 IP localhost.http-alt > localhost.58643: Flags [P.], seq 16417:17443, ack 1, win 342, options [nop,nop,TS val 5067189 ecr 5067177], length 1026
1449991959.352584 IP localhost.58643 > localhost.http-alt: Flags [.], ack 17443, win 614, options [nop,nop,TS val 5067189 ecr 5067189], length 0
1449991959.402307 IP localhost.http-alt > localhost.58643: Flags [P.], seq 17443:18469, ack 1, win 342, options [nop,nop,TS val 5067202 ecr 5067189], length 1026
1449991959.402646 IP localhost.58643 > localhost.http-alt: Flags [.], ack 18469, win 630, options [nop,nop,TS val 5067202 ecr 5067202], length 0
1449991959.452318 IP localhost.http-alt > localhost.58643: Flags [P.], seq 18469:19495, ack 1, win 342, options [nop,nop,TS val 5067214 ecr 5067202], length 1026
1449991959.452565 IP localhost.58643 > localhost.http-alt: Flags [.], ack 19495, win 646, options [nop,nop,TS val 5067214 ecr 5067214], length 0
1449991959.502350 IP localhost.http-alt > localhost.58643: Flags [P.], seq 19495:20521, ack 1, win 342, options [nop,nop,TS val 5067227 ecr 5067214], length 1026
1449991959.502543 IP localhost.58643 > localhost.http-alt: Flags [.], ack 20521, win 662, options [nop,nop,TS val 5067227 ecr 5067227], length 0
1449991959.552309 IP localhost.http-alt > localhost.58643: Flags [P.], seq 20521:21547, ack 1, win 342, options [nop,nop,TS val 5067239 ecr 5067227], length 1026
1449991959.552479 IP localhost.58643 > localhost.http-alt: Flags [.], ack 21547, win 678, options [nop,nop,TS val 5067239 ecr 5067239], length 0
1449991959.602323 IP localhost.http-alt > localhost.58643: Flags [P.], seq 21547:22573, ack 1, win 342, options [nop,nop,TS val 5067252 ecr 5067239], length 1026
1449991959.602683 IP localhost.58643 > localhost.http-alt: Flags [.], ack 22573, win 695, options [nop,nop,TS val 5067252 ecr 5067252], length 0
1449991959.652277 IP localhost.http-alt > localhost.58643: Flags [P.], seq 22573:23599, ack 1, win 342, options [nop,nop,TS val 5067264 ecr 5067252], length 1026
1449991959.652575 IP localhost.58643 > localhost.http-alt: Flags [.], ack 23599, win 711, options [nop,nop,TS val 5067264 ecr 5067264], length 0
1449991959.702301 IP localhost.http-alt > localhost.58643: Flags [P.], seq 23599:24625, ack 1, win 342, options [nop,nop,TS val 5067277 ecr 5067264], length 1026
1449991959.702627 IP localhost.58643 > localhost.http-alt: Flags [.], ack 24625, win 727, options [nop,nop,TS val 5067277 ecr 5067277], length 0
1449991959.752271 IP localhost.http-alt > localhost.58643: Flags [P.], seq 24625:25651, ack 1, win 342, options [nop,nop,TS val 5067289 ecr 5067277], length 1026
1449991959.752502 IP localhost.58643 > localhost.http-alt: Flags [.], ack 25651, win 743, options [nop,nop,TS val 5067289 ecr 5067289], length 0
1449991959.802305 IP localhost.http-alt > localhost.58643: Flags [P.], seq 25651:26677, ack 1, win 342, options [nop,nop,TS val 5067302 ecr 5067289], length 1026
1449991959.802514 IP localhost.58643 > localhost.http-alt: Flags [.], ack 26677, win 759, options [nop,nop,TS val 5067302 ecr 5067302], length 0
1449991959.852492 IP localhost.http-alt > localhost.58643: Flags [P.], seq 26677:27703, ack 1, win 342, options [nop,nop,TS val 5067314 ecr 5067302], length 1026
1449991959.852849 IP localhost.58643 > localhost.http-alt: Flags [.], ack 27703, win 775, options [nop,nop,TS val 5067314 ecr 5067314], length 0
1449991959.902357 IP localhost.http-alt > localhost.58643: Flags [P.], seq 27703:28729, ack 1, win 342, options [nop,nop,TS val 5067327 ecr 5067314], length 1026
1449991959.902745 IP localhost.58643 > localhost.http-alt: Flags [.], ack 28729, win 791, options [nop,nop,TS val 5067327 ecr 5067327], length 0
1449991959.952315 IP localhost.http-alt > localhost.58643: Flags [P.], seq 28729:29755, ack 1, win 342, options [nop,nop,TS val 5067339 ecr 5067327], length 1026
1449991959.952678 IP localhost.58643 > localhost.http-alt: Flags [.], ack 29755, win 807, options [nop,nop,TS val 5067339 ecr 5067339], length 0
1449991960.002335 IP localhost.http-alt > localhost.58643: Flags [P.], seq 29755:30781, ack 1, win 342, options [nop,nop,TS val 5067352 ecr 5067339], length 1026
1449991960.002715 IP localhost.58643 > localhost.http-alt: Flags [.], ack 30781, win 823, options [nop,nop,TS val 5067352 ecr 5067352], length 0
1449991960.052300 IP localhost.http-alt > localhost.58643: Flags [P.], seq 30781:31807, ack 1, win 342, options [nop,nop,TS val 5067364 ecr 5067352], length 1026
1449991960.052454 IP localhost.58643 > localhost.http-alt: Flags [.], ack 31807, win 839, options [nop,nop,TS val 5067364 ecr 5067364], length 0
1449991960.102334 IP localhost.http-alt > localhost.58643: Flags [P.], seq 31807:32833, ack 1, win 342, options [nop,nop,TS val 5067377 ecr 5067364], length 1026
1449991960.102647 IP localhost.58643 > localhost.http-alt: Flags [.], ack 32833, win 855, options [nop,nop,TS val 5067377 ecr 5067377], length 0
1449991960.152402 IP localhost.http-alt > localhost.58643: Flags [P.], seq 32833:33859, ack 1, win 342, options [nop,nop,TS val 5067389 ecr 5067377], length 1026
1449991960.152854 IP localhost.58643 > localhost.http-alt: Flags [.], ack 33859, win 871, options [nop,nop,TS val 5067389 ecr 5067389], length 0
1449991960.202323 IP localhost.http-alt > localhost.58643: Flags [P.], seq 33859:34885, ack 1, win 342, options [nop,nop,TS val 5067402 ecr 5067389], length 1026
1449991960.202699 IP localhost.58643 > localhost.http-alt: Flags [.], ack 34885, win 887, options [nop,nop,TS val 5067402 ecr 5067402], length 0
1449991960.252331 IP localhost.http-alt > localhost.58643: Flags [P.], seq 34885:35911, ack 1, win 342, options [nop,nop,TS val 5067414 ecr 5067402], length 1026
1449991960.252658 IP localhost.58643 > localhost.http-alt: Flags [.], ack 35911, win 903, options [nop,nop,TS val 5067414 ecr 5067414], length 0
1449991960.302315 IP localhost.http-alt > localhost.58643: Flags [P.], seq 35911:36937, ack 1, win 342, options [nop,nop,TS val 5067427 ecr 5067414], length 1026
1449991960.302642 IP localhost.58643 > localhost.http-alt: Flags [.], ack 36937, win 919, options [nop,nop,TS val 5067427 ecr 5067427], length 0
1449991960.352297 IP localhost.http-alt > localhost.58643: Flags [P.], seq 36937:37963, ack 1, win 342, options [nop,nop,TS val 5067439 ecr 5067427], length 1026
1449991960.352618 IP localhost.58643 > localhost.http-alt: Flags [.], ack 37963, win 935, options [nop,nop,TS val 5067439 ecr 5067439], length 0
1449991960.402323 IP localhost.http-alt > localhost.58643: Flags [P.], seq 37963:38989, ack 1, win 342, options [nop,nop,TS val 5067452 ecr 5067439], length 1026
1449991960.402678 IP localhost.58643 > localhost.http-alt: Flags [.], ack 38989, win 951, options [nop,nop,TS val 5067452 ecr 5067452], length 0
1449991960.452334 IP localhost.http-alt > localhost.58643: Flags [P.], seq 38989:40015, ack 1, win 342, options [nop,nop,TS val 5067464 ecr 5067452], length 1026
1449991960.452695 IP localhost.58643 > localhost.http-alt: Flags [.], ack 40015, win 967, options [nop,nop,TS val 5067464 ecr 5067464], length 0
1449991960.502429 IP localhost.http-alt > localhost.58643: Flags [P.], seq 40015:41041, ack 1, win 342, options [nop,nop,TS val 5067477 ecr 5067464], length 1026
1449991960.502895 IP localhost.58643 > localhost.http-alt: Flags [.], ack 41041, win 983, options [nop,nop,TS val 5067477 ecr 5067477], length 0
1449991960.552338 IP localhost.http-alt > localhost.58643: Flags [P.], seq 41041:42067, ack 1, win 342, options [nop,nop,TS val 5067489 ecr 5067477], length 1026
1449991960.552831 IP localhost.58643 > localhost.http-alt: Flags [.], ack 42067, win 999, options [nop,nop,TS val 5067489 ecr 5067489], length 0
1449991960.602364 IP localhost.http-alt > localhost.58643: Flags [P.], seq 42067:43093, ack 1, win 342, options [nop,nop,TS val 5067502 ecr 5067489], length 1026
1449991960.602735 IP localhost.58643 > localhost.http-alt: Flags [.], ack 43093, win 1015, options [nop,nop,TS val 5067502 ecr 5067502], length 0
1449991960.652319 IP localhost.http-alt > localhost.58643: Flags [P.], seq 43093:44119, ack 1, win 342, options [nop,nop,TS val 5067514 ecr 5067502], length 1026
1449991960.652678 IP localhost.58643 > localhost.http-alt: Flags [.], ack 44119, win 1031, options [nop,nop,TS val 5067514 ecr 5067514], length 0
1449991960.702392 IP localhost.http-alt > localhost.58643: Flags [P.], seq 44119:45145, ack 1, win 342, options [nop,nop,TS val 5067527 ecr 5067514], length 1026
1449991960.702828 IP localhost.58643 > localhost.http-alt: Flags [.], ack 45145, win 1047, options [nop,nop,TS val 5067527 ecr 5067527], length 0
1449991960.752309 IP localhost.http-alt > localhost.58643: Flags [P.], seq 45145:46171, ack 1, win 342, options [nop,nop,TS val 5067539 ecr 5067527], length 1026
1449991960.752667 IP localhost.58643 > localhost.http-alt: Flags [.], ack 46171, win 1063, options [nop,nop,TS val 5067539 ecr 5067539], length 0
1449991960.802322 IP localhost.http-alt > localhost.58643: Flags [P.], seq 46171:47197, ack 1, win 342, options [nop,nop,TS val 5067552 ecr 5067539], length 1026
1449991960.802624 IP localhost.58643 > localhost.http-alt: Flags [.], ack 47197, win 1079, options [nop,nop,TS val 5067552 ecr 5067552], length 0
1449991960.852297 IP localhost.http-alt > localhost.58643: Flags [P.], seq 47197:48223, ack 1, win 342, options [nop,nop,TS val 5067564 ecr 5067552], length 1026
1449991960.852643 IP localhost.58643 > localhost.http-alt: Flags [.], ack 48223, win 1095, options [nop,nop,TS val 5067564 ecr 5067564], length 0
1449991960.902311 IP localhost.http-alt > localhost.58643: Flags [P.], seq 48223:49249, ack 1, win 342, options [nop,nop,TS val 5067577 ecr 5067564], length 1026
1449991960.902657 IP localhost.58643 > localhost.http-alt: Flags [.], ack 49249, win 1111, options [nop,nop,TS val 5067577 ecr 5067577], length 0
1449991960.952330 IP localhost.http-alt > localhost.58643: Flags [P.], seq 49249:50275, ack 1, win 342, options [nop,nop,TS val 5067589 ecr 5067577], length 1026
1449991960.952750 IP localhost.58643 > localhost.http-alt: Flags [.], ack 50275, win 1127, options [nop,nop,TS val 5067589 ecr 5067589], length 0
1449991961.002326 IP localhost.http-alt > localhost.58643: Flags [P.], seq 50275:51301, ack 1, win 342, options [nop,nop,TS val 5067602 ecr 5067589], length 1026
1449991961.002679 IP localhost.58643 > localhost.http-alt: Flags [.], ack 51301, win 1143, options [nop,nop,TS val 5067602 ecr 5067602], length 0
1449991961.052285 IP localhost.http-alt > localhost.58643: Flags [P.], seq 51301:52327, ack 1, win 342, options [nop,nop,TS val 5067614 ecr 5067602], length 1026
1449991961.052560 IP localhost.58643 > localhost.http-alt: Flags [.], ack 52327, win 1159, options [nop,nop,TS val 5067614 ecr 5067614], length 0
1449991961.102419 IP localhost.http-alt > localhost.58643: Flags [P.], seq 52327:53353, ack 1, win 342, options [nop,nop,TS val 5067627 ecr 5067614], length 1026
1449991961.102876 IP localhost.58643 > localhost.http-alt: Flags [.], ack 53353, win 1175, options [nop,nop,TS val 5067627 ecr 5067627], length 0
1449991961.152377 IP localhost.http-alt > localhost.58643: Flags [P.], seq 53353:54379, ack 1, win 342, options [nop,nop,TS val 5067639 ecr 5067627], length 1026
1449991961.152844 IP localhost.58643 > localhost.http-alt: Flags [.], ack 54379, win 1191, options [nop,nop,TS val 5067639 ecr 5067639], length 0
1449991961.202259 IP localhost.http-alt > localhost.58643: Flags [P.], seq 54379:55405, ack 1, win 342, options [nop,nop,TS val 5067651 ecr 5067639], length 1026
1449991961.202425 IP localhost.58643 > localhost.http-alt: Flags [.], ack 55405, win 1208, options [nop,nop,TS val 5067652 ecr 5067651], length 0
1449991961.252292 IP localhost.http-alt > localhost.58643: Flags [P.], seq 55405:56431, ack 1, win 342, options [nop,nop,TS val 5067664 ecr 5067652], length 1026
1449991961.252580 IP localhost.58643 > localhost.http-alt: Flags [.], ack 56431, win 1224, options [nop,nop,TS val 5067664 ecr 5067664], length 0
1449991961.302332 IP localhost.http-alt > localhost.58643: Flags [P.], seq 56431:57457, ack 1, win 342, options [nop,nop,TS val 5067677 ecr 5067664], length 1026
1449991961.302641 IP localhost.58643 > localhost.http-alt: Flags [.], ack 57457, win 1240, options [nop,nop,TS val 5067677 ecr 5067677], length 0
1449991961.352288 IP localhost.http-alt > localhost.58643: Flags [P.], seq 57457:58483, ack 1, win 342, options [nop,nop,TS val 5067689 ecr 5067677], length 1026
1449991961.352467 IP localhost.58643 > localhost.http-alt: Flags [.], ack 58483, win 1256, options [nop,nop,TS val 5067689 ecr 5067689], length 0
1449991961.402300 IP localhost.http-alt > localhost.58643: Flags [P.], seq 58483:59509, ack 1, win 342, options [nop,nop,TS val 5067702 ecr 5067689], length 1026
1449991961.402533 IP localhost.58643 > localhost.http-alt: Flags [.], ack 59509, win 1272, options [nop,nop,TS val 5067702 ecr 5067702], length 0
1449991961.452314 IP localhost.http-alt > localhost.58643: Flags [P.], seq 59509:60535, ack 1, win 342, options [nop,nop,TS val 5067714 ecr 5067702], length 1026
1449991961.452620 IP localhost.58643 > localhost.http-alt: Flags [.], ack 60535, win 1288, options [nop,nop,TS val 5067714 ecr 5067714], length 0
1449991961.502293 IP localhost.http-alt > localhost.58643: Flags [P.], seq 60535:61561, ack 1, win 342, options [nop,nop,TS val 5067727 ecr 5067714], length 1026
1449991961.502507 IP localhost.58643 > localhost.http-alt: Flags [.], ack 61561, win 1304, options [nop,nop,TS val 5067727 ecr 5067727], length 0
1449991961.552264 IP localhost.http-alt > localhost.58643: Flags [P.], seq 61561:62587, ack 1, win 342, options [nop,nop,TS val 5067739 ecr 5067727], length 1026
1449991961.552496 IP localhost.58643 > localhost.http-alt: Flags [.], ack 62587, win 1320, options [nop,nop,TS val 5067739 ecr 5067739], length 0
1449991961.602323 IP localhost.http-alt > localhost.58643: Flags [P.], seq 62587:63613, ack 1, win 342, options [nop,nop,TS val 5067752 ecr 5067739], length 1026
1449991961.602582 IP localhost.58643 > localhost.http-alt: Flags [.], ack 63613, win 1336, options [nop,nop,TS val 5067752 ecr 5067752], length 0
1449991961.652363 IP localhost.http-alt > localhost.58643: Flags [P.], seq 63613:64639, ack 1, win 342, options [nop,nop,TS val 5067764 ecr 5067752], length 1026
1449991961.652696 IP localhost.58643 > localhost.http-alt: Flags [.], ack 64639, win 1352, options [nop,nop,TS val 5067764 ecr 5067764], length 0
1449991961.702295 IP localhost.http-alt > localhost.58643: Flags [P.], seq 64639:65665, ack 1, win 342, options [nop,nop,TS val 5067777 ecr 5067764], length 1026
1449991961.702625 IP localhost.58643 > localhost.http-alt: Flags [.], ack 65665, win 1368, options [nop,nop,TS val 5067777 ecr 5067777], length 0
1449991961.752258 IP localhost.http-alt > localhost.58643: Flags [P.], seq 65665:66691, ack 1, win 342, options [nop,nop,TS val 5067789 ecr 5067777], length 1026
1449991961.752582 IP localhost.58643 > localhost.http-alt: Flags [.], ack 66691, win 1384, options [nop,nop,TS val 5067789 ecr 5067789], length 0
1449991961.802255 IP localhost.http-alt > localhost.58643: Flags [P.], seq 66691:67717, ack 1, win 342, options [nop,nop,TS val 5067801 ecr 5067789], length 1026
1449991961.802565 IP localhost.58643 > localhost.http-alt: Flags [.], ack 67717, win 1400, options [nop,nop,TS val 5067802 ecr 5067801], length 0
1449991961.852294 IP localhost.http-alt > localhost.58643: Flags [P.], seq 67717:68743, ack 1, win 342, options [nop,nop,TS val 5067814 ecr 5067802], length 1026
1449991961.852636 IP localhost.58643 > localhost.http-alt: Flags [.], ack 68743, win 1416, options [nop,nop,TS val 5067814 ecr 5067814], length 0
1449991961.902256 IP localhost.http-alt > localhost.58643: Flags [P.], seq 68743:69769, ack 1, win 342, options [nop,nop,TS val 5067826 ecr 5067814], length 1026
1449991961.902574 IP localhost.58643 > localhost.http-alt: Flags [.], ack 69769, win 1432, options [nop,nop,TS val 5067827 ecr 5067826], length 0
1449991961.952255 IP localhost.http-alt > localhost.58643: Flags [P.], seq 69769:70795, ack 1, win 342, options [nop,nop,TS val 5067839 ecr 5067827], length 1026
1449991961.952504 IP localhost.58643 > localhost.http-alt: Flags [.], ack 70795, win 1448, options [nop,nop,TS val 5067839 ecr 5067839], length 0
1449991962.002328 IP localhost.http-alt > localhost.58643: Flags [P.], seq 70795:71821, ack 1, win 342, options [nop,nop,TS val 5067852 ecr 5067839], length 1026
1449991962.002691 IP localhost.58643 > localhost.http-alt: Flags [.], ack 71821, win 1464, options [nop,nop,TS val 5067852 ecr 5067852], length 0
1449991962.052296 IP localhost.http-alt > localhost.58643: Flags [P.], seq 71821:72847, ack 1, win 342, options [nop,nop,TS val 5067864 ecr 5067852], length 1026
1449991962.052636 IP localhost.58643 > localhost.http-alt: Flags [.], ack 72847, win 1480, options [nop,nop,TS val 5067864 ecr 5067864], length 0
1449991962.102331 IP localhost.http-alt > localhost.58643: Flags [P.], seq 72847:73873, ack 1, win 342, options [nop,nop,TS val 5067877 ecr 5067864], length 1026
1449991962.102609 IP localhost.58643 > localhost.http-alt: Flags [.], ack 73873, win 1496, options [nop,nop,TS val 5067877 ecr 5067877], length 0
1449991962.152302 IP localhost.http-alt > localhost.58643: Flags [P.], seq 73873:74899, ack 1, win 342, options [nop,nop,TS val 5067889 ecr 5067877], length 1026
1449991962.152674 IP localhost.58643 > localhost.http-alt: Flags [.], ack 74899, win 1512, options [nop,nop,TS val 5067889 ecr 5067889], length 0
1449991962.202380 IP localhost.http-alt > localhost.58643: Flags [P.], seq 74899:75925, ack 1, win 342, options [nop,nop,TS val 5067902 ecr 5067889], length 1026
1449991962.202863 IP localhost.58643 > localhost.http-alt: Flags [.], ack 75925, win 1528, options [nop,nop,TS val 5067902 ecr 5067902], length 0
1449991962.252309 IP localhost.http-alt > localhost.58643: Flags [P.], seq 75925:76951, ack 1, win 342, options [nop,nop,TS val 5067914 ecr 5067902], length 1026
1449991962.252684 IP localhost.58643 > localhost.http-alt: Flags [.], ack 76951, win 1544, options [nop,nop,TS val 5067914 ecr 5067914], length 0
1449991962.302315 IP localhost.http-alt > localhost.58643: Flags [P.], seq 76951:77977, ack 1, win 342, options [nop,nop,TS val 5067927 ecr 5067914], length 1026
1449991962.302675 IP localhost.58643 > localhost.http-alt: Flags [.], ack 77977, win 1560, options [nop,nop,TS val 5067927 ecr 5067927], length 0
1449991962.352375 IP localhost.http-alt > localhost.58643: Flags [P.], seq 77977:79003, ack 1, win 342, options [nop,nop,TS val 5067939 ecr 5067927], length 1026
1449991962.352750 IP localhost.58643 > localhost.http-alt: Flags [.], ack 79003, win 1576, options [nop,nop,TS val 5067939 ecr 5067939], length 0
1449991962.402311 IP localhost.http-alt > localhost.58643: Flags [P.], seq 79003:80029, ack 1, win 342, options [nop,nop,TS val 5067952 ecr 5067939], length 1026
1449991962.402509 IP localhost.58643 > localhost.http-alt: Flags [.], ack 80029, win 1592, options [nop,nop,TS val 5067952 ecr 5067952], length 0
1449991962.452287 IP localhost.http-alt > localhost.58643: Flags [P.], seq 80029:81055, ack 1, win 342, options [nop,nop,TS val 5067964 ecr 5067952], length 1026
1449991962.452518 IP localhost.58643 > localhost.http-alt: Flags [.], ack 81055, win 1608, options [nop,nop,TS val 5067964 ecr 5067964], length 0
1449991962.502348 IP localhost.http-alt > localhost.58643: Flags [P.], seq 81055:82081, ack 1, win 342, options [nop,nop,TS val 5067977 ecr 5067964], length 1026
1449991962.502673 IP localhost.58643 > localhost.http-alt: Flags [.], ack 82081, win 1624, options [nop,nop,TS val 5067977 ecr 5067977], length 0
1449991962.552280 IP localhost.http-alt > localhost.58643: Flags [P.], seq 82081:83107, ack 1, win 342, options [nop,nop,TS val 5067989 ecr 5067977], length 1026
1449991962.552456 IP localhost.58643 > localhost.http-alt: Flags [.], ack 83107, win 1640, options [nop,nop,TS val 5067989 ecr 5067989], length 0
1449991962.602334 IP localhost.http-alt > localhost.58643: Flags [P.], seq 83107:84133, ack 1, win 342, options [nop,nop,TS val 5068002 ecr 5067989], length 1026
1449991962.602700 IP localhost.58643 > localhost.http-alt: Flags [.], ack 84133, win 1656, options [nop,nop,TS val 5068002 ecr 5068002], length 0
1449991962.652300 IP localhost.http-alt > localhost.58643: Flags [P.], seq 84133:85159, ack 1, win 342, options [nop,nop,TS val 5068014 ecr 5068002], length 1026
1449991962.652653 IP localhost.58643 > localhost.http-alt: Flags [.], ack 85159, win 1672, options [nop,nop,TS val 5068014 ecr 5068014], length 0
1449991962.702251 IP localhost.http-alt > localhost.58643: Flags [P.], seq 85159:86185, ack 1, win 342, options [nop,nop,TS val 5068026 ecr 5068014], length 1026
1449991962.702546 IP localhost.58643 > localhost.http-alt: Flags [.], ack 86185, win 1688, options [nop,nop,TS val 5068027 ecr 5068026], length 0
1449991962.752293 IP localhost.http-alt > localhost.58643: Flags [P.], seq 86185:87211, ack 1, win 342, options [nop,nop,TS val 5068039 ecr 5068027], length 1026
1449991962.752669 IP localhost.58643 > localhost.http-alt: Flags [.], ack 87211, win 1704, options [nop,nop,TS val 5068039 ecr 5068039], length 0
1449991962.802331 IP localhost.http-alt > localhost.58643: Flags [P.], seq 87211:88237, ack 1, win 342, options [nop,nop,TS val 5068052 ecr 5068039], length 1026
1449991962.802589 IP localhost.58643 > localhost.http-alt: Flags [.], ack 88237, win 1721, options [nop,nop,TS val 5068052 ecr 5068052], length 0
1449991962.852306 IP localhost.http-alt > localhost.58643: Flags [P.], seq 88237:89263, ack 1, win 342, options [nop,nop,TS val 5068064 ecr 5068052], length 1026
1449991962.852662 IP localhost.58643 > localhost.http-alt: Flags [.], ack 89263, win 1737, options [nop,nop,TS val 5068064 ecr 5068064], length 0
1449991962.902265 IP localhost.http-alt > localhost.58643: Flags [P.], seq 89263:90289, ack 1, win 342, options [nop,nop,TS val 5068076 ecr 5068064], length 1026
1449991962.902444 IP localhost.58643 > localhost.http-alt: Flags [.], ack 90289, win 1753, options [nop,nop,TS val 5068077 ecr 5068076], length 0
1449991962.952295 IP localhost.http-alt > localhost.58643: Flags [P.], seq 90289:91315, ack 1, win 342, options [nop,nop,TS val 5068089 ecr 5068077], length 1026
1449991962.952518 IP localhost.58643 > localhost.http-alt: Flags [.], ack 91315, win 1769, options [nop,nop,TS val 5068089 ecr 5068089], length 0
1449991963.002261 IP localhost.http-alt > localhost.58643: Flags [P.], seq 91315:92341, ack 1, win 342, options [nop,nop,TS val 5068101 ecr 5068089], length 1026
1449991963.002529 IP localhost.58643 > localhost.http-alt: Flags [.], ack 92341, win 1785, options [nop,nop,TS val 5068102 ecr 5068101], length 0
1449991963.052392 IP localhost.http-alt > localhost.58643: Flags [P.], seq 92341:93367, ack 1, win 342, options [nop,nop,TS val 5068114 ecr 5068102], length 1026
1449991963.052921 IP localhost.58643 > localhost.http-alt: Flags [.], ack 93367, win 1801, options [nop,nop,TS val 5068114 ecr 5068114], length 0
1449991963.102416 IP localhost.http-alt > localhost.58643: Flags [P.], seq 93367:94393, ack 1, win 342, options [nop,nop,TS val 5068127 ecr 5068114], length 1026
1449991963.102905 IP localhost.58643 > localhost.http-alt: Flags [.], ack 94393, win 1817, options [nop,nop,TS val 5068127 ecr 5068127], length 0
1449991963.152302 IP localhost.http-alt > localhost.58643: Flags [P.], seq 94393:95419, ack 1, win 342, options [nop,nop,TS val 5068139 ecr 5068127], length 1026
1449991963.152467 IP localhost.58643 > localhost.http-alt: Flags [.], ack 95419, win 1833, options [nop,nop,TS val 5068139 ecr 5068139], length 0
1449991963.202328 IP localhost.http-alt > localhost.58643: Flags [P.], seq 95419:96445, ack 1, win 342, options [nop,nop,TS val 5068152 ecr 5068139], length 1026
1449991963.202712 IP localhost.58643 > localhost.http-alt: Flags [.], ack 96445, win 1849, options [nop,nop,TS val 5068152 ecr 5068152], length 0
1449991963.252306 IP localhost.http-alt > localhost.58643: Flags [P.], seq 96445:97471, ack 1, win 342, options [nop,nop,TS val 5068164 ecr 5068152], length 1026
1449991963.252650 IP localhost.58643 > localhost.http-alt: Flags [.], ack 97471, win 1865, options [nop,nop,TS val 5068164 ecr 5068164], length 0
1449991963.302325 IP localhost.http-alt > localhost.58643: Flags [P.], seq 97471:98497, ack 1, win 342, options [nop,nop,TS val 5068177 ecr 5068164], length 1026
1449991963.302664 IP localhost.58643 > localhost.http-alt: Flags [.], ack 98497, win 1881, options [nop,nop,TS val 5068177 ecr 5068177], length 0
1449991963.352296 IP localhost.http-alt > localhost.58643: Flags [P.], seq 98497:99523, ack 1, win 342, options [nop,nop,TS val 5068189 ecr 5068177], length 1026
1449991963.352627 IP localhost.58643 > localhost.http-alt: Flags [.], ack 99523, win 1897, options [nop,nop,TS val 5068189 ecr 5068189], length 0
1449991963.402346 IP localhost.http-alt > localhost.58643: Flags [P.], seq 99523:100549, ack 1, win 342, options [nop,nop,TS val 5068202 ecr 5068189], length 1026
1449991963.402683 IP localhost.58643 > localhost.http-alt: Flags [.], ack 100549, win 1913, options [nop,nop,TS val 5068202 ecr 5068202], length 0
1449991963.452289 IP localhost.http-alt > localhost.58643: Flags [P.], seq 100549:101575, ack 1, win 342, options [nop,nop,TS val 5068214 ecr 5068202], length 1026
1449991963.452521 IP localhost.58643 > localhost.http-alt: Flags [.], ack 101575, win 1929, options [nop,nop,TS val 5068214 ecr 5068214], length 0
1449991963.502413 IP localhost.http-alt > localhost.58643: Flags [P.], seq 101575:102601, ack 1, win 342, options [nop,nop,TS val 5068227 ecr 5068214], length 1026
1449991963.502891 IP localhost.58643 > localhost.http-alt: Flags [.], ack 102601, win 1945, options [nop,nop,TS val 5068227 ecr 5068227], length 0
1449991963.552387 IP localhost.http-alt > localhost.58643: Flags [P.], seq 102601:103627, ack 1, win 342, options [nop,nop,TS val 5068239 ecr 5068227], length 1026
1449991963.552695 IP localhost.58643 > localhost.http-alt: Flags [.], ack 103627, win 1961, options [nop,nop,TS val 5068239 ecr 5068239], length 0
1449991963.602342 IP localhost.http-alt > localhost.58643: Flags [P.], seq 103627:104653, ack 1, win 342, options [nop,nop,TS val 5068252 ecr 5068239], length 1026
1449991963.602729 IP localhost.58643 > localhost.http-alt: Flags [.], ack 104653, win 1977, options [nop,nop,TS val 5068252 ecr 5068252], length 0
1449991963.652350 IP localhost.http-alt > localhost.58643: Flags [P.], seq 104653:105679, ack 1, win 342, options [nop,nop,TS val 5068264 ecr 5068252], length 1026
1449991963.652710 IP localhost.58643 > localhost.http-alt: Flags [.], ack 105679, win 1993, options [nop,nop,TS val 5068264 ecr 5068264], length 0
1449991963.702399 IP localhost.http-alt > localhost.58643: Flags [P.], seq 105679:106705, ack 1, win 342, options [nop,nop,TS val 5068277 ecr 5068264], length 1026
1449991963.702666 IP localhost.58643 > localhost.http-alt: Flags [.], ack 106705, win 2009, options [nop,nop,TS val 5068277 ecr 5068277], length 0
1449991963.752384 IP localhost.http-alt > localhost.58643: Flags [P.], seq 106705:107731, ack 1, win 342, options [nop,nop,TS val 5068289 ecr 5068277], length 1026
1449991963.752708 IP localhost.58643 > localhost.http-alt: Flags [.], ack 107731, win 2025, options [nop,nop,TS val 5068289 ecr 5068289], length 0
1449991963.802344 IP localhost.http-alt > localhost.58643: Flags [P.], seq 107731:108757, ack 1, win 342, options [nop,nop,TS val 5068302 ecr 5068289], length 1026
1449991963.802576 IP localhost.58643 > localhost.http-alt: Flags [.], ack 108757, win 2041, options [nop,nop,TS val 5068302 ecr 5068302], length 0
1449991963.852356 IP localhost.http-alt > localhost.58643: Flags [P.], seq 108757:109783, ack 1, win 342, options [nop,nop,TS val 5068314 ecr 5068302], length 1026
1449991963.852652 IP localhost.58643 > localhost.http-alt: Flags [.], ack 109783, win 2057, options [nop,nop,TS val 5068314 ecr 5068314], length 0
1449991963.902324 IP localhost.http-alt > localhost.58643: Flags [P.], seq 109783:110809, ack 1, win 342, options [nop,nop,TS val 5068327 ecr 5068314], length 1026
1449991963.902508 IP localhost.58643 > localhost.http-alt: Flags [.], ack 110809, win 2073, options [nop,nop,TS val 5068327 ecr 5068327], length 0
1449991963.952247 IP localhost.http-alt > localhost.58643: Flags [P.], seq 110809:111835, ack 1, win 342, options [nop,nop,TS val 5068339 ecr 5068327], length 1026
1449991963.952404 IP localhost.58643 > localhost.http-alt: Flags [.], ack 111835, win 2089, options [nop,nop,TS val 5068339 ecr 5068339], length 0
1449991964.002465 IP localhost.http-alt > localhost.58643: Flags [P.], seq 111835:112861, ack 1, win 342, options [nop,nop,TS val 5068352 ecr 5068339], length 1026
1449991964.002690 IP localhost.58643 > localhost.http-alt: Flags [.], ack 112861, win 2105, options [nop,nop,TS val 5068352 ecr 5068352], length 0
1449991964.052362 IP localhost.http-alt > localhost.58643: Flags [P.], seq 112861:113887, ack 1, win 342, options [nop,nop,TS val 5068364 ecr 5068352], length 1026
1449991964.052565 IP localhost.58643 > localhost.http-alt: Flags [.], ack 113887, win 2121, options [nop,nop,TS val 5068364 ecr 5068364], length 0
1449991964.102406 IP localhost.http-alt > localhost.58643: Flags [P.], seq 113887:114913, ack 1, win 342, options [nop,nop,TS val 5068377 ecr 5068364], length 1026
1449991964.102982 IP localhost.58643 > localhost.http-alt: Flags [.], ack 114913, win 2137, options [nop,nop,TS val 5068377 ecr 5068377], length 0
1449991964.152391 IP localhost.http-alt > localhost.58643: Flags [P.], seq 114913:115939, ack 1, win 342, options [nop,nop,TS val 5068389 ecr 5068377], length 1026
1449991964.152739 IP localhost.58643 > localhost.http-alt: Flags [.], ack 115939, win 2153, options [nop,nop,TS val 5068389 ecr 5068389], length 0
1449991964.202257 IP localhost.http-alt > localhost.58643: Flags [P.], seq 115939:116965, ack 1, win 342, options [nop,nop,TS val 5068401 ecr 5068389], length 1026
1449991964.202586 IP localhost.58643 > localhost.http-alt: Flags [.], ack 116965, win 2169, options [nop,nop,TS val 5068402 ecr 5068401], length 0
1449991964.252261 IP localhost.http-alt > localhost.58643: Flags [P.], seq 116965:117991, ack 1, win 342, options [nop,nop,TS val 5068414 ecr 5068402], length 1026
1449991964.252599 IP localhost.58643 > localhost.http-alt: Flags [.], ack 117991, win 2185, options [nop,nop,TS val 5068414 ecr 5068414], length 0
1449991964.302258 IP localhost.http-alt > localhost.58643: Flags [P.], seq 117991:119017, ack 1, win 342, options [nop,nop,TS val 5068426 ecr 5068414], length 1026
1449991964.302630 IP localhost.58643 > localhost.http-alt: Flags [.], ack 119017, win 2201, options [nop,nop,TS val 5068427 ecr 5068426], length 0
1449991964.352253 IP localhost.http-alt > localhost.58643: Flags [P.], seq 119017:120043, ack 1, win 342, options [nop,nop,TS val 5068439 ecr 5068427], length 1026
1449991964.352584 IP localhost.58643 > localhost.http-alt: Flags [.], ack 120043, win 2217, options [nop,nop,TS val 5068439 ecr 5068439], length 0
1449991964.402251 IP localhost.http-alt > localhost.58643: Flags [P.], seq 120043:121069, ack 1, win 342, options [nop,nop,TS val 5068451 ecr 5068439], length 1026
1449991964.402584 IP localhost.58643 > localhost.http-alt: Flags [.], ack 121069, win 2234, options [nop,nop,TS val 5068452 ecr 5068451], length 0
1449991964.452306 IP localhost.http-alt > localhost.58643: Flags [P.], seq 121069:122095, ack 1, win 342, options [nop,nop,TS val 5068464 ecr 5068452], length 1026
1449991964.452579 IP localhost.58643 > localhost.http-alt: Flags [.], ack 122095, win 2250, options [nop,nop,TS val 5068464 ecr 5068464], length 0
1449991964.502347 IP localhost.http-alt > localhost.58643: Flags [P.], seq 122095:123121, ack 1, win 342, options [nop,nop,TS val 5068477 ecr 5068464], length 1026
1449991964.502815 IP localhost.58643 > localhost.http-alt: Flags [.], ack 123121, win 2266, options [nop,nop,TS val 5068477 ecr 5068477], length 0
1449991964.552319 IP localhost.http-alt > localhost.58643: Flags [P.], seq 123121:124147, ack 1, win 342, options [nop,nop,TS val 5068489 ecr 5068477], length 1026
1449991964.552661 IP localhost.58643 > localhost.http-alt: Flags [.], ack 124147, win 2282, options [nop,nop,TS val 5068489 ecr 5068489], length 0
1449991964.602303 IP localhost.http-alt > localhost.58643: Flags [P.], seq 124147:125173, ack 1, win 342, options [nop,nop,TS val 5068502 ecr 5068489], length 1026
1449991964.602649 IP localhost.58643 > localhost.http-alt: Flags [.], ack 125173, win 2298, options [nop,nop,TS val 5068502 ecr 5068502], length 0
1449991964.652266 IP localhost.http-alt > localhost.58643: Flags [P.], seq 125173:126199, ack 1, win 342, options [nop,nop,TS val 5068514 ecr 5068502], length 1026
1449991964.652598 IP localhost.58643 > localhost.http-alt: Flags [.], ack 126199, win 2314, options [nop,nop,TS val 5068514 ecr 5068514], length 0
1449991964.702313 IP localhost.http-alt > localhost.58643: Flags [P.], seq 126199:127225, ack 1, win 342, options [nop,nop,TS val 5068527 ecr 5068514], length 1026
1449991964.702623 IP localhost.58643 > localhost.http-alt: Flags [.], ack 127225, win 2330, options [nop,nop,TS val 5068527 ecr 5068527], length 0
1449991964.752278 IP localhost.http-alt > localhost.58643: Flags [P.], seq 127225:128251, ack 1, win 342, options [nop,nop,TS val 5068539 ecr 5068527], length 1026
1449991964.752419 IP localhost.58643 > localhost.http-alt: Flags [.], ack 128251, win 2346, options [nop,nop,TS val 5068539 ecr 5068539], length 0
1449991964.802372 IP localhost.http-alt > localhost.58643: Flags [P.], seq 128251:129277, ack 1, win 342, options [nop,nop,TS val 5068552 ecr 5068539], length 1026
1449991964.802613 IP localhost.58643 > localhost.http-alt: Flags [.], ack 129277, win 2362, options [nop,nop,TS val 5068552 ecr 5068552], length 0
1449991964.852398 IP localhost.http-alt > localhost.58643: Flags [P.], seq 129277:130303, ack 1, win 342, options [nop,nop,TS val 5068564 ecr 5068552], length 1026
1449991964.852675 IP localhost.58643 > localhost.http-alt: Flags [.], ack 130303, win 2378, options [nop,nop,TS val 5068564 ecr 5068564], length 0
1449991964.902256 IP localhost.http-alt > localhost.58643: Flags [P.], seq 130303:131329, ack 1, win 342, options [nop,nop,TS val 5068576 ecr 5068564], length 1026
1449991964.902602 IP localhost.58643 > localhost.http-alt: Flags [.], ack 131329, win 2394, options [nop,nop,TS val 5068577 ecr 5068576], length 0
