1450056058.982041 IP 10.1.1.2.17500 > 10.1.1.255.17500: UDP, length 293
1450056067.984465 IP 10.1.1.2.50628 > 10.1.1.1.2000: Flags [S], seq 4161630064, win 29200, options [mss 1460,sackOK,TS val 6850595 ecr 0,nop,wscale 9], length 0
1450056067.984531 IP 10.1.1.1.2000 > 10.1.1.2.50628: Flags [S.], seq 4183364733, ack 4161630065, win 28960, options [mss 1460,sackOK,TS val 6850635 ecr 6850595,nop,wscale 9], length 0
1450056068.144572 IP 10.1.1.2.50628 > 10.1.1.1.2000: Flags [.], ack 1, win 58, options [nop,nop,TS val 6850635 ecr 6850635], length 0
1450056068.144766 IP 10.1.1.2.58269 > 10.1.1.1.2000: Flags [S], seq 3045690609, win 29200, options [mss 1460,sackOK,TS val 6850635 ecr 0,nop,wscale 9], length 0
1450056068.144800 IP 10.1.1.1.2000 > 10.1.1.2.58269: Flags [S.], seq 1247344809, ack 3045690610, win 28960, options [mss 1460,sackOK,TS val 6850675 ecr 6850635,nop,wscale 9], length 0
1450056068.304836 IP 10.1.1.2.58269 > 10.1.1.1.2000: Flags [.], ack 1, win 58, options [nop,nop,TS val 6850675 ecr 6850675], length 0
1450056068.304956 IP 10.1.1.2.55348 > 10.1.1.1.2000: Flags [S], seq 2207245290, win 29200, options [mss 1460,sackOK,TS val 6850675 ecr 0,nop,wscale 9], length 0
1450056068.304994 IP 10.1.1.1.2000 > 10.1.1.2.55348: Flags [S.], seq 3344384677, ack 2207245291, win 28960, options [mss 1460,sackOK,TS val 6850715 ecr 6850675,nop,wscale 9], length 0
1450056068.465060 IP 10.1.1.2.55348 > 10.1.1.1.2000: Flags [.], ack 1, win 58, options [nop,nop,TS val 6850715 ecr 6850715], length 0
1450056068.465145 IP 10.1.1.2.46322 > 10.1.1.1.2000: Flags [S], seq 2075338049, win 29200, options [mss 1460,sackOK,TS val 6850715 ecr 0,nop,wscale 9], length 0
1450056068.465179 IP 10.1.1.1.2000 > 10.1.1.2.46322: Flags [S.], seq 643922301, ack 2075338050, win 28960, options [mss 1460,sackOK,TS val 6850755 ecr 6850715,nop,wscale 9], length 0
1450056068.625213 IP 10.1.1.2.46322 > 10.1.1.1.2000: Flags [.], ack 1, win 58, options [nop,nop,TS val 6850755 ecr 6850755], length 0
1450056068.625336 IP 10.1.1.2.39166 > 10.1.1.1.2000: Flags [S], seq 3354855404, win 29200, options [mss 1460,sackOK,TS val 6850755 ecr 0,nop,wscale 9], length 0
1450056068.625367 IP 10.1.1.1.2000 > 10.1.1.2.39166: Flags [S.], seq 1775515896, ack 3354855405, win 28960, options [mss 1460,sackOK,TS val 6850795 ecr 6850755,nop,wscale 9], length 0
1450056068.785401 IP 10.1.1.2.39166 > 10.1.1.1.2000: Flags [.], ack 1, win 58, options [nop,nop,TS val 6850795 ecr 6850795], length 0
1450056068.835967 IP 10.1.1.1.2000 > 10.1.1.2.50628: Flags [P.], seq 1:1027, ack 1, win 57, options [nop,nop,TS val 6850848 ecr 6850635], length 1026
1450056068.885934 IP 10.1.1.1.2000 > 10.1.1.2.58269: Flags [P.], seq 1:1027, ack 1, win 57, options [nop,nop,TS val 6850860 ecr 6850675], length 1026
1450056068.935804 IP 10.1.1.1.2000 > 10.1.1.2.55348: Flags [P.], seq 1:1027, ack 1, win 57, options [nop,nop,TS val 6850873 ecr 6850715], length 1026
1450056068.985793 IP 10.1.1.1.2000 > 10.1.1.2.46322: Flags [P.], seq 1:1027, ack 1, win 57, options [nop,nop,TS val 6850885 ecr 6850755], length 1026
1450056068.996000 IP 10.1.1.2.50628 > 10.1.1.1.2000: Flags [.], ack 1027, win 62, options [nop,nop,TS val 6850848 ecr 6850848], length 0
1450056069.035837 IP 10.1.1.1.2000 > 10.1.1.2.39166: Flags [P.], seq 1:1027, ack 1, win 57, options [nop,nop,TS val 6850898 ecr 6850795], length 1026
1450056069.045975 IP 10.1.1.2.58269 > 10.1.1.1.2000: Flags [.], ack 1027, win 62, options [nop,nop,TS val 6850860 ecr 6850860], length 0
1450056069.085816 IP 10.1.1.1.2000 > 10.1.1.2.50628: Flags [P.], seq 1027:2053, ack 1, win 57, options [nop,nop,TS val 6850910 ecr 6850848], length 1026
1450056069.095844 IP 10.1.1.2.55348 > 10.1.1.1.2000: Flags [.], ack 1027, win 62, options [nop,nop,TS val 6850873 ecr 6850873], length 0
1450056069.135785 IP 10.1.1.1.2000 > 10.1.1.2.58269: Flags [P.], seq 1027:2053, ack 1, win 57, options [nop,nop,TS val 6850923 ecr 6850860], length 1026
1450056069.145834 IP 10.1.1.2.46322 > 10.1.1.1.2000: Flags [.], ack 1027, win 62, options [nop,nop,TS val 6850885 ecr 6850885], length 0
1450056069.185889 IP 10.1.1.1.2000 > 10.1.1.2.55348: Flags [P.], seq 1027:2053, ack 1, win 57, options [nop,nop,TS val 6850935 ecr 6850873], length 1026
1450056069.195886 IP 10.1.1.2.39166 > 10.1.1.1.2000: Flags [.], ack 1027, win 62, options [nop,nop,TS val 6850898 ecr 6850898], length 0
1450056069.235893 IP 10.1.1.1.2000 > 10.1.1.2.46322: Flags [P.], seq 1027:2053, ack 1, win 57, options [nop,nop,TS val 6850948 ecr 6850885], length 1026
1450056069.245879 IP 10.1.1.2.50628 > 10.1.1.1.2000: Flags [.], ack 2053, win 66, options [nop,nop,TS val 6850910 ecr 6850910], length 0
1450056069.285795 IP 10.1.1.1.2000 > 10.1.1.2.39166: Flags [P.], seq 1027:2053, ack 1, win 57, options [nop,nop,TS val 6850960 ecr 6850898], length 1026
1450056069.295831 IP 10.1.1.2.58269 > 10.1.1.1.2000: Flags [.], ack 2053, win 66, options [nop,nop,TS val 6850923 ecr 6850923], length 0
1450056069.335784 IP 10.1.1.1.2000 > 10.1.1.2.50628: Flags [P.], seq 2053:3079, ack 1, win 57, options [nop,nop,TS val 6850973 ecr 6850910], length 1026
1450056069.345947 IP 10.1.1.2.55348 > 10.1.1.1.2000: Flags [.], ack 2053, win 66, options [nop,nop,TS val 6850935 ecr 6850935], length 0
1450056069.385744 IP 10.1.1.1.2000 > 10.1.1.2.58269: Flags [P.], seq 2053:3079, ack 1, win 57, options [nop,nop,TS val 6850985 ecr 6850923], length 1026
1450056069.395931 IP 10.1.1.2.46322 > 10.1.1.1.2000: Flags [.], ack 2053, win 66, options [nop,nop,TS val 6850948 ecr 6850948], length 0
1450056069.435856 IP 10.1.1.1.2000 > 10.1.1.2.55348: Flags [P.], seq 2053:3079, ack 1, win 57, options [nop,nop,TS val 6850998 ecr 6850935], length 1026
1450056069.445825 IP 10.1.1.2.39166 > 10.1.1.1.2000: Flags [.], ack 2053, win 66, options [nop,nop,TS val 6850960 ecr 6850960], length 0
1450056069.485795 IP 10.1.1.1.2000 > 10.1.1.2.46322: Flags [P.], seq 2053:3079, ack 1, win 57, options [nop,nop,TS val 6851010 ecr 6850948], length 1026
1450056069.495814 IP 10.1.1.2.50628 > 10.1.1.1.2000: Flags [.], ack 3079, win 70, options [nop,nop,TS val 6850973 ecr 6850973], length 0
1450056069.535803 IP 10.1.1.1.2000 > 10.1.1.2.39166: Flags [P.], seq 2053:3079, ack 1, win 57, options [nop,nop,TS val 6851023 ecr 6850960], length 1026
1450056069.545769 IP 10.1.1.2.58269 > 10.1.1.1.2000: Flags [.], ack 3079, win 70, options [nop,nop,TS val 6850985 ecr 6850985], length 0
1450056069.585786 IP 10.1.1.1.2000 > 10.1.1.2.50628: Flags [P.], seq 3079:4105, ack 1, win 57, options [nop,nop,TS val 6851035 ecr 6850973], length 1026
1450056069.595887 IP 10.1.1.2.55348 > 10.1.1.1.2000: Flags [.], ack 3079, win 70, options [nop,nop,TS val 6850998 ecr 6850998], length 0
1450056069.635895 IP 10.1.1.1.2000 > 10.1.1.2.58269: Flags [P.], seq 3079:4105, ack 1, win 57, options [nop,nop,TS val 6851048 ecr 6850985], length 1026
1450056069.645876 IP 10.1.1.2.46322 > 10.1.1.1.2000: Flags [.], ack 3079, win 70, options [nop,nop,TS val 6851010 ecr 6851010], length 0
1450056069.685897 IP 10.1.1.1.2000 > 10.1.1.2.55348: Flags [P.], seq 3079:4105, ack 1, win 57, options [nop,nop,TS val 6851060 ecr 6850998], length 1026
1450056069.695843 IP 10.1.1.2.39166 > 10.1.1.1.2000: Flags [.], ack 3079, win 70, options [nop,nop,TS val 6851023 ecr 6851023], length 0
1450056069.735795 IP 10.1.1.1.2000 > 10.1.1.2.46322: Flags [P.], seq 3079:4105, ack 1, win 57, options [nop,nop,TS val 6851073 ecr 6851010], length 1026
1450056069.745821 IP 10.1.1.2.50628 > 10.1.1.1.2000: Flags [.], ack 4105, win 74, options [nop,nop,TS val 6851035 ecr 6851035], length 0
1450056069.785839 IP 10.1.1.1.2000 > 10.1.1.2.39166: Flags [P.], seq 3079:4105, ack 1, win 57, options [nop,nop,TS val 6851085 ecr 6851023], length 1026
1450056069.795927 IP 10.1.1.2.58269 > 10.1.1.1.2000: Flags [.], ack 4105, win 74, options [nop,nop,TS val 6851048 ecr 6851048], length 0
1450056069.835803 IP 10.1.1.1.2000 > 10.1.1.2.50628: Flags [P.], seq 4105:5131, ack 1, win 57, options [nop,nop,TS val 6851098 ecr 6851035], length 1026
1450056069.885895 IP 10.1.1.1.2000 > 10.1.1.2.58269: Flags [P.], seq 4105:5131, ack 1, win 57, options [nop,nop,TS val 6851110 ecr 6851048], length 1026
1450056069.895835 IP 10.1.1.2.46322 > 10.1.1.1.2000: Flags [.], ack 4105, win 74, options [nop,nop,TS val 6851073 ecr 6851073], length 0
1450056069.935899 IP 10.1.1.1.2000 > 10.1.1.2.55348: Flags [P.], seq 4105:5131, ack 1, win 57, options [nop,nop,TS val 6851123 ecr 6850998], length 1026
1450056069.945871 IP 10.1.1.2.39166 > 10.1.1.1.2000: Flags [.], ack 4105, win 74, options [nop,nop,TS val 6851085 ecr 6851085], length 0
1450056069.985795 IP 10.1.1.1.2000 > 10.1.1.2.46322: Flags [P.], seq 4105:5131, ack 1, win 57, options [nop,nop,TS val 6851135 ecr 6851073], length 1026
1450056069.995838 IP 10.1.1.2.50628 > 10.1.1.1.2000: Flags [.], ack 5131, win 78, options [nop,nop,TS val 6851098 ecr 6851098], length 0
1450056070.035795 IP 10.1.1.1.2000 > 10.1.1.2.39166: Flags [P.], seq 4105:5131, ack 1, win 57, options [nop,nop,TS val 6851148 ecr 6851085], length 1026
1450056070.045932 IP 10.1.1.2.58269 > 10.1.1.1.2000: Flags [.], ack 5131, win 78, options [nop,nop,TS val 6851110 ecr 6851110], length 0
1450056070.085784 IP 10.1.1.1.2000 > 10.1.1.2.50628: Flags [P.], seq 5131:6157, ack 1, win 57, options [nop,nop,TS val 6851160 ecr 6851098], length 1026
1450056070.095933 IP 10.1.1.2.55348 > 10.1.1.1.2000: Flags [.], ack 5131, win 78, options [nop,nop,TS val 6851123 ecr 6851123], length 0
1450056070.136093 IP 10.1.1.1.2000 > 10.1.1.2.58269: Flags [P.], seq 5131:6157, ack 1, win 57, options [nop,nop,TS val 6851173 ecr 6851110], length 1026
1450056070.145840 IP 10.1.1.2.46322 > 10.1.1.1.2000: Flags [.], ack 5131, win 78, options [nop,nop,TS val 6851135 ecr 6851135], length 0
1450056070.185801 IP 10.1.1.1.2000 > 10.1.1.2.55348: Flags [P.], seq 5131:6157, ack 1, win 57, options [nop,nop,TS val 6851185 ecr 6851123], length 1026
1450056070.195834 IP 10.1.1.2.39166 > 10.1.1.1.2000: Flags [.], ack 5131, win 78, options [nop,nop,TS val 6851148 ecr 6851148], length 0
1450056070.235775 IP 10.1.1.1.2000 > 10.1.1.2.46322: Flags [P.], seq 5131:6157, ack 1, win 57, options [nop,nop,TS val 6851198 ecr 6851135], length 1026
1450056070.245809 IP 10.1.1.2.50628 > 10.1.1.1.2000: Flags [.], ack 6157, win 82, options [nop,nop,TS val 6851160 ecr 6851160], length 0
1450056070.285792 IP 10.1.1.1.2000 > 10.1.1.2.39166: Flags [P.], seq 5131:6157, ack 1, win 57, options [nop,nop,TS val 6851210 ecr 6851148], length 1026
1450056070.296124 IP 10.1.1.2.58269 > 10.1.1.1.2000: Flags [.], ack 6157, win 82, options [nop,nop,TS val 6851173 ecr 6851173], length 0
1450056070.335870 IP 10.1.1.1.2000 > 10.1.1.2.50628: Flags [P.], seq 6157:7183, ack 1, win 57, options [nop,nop,TS val 6851223 ecr 6851160], length 1026
1450056070.345864 IP 10.1.1.2.55348 > 10.1.1.1.2000: Flags [.], ack 6157, win 82, options [nop,nop,TS val 6851185 ecr 6851185], length 0
1450056070.385826 IP 10.1.1.1.2000 > 10.1.1.2.58269: Flags [P.], seq 6157:7183, ack 1, win 57, options [nop,nop,TS val 6851235 ecr 6851173], length 1026
1450056070.395800 IP 10.1.1.2.46322 > 10.1.1.1.2000: Flags [.], ack 6157, win 82, options [nop,nop,TS val 6851198 ecr 6851198], length 0
1450056070.435752 IP 10.1.1.1.2000 > 10.1.1.2.55348: Flags [P.], seq 6157:7183, ack 1, win 57, options [nop,nop,TS val 6851248 ecr 6851185], length 1026
1450056070.485781 IP 10.1.1.1.2000 > 10.1.1.2.46322: Flags [P.], seq 6157:7183, ack 1, win 57, options [nop,nop,TS val 6851260 ecr 6851198], length 1026
1450056070.495889 IP 10.1.1.2.50628 > 10.1.1.1.2000: Flags [.], ack 7183, win 86, options [nop,nop,TS val 6851223 ecr 6851223], length 0
1450056070.535863 IP 10.1.1.1.2000 > 10.1.1.2.39166: Flags [P.], seq 6157:7183, ack 1, win 57, options [nop,nop,TS val 6851273 ecr 6851148], length 1026
1450056070.545847 IP 10.1.1.2.58269 > 10.1.1.1.2000: Flags [.], ack 7183, win 86, options [nop,nop,TS val 6851235 ecr 6851235], length 0
1450056070.585779 IP 10.1.1.1.2000 > 10.1.1.2.50628: Flags [P.], seq 7183:8209, ack 1, win 57, options [nop,nop,TS val 6851285 ecr 6851223], length 1026
1450056070.595773 IP 10.1.1.2.55348 > 10.1.1.1.2000: Flags [.], ack 7183, win 86, options [nop,nop,TS val 6851248 ecr 6851248], length 0
1450056070.635819 IP 10.1.1.1.2000 > 10.1.1.2.58269: Flags [P.], seq 7183:8209, ack 1, win 57, options [nop,nop,TS val 6851298 ecr 6851235], length 1026
1450056070.645806 IP 10.1.1.2.46322 > 10.1.1.1.2000: Flags [.], ack 7183, win 86, options [nop,nop,TS val 6851260 ecr 6851260], length 0
1450056070.685770 IP 10.1.1.1.2000 > 10.1.1.2.55348: Flags [P.], seq 7183:8209, ack 1, win 57, options [nop,nop,TS val 6851310 ecr 6851248], length 1026
1450056070.687673 IP 10.1.1.1.2000 > 10.1.1.2.39166: Flags [P.], seq 6157:7183, ack 1, win 57, options [nop,nop,TS val 6851311 ecr 6851148], length 1026
1450056070.695882 IP 10.1.1.2.39166 > 10.1.1.1.2000: Flags [.], ack 7183, win 86, options [nop,nop,TS val 6851273 ecr 6851273], length 0
1450056070.735739 IP 10.1.1.1.2000 > 10.1.1.2.46322: Flags [P.], seq 7183:8209, ack 1, win 57, options [nop,nop,TS val 6851323 ecr 6851260], length 1026
1450056070.745801 IP 10.1.1.2.50628 > 10.1.1.1.2000: Flags [.], ack 8209, win 90, options [nop,nop,TS val 6851285 ecr 6851285], length 0
1450056070.785750 IP 10.1.1.1.2000 > 10.1.1.2.39166: Flags [P.], seq 7183:8209, ack 1, win 57, options [nop,nop,TS val 6851335 ecr 6851273], length 1026
1450056070.795853 IP 10.1.1.2.58269 > 10.1.1.1.2000: Flags [.], ack 8209, win 90, options [nop,nop,TS val 6851298 ecr 6851298], length 0
1450056070.835813 IP 10.1.1.1.2000 > 10.1.1.2.50628: Flags [P.], seq 8209:9235, ack 1, win 57, options [nop,nop,TS val 6851348 ecr 6851285], length 1026
1450056070.845790 IP 10.1.1.2.55348 > 10.1.1.1.2000: Flags [.], ack 8209, win 90, options [nop,nop,TS val 6851310 ecr 6851310], length 0
1450056070.847698 IP 10.1.1.2.39166 > 10.1.1.1.2000: Flags [.], ack 7183, win 86, options [nop,nop,TS val 6851311 ecr 6851311,nop,nop,sack 1 {6157:7183}], length 0
1450056070.885739 IP 10.1.1.1.2000 > 10.1.1.2.58269: Flags [P.], seq 8209:9235, ack 1, win 57, options [nop,nop,TS val 6851360 ecr 6851298], length 1026
1450056070.895761 IP 10.1.1.2.46322 > 10.1.1.1.2000: Flags [.], ack 8209, win 90, options [nop,nop,TS val 6851323 ecr 6851323], length 0
1450056070.935883 IP 10.1.1.1.2000 > 10.1.1.2.55348: Flags [P.], seq 8209:9235, ack 1, win 57, options [nop,nop,TS val 6851373 ecr 6851310], length 1026
1450056070.945773 IP 10.1.1.2.39166 > 10.1.1.1.2000: Flags [.], ack 8209, win 90, options [nop,nop,TS val 6851335 ecr 6851335], length 0
1450056070.985813 IP 10.1.1.1.2000 > 10.1.1.2.46322: Flags [P.], seq 8209:9235, ack 1, win 57, options [nop,nop,TS val 6851385 ecr 6851323], length 1026
1450056070.995833 IP 10.1.1.2.50628 > 10.1.1.1.2000: Flags [.], ack 9235, win 94, options [nop,nop,TS val 6851348 ecr 6851348], length 0
1450056071.035800 IP 10.1.1.1.2000 > 10.1.1.2.39166: Flags [P.], seq 8209:9235, ack 1, win 57, options [nop,nop,TS val 6851398 ecr 6851335], length 1026
1450056071.045764 IP 10.1.1.2.58269 > 10.1.1.1.2000: Flags [.], ack 9235, win 94, options [nop,nop,TS val 6851360 ecr 6851360], length 0
1450056071.085810 IP 10.1.1.1.2000 > 10.1.1.2.50628: Flags [P.], seq 9235:10261, ack 1, win 57, options [nop,nop,TS val 6851410 ecr 6851348], length 1026
1450056071.095915 IP 10.1.1.2.55348 > 10.1.1.1.2000: Flags [.], ack 9235, win 94, options [nop,nop,TS val 6851373 ecr 6851373], length 0
1450056071.135813 IP 10.1.1.1.2000 > 10.1.1.2.58269: Flags [P.], seq 9235:10261, ack 1, win 57, options [nop,nop,TS val 6851423 ecr 6851360], length 1026
1450056071.145848 IP 10.1.1.2.46322 > 10.1.1.1.2000: Flags [.], ack 9235, win 94, options [nop,nop,TS val 6851385 ecr 6851385], length 0
1450056071.185824 IP 10.1.1.1.2000 > 10.1.1.2.55348: Flags [P.], seq 9235:10261, ack 1, win 57, options [nop,nop,TS val 6851435 ecr 6851373], length 1026
1450056071.195843 IP 10.1.1.2.39166 > 10.1.1.1.2000: Flags [.], ack 9235, win 94, options [nop,nop,TS val 6851398 ecr 6851398], length 0
1450056071.235712 IP 10.1.1.1.2000 > 10.1.1.2.46322: Flags [P.], seq 9235:10261, ack 1, win 57, options [nop,nop,TS val 6851448 ecr 6851385], length 1026
1450056071.245839 IP 10.1.1.2.50628 > 10.1.1.1.2000: Flags [.], ack 10261, win 98, options [nop,nop,TS val 6851410 ecr 6851410], length 0
1450056071.285853 IP 10.1.1.1.2000 > 10.1.1.2.39166: Flags [P.], seq 9235:10261, ack 1, win 57, options [nop,nop,TS val 6851460 ecr 6851398], length 1026
1450056071.295852 IP 10.1.1.2.58269 > 10.1.1.1.2000: Flags [.], ack 10261, win 98, options [nop,nop,TS val 6851423 ecr 6851423], length 0
1450056071.335813 IP 10.1.1.1.2000 > 10.1.1.2.50628: Flags [P.], seq 10261:11287, ack 1, win 57, options [nop,nop,TS val 6851473 ecr 6851410], length 1026
1450056071.345861 IP 10.1.1.2.55348 > 10.1.1.1.2000: Flags [.], ack 10261, win 98, options [nop,nop,TS val 6851435 ecr 6851435], length 0
1450056071.385838 IP 10.1.1.1.2000 > 10.1.1.2.58269: Flags [P.], seq 10261:11287, ack 1, win 57, options [nop,nop,TS val 6851485 ecr 6851423], length 1026
1450056071.395763 IP 10.1.1.2.46322 > 10.1.1.1.2000: Flags [.], ack 10261, win 98, options [nop,nop,TS val 6851448 ecr 6851448], length 0
1450056071.435811 IP 10.1.1.1.2000 > 10.1.1.2.55348: Flags [P.], seq 10261:11287, ack 1, win 57, options [nop,nop,TS val 6851498 ecr 6851435], length 1026
1450056071.445886 IP 10.1.1.2.39166 > 10.1.1.1.2000: Flags [.], ack 10261, win 98, options [nop,nop,TS val 6851460 ecr 6851460], length 0
1450056071.485773 IP 10.1.1.1.2000 > 10.1.1.2.46322: Flags [P.], seq 10261:11287, ack 1, win 57, options [nop,nop,TS val 6851510 ecr 6851448], length 1026
1450056071.495842 IP 10.1.1.2.50628 > 10.1.1.1.2000: Flags [.], ack 11287, win 102, options [nop,nop,TS val 6851473 ecr 6851473], length 0
1450056071.535748 IP 10.1.1.1.2000 > 10.1.1.2.39166: Flags [P.], seq 10261:11287, ack 1, win 57, options [nop,nop,TS val 6851523 ecr 6851460], length 1026
1450056071.545859 IP 10.1.1.2.58269 > 10.1.1.1.2000: Flags [.], ack 11287, win 102, options [nop,nop,TS val 6851485 ecr 6851485], length 0
1450056071.585754 IP 10.1.1.1.2000 > 10.1.1.2.50628: Flags [P.], seq 11287:12313, ack 1, win 57, options [nop,nop,TS val 6851535 ecr 6851473], length 1026
1450056071.595835 IP 10.1.1.2.55348 > 10.1.1.1.2000: Flags [.], ack 11287, win 102, options [nop,nop,TS val 6851498 ecr 6851498], length 0
1450056071.635782 IP 10.1.1.1.2000 > 10.1.1.2.58269: Flags [P.], seq 11287:12313, ack 1, win 57, options [nop,nop,TS val 6851548 ecr 6851485], length 1026
1450056071.645793 IP 10.1.1.2.46322 > 10.1.1.1.2000: Flags [.], ack 11287, win 102, options [nop,nop,TS val 6851510 ecr 6851510], length 0
1450056071.685799 IP 10.1.1.1.2000 > 10.1.1.2.55348: Flags [P.], seq 11287:12313, ack 1, win 57, options [nop,nop,TS val 6851560 ecr 6851498], length 1026
1450056071.695771 IP 10.1.1.2.39166 > 10.1.1.1.2000: Flags [.], ack 11287, win 102, options [nop,nop,TS val 6851523 ecr 6851523], length 0
1450056071.735707 IP 10.1.1.1.2000 > 10.1.1.2.46322: Flags [P.], seq 11287:12313, ack 1, win 57, options [nop,nop,TS val 6851573 ecr 6851510], length 1026
1450056071.745775 IP 10.1.1.2.50628 > 10.1.1.1.2000: Flags [.], ack 12313, win 106, options [nop,nop,TS val 6851535 ecr 6851535], length 0
1450056071.785906 IP 10.1.1.1.2000 > 10.1.1.2.39166: Flags [P.], seq 11287:12313, ack 1, win 57, options [nop,nop,TS val 6851585 ecr 6851523], length 1026
1450056071.795819 IP 10.1.1.2.58269 > 10.1.1.1.2000: Flags [.], ack 12313, win 106, options [nop,nop,TS val 6851548 ecr 6851548], length 0
1450056071.835798 IP 10.1.1.1.2000 > 10.1.1.2.50628: Flags [P.], seq 12313:13339, ack 1, win 57, options [nop,nop,TS val 6851598 ecr 6851535], length 1026
1450056071.845832 IP 10.1.1.2.55348 > 10.1.1.1.2000: Flags [.], ack 12313, win 106, options [nop,nop,TS val 6851560 ecr 6851560], length 0
1450056071.885843 IP 10.1.1.1.2000 > 10.1.1.2.58269: Flags [P.], seq 12313:13339, ack 1, win 57, options [nop,nop,TS val 6851610 ecr 6851548], length 1026
1450056071.895736 IP 10.1.1.2.46322 > 10.1.1.1.2000: Flags [.], ack 12313, win 106, options [nop,nop,TS val 6851573 ecr 6851573], length 0
1450056071.935834 IP 10.1.1.1.2000 > 10.1.1.2.55348: Flags [P.], seq 12313:13339, ack 1, win 57, options [nop,nop,TS val 6851623 ecr 6851560], length 1026
1450056071.945935 IP 10.1.1.2.39166 > 10.1.1.1.2000: Flags [.], ack 12313, win 106, options [nop,nop,TS val 6851585 ecr 6851585], length 0
1450056071.985810 IP 10.1.1.1.2000 > 10.1.1.2.46322: Flags [P.], seq 12313:13339, ack 1, win 57, options [nop,nop,TS val 6851635 ecr 6851573], length 1026
1450056071.995832 IP 10.1.1.2.50628 > 10.1.1.1.2000: Flags [.], ack 13339, win 110, options [nop,nop,TS val 6851598 ecr 6851598], length 0
1450056072.035798 IP 10.1.1.1.2000 > 10.1.1.2.39166: Flags [P.], seq 12313:13339, ack 1, win 57, options [nop,nop,TS val 6851648 ecr 6851585], length 1026
1450056072.045879 IP 10.1.1.2.58269 > 10.1.1.1.2000: Flags [.], ack 13339, win 110, options [nop,nop,TS val 6851610 ecr 6851610], length 0
1450056072.085776 IP 10.1.1.1.2000 > 10.1.1.2.50628: Flags [P.], seq 13339:14365, ack 1, win 57, options [nop,nop,TS val 6851660 ecr 6851598], length 1026
1450056072.095871 IP 10.1.1.2.55348 > 10.1.1.1.2000: Flags [.], ack 13339, win 110, options [nop,nop,TS val 6851623 ecr 6851623], length 0
1450056072.135798 IP 10.1.1.1.2000 > 10.1.1.2.58269: Flags [P.], seq 13339:14365, ack 1, win 57, options [nop,nop,TS val 6851673 ecr 6851610], length 1026
1450056072.185795 IP 10.1.1.1.2000 > 10.1.1.2.55348: Flags [P.], seq 13339:14365, ack 1, win 57, options [nop,nop,TS val 6851685 ecr 6851623], length 1026
1450056072.195832 IP 10.1.1.2.39166 > 10.1.1.1.2000: Flags [.], ack 13339, win 110, options [nop,nop,TS val 6851648 ecr 6851648], length 0
1450056072.235766 IP 10.1.1.1.2000 > 10.1.1.2.46322: Flags [P.], seq 13339:14365, ack 1, win 57, options [nop,nop,TS val 6851698 ecr 6851573], length 1026
1450056072.245802 IP 10.1.1.2.50628 > 10.1.1.1.2000: Flags [.], ack 14365, win 114, options [nop,nop,TS val 6851660 ecr 6851660], length 0
1450056072.285798 IP 10.1.1.1.2000 > 10.1.1.2.39166: Flags [P.], seq 13339:14365, ack 1, win 57, options [nop,nop,TS val 6851710 ecr 6851648], length 1026
1450056072.295828 IP 10.1.1.2.58269 > 10.1.1.1.2000: Flags [.], ack 14365, win 114, options [nop,nop,TS val 6851673 ecr 6851673], length 0
1450056072.335824 IP 10.1.1.1.2000 > 10.1.1.2.50628: Flags [P.], seq 14365:15391, ack 1, win 57, options [nop,nop,TS val 6851723 ecr 6851660], length 1026
1450056072.345826 IP 10.1.1.2.55348 > 10.1.1.1.2000: Flags [.], ack 14365, win 114, options [nop,nop,TS val 6851685 ecr 6851685], length 0
1450056072.355698 IP 10.1.1.1.2000 > 10.1.1.2.46322: Flags [P.], seq 13339:14365, ack 1, win 57, options [nop,nop,TS val 6851728 ecr 6851573], length 1026
1450056072.385825 IP 10.1.1.1.2000 > 10.1.1.2.58269: Flags [P.], seq 14365:15391, ack 1, win 57, options [nop,nop,TS val 6851735 ecr 6851673], length 1026
1450056072.395801 IP 10.1.1.2.46322 > 10.1.1.1.2000: Flags [.], ack 14365, win 114, options [nop,nop,TS val 6851698 ecr 6851698], length 0
1450056072.435805 IP 10.1.1.1.2000 > 10.1.1.2.55348: Flags [P.], seq 14365:15391, ack 1, win 57, options [nop,nop,TS val 6851748 ecr 6851685], length 1026
1450056072.445832 IP 10.1.1.2.39166 > 10.1.1.1.2000: Flags [.], ack 14365, win 114, options [nop,nop,TS val 6851710 ecr 6851710], length 0
1450056072.485815 IP 10.1.1.1.2000 > 10.1.1.2.46322: Flags [P.], seq 14365:15391, ack 1, win 57, options [nop,nop,TS val 6851760 ecr 6851698], length 1026
1450056072.495853 IP 10.1.1.2.50628 > 10.1.1.1.2000: Flags [.], ack 15391, win 118, options [nop,nop,TS val 6851723 ecr 6851723], length 0
1450056072.515741 IP 10.1.1.2.46322 > 10.1.1.1.2000: Flags [.], ack 14365, win 114, options [nop,nop,TS val 6851728 ecr 6851728,nop,nop,sack 1 {13339:14365}], length 0
1450056072.535829 IP 10.1.1.1.2000 > 10.1.1.2.39166: Flags [P.], seq 14365:15391, ack 1, win 57, options [nop,nop,TS val 6851773 ecr 6851710], length 1026
1450056072.545855 IP 10.1.1.2.58269 > 10.1.1.1.2000: Flags [.], ack 15391, win 118, options [nop,nop,TS val 6851735 ecr 6851735], length 0
1450056072.585799 IP 10.1.1.1.2000 > 10.1.1.2.50628: Flags [P.], seq 15391:16417, ack 1, win 57, options [nop,nop,TS val 6851785 ecr 6851723], length 1026
1450056072.595836 IP 10.1.1.2.55348 > 10.1.1.1.2000: Flags [.], ack 15391, win 118, options [nop,nop,TS val 6851748 ecr 6851748], length 0
1450056072.635901 IP 10.1.1.1.2000 > 10.1.1.2.58269: Flags [P.], seq 15391:16417, ack 1, win 57, options [nop,nop,TS val 6851798 ecr 6851735], length 1026
1450056072.645892 IP 10.1.1.2.46322 > 10.1.1.1.2000: Flags [.], ack 15391, win 118, options [nop,nop,TS val 6851760 ecr 6851760], length 0
1450056072.685754 IP 10.1.1.1.2000 > 10.1.1.2.55348: Flags [P.], seq 15391:16417, ack 1, win 57, options [nop,nop,TS val 6851810 ecr 6851748], length 1026
1450056072.695862 IP 10.1.1.2.39166 > 10.1.1.1.2000: Flags [.], ack 15391, win 118, options [nop,nop,TS val 6851773 ecr 6851773], length 0
1450056072.735881 IP 10.1.1.1.2000 > 10.1.1.2.46322: Flags [P.], seq 15391:16417, ack 1, win 57, options [nop,nop,TS val 6851823 ecr 6851760], length 1026
1450056072.745831 IP 10.1.1.2.50628 > 10.1.1.1.2000: Flags [.], ack 16417, win 122, options [nop,nop,TS val 6851785 ecr 6851785], length 0
1450056072.785771 IP 10.1.1.1.2000 > 10.1.1.2.39166: Flags [P.], seq 15391:16417, ack 1, win 57, options [nop,nop,TS val 6851835 ecr 6851773], length 1026
1450056072.795938 IP 10.1.1.2.58269 > 10.1.1.1.2000: Flags [.], ack 16417, win 122, options [nop,nop,TS val 6851798 ecr 6851798], length 0
1450056072.835819 IP 10.1.1.1.2000 > 10.1.1.2.50628: Flags [P.], seq 16417:17443, ack 1, win 57, options [nop,nop,TS val 6851848 ecr 6851785], length 1026
1450056072.845777 IP 10.1.1.2.55348 > 10.1.1.1.2000: Flags [.], ack 16417, win 122, options [nop,nop,TS val 6851810 ecr 6851810], length 0
1450056072.885878 IP 10.1.1.1.2000 > 10.1.1.2.58269: Flags [P.], seq 16417:17443, ack 1, win 57, options [nop,nop,TS val 6851860 ecr 6851798], length 1026
1450056072.895911 IP 10.1.1.2.46322 > 10.1.1.1.2000: Flags [.], ack 16417, win 122, options [nop,nop,TS val 6851823 ecr 6851823], length 0
1450056072.935741 IP 10.1.1.1.2000 > 10.1.1.2.55348: Flags [P.], seq 16417:17443, ack 1, win 57, options [nop,nop,TS val 6851873 ecr 6851810], length 1026
1450056072.945797 IP 10.1.1.2.39166 > 10.1.1.1.2000: Flags [.], ack 16417, win 122, options [nop,nop,TS val 6851835 ecr 6851835], length 0
1450056072.985793 IP 10.1.1.1.2000 > 10.1.1.2.46322: Flags [P.], seq 16417:17443, ack 1, win 57, options [nop,nop,TS val 6851885 ecr 6851823], length 1026
1450056072.995853 IP 10.1.1.2.50628 > 10.1.1.1.2000: Flags [.], ack 17443, win 126, options [nop,nop,TS val 6851848 ecr 6851848], length 0
1450056073.035766 IP 10.1.1.1.2000 > 10.1.1.2.39166: Flags [P.], seq 16417:17443, ack 1, win 57, options [nop,nop,TS val 6851898 ecr 6851835], length 1026
1450056073.045912 IP 10.1.1.2.58269 > 10.1.1.1.2000: Flags [.], ack 17443, win 126, options [nop,nop,TS val 6851860 ecr 6851860], length 0
1450056073.085864 IP 10.1.1.1.2000 > 10.1.1.2.50628: Flags [P.], seq 17443:18469, ack 1, win 57, options [nop,nop,TS val 6851910 ecr 6851848], length 1026
1450056073.095767 IP 10.1.1.2.55348 > 10.1.1.1.2000: Flags [.], ack 17443, win 126, options [nop,nop,TS val 6851873 ecr 6851873], length 0
1450056073.135834 IP 10.1.1.1.2000 > 10.1.1.2.58269: Flags [P.], seq 17443:18469, ack 1, win 57, options [nop,nop,TS val 6851923 ecr 6851860], length 1026
1450056073.145825 IP 10.1.1.2.46322 > 10.1.1.1.2000: Flags [.], ack 17443, win 126, options [nop,nop,TS val 6851885 ecr 6851885], length 0
1450056073.185857 IP 10.1.1.1.2000 > 10.1.1.2.55348: Flags [P.], seq 17443:18469, ack 1, win 57, options [nop,nop,TS val 6851935 ecr 6851873], length 1026
1450056073.195799 IP 10.1.1.2.39166 > 10.1.1.1.2000: Flags [.], ack 17443, win 126, options [nop,nop,TS val 6851898 ecr 6851898], length 0
1450056073.235775 IP 10.1.1.1.2000 > 10.1.1.2.46322: Flags [P.], seq 17443:18469, ack 1, win 57, options [nop,nop,TS val 6851948 ecr 6851885], length 1026
1450056073.245896 IP 10.1.1.2.50628 > 10.1.1.1.2000: Flags [.], ack 18469, win 130, options [nop,nop,TS val 6851910 ecr 6851910], length 0
1450056073.285887 IP 10.1.1.1.2000 > 10.1.1.2.39166: Flags [P.], seq 17443:18469, ack 1, win 57, options [nop,nop,TS val 6851960 ecr 6851898], length 1026
1450056073.295863 IP 10.1.1.2.58269 > 10.1.1.1.2000: Flags [.], ack 18469, win 130, options [nop,nop,TS val 6851923 ecr 6851923], length 0
1450056073.335805 IP 10.1.1.1.2000 > 10.1.1.2.50628: Flags [P.], seq 18469:19495, ack 1, win 57, options [nop,nop,TS val 6851973 ecr 6851910], length 1026
1450056073.345889 IP 10.1.1.2.55348 > 10.1.1.1.2000: Flags [.], ack 18469, win 130, options [nop,nop,TS val 6851935 ecr 6851935], length 0
1450056073.385792 IP 10.1.1.1.2000 > 10.1.1.2.58269: Flags [P.], seq 18469:19495, ack 1, win 57, options [nop,nop,TS val 6851985 ecr 6851923], length 1026
1450056073.395818 IP 10.1.1.2.46322 > 10.1.1.1.2000: Flags [.], ack 18469, win 130, options [nop,nop,TS val 6851948 ecr 6851948], length 0
1450056073.435892 IP 10.1.1.1.2000 > 10.1.1.2.55348: Flags [P.], seq 18469:19495, ack 1, win 57, options [nop,nop,TS val 6851998 ecr 6851935], length 1026
1450056073.485802 IP 10.1.1.1.2000 > 10.1.1.2.46322: Flags [P.], seq 18469:19495, ack 1, win 57, options [nop,nop,TS val 6852010 ecr 6851948], length 1026
1450056073.495840 IP 10.1.1.2.50628 > 10.1.1.1.2000: Flags [.], ack 19495, win 134, options [nop,nop,TS val 6851973 ecr 6851973], length 0
1450056073.535872 IP 10.1.1.1.2000 > 10.1.1.2.39166: Flags [P.], seq 18469:19495, ack 1, win 57, options [nop,nop,TS val 6852023 ecr 6851898], length 1026
1450056073.545821 IP 10.1.1.2.58269 > 10.1.1.1.2000: Flags [.], ack 19495, win 134, options [nop,nop,TS val 6851985 ecr 6851985], length 0
1450056073.585805 IP 10.1.1.1.2000 > 10.1.1.2.50628: Flags [P.], seq 19495:20521, ack 1, win 57, options [nop,nop,TS val 6852035 ecr 6851973], length 1026
1450056073.595931 IP 10.1.1.2.55348 > 10.1.1.1.2000: Flags [.], ack 19495, win 134, options [nop,nop,TS val 6851998 ecr 6851998], length 0
1450056073.635821 IP 10.1.1.1.2000 > 10.1.1.2.58269: Flags [P.], seq 19495:20521, ack 1, win 57, options [nop,nop,TS val 6852048 ecr 6851985], length 1026
1450056073.645844 IP 10.1.1.2.46322 > 10.1.1.1.2000: Flags [.], ack 19495, win 134, options [nop,nop,TS val 6852010 ecr 6852010], length 0
1450056073.663692 IP 10.1.1.1.2000 > 10.1.1.2.39166: Flags [P.], seq 18469:19495, ack 1, win 57, options [nop,nop,TS val 6852055 ecr 6851898], length 1026
1450056073.685788 IP 10.1.1.1.2000 > 10.1.1.2.55348: Flags [P.], seq 19495:20521, ack 1, win 57, options [nop,nop,TS val 6852060 ecr 6851998], length 1026
1450056073.695905 IP 10.1.1.2.39166 > 10.1.1.1.2000: Flags [.], ack 19495, win 134, options [nop,nop,TS val 6852023 ecr 6852023], length 0
1450056073.735814 IP 10.1.1.1.2000 > 10.1.1.2.46322: Flags [P.], seq 19495:20521, ack 1, win 57, options [nop,nop,TS val 6852073 ecr 6852010], length 1026
1450056073.745846 IP 10.1.1.2.50628 > 10.1.1.1.2000: Flags [.], ack 20521, win 138, options [nop,nop,TS val 6852035 ecr 6852035], length 0
1450056073.785793 IP 10.1.1.1.2000 > 10.1.1.2.39166: Flags [P.], seq 19495:20521, ack 1, win 57, options [nop,nop,TS val 6852085 ecr 6852023], length 1026
1450056073.795859 IP 10.1.1.2.58269 > 10.1.1.1.2000: Flags [.], ack 20521, win 138, options [nop,nop,TS val 6852048 ecr 6852048], length 0
1450056073.823742 IP 10.1.1.2.39166 > 10.1.1.1.2000: Flags [.], ack 19495, win 134, options [nop,nop,TS val 6852055 ecr 6852055,nop,nop,sack 1 {18469:19495}], length 0
1450056073.835786 IP 10.1.1.1.2000 > 10.1.1.2.50628: Flags [P.], seq 20521:21547, ack 1, win 57, options [nop,nop,TS val 6852098 ecr 6852035], length 1026
1450056073.845818 IP 10.1.1.2.55348 > 10.1.1.1.2000: Flags [.], ack 20521, win 138, options [nop,nop,TS val 6852060 ecr 6852060], length 0
1450056073.885768 IP 10.1.1.1.2000 > 10.1.1.2.58269: Flags [P.], seq 20521:21547, ack 1, win 57, options [nop,nop,TS val 6852110 ecr 6852048], length 1026
1450056073.895853 IP 10.1.1.2.46322 > 10.1.1.1.2000: Flags [.], ack 20521, win 138, options [nop,nop,TS val 6852073 ecr 6852073], length 0
1450056073.935871 IP 10.1.1.1.2000 > 10.1.1.2.55348: Flags [P.], seq 20521:21547, ack 1, win 57, options [nop,nop,TS val 6852123 ecr 6852060], length 1026
1450056073.945823 IP 10.1.1.2.39166 > 10.1.1.1.2000: Flags [.], ack 20521, win 138, options [nop,nop,TS val 6852085 ecr 6852085], length 0
1450056073.985802 IP 10.1.1.1.2000 > 10.1.1.2.46322: Flags [P.], seq 20521:21547, ack 1, win 57, options [nop,nop,TS val 6852135 ecr 6852073], length 1026
1450056073.995844 IP 10.1.1.2.50628 > 10.1.1.1.2000: Flags [.], ack 21547, win 142, options [nop,nop,TS val 6852098 ecr 6852098], length 0
1450056074.035842 IP 10.1.1.1.2000 > 10.1.1.2.39166: Flags [P.], seq 20521:21547, ack 1, win 57, options [nop,nop,TS val 6852148 ecr 6852085], length 1026
1450056074.045796 IP 10.1.1.2.58269 > 10.1.1.1.2000: Flags [.], ack 21547, win 142, options [nop,nop,TS val 6852110 ecr 6852110], length 0
1450056074.085796 IP 10.1.1.1.2000 > 10.1.1.2.50628: Flags [P.], seq 21547:22573, ack 1, win 57, options [nop,nop,TS val 6852160 ecr 6852098], length 1026
1450056074.095913 IP 10.1.1.2.55348 > 10.1.1.1.2000: Flags [.], ack 21547, win 142, options [nop,nop,TS val 6852123 ecr 6852123], length 0
1450056074.135837 IP 10.1.1.1.2000 > 10.1.1.2.58269: Flags [P.], seq 21547:22573, ack 1, win 57, options [nop,nop,TS val 6852173 ecr 6852110], length 1026
1450056074.145833 IP 10.1.1.2.46322 > 10.1.1.1.2000: Flags [.], ack 21547, win 142, options [nop,nop,TS val 6852135 ecr 6852135], length 0
1450056074.185831 IP 10.1.1.1.2000 > 10.1.1.2.55348: Flags [P.], seq 21547:22573, ack 1, win 57, options [nop,nop,TS val 6852185 ecr 6852123], length 1026
1450056074.195878 IP 10.1.1.2.39166 > 10.1.1.1.2000: Flags [.], ack 21547, win 142, options [nop,nop,TS val 6852148 ecr 6852148], length 0
1450056074.235912 IP 10.1.1.1.2000 > 10.1.1.2.46322: Flags [P.], seq 21547:22573, ack 1, win 57, options [nop,nop,TS val 6852198 ecr 6852135], length 1026
1450056074.245831 IP 10.1.1.2.50628 > 10.1.1.1.2000: Flags [.], ack 22573, win 146, options [nop,nop,TS val 6852160 ecr 6852160], length 0
1450056074.285901 IP 10.1.1.1.2000 > 10.1.1.2.39166: Flags [P.], seq 21547:22573, ack 1, win 57, options [nop,nop,TS val 6852210 ecr 6852148], length 1026
1450056074.295902 IP 10.1.1.2.58269 > 10.1.1.1.2000: Flags [.], ack 22573, win 146, options [nop,nop,TS val 6852173 ecr 6852173], length 0
1450056074.335920 IP 10.1.1.1.2000 > 10.1.1.2.50628: Flags [P.], seq 22573:23599, ack 1, win 57, options [nop,nop,TS val 6852223 ecr 6852160], length 1026
1450056074.345891 IP 10.1.1.2.55348 > 10.1.1.1.2000: Flags [.], ack 22573, win 146, options [nop,nop,TS val 6852185 ecr 6852185], length 0
1450056074.385897 IP 10.1.1.1.2000 > 10.1.1.2.58269: Flags [P.], seq 22573:23599, ack 1, win 57, options [nop,nop,TS val 6852235 ecr 6852173], length 1026
1450056074.395955 IP 10.1.1.2.46322 > 10.1.1.1.2000: Flags [.], ack 22573, win 146, options [nop,nop,TS val 6852198 ecr 6852198], length 0
1450056074.435802 IP 10.1.1.1.2000 > 10.1.1.2.55348: Flags [P.], seq 22573:23599, ack 1, win 57, options [nop,nop,TS val 6852248 ecr 6852185], length 1026
1450056074.445935 IP 10.1.1.2.39166 > 10.1.1.1.2000: Flags [.], ack 22573, win 146, options [nop,nop,TS val 6852210 ecr 6852210], length 0
1450056074.485793 IP 10.1.1.1.2000 > 10.1.1.2.46322: Flags [P.], seq 22573:23599, ack 1, win 57, options [nop,nop,TS val 6852260 ecr 6852198], length 1026
1450056074.495962 IP 10.1.1.2.50628 > 10.1.1.1.2000: Flags [.], ack 23599, win 150, options [nop,nop,TS val 6852223 ecr 6852223], length 0
1450056074.535807 IP 10.1.1.1.2000 > 10.1.1.2.39166: Flags [P.], seq 22573:23599, ack 1, win 57, options [nop,nop,TS val 6852273 ecr 6852210], length 1026
1450056074.545961 IP 10.1.1.2.58269 > 10.1.1.1.2000: Flags [.], ack 23599, win 150, options [nop,nop,TS val 6852235 ecr 6852235], length 0
1450056074.585860 IP 10.1.1.1.2000 > 10.1.1.2.50628: Flags [P.], seq 23599:24625, ack 1, win 57, options [nop,nop,TS val 6852285 ecr 6852223], length 1026
1450056074.595831 IP 10.1.1.2.55348 > 10.1.1.1.2000: Flags [.], ack 23599, win 150, options [nop,nop,TS val 6852248 ecr 6852248], length 0
1450056074.635817 IP 10.1.1.1.2000 > 10.1.1.2.58269: Flags [P.], seq 23599:24625, ack 1, win 57, options [nop,nop,TS val 6852298 ecr 6852235], length 1026
1450056074.645823 IP 10.1.1.2.46322 > 10.1.1.1.2000: Flags [.], ack 23599, win 150, options [nop,nop,TS val 6852260 ecr 6852260], length 0
1450056074.685805 IP 10.1.1.1.2000 > 10.1.1.2.55348: Flags [P.], seq 23599:24625, ack 1, win 57, options [nop,nop,TS val 6852310 ecr 6852248], length 1026
1450056074.695841 IP 10.1.1.2.39166 > 10.1.1.1.2000: Flags [.], ack 23599, win 150, options [nop,nop,TS val 6852273 ecr 6852273], length 0
1450056074.735801 IP 10.1.1.1.2000 > 10.1.1.2.46322: Flags [P.], seq 23599:24625, ack 1, win 57, options [nop,nop,TS val 6852323 ecr 6852260], length 1026
1450056074.745893 IP 10.1.1.2.50628 > 10.1.1.1.2000: Flags [.], ack 24625, win 154, options [nop,nop,TS val 6852285 ecr 6852285], length 0
1450056074.785769 IP 10.1.1.1.2000 > 10.1.1.2.39166: Flags [P.], seq 23599:24625, ack 1, win 57, options [nop,nop,TS val 6852335 ecr 6852273], length 1026
1450056074.795848 IP 10.1.1.2.58269 > 10.1.1.1.2000: Flags [.], ack 24625, win 154, options [nop,nop,TS val 6852298 ecr 6852298], length 0
1450056074.835847 IP 10.1.1.1.2000 > 10.1.1.2.50628: Flags [P.], seq 24625:25651, ack 1, win 57, options [nop,nop,TS val 6852348 ecr 6852285], length 1026
1450056074.845834 IP 10.1.1.2.55348 > 10.1.1.1.2000: Flags [.], ack 24625, win 154, options [nop,nop,TS val 6852310 ecr 6852310], length 0
1450056074.885741 IP 10.1.1.1.2000 > 10.1.1.2.58269: Flags [P.], seq 24625:25651, ack 1, win 57, options [nop,nop,TS val 6852360 ecr 6852298], length 1026
1450056074.895828 IP 10.1.1.2.46322 > 10.1.1.1.2000: Flags [.], ack 24625, win 154, options [nop,nop,TS val 6852323 ecr 6852323], length 0
1450056074.935777 IP 10.1.1.1.2000 > 10.1.1.2.55348: Flags [P.], seq 24625:25651, ack 1, win 57, options [nop,nop,TS val 6852373 ecr 6852310], length 1026
1450056074.945787 IP 10.1.1.2.39166 > 10.1.1.1.2000: Flags [.], ack 24625, win 154, options [nop,nop,TS val 6852335 ecr 6852335], length 0
1450056074.985788 IP 10.1.1.1.2000 > 10.1.1.2.46322: Flags [P.], seq 24625:25651, ack 1, win 57, options [nop,nop,TS val 6852385 ecr 6852323], length 1026
1450056074.995878 IP 10.1.1.2.50628 > 10.1.1.1.2000: Flags [.], ack 25651, win 158, options [nop,nop,TS val 6852348 ecr 6852348], length 0
1450056075.035810 IP 10.1.1.1.2000 > 10.1.1.2.39166: Flags [P.], seq 24625:25651, ack 1, win 57, options [nop,nop,TS val 6852398 ecr 6852335], length 1026
1450056075.045760 IP 10.1.1.2.58269 > 10.1.1.1.2000: Flags [.], ack 25651, win 158, options [nop,nop,TS val 6852360 ecr 6852360], length 0
1450056075.085845 IP 10.1.1.1.2000 > 10.1.1.2.50628: Flags [P.], seq 25651:26677, ack 1, win 57, options [nop,nop,TS val 6852410 ecr 6852348], length 1026
1450056075.095801 IP 10.1.1.2.55348 > 10.1.1.1.2000: Flags [.], ack 25651, win 158, options [nop,nop,TS val 6852373 ecr 6852373], length 0
1450056075.135811 IP 10.1.1.1.2000 > 10.1.1.2.58269: Flags [P.], seq 25651:26677, ack 1, win 57, options [nop,nop,TS val 6852423 ecr 6852360], length 1026
1450056075.145821 IP 10.1.1.2.46322 > 10.1.1.1.2000: Flags [.], ack 25651, win 158, options [nop,nop,TS val 6852385 ecr 6852385], length 0
1450056075.185859 IP 10.1.1.1.2000 > 10.1.1.2.55348: Flags [P.], seq 25651:26677, ack 1, win 57, options [nop,nop,TS val 6852435 ecr 6852373], length 1026
1450056075.195849 IP 10.1.1.2.39166 > 10.1.1.1.2000: Flags [.], ack 25651, win 158, options [nop,nop,TS val 6852398 ecr 6852398], length 0
