1450056869.480360 IP 10.1.1.2.17500 > 10.1.1.255.17500: UDP, length 293
1450056869.757093 IP 10.1.1.2.138 > 10.1.1.255.138: NBT UDP PACKET(138)
1450056869.757118 IP 10.1.1.2.138 > 10.1.1.255.138: NBT UDP PACKET(138)
1450056890.292560 IP 10.1.1.2.2000 > 10.1.1.1.2000: Flags [S], seq 3732017814, win 29200, options [mss 1460,sackOK,TS val 7056172 ecr 0,nop,wscale 9], length 0
1450056890.292629 IP 10.1.1.1.2000 > 10.1.1.2.2000: Flags [S.], seq 612053419, ack 3732017815, win 28960, options [mss 1460,sackOK,TS val 7056212 ecr 7056172,nop,wscale 9], length 0
1450056890.452702 IP 10.1.1.2.2000 > 10.1.1.1.2000: Flags [.], ack 1, win 58, options [nop,nop,TS val 7056212 ecr 7056212], length 0
1450056890.503322 IP 10.1.1.1.2000 > 10.1.1.2.2000: Flags [P.], seq 1:1027, ack 1, win 57, options [nop,nop,TS val 7056264 ecr 7056212], length 1026
1450056890.553172 IP 10.1.1.1.2000 > 10.1.1.2.2000: Flags [P.], seq 1027:2053, ack 1, win 57, options [nop,nop,TS val 7056277 ecr 7056212], length 1026
1450056890.603181 IP 10.1.1.1.2000 > 10.1.1.2.2000: Flags [P.], seq 2053:3079, ack 1, win 57, options [nop,nop,TS val 7056289 ecr 7056212], length 1026
1450056890.653189 IP 10.1.1.1.2000 > 10.1.1.2.2000: Flags [P.], seq 3079:4105, ack 1, win 57, options [nop,nop,TS val 7056302 ecr 7056212], length 1026
1450056890.663392 IP 10.1.1.2.2000 > 10.1.1.1.2000: Flags [.], ack 1027, win 62, options [nop,nop,TS val 7056264 ecr 7056264], length 0
1450056890.703202 IP 10.1.1.1.2000 > 10.1.1.2.2000: Flags [P.], seq 4105:5131, ack 1, win 57, options [nop,nop,TS val 7056314 ecr 7056264], length 1026
1450056890.713210 IP 10.1.1.2.2000 > 10.1.1.1.2000: Flags [.], ack 2053, win 66, options [nop,nop,TS val 7056277 ecr 7056277], length 0
1450056890.753228 IP 10.1.1.1.2000 > 10.1.1.2.2000: Flags [P.], seq 5131:6157, ack 1, win 57, options [nop,nop,TS val 7056327 ecr 7056277], length 1026
1450056890.803156 IP 10.1.1.1.2000 > 10.1.1.2.2000: Flags [P.], seq 6157:7183, ack 1, win 57, options [nop,nop,TS val 7056339 ecr 7056277], length 1026
1450056890.813219 IP 10.1.1.2.2000 > 10.1.1.1.2000: Flags [.], ack 4105, win 74, options [nop,nop,TS val 7056302 ecr 7056302], length 0
1450056890.853104 IP 10.1.1.1.2000 > 10.1.1.2.2000: Flags [P.], seq 7183:8209, ack 1, win 57, options [nop,nop,TS val 7056352 ecr 7056302], length 1026
1450056890.863239 IP 10.1.1.2.2000 > 10.1.1.1.2000: Flags [.], ack 5131, win 78, options [nop,nop,TS val 7056314 ecr 7056314], length 0
1450056890.903094 IP 10.1.1.1.2000 > 10.1.1.2.2000: Flags [P.], seq 8209:9235, ack 1, win 57, options [nop,nop,TS val 7056364 ecr 7056314], length 1026
1450056890.913256 IP 10.1.1.2.2000 > 10.1.1.1.2000: Flags [.], ack 6157, win 82, options [nop,nop,TS val 7056327 ecr 7056327], length 0
1450056890.953131 IP 10.1.1.1.2000 > 10.1.1.2.2000: Flags [P.], seq 9235:10261, ack 1, win 57, options [nop,nop,TS val 7056377 ecr 7056327], length 1026
1450056890.963197 IP 10.1.1.2.2000 > 10.1.1.1.2000: Flags [.], ack 7183, win 86, options [nop,nop,TS val 7056339 ecr 7056339], length 0
1450056891.003108 IP 10.1.1.1.2000 > 10.1.1.2.2000: Flags [P.], seq 10261:11287, ack 1, win 57, options [nop,nop,TS val 7056389 ecr 7056339], length 1026
1450056891.013131 IP 10.1.1.2.2000 > 10.1.1.1.2000: Flags [.], ack 8209, win 90, options [nop,nop,TS val 7056352 ecr 7056352], length 0
1450056891.053149 IP 10.1.1.1.2000 > 10.1.1.2.2000: Flags [P.], seq 11287:12313, ack 1, win 57, options [nop,nop,TS val 7056402 ecr 7056352], length 1026
1450056891.063114 IP 10.1.1.2.2000 > 10.1.1.1.2000: Flags [.], ack 9235, win 94, options [nop,nop,TS val 7056364 ecr 7056364], length 0
1450056891.103174 IP 10.1.1.1.2000 > 10.1.1.2.2000: Flags [P.], seq 12313:13339, ack 1, win 57, options [nop,nop,TS val 7056414 ecr 7056364], length 1026
1450056891.113155 IP 10.1.1.2.2000 > 10.1.1.1.2000: Flags [.], ack 10261, win 98, options [nop,nop,TS val 7056377 ecr 7056377], length 0
1450056891.153098 IP 10.1.1.1.2000 > 10.1.1.2.2000: Flags [P.], seq 13339:14365, ack 1, win 57, options [nop,nop,TS val 7056427 ecr 7056377], length 1026
1450056891.163126 IP 10.1.1.2.2000 > 10.1.1.1.2000: Flags [.], ack 11287, win 102, options [nop,nop,TS val 7056389 ecr 7056389], length 0
1450056891.203152 IP 10.1.1.1.2000 > 10.1.1.2.2000: Flags [P.], seq 14365:15391, ack 1, win 57, options [nop,nop,TS val 7056439 ecr 7056389], length 1026
1450056891.213177 IP 10.1.1.2.2000 > 10.1.1.1.2000: Flags [.], ack 12313, win 106, options [nop,nop,TS val 7056402 ecr 7056402], length 0
1450056891.253159 IP 10.1.1.1.2000 > 10.1.1.2.2000: Flags [P.], seq 15391:16417, ack 1, win 57, options [nop,nop,TS val 7056452 ecr 7056402], length 1026
1450056891.263207 IP 10.1.1.2.2000 > 10.1.1.1.2000: Flags [.], ack 13339, win 110, options [nop,nop,TS val 7056414 ecr 7056414], length 0
1450056891.303172 IP 10.1.1.1.2000 > 10.1.1.2.2000: Flags [P.], seq 16417:17443, ack 1, win 57, options [nop,nop,TS val 7056464 ecr 7056414], length 1026
1450056891.313124 IP 10.1.1.2.2000 > 10.1.1.1.2000: Flags [.], ack 14365, win 114, options [nop,nop,TS val 7056427 ecr 7056427], length 0
1450056891.353205 IP 10.1.1.1.2000 > 10.1.1.2.2000: Flags [P.], seq 17443:18469, ack 1, win 57, options [nop,nop,TS val 7056477 ecr 7056427], length 1026
1450056891.363182 IP 10.1.1.2.2000 > 10.1.1.1.2000: Flags [.], ack 15391, win 118, options [nop,nop,TS val 7056439 ecr 7056439], length 0
1450056891.403258 IP 10.1.1.1.2000 > 10.1.1.2.2000: Flags [P.], seq 18469:19495, ack 1, win 57, options [nop,nop,TS val 7056489 ecr 7056439], length 1026
1450056891.413193 IP 10.1.1.2.2000 > 10.1.1.1.2000: Flags [.], ack 16417, win 122, options [nop,nop,TS val 7056452 ecr 7056452], length 0
1450056891.453185 IP 10.1.1.1.2000 > 10.1.1.2.2000: Flags [P.], seq 19495:20521, ack 1, win 57, options [nop,nop,TS val 7056502 ecr 7056452], length 1026
1450056891.503204 IP 10.1.1.1.2000 > 10.1.1.2.2000: Flags [P.], seq 20521:21547, ack 1, win 57, options [nop,nop,TS val 7056514 ecr 7056452], length 1026
1450056891.513247 IP 10.1.1.2.2000 > 10.1.1.1.2000: Flags [.], ack 18469, win 130, options [nop,nop,TS val 7056477 ecr 7056477], length 0
1450056891.553155 IP 10.1.1.1.2000 > 10.1.1.2.2000: Flags [P.], seq 21547:22573, ack 1, win 57, options [nop,nop,TS val 7056527 ecr 7056477], length 1026
1450056891.563296 IP 10.1.1.2.2000 > 10.1.1.1.2000: Flags [.], ack 19495, win 134, options [nop,nop,TS val 7056489 ecr 7056489], length 0
1450056891.603176 IP 10.1.1.1.2000 > 10.1.1.2.2000: Flags [P.], seq 22573:23599, ack 1, win 57, options [nop,nop,TS val 7056539 ecr 7056489], length 1026
1450056891.613221 IP 10.1.1.2.2000 > 10.1.1.1.2000: Flags [.], ack 20521, win 138, options [nop,nop,TS val 7056502 ecr 7056502], length 0
1450056891.653101 IP 10.1.1.1.2000 > 10.1.1.2.2000: Flags [P.], seq 23599:24625, ack 1, win 57, options [nop,nop,TS val 7056552 ecr 7056502], length 1026
1450056891.663290 IP 10.1.1.2.2000 > 10.1.1.1.2000: Flags [.], ack 21547, win 142, options [nop,nop,TS val 7056514 ecr 7056514], length 0
1450056891.703216 IP 10.1.1.1.2000 > 10.1.1.2.2000: Flags [P.], seq 24625:25651, ack 1, win 57, options [nop,nop,TS val 7056564 ecr 7056514], length 1026
1450056891.713193 IP 10.1.1.2.2000 > 10.1.1.1.2000: Flags [.], ack 22573, win 146, options [nop,nop,TS val 7056527 ecr 7056527], length 0
1450056891.753192 IP 10.1.1.1.2000 > 10.1.1.2.2000: Flags [P.], seq 25651:26677, ack 1, win 57, options [nop,nop,TS val 7056577 ecr 7056527], length 1026
1450056891.763207 IP 10.1.1.2.2000 > 10.1.1.1.2000: Flags [.], ack 23599, win 150, options [nop,nop,TS val 7056539 ecr 7056539], length 0
1450056891.803189 IP 10.1.1.1.2000 > 10.1.1.2.2000: Flags [P.], seq 26677:27703, ack 1, win 57, options [nop,nop,TS val 7056589 ecr 7056539], length 1026
1450056891.813122 IP 10.1.1.2.2000 > 10.1.1.1.2000: Flags [.], ack 24625, win 154, options [nop,nop,TS val 7056552 ecr 7056552], length 0
1450056891.853156 IP 10.1.1.1.2000 > 10.1.1.2.2000: Flags [P.], seq 27703:28729, ack 1, win 57, options [nop,nop,TS val 7056602 ecr 7056552], length 1026
1450056891.863254 IP 10.1.1.2.2000 > 10.1.1.1.2000: Flags [.], ack 25651, win 158, options [nop,nop,TS val 7056564 ecr 7056564], length 0
1450056891.903171 IP 10.1.1.1.2000 > 10.1.1.2.2000: Flags [P.], seq 28729:29755, ack 1, win 57, options [nop,nop,TS val 7056614 ecr 7056564], length 1026
1450056891.953161 IP 10.1.1.1.2000 > 10.1.1.2.2000: Flags [P.], seq 29755:30781, ack 1, win 57, options [nop,nop,TS val 7056627 ecr 7056564], length 1026
1450056891.963212 IP 10.1.1.2.2000 > 10.1.1.1.2000: Flags [.], ack 27703, win 166, options [nop,nop,TS val 7056589 ecr 7056589], length 0
1450056892.003154 IP 10.1.1.1.2000 > 10.1.1.2.2000: Flags [P.], seq 30781:31807, ack 1, win 57, options [nop,nop,TS val 7056639 ecr 7056589], length 1026
1450056892.013199 IP 10.1.1.2.2000 > 10.1.1.1.2000: Flags [.], ack 28729, win 170, options [nop,nop,TS val 7056602 ecr 7056602], length 0
1450056892.053226 IP 10.1.1.1.2000 > 10.1.1.2.2000: Flags [P.], seq 31807:32833, ack 1, win 57, options [nop,nop,TS val 7056652 ecr 7056602], length 1026
1450056892.063207 IP 10.1.1.2.2000 > 10.1.1.1.2000: Flags [.], ack 29755, win 174, options [nop,nop,TS val 7056614 ecr 7056614], length 0
1450056892.103146 IP 10.1.1.1.2000 > 10.1.1.2.2000: Flags [P.], seq 32833:33859, ack 1, win 57, options [nop,nop,TS val 7056664 ecr 7056614], length 1026
1450056892.113191 IP 10.1.1.2.2000 > 10.1.1.1.2000: Flags [.], ack 30781, win 178, options [nop,nop,TS val 7056627 ecr 7056627], length 0
1450056892.153183 IP 10.1.1.1.2000 > 10.1.1.2.2000: Flags [P.], seq 33859:34885, ack 1, win 57, options [nop,nop,TS val 7056677 ecr 7056627], length 1026
1450056892.163190 IP 10.1.1.2.2000 > 10.1.1.1.2000: Flags [.], ack 31807, win 182, options [nop,nop,TS val 7056639 ecr 7056639], length 0
1450056892.203148 IP 10.1.1.1.2000 > 10.1.1.2.2000: Flags [P.], seq 34885:35911, ack 1, win 57, options [nop,nop,TS val 7056689 ecr 7056639], length 1026
1450056892.213263 IP 10.1.1.2.2000 > 10.1.1.1.2000: Flags [.], ack 32833, win 186, options [nop,nop,TS val 7056652 ecr 7056652], length 0
1450056892.253279 IP 10.1.1.1.2000 > 10.1.1.2.2000: Flags [P.], seq 35911:36937, ack 1, win 57, options [nop,nop,TS val 7056702 ecr 7056652], length 1026
1450056892.263181 IP 10.1.1.2.2000 > 10.1.1.1.2000: Flags [.], ack 33859, win 190, options [nop,nop,TS val 7056664 ecr 7056664], length 0
1450056892.303187 IP 10.1.1.1.2000 > 10.1.1.2.2000: Flags [P.], seq 36937:37963, ack 1, win 57, options [nop,nop,TS val 7056714 ecr 7056664], length 1026
1450056892.313220 IP 10.1.1.2.2000 > 10.1.1.1.2000: Flags [.], ack 34885, win 194, options [nop,nop,TS val 7056677 ecr 7056677], length 0
1450056892.353173 IP 10.1.1.1.2000 > 10.1.1.2.2000: Flags [P.], seq 37963:38989, ack 1, win 57, options [nop,nop,TS val 7056727 ecr 7056677], length 1026
1450056892.363182 IP 10.1.1.2.2000 > 10.1.1.1.2000: Flags [.], ack 35911, win 198, options [nop,nop,TS val 7056689 ecr 7056689], length 0
1450056892.403197 IP 10.1.1.1.2000 > 10.1.1.2.2000: Flags [P.], seq 38989:40015, ack 1, win 57, options [nop,nop,TS val 7056739 ecr 7056689], length 1026
1450056892.413318 IP 10.1.1.2.2000 > 10.1.1.1.2000: Flags [.], ack 36937, win 202, options [nop,nop,TS val 7056702 ecr 7056702], length 0
1450056892.453158 IP 10.1.1.1.2000 > 10.1.1.2.2000: Flags [P.], seq 40015:41041, ack 1, win 57, options [nop,nop,TS val 7056752 ecr 7056702], length 1026
1450056892.463233 IP 10.1.1.2.2000 > 10.1.1.1.2000: Flags [.], ack 37963, win 206, options [nop,nop,TS val 7056714 ecr 7056714], length 0
1450056892.503178 IP 10.1.1.1.2000 > 10.1.1.2.2000: Flags [P.], seq 41041:42067, ack 1, win 57, options [nop,nop,TS val 7056764 ecr 7056714], length 1026
1450056892.513205 IP 10.1.1.2.2000 > 10.1.1.1.2000: Flags [.], ack 38989, win 210, options [nop,nop,TS val 7056727 ecr 7056727], length 0
1450056892.553159 IP 10.1.1.1.2000 > 10.1.1.2.2000: Flags [P.], seq 42067:43093, ack 1, win 57, options [nop,nop,TS val 7056777 ecr 7056727], length 1026
1450056892.563230 IP 10.1.1.2.2000 > 10.1.1.1.2000: Flags [.], ack 40015, win 214, options [nop,nop,TS val 7056739 ecr 7056739], length 0
1450056892.603162 IP 10.1.1.1.2000 > 10.1.1.2.2000: Flags [P.], seq 43093:44119, ack 1, win 57, options [nop,nop,TS val 7056789 ecr 7056739], length 1026
1450056892.613222 IP 10.1.1.2.2000 > 10.1.1.1.2000: Flags [.], ack 41041, win 218, options [nop,nop,TS val 7056752 ecr 7056752], length 0
1450056892.653150 IP 10.1.1.1.2000 > 10.1.1.2.2000: Flags [P.], seq 44119:45145, ack 1, win 57, options [nop,nop,TS val 7056802 ecr 7056752], length 1026
1450056892.663213 IP 10.1.1.2.2000 > 10.1.1.1.2000: Flags [.], ack 42067, win 222, options [nop,nop,TS val 7056764 ecr 7056764], length 0
1450056892.703164 IP 10.1.1.1.2000 > 10.1.1.2.2000: Flags [P.], seq 45145:46171, ack 1, win 57, options [nop,nop,TS val 7056814 ecr 7056764], length 1026
1450056892.713198 IP 10.1.1.2.2000 > 10.1.1.1.2000: Flags [.], ack 43093, win 226, options [nop,nop,TS val 7056777 ecr 7056777], length 0
1450056892.753154 IP 10.1.1.1.2000 > 10.1.1.2.2000: Flags [P.], seq 46171:47197, ack 1, win 57, options [nop,nop,TS val 7056827 ecr 7056777], length 1026
1450056892.763200 IP 10.1.1.2.2000 > 10.1.1.1.2000: Flags [.], ack 44119, win 230, options [nop,nop,TS val 7056789 ecr 7056789], length 0
1450056892.803161 IP 10.1.1.1.2000 > 10.1.1.2.2000: Flags [P.], seq 47197:48223, ack 1, win 57, options [nop,nop,TS val 7056839 ecr 7056789], length 1026
1450056892.813186 IP 10.1.1.2.2000 > 10.1.1.1.2000: Flags [.], ack 45145, win 234, options [nop,nop,TS val 7056802 ecr 7056802], length 0
1450056892.853424 IP 10.1.1.1.2000 > 10.1.1.2.2000: Flags [P.], seq 48223:49249, ack 1, win 57, options [nop,nop,TS val 7056852 ecr 7056802], length 1026
1450056892.863206 IP 10.1.1.2.2000 > 10.1.1.1.2000: Flags [.], ack 46171, win 238, options [nop,nop,TS val 7056814 ecr 7056814], length 0
1450056892.903164 IP 10.1.1.1.2000 > 10.1.1.2.2000: Flags [P.], seq 49249:50275, ack 1, win 57, options [nop,nop,TS val 7056864 ecr 7056814], length 1026
1450056892.913194 IP 10.1.1.2.2000 > 10.1.1.1.2000: Flags [.], ack 47197, win 242, options [nop,nop,TS val 7056827 ecr 7056827], length 0
1450056892.953146 IP 10.1.1.1.2000 > 10.1.1.2.2000: Flags [P.], seq 50275:51301, ack 1, win 57, options [nop,nop,TS val 7056877 ecr 7056827], length 1026
1450056892.963197 IP 10.1.1.2.2000 > 10.1.1.1.2000: Flags [.], ack 48223, win 246, options [nop,nop,TS val 7056839 ecr 7056839], length 0
1450056893.003167 IP 10.1.1.1.2000 > 10.1.1.2.2000: Flags [P.], seq 51301:52327, ack 1, win 57, options [nop,nop,TS val 7056889 ecr 7056839], length 1026
1450056893.013469 IP 10.1.1.2.2000 > 10.1.1.1.2000: Flags [.], ack 49249, win 250, options [nop,nop,TS val 7056852 ecr 7056852], length 0
1450056893.053164 IP 10.1.1.1.2000 > 10.1.1.2.2000: Flags [P.], seq 52327:53353, ack 1, win 57, options [nop,nop,TS val 7056902 ecr 7056852], length 1026
1450056893.063194 IP 10.1.1.2.2000 > 10.1.1.1.2000: Flags [.], ack 50275, win 254, options [nop,nop,TS val 7056864 ecr 7056864], length 0
1450056893.103150 IP 10.1.1.1.2000 > 10.1.1.2.2000: Flags [P.], seq 53353:54379, ack 1, win 57, options [nop,nop,TS val 7056914 ecr 7056864], length 1026
1450056893.113184 IP 10.1.1.2.2000 > 10.1.1.1.2000: Flags [.], ack 51301, win 258, options [nop,nop,TS val 7056877 ecr 7056877], length 0
1450056893.153172 IP 10.1.1.1.2000 > 10.1.1.2.2000: Flags [P.], seq 54379:55405, ack 1, win 57, options [nop,nop,TS val 7056927 ecr 7056877], length 1026
1450056893.163208 IP 10.1.1.2.2000 > 10.1.1.1.2000: Flags [.], ack 52327, win 262, options [nop,nop,TS val 7056889 ecr 7056889], length 0
1450056893.203166 IP 10.1.1.1.2000 > 10.1.1.2.2000: Flags [P.], seq 55405:56431, ack 1, win 57, options [nop,nop,TS val 7056939 ecr 7056889], length 1026
1450056893.213205 IP 10.1.1.2.2000 > 10.1.1.1.2000: Flags [.], ack 53353, win 266, options [nop,nop,TS val 7056902 ecr 7056902], length 0
1450056893.253165 IP 10.1.1.1.2000 > 10.1.1.2.2000: Flags [P.], seq 56431:57457, ack 1, win 57, options [nop,nop,TS val 7056952 ecr 7056902], length 1026
1450056893.263181 IP 10.1.1.2.2000 > 10.1.1.1.2000: Flags [.], ack 54379, win 270, options [nop,nop,TS val 7056914 ecr 7056914], length 0
1450056893.303203 IP 10.1.1.1.2000 > 10.1.1.2.2000: Flags [P.], seq 57457:58483, ack 1, win 57, options [nop,nop,TS val 7056964 ecr 7056914], length 1026
1450056893.313202 IP 10.1.1.2.2000 > 10.1.1.1.2000: Flags [.], ack 55405, win 274, options [nop,nop,TS val 7056927 ecr 7056927], length 0
1450056893.353148 IP 10.1.1.1.2000 > 10.1.1.2.2000: Flags [P.], seq 58483:59509, ack 1, win 57, options [nop,nop,TS val 7056977 ecr 7056927], length 1026
1450056893.363229 IP 10.1.1.2.2000 > 10.1.1.1.2000: Flags [.], ack 56431, win 278, options [nop,nop,TS val 7056939 ecr 7056939], length 0
1450056893.403149 IP 10.1.1.1.2000 > 10.1.1.2.2000: Flags [P.], seq 59509:60535, ack 1, win 57, options [nop,nop,TS val 7056989 ecr 7056939], length 1026
1450056893.413202 IP 10.1.1.2.2000 > 10.1.1.1.2000: Flags [.], ack 57457, win 282, options [nop,nop,TS val 7056952 ecr 7056952], length 0
1450056893.453153 IP 10.1.1.1.2000 > 10.1.1.2.2000: Flags [P.], seq 60535:61561, ack 1, win 57, options [nop,nop,TS val 7057002 ecr 7056952], length 1026
1450056893.463241 IP 10.1.1.2.2000 > 10.1.1.1.2000: Flags [.], ack 58483, win 286, options [nop,nop,TS val 7056964 ecr 7056964], length 0
1450056893.503156 IP 10.1.1.1.2000 > 10.1.1.2.2000: Flags [P.], seq 61561:62587, ack 1, win 57, options [nop,nop,TS val 7057014 ecr 7056964], length 1026
1450056893.513181 IP 10.1.1.2.2000 > 10.1.1.1.2000: Flags [.], ack 59509, win 290, options [nop,nop,TS val 7056977 ecr 7056977], length 0
1450056893.553204 IP 10.1.1.1.2000 > 10.1.1.2.2000: Flags [P.], seq 62587:63613, ack 1, win 57, options [nop,nop,TS val 7057027 ecr 7056977], length 1026
1450056893.563182 IP 10.1.1.2.2000 > 10.1.1.1.2000: Flags [.], ack 60535, win 294, options [nop,nop,TS val 7056989 ecr 7056989], length 0
1450056893.603151 IP 10.1.1.1.2000 > 10.1.1.2.2000: Flags [P.], seq 63613:64639, ack 1, win 57, options [nop,nop,TS val 7057039 ecr 7056989], length 1026
1450056893.653147 IP 10.1.1.1.2000 > 10.1.1.2.2000: Flags [P.], seq 64639:65665, ack 1, win 57, options [nop,nop,TS val 7057052 ecr 7056989], length 1026
1450056893.663192 IP 10.1.1.2.2000 > 10.1.1.1.2000: Flags [.], ack 62587, win 302, options [nop,nop,TS val 7057014 ecr 7057014], length 0
1450056893.703146 IP 10.1.1.1.2000 > 10.1.1.2.2000: Flags [P.], seq 65665:66691, ack 1, win 57, options [nop,nop,TS val 7057064 ecr 7057014], length 1026
1450056893.713246 IP 10.1.1.2.2000 > 10.1.1.1.2000: Flags [.], ack 63613, win 306, options [nop,nop,TS val 7057027 ecr 7057027], length 0
1450056893.753143 IP 10.1.1.1.2000 > 10.1.1.2.2000: Flags [P.], seq 66691:67717, ack 1, win 57, options [nop,nop,TS val 7057077 ecr 7057027], length 1026
1450056893.763182 IP 10.1.1.2.2000 > 10.1.1.1.2000: Flags [.], ack 64639, win 310, options [nop,nop,TS val 7057039 ecr 7057039], length 0
1450056893.803168 IP 10.1.1.1.2000 > 10.1.1.2.2000: Flags [P.], seq 67717:68743, ack 1, win 57, options [nop,nop,TS val 7057089 ecr 7057039], length 1026
1450056893.813178 IP 10.1.1.2.2000 > 10.1.1.1.2000: Flags [.], ack 65665, win 314, options [nop,nop,TS val 7057052 ecr 7057052], length 0
1450056893.853144 IP 10.1.1.1.2000 > 10.1.1.2.2000: Flags [P.], seq 68743:69769, ack 1, win 57, options [nop,nop,TS val 7057102 ecr 7057052], length 1026
1450056893.863193 IP 10.1.1.2.2000 > 10.1.1.1.2000: Flags [.], ack 66691, win 318, options [nop,nop,TS val 7057064 ecr 7057064], length 0
1450056893.903154 IP 10.1.1.1.2000 > 10.1.1.2.2000: Flags [P.], seq 69769:70795, ack 1, win 57, options [nop,nop,TS val 7057114 ecr 7057064], length 1026
1450056893.913175 IP 10.1.1.2.2000 > 10.1.1.1.2000: Flags [.], ack 67717, win 322, options [nop,nop,TS val 7057077 ecr 7057077], length 0
1450056893.953158 IP 10.1.1.1.2000 > 10.1.1.2.2000: Flags [P.], seq 70795:71821, ack 1, win 57, options [nop,nop,TS val 7057127 ecr 7057077], length 1026
1450056894.003229 IP 10.1.1.1.2000 > 10.1.1.2.2000: Flags [P.], seq 71821:72847, ack 1, win 57, options [nop,nop,TS val 7057139 ecr 7057077], length 1026
1450056894.013175 IP 10.1.1.2.2000 > 10.1.1.1.2000: Flags [.], ack 69769, win 330, options [nop,nop,TS val 7057102 ecr 7057102], length 0
1450056894.053180 IP 10.1.1.1.2000 > 10.1.1.2.2000: Flags [P.], seq 72847:73873, ack 1, win 57, options [nop,nop,TS val 7057152 ecr 7057102], length 1026
1450056894.063189 IP 10.1.1.2.2000 > 10.1.1.1.2000: Flags [.], ack 70795, win 334, options [nop,nop,TS val 7057114 ecr 7057114], length 0
1450056894.103158 IP 10.1.1.1.2000 > 10.1.1.2.2000: Flags [P.], seq 73873:74899, ack 1, win 57, options [nop,nop,TS val 7057164 ecr 7057114], length 1026
1450056894.113194 IP 10.1.1.2.2000 > 10.1.1.1.2000: Flags [.], ack 71821, win 338, options [nop,nop,TS val 7057127 ecr 7057127], length 0
1450056894.153181 IP 10.1.1.1.2000 > 10.1.1.2.2000: Flags [P.], seq 74899:75925, ack 1, win 57, options [nop,nop,TS val 7057177 ecr 7057127], length 1026
1450056894.163295 IP 10.1.1.2.2000 > 10.1.1.1.2000: Flags [.], ack 72847, win 342, options [nop,nop,TS val 7057139 ecr 7057139], length 0
1450056894.203168 IP 10.1.1.1.2000 > 10.1.1.2.2000: Flags [P.], seq 75925:76951, ack 1, win 57, options [nop,nop,TS val 7057189 ecr 7057139], length 1026
1450056894.213214 IP 10.1.1.2.2000 > 10.1.1.1.2000: Flags [.], ack 73873, win 346, options [nop,nop,TS val 7057152 ecr 7057152], length 0
1450056894.253234 IP 10.1.1.1.2000 > 10.1.1.2.2000: Flags [P.], seq 76951:77977, ack 1, win 57, options [nop,nop,TS val 7057202 ecr 7057152], length 1026
1450056894.263199 IP 10.1.1.2.2000 > 10.1.1.1.2000: Flags [.], ack 74899, win 350, options [nop,nop,TS val 7057164 ecr 7057164], length 0
1450056894.303171 IP 10.1.1.1.2000 > 10.1.1.2.2000: Flags [P.], seq 77977:79003, ack 1, win 57, options [nop,nop,TS val 7057214 ecr 7057164], length 1026
1450056894.313216 IP 10.1.1.2.2000 > 10.1.1.1.2000: Flags [.], ack 75925, win 354, options [nop,nop,TS val 7057177 ecr 7057177], length 0
1450056894.353152 IP 10.1.1.1.2000 > 10.1.1.2.2000: Flags [P.], seq 79003:80029, ack 1, win 57, options [nop,nop,TS val 7057227 ecr 7057177], length 1026
1450056894.363201 IP 10.1.1.2.2000 > 10.1.1.1.2000: Flags [.], ack 76951, win 358, options [nop,nop,TS val 7057189 ecr 7057189], length 0
1450056894.403155 IP 10.1.1.1.2000 > 10.1.1.2.2000: Flags [P.], seq 80029:81055, ack 1, win 57, options [nop,nop,TS val 7057239 ecr 7057189], length 1026
1450056894.413303 IP 10.1.1.2.2000 > 10.1.1.1.2000: Flags [.], ack 77977, win 361, options [nop,nop,TS val 7057202 ecr 7057202], length 0
1450056894.453193 IP 10.1.1.1.2000 > 10.1.1.2.2000: Flags [P.], seq 81055:82081, ack 1, win 57, options [nop,nop,TS val 7057252 ecr 7057202], length 1026
1450056894.503164 IP 10.1.1.1.2000 > 10.1.1.2.2000: Flags [P.], seq 82081:83107, ack 1, win 57, options [nop,nop,TS val 7057264 ecr 7057202], length 1026
1450056894.513183 IP 10.1.1.2.2000 > 10.1.1.1.2000: Flags [.], ack 80029, win 361, options [nop,nop,TS val 7057227 ecr 7057227], length 0
1450056894.553147 IP 10.1.1.1.2000 > 10.1.1.2.2000: Flags [P.], seq 83107:84133, ack 1, win 57, options [nop,nop,TS val 7057277 ecr 7057227], length 1026
1450056894.563188 IP 10.1.1.2.2000 > 10.1.1.1.2000: Flags [.], ack 81055, win 361, options [nop,nop,TS val 7057239 ecr 7057239], length 0
1450056894.603156 IP 10.1.1.1.2000 > 10.1.1.2.2000: Flags [P.], seq 84133:85159, ack 1, win 57, options [nop,nop,TS val 7057289 ecr 7057239], length 1026
1450056894.613229 IP 10.1.1.2.2000 > 10.1.1.1.2000: Flags [.], ack 82081, win 361, options [nop,nop,TS val 7057252 ecr 7057252], length 0
1450056894.653146 IP 10.1.1.1.2000 > 10.1.1.2.2000: Flags [P.], seq 85159:86185, ack 1, win 57, options [nop,nop,TS val 7057302 ecr 7057252], length 1026
1450056894.663192 IP 10.1.1.2.2000 > 10.1.1.1.2000: Flags [.], ack 83107, win 361, options [nop,nop,TS val 7057264 ecr 7057264], length 0
1450056894.703147 IP 10.1.1.1.2000 > 10.1.1.2.2000: Flags [P.], seq 86185:87211, ack 1, win 57, options [nop,nop,TS val 7057314 ecr 7057264], length 1026
1450056894.713176 IP 10.1.1.2.2000 > 10.1.1.1.2000: Flags [.], ack 84133, win 361, options [nop,nop,TS val 7057277 ecr 7057277], length 0
1450056894.753154 IP 10.1.1.1.2000 > 10.1.1.2.2000: Flags [P.], seq 87211:88237, ack 1, win 57, options [nop,nop,TS val 7057327 ecr 7057277], length 1026
1450056894.763220 IP 10.1.1.2.2000 > 10.1.1.1.2000: Flags [.], ack 85159, win 361, options [nop,nop,TS val 7057289 ecr 7057289], length 0
1450056894.803173 IP 10.1.1.1.2000 > 10.1.1.2.2000: Flags [P.], seq 88237:89263, ack 1, win 57, options [nop,nop,TS val 7057339 ecr 7057289], length 1026
1450056894.813180 IP 10.1.1.2.2000 > 10.1.1.1.2000: Flags [.], ack 86185, win 361, options [nop,nop,TS val 7057302 ecr 7057302], length 0
1450056894.853183 IP 10.1.1.1.2000 > 10.1.1.2.2000: Flags [P.], seq 89263:90289, ack 1, win 57, options [nop,nop,TS val 7057352 ecr 7057302], length 1026
1450056894.863215 IP 10.1.1.2.2000 > 10.1.1.1.2000: Flags [.], ack 87211, win 361, options [nop,nop,TS val 7057314 ecr 7057314], length 0
1450056894.903172 IP 10.1.1.1.2000 > 10.1.1.2.2000: Flags [P.], seq 90289:91315, ack 1, win 57, options [nop,nop,TS val 7057364 ecr 7057314], length 1026
1450056894.913192 IP 10.1.1.2.2000 > 10.1.1.1.2000: Flags [.], ack 88237, win 361, options [nop,nop,TS val 7057327 ecr 7057327], length 0
1450056894.953203 IP 10.1.1.1.2000 > 10.1.1.2.2000: Flags [P.], seq 91315:92341, ack 1, win 57, options [nop,nop,TS val 7057377 ecr 7057327], length 1026
1450056894.963209 IP 10.1.1.2.2000 > 10.1.1.1.2000: Flags [.], ack 89263, win 361, options [nop,nop,TS val 7057339 ecr 7057339], length 0
1450056895.003170 IP 10.1.1.1.2000 > 10.1.1.2.2000: Flags [P.], seq 92341:93367, ack 1, win 57, options [nop,nop,TS val 7057389 ecr 7057339], length 1026
1450056895.013226 IP 10.1.1.2.2000 > 10.1.1.1.2000: Flags [.], ack 90289, win 361, options [nop,nop,TS val 7057352 ecr 7057352], length 0
1450056895.053148 IP 10.1.1.1.2000 > 10.1.1.2.2000: Flags [P.], seq 93367:94393, ack 1, win 57, options [nop,nop,TS val 7057402 ecr 7057352], length 1026
1450056895.063209 IP 10.1.1.2.2000 > 10.1.1.1.2000: Flags [.], ack 91315, win 361, options [nop,nop,TS val 7057364 ecr 7057364], length 0
1450056895.103177 IP 10.1.1.1.2000 > 10.1.1.2.2000: Flags [P.], seq 94393:95419, ack 1, win 57, options [nop,nop,TS val 7057414 ecr 7057364], length 1026
1450056895.113246 IP 10.1.1.2.2000 > 10.1.1.1.2000: Flags [.], ack 92341, win 361, options [nop,nop,TS val 7057377 ecr 7057377], length 0
1450056895.153156 IP 10.1.1.1.2000 > 10.1.1.2.2000: Flags [P.], seq 95419:96445, ack 1, win 57, options [nop,nop,TS val 7057427 ecr 7057377], length 1026
1450056895.199700 IP 10.1.1.2.2000 > 10.1.1.1.2000: Flags [.], ack 93367, win 361, options [nop,nop,TS val 7057399 ecr 7057389], length 0
1450056895.203156 IP 10.1.1.1.2000 > 10.1.1.2.2000: Flags [P.], seq 96445:97471, ack 1, win 57, options [nop,nop,TS val 7057439 ecr 7057399], length 1026
1450056895.253152 IP 10.1.1.1.2000 > 10.1.1.2.2000: Flags [P.], seq 97471:98497, ack 1, win 57, options [nop,nop,TS val 7057452 ecr 7057399], length 1026
1450056895.263208 IP 10.1.1.2.2000 > 10.1.1.1.2000: Flags [.], ack 95419, win 361, options [nop,nop,TS val 7057414 ecr 7057402], length 0
1450056895.303155 IP 10.1.1.1.2000 > 10.1.1.2.2000: Flags [P.], seq 98497:99523, ack 1, win 57, options [nop,nop,TS val 7057464 ecr 7057414], length 1026
1450056895.353242 IP 10.1.1.1.2000 > 10.1.1.2.2000: Flags [P.], seq 99523:100549, ack 1, win 57, options [nop,nop,TS val 7057477 ecr 7057414], length 1026
1450056895.363209 IP 10.1.1.2.2000 > 10.1.1.1.2000: Flags [.], ack 97471, win 361, options [nop,nop,TS val 7057439 ecr 7057427], length 0
1450056895.403194 IP 10.1.1.1.2000 > 10.1.1.2.2000: Flags [P.], seq 100549:101575, ack 1, win 57, options [nop,nop,TS val 7057489 ecr 7057439], length 1026
1450056895.453185 IP 10.1.1.1.2000 > 10.1.1.2.2000: Flags [P.], seq 101575:102601, ack 1, win 57, options [nop,nop,TS val 7057502 ecr 7057439], length 1026
1450056895.463190 IP 10.1.1.2.2000 > 10.1.1.1.2000: Flags [.], ack 99523, win 361, options [nop,nop,TS val 7057464 ecr 7057452], length 0
1450056895.503202 IP 10.1.1.1.2000 > 10.1.1.2.2000: Flags [P.], seq 102601:103627, ack 1, win 57, options [nop,nop,TS val 7057514 ecr 7057464], length 1026
1450056895.553170 IP 10.1.1.1.2000 > 10.1.1.2.2000: Flags [P.], seq 103627:104653, ack 1, win 57, options [nop,nop,TS val 7057527 ecr 7057464], length 1026
1450056895.563227 IP 10.1.1.2.2000 > 10.1.1.1.2000: Flags [.], ack 101575, win 361, options [nop,nop,TS val 7057489 ecr 7057477], length 0
1450056895.603223 IP 10.1.1.1.2000 > 10.1.1.2.2000: Flags [P.], seq 104653:105679, ack 1, win 57, options [nop,nop,TS val 7057539 ecr 7057489], length 1026
1450056895.653188 IP 10.1.1.1.2000 > 10.1.1.2.2000: Flags [P.], seq 105679:106705, ack 1, win 57, options [nop,nop,TS val 7057552 ecr 7057489], length 1026
1450056895.663262 IP 10.1.1.2.2000 > 10.1.1.1.2000: Flags [.], ack 103627, win 361, options [nop,nop,TS val 7057514 ecr 7057502], length 0
1450056895.703174 IP 10.1.1.1.2000 > 10.1.1.2.2000: Flags [P.], seq 106705:107731, ack 1, win 57, options [nop,nop,TS val 7057564 ecr 7057514], length 1026
1450056895.753177 IP 10.1.1.1.2000 > 10.1.1.2.2000: Flags [P.], seq 107731:108757, ack 1, win 57, options [nop,nop,TS val 7057577 ecr 7057514], length 1026
1450056895.763260 IP 10.1.1.2.2000 > 10.1.1.1.2000: Flags [.], ack 105679, win 361, options [nop,nop,TS val 7057539 ecr 7057527], length 0
1450056895.803222 IP 10.1.1.1.2000 > 10.1.1.2.2000: Flags [P.], seq 108757:109783, ack 1, win 57, options [nop,nop,TS val 7057589 ecr 7057539], length 1026
1450056895.853153 IP 10.1.1.1.2000 > 10.1.1.2.2000: Flags [P.], seq 109783:110809, ack 1, win 57, options [nop,nop,TS val 7057602 ecr 7057539], length 1026
1450056895.863214 IP 10.1.1.2.2000 > 10.1.1.1.2000: Flags [.], ack 107731, win 361, options [nop,nop,TS val 7057564 ecr 7057552], length 0
1450056895.903184 IP 10.1.1.1.2000 > 10.1.1.2.2000: Flags [P.], seq 110809:111835, ack 1, win 57, options [nop,nop,TS val 7057614 ecr 7057564], length 1026
1450056895.953149 IP 10.1.1.1.2000 > 10.1.1.2.2000: Flags [P.], seq 111835:112861, ack 1, win 57, options [nop,nop,TS val 7057627 ecr 7057564], length 1026
1450056895.963289 IP 10.1.1.2.2000 > 10.1.1.1.2000: Flags [.], ack 109783, win 361, options [nop,nop,TS val 7057589 ecr 7057577], length 0
1450056896.003180 IP 10.1.1.1.2000 > 10.1.1.2.2000: Flags [P.], seq 112861:113887, ack 1, win 57, options [nop,nop,TS val 7057639 ecr 7057589], length 1026
1450056896.053143 IP 10.1.1.1.2000 > 10.1.1.2.2000: Flags [P.], seq 113887:114913, ack 1, win 57, options [nop,nop,TS val 7057652 ecr 7057589], length 1026
1450056896.103148 IP 10.1.1.1.2000 > 10.1.1.2.2000: Flags [P.], seq 114913:115939, ack 1, win 57, options [nop,nop,TS val 7057664 ecr 7057589], length 1026
1450056896.153166 IP 10.1.1.1.2000 > 10.1.1.2.2000: Flags [P.], seq 115939:116965, ack 1, win 57, options [nop,nop,TS val 7057677 ecr 7057589], length 1026
1450056896.163217 IP 10.1.1.2.2000 > 10.1.1.1.2000: Flags [.], ack 113887, win 361, options [nop,nop,TS val 7057639 ecr 7057627], length 0
1450056896.203150 IP 10.1.1.1.2000 > 10.1.1.2.2000: Flags [P.], seq 116965:117991, ack 1, win 57, options [nop,nop,TS val 7057689 ecr 7057639], length 1026
1450056896.253190 IP 10.1.1.1.2000 > 10.1.1.2.2000: Flags [P.], seq 117991:119017, ack 1, win 57, options [nop,nop,TS val 7057702 ecr 7057639], length 1026
1450056896.263187 IP 10.1.1.2.2000 > 10.1.1.1.2000: Flags [.], ack 115939, win 361, options [nop,nop,TS val 7057664 ecr 7057652], length 0
1450056896.303129 IP 10.1.1.1.2000 > 10.1.1.2.2000: Flags [P.], seq 119017:120043, ack 1, win 57, options [nop,nop,TS val 7057714 ecr 7057664], length 1026
1450056896.353162 IP 10.1.1.1.2000 > 10.1.1.2.2000: Flags [P.], seq 120043:121069, ack 1, win 57, options [nop,nop,TS val 7057727 ecr 7057664], length 1026
1450056896.363186 IP 10.1.1.2.2000 > 10.1.1.1.2000: Flags [.], ack 117991, win 361, options [nop,nop,TS val 7057689 ecr 7057677], length 0
1450056896.403153 IP 10.1.1.1.2000 > 10.1.1.2.2000: Flags [P.], seq 121069:122095, ack 1, win 57, options [nop,nop,TS val 7057739 ecr 7057689], length 1026
1450056896.453147 IP 10.1.1.1.2000 > 10.1.1.2.2000: Flags [P.], seq 122095:123121, ack 1, win 57, options [nop,nop,TS val 7057752 ecr 7057689], length 1026
1450056896.463165 IP 10.1.1.2.2000 > 10.1.1.1.2000: Flags [.], ack 120043, win 361, options [nop,nop,TS val 7057714 ecr 7057702], length 0
1450056896.503226 IP 10.1.1.1.2000 > 10.1.1.2.2000: Flags [P.], seq 123121:124147, ack 1, win 57, options [nop,nop,TS val 7057764 ecr 7057714], length 1026
1450056896.553151 IP 10.1.1.1.2000 > 10.1.1.2.2000: Flags [P.], seq 124147:125173, ack 1, win 57, options [nop,nop,TS val 7057777 ecr 7057714], length 1026
1450056896.563190 IP 10.1.1.2.2000 > 10.1.1.1.2000: Flags [.], ack 122095, win 361, options [nop,nop,TS val 7057739 ecr 7057727], length 0
1450056896.603160 IP 10.1.1.1.2000 > 10.1.1.2.2000: Flags [P.], seq 125173:126199, ack 1, win 57, options [nop,nop,TS val 7057789 ecr 7057739], length 1026
1450056896.653167 IP 10.1.1.1.2000 > 10.1.1.2.2000: Flags [P.], seq 126199:127225, ack 1, win 57, options [nop,nop,TS val 7057802 ecr 7057739], length 1026
1450056896.663273 IP 10.1.1.2.2000 > 10.1.1.1.2000: Flags [.], ack 124147, win 361, options [nop,nop,TS val 7057764 ecr 7057752], length 0
1450056896.703140 IP 10.1.1.1.2000 > 10.1.1.2.2000: Flags [P.], seq 127225:128251, ack 1, win 57, options [nop,nop,TS val 7057814 ecr 7057764], length 1026
1450056896.753196 IP 10.1.1.1.2000 > 10.1.1.2.2000: Flags [P.], seq 128251:129277, ack 1, win 57, options [nop,nop,TS val 7057827 ecr 7057764], length 1026
1450056896.763226 IP 10.1.1.2.2000 > 10.1.1.1.2000: Flags [.], ack 126199, win 361, options [nop,nop,TS val 7057789 ecr 7057777], length 0
1450056896.803213 IP 10.1.1.1.2000 > 10.1.1.2.2000: Flags [P.], seq 129277:130303, ack 1, win 57, options [nop,nop,TS val 7057839 ecr 7057789], length 1026
1450056896.853162 IP 10.1.1.1.2000 > 10.1.1.2.2000: Flags [P.], seq 130303:131329, ack 1, win 57, options [nop,nop,TS val 7057852 ecr 7057789], length 1026
1450056896.863180 IP 10.1.1.2.2000 > 10.1.1.1.2000: Flags [.], ack 128251, win 361, options [nop,nop,TS val 7057814 ecr 7057802], length 0
1450056896.903208 IP 10.1.1.1.2000 > 10.1.1.2.2000: Flags [P.], seq 131329:132355, ack 1, win 57, options [nop,nop,TS val 7057864 ecr 7057814], length 1026
1450056896.953191 IP 10.1.1.1.2000 > 10.1.1.2.2000: Flags [P.], seq 132355:133381, ack 1, win 57, options [nop,nop,TS val 7057877 ecr 7057814], length 1026
1450056896.963255 IP 10.1.1.2.2000 > 10.1.1.1.2000: Flags [.], ack 130303, win 361, options [nop,nop,TS val 7057839 ecr 7057827], length 0
1450056897.003178 IP 10.1.1.1.2000 > 10.1.1.2.2000: Flags [P.], seq 133381:134407, ack 1, win 57, options [nop,nop,TS val 7057889 ecr 7057839], length 1026
1450056897.053200 IP 10.1.1.1.2000 > 10.1.1.2.2000: Flags [P.], seq 134407:135433, ack 1, win 57, options [nop,nop,TS val 7057902 ecr 7057839], length 1026
1450056897.063250 IP 10.1.1.2.2000 > 10.1.1.1.2000: Flags [.], ack 132355, win 361, options [nop,nop,TS val 7057864 ecr 7057852], length 0
1450056897.103178 IP 10.1.1.1.2000 > 10.1.1.2.2000: Flags [P.], seq 135433:136459, ack 1, win 57, options [nop,nop,TS val 7057914 ecr 7057864], length 1026
1450056897.153169 IP 10.1.1.1.2000 > 10.1.1.2.2000: Flags [P.], seq 136459:137485, ack 1, win 57, options [nop,nop,TS val 7057927 ecr 7057864], length 1026
1450056897.163218 IP 10.1.1.2.2000 > 10.1.1.1.2000: Flags [.], ack 134407, win 361, options [nop,nop,TS val 7057889 ecr 7057877], length 0
1450056897.203258 IP 10.1.1.1.2000 > 10.1.1.2.2000: Flags [P.], seq 137485:138511, ack 1, win 57, options [nop,nop,TS val 7057939 ecr 7057889], length 1026
1450056897.253164 IP 10.1.1.1.2000 > 10.1.1.2.2000: Flags [P.], seq 138511:139537, ack 1, win 57, options [nop,nop,TS val 7057952 ecr 7057889], length 1026
1450056897.263238 IP 10.1.1.2.2000 > 10.1.1.1.2000: Flags [.], ack 136459, win 361, options [nop,nop,TS val 7057914 ecr 7057902], length 0
1450056897.303187 IP 10.1.1.1.2000 > 10.1.1.2.2000: Flags [P.], seq 139537:140563, ack 1, win 57, options [nop,nop,TS val 7057964 ecr 7057914], length 1026
1450056897.353211 IP 10.1.1.1.2000 > 10.1.1.2.2000: Flags [P.], seq 140563:141589, ack 1, win 57, options [nop,nop,TS val 7057977 ecr 7057914], length 1026
1450056897.363293 IP 10.1.1.2.2000 > 10.1.1.1.2000: Flags [.], ack 138511, win 361, options [nop,nop,TS val 7057939 ecr 7057927], length 0
1450056897.403218 IP 10.1.1.1.2000 > 10.1.1.2.2000: Flags [P.], seq 141589:142615, ack 1, win 57, options [nop,nop,TS val 7057989 ecr 7057939], length 1026
1450056897.453173 IP 10.1.1.1.2000 > 10.1.1.2.2000: Flags [P.], seq 142615:143641, ack 1, win 57, options [nop,nop,TS val 7058002 ecr 7057939], length 1026
1450056897.463224 IP 10.1.1.2.2000 > 10.1.1.1.2000: Flags [.], ack 140563, win 361, options [nop,nop,TS val 7057964 ecr 7057952], length 0
1450056897.503244 IP 10.1.1.1.2000 > 10.1.1.2.2000: Flags [P.], seq 143641:144667, ack 1, win 57, options [nop,nop,TS val 7058014 ecr 7057964], length 1026
1450056897.553201 IP 10.1.1.1.2000 > 10.1.1.2.2000: Flags [P.], seq 144667:145693, ack 1, win 57, options [nop,nop,TS val 7058027 ecr 7057964], length 1026
1450056897.563257 IP 10.1.1.2.2000 > 10.1.1.1.2000: Flags [.], ack 142615, win 361, options [nop,nop,TS val 7057989 ecr 7057977], length 0
1450056897.603158 IP 10.1.1.1.2000 > 10.1.1.2.2000: Flags [P.], seq 145693:146719, ack 1, win 57, options [nop,nop,TS val 7058039 ecr 7057989], length 1026
1450056897.653174 IP 10.1.1.1.2000 > 10.1.1.2.2000: Flags [P.], seq 146719:147745, ack 1, win 57, options [nop,nop,TS val 7058052 ecr 7057989], length 1026
1450056897.663277 IP 10.1.1.2.2000 > 10.1.1.1.2000: Flags [.], ack 144667, win 361, options [nop,nop,TS val 7058014 ecr 7058002], length 0
1450056897.703159 IP 10.1.1.1.2000 > 10.1.1.2.2000: Flags [P.], seq 147745:148771, ack 1, win 57, options [nop,nop,TS val 7058064 ecr 7058014], length 1026
1450056897.753239 IP 10.1.1.1.2000 > 10.1.1.2.2000: Flags [P.], seq 148771:149797, ack 1, win 57, options [nop,nop,TS val 7058077 ecr 7058014], length 1026
1450056897.763203 IP 10.1.1.2.2000 > 10.1.1.1.2000: Flags [.], ack 146719, win 361, options [nop,nop,TS val 7058039 ecr 7058027], length 0
1450056897.803296 IP 10.1.1.1.2000 > 10.1.1.2.2000: Flags [P.], seq 149797:150823, ack 1, win 57, options [nop,nop,TS val 7058089 ecr 7058039], length 1026
1450056897.853171 IP 10.1.1.1.2000 > 10.1.1.2.2000: Flags [P.], seq 150823:151849, ack 1, win 57, options [nop,nop,TS val 7058102 ecr 7058039], length 1026
1450056897.863193 IP 10.1.1.2.2000 > 10.1.1.1.2000: Flags [.], ack 148771, win 361, options [nop,nop,TS val 7058064 ecr 7058052], length 0
1450056897.903203 IP 10.1.1.1.2000 > 10.1.1.2.2000: Flags [P.], seq 151849:152875, ack 1, win 57, options [nop,nop,TS val 7058114 ecr 7058064], length 1026
1450056897.953161 IP 10.1.1.1.2000 > 10.1.1.2.2000: Flags [P.], seq 152875:153901, ack 1, win 57, options [nop,nop,TS val 7058127 ecr 7058064], length 1026
1450056897.963339 IP 10.1.1.2.2000 > 10.1.1.1.2000: Flags [.], ack 150823, win 361, options [nop,nop,TS val 7058089 ecr 7058077], length 0
1450056898.003273 IP 10.1.1.1.2000 > 10.1.1.2.2000: Flags [P.], seq 153901:154927, ack 1, win 57, options [nop,nop,TS val 7058139 ecr 7058089], length 1026
1450056898.053257 IP 10.1.1.1.2000 > 10.1.1.2.2000: Flags [P.], seq 154927:155953, ack 1, win 57, options [nop,nop,TS val 7058152 ecr 7058089], length 1026
1450056898.063241 IP 10.1.1.2.2000 > 10.1.1.1.2000: Flags [.], ack 152875, win 361, options [nop,nop,TS val 7058114 ecr 7058102], length 0
1450056898.103156 IP 10.1.1.1.2000 > 10.1.1.2.2000: Flags [P.], seq 155953:156979, ack 1, win 57, options [nop,nop,TS val 7058164 ecr 7058114], length 1026
