1450054287.624914 IP 10.1.1.2.17500 > 10.1.1.255.17500: UDP, length 293
1450054317.649676 IP 10.1.1.2.17500 > 10.1.1.255.17500: UDP, length 293
1450054347.673494 IP 10.1.1.2.17500 > 10.1.1.255.17500: UDP, length 293
1450054352.534074 IP 10.1.1.2.50225 > 10.1.1.1.2000: Flags [S], seq 1598197867, win 29200, options [mss 1460,sackOK,TS val 6421772 ecr 0,nop,wscale 9], length 0
1450054352.534127 IP 10.1.1.1.2000 > 10.1.1.2.50225: Flags [S.], seq 3858951956, ack 1598197868, win 28960, options [mss 1460,sackOK,TS val 6421772 ecr 6421772,nop,wscale 9], length 0
1450054352.534158 IP 10.1.1.2.50225 > 10.1.1.1.2000: Flags [.], ack 1, win 58, options [nop,nop,TS val 6421772 ecr 6421772], length 0
1450054352.534727 IP 10.1.1.2.60653 > 10.1.1.1.2000: Flags [S], seq 2780604521, win 29200, options [mss 1460,sackOK,TS val 6421772 ecr 0,nop,wscale 9], length 0
1450054352.534761 IP 10.1.1.1.2000 > 10.1.1.2.60653: Flags [S.], seq 530474537, ack 2780604522, win 28960, options [mss 1460,sackOK,TS val 6421772 ecr 6421772,nop,wscale 9], length 0
1450054352.534780 IP 10.1.1.2.60653 > 10.1.1.1.2000: Flags [.], ack 1, win 58, options [nop,nop,TS val 6421772 ecr 6421772], length 0
1450054352.534878 IP 10.1.1.2.56705 > 10.1.1.1.2000: Flags [S], seq 4011828993, win 29200, options [mss 1460,sackOK,TS val 6421772 ecr 0,nop,wscale 9], length 0
1450054352.534904 IP 10.1.1.1.2000 > 10.1.1.2.56705: Flags [S.], seq 166478232, ack 4011828994, win 28960, options [mss 1460,sackOK,TS val 6421772 ecr 6421772,nop,wscale 9], length 0
1450054352.534922 IP 10.1.1.2.56705 > 10.1.1.1.2000: Flags [.], ack 1, win 58, options [nop,nop,TS val 6421772 ecr 6421772], length 0
1450054352.535034 IP 10.1.1.2.55311 > 10.1.1.1.2000: Flags [S], seq 3780407267, win 29200, options [mss 1460,sackOK,TS val 6421772 ecr 0,nop,wscale 9], length 0
1450054352.535058 IP 10.1.1.1.2000 > 10.1.1.2.55311: Flags [S.], seq 4094482197, ack 3780407268, win 28960, options [mss 1460,sackOK,TS val 6421772 ecr 6421772,nop,wscale 9], length 0
1450054352.535081 IP 10.1.1.2.55311 > 10.1.1.1.2000: Flags [.], ack 1, win 58, options [nop,nop,TS val 6421772 ecr 6421772], length 0
1450054352.535164 IP 10.1.1.2.34920 > 10.1.1.1.2000: Flags [S], seq 1432288415, win 29200, options [mss 1460,sackOK,TS val 6421772 ecr 0,nop,wscale 9], length 0
1450054352.535181 IP 10.1.1.1.2000 > 10.1.1.2.34920: Flags [S.], seq 49243394, ack 1432288416, win 28960, options [mss 1460,sackOK,TS val 6421772 ecr 6421772,nop,wscale 9], length 0
1450054352.535196 IP 10.1.1.2.34920 > 10.1.1.1.2000: Flags [.], ack 1, win 58, options [nop,nop,TS val 6421772 ecr 6421772], length 0
1450054352.585670 IP 10.1.1.1.2000 > 10.1.1.2.50225: Flags [P.], seq 1:1027, ack 1, win 57, options [nop,nop,TS val 6421785 ecr 6421772], length 1026
1450054352.585721 IP 10.1.1.2.50225 > 10.1.1.1.2000: Flags [.], ack 1027, win 62, options [nop,nop,TS val 6421785 ecr 6421785], length 0
1450054352.635718 IP 10.1.1.1.2000 > 10.1.1.2.60653: Flags [P.], seq 1:1027, ack 1, win 57, options [nop,nop,TS val 6421798 ecr 6421772], length 1026
1450054352.635758 IP 10.1.1.2.60653 > 10.1.1.1.2000: Flags [.], ack 1027, win 62, options [nop,nop,TS val 6421798 ecr 6421798], length 0
1450054352.685558 IP 10.1.1.1.2000 > 10.1.1.2.56705: Flags [P.], seq 1:1027, ack 1, win 57, options [nop,nop,TS val 6421810 ecr 6421772], length 1026
1450054352.685597 IP 10.1.1.2.56705 > 10.1.1.1.2000: Flags [.], ack 1027, win 62, options [nop,nop,TS val 6421810 ecr 6421810], length 0
1450054352.735529 IP 10.1.1.1.2000 > 10.1.1.2.55311: Flags [P.], seq 1:1027, ack 1, win 57, options [nop,nop,TS val 6421822 ecr 6421772], length 1026
1450054352.735565 IP 10.1.1.2.55311 > 10.1.1.1.2000: Flags [.], ack 1027, win 62, options [nop,nop,TS val 6421822 ecr 6421822], length 0
1450054352.785561 IP 10.1.1.1.2000 > 10.1.1.2.34920: Flags [P.], seq 1:1027, ack 1, win 57, options [nop,nop,TS val 6421835 ecr 6421772], length 1026
1450054352.785598 IP 10.1.1.2.34920 > 10.1.1.1.2000: Flags [.], ack 1027, win 62, options [nop,nop,TS val 6421835 ecr 6421835], length 0
1450054352.835947 IP 10.1.1.1.2000 > 10.1.1.2.50225: Flags [P.], seq 1027:2053, ack 1, win 57, options [nop,nop,TS val 6421848 ecr 6421785], length 1026
1450054352.835978 IP 10.1.1.2.50225 > 10.1.1.1.2000: Flags [.], ack 2053, win 66, options [nop,nop,TS val 6421848 ecr 6421848], length 0
1450054352.885512 IP 10.1.1.1.2000 > 10.1.1.2.60653: Flags [P.], seq 1027:2053, ack 1, win 57, options [nop,nop,TS val 6421860 ecr 6421798], length 1026
1450054352.885540 IP 10.1.1.2.60653 > 10.1.1.1.2000: Flags [.], ack 2053, win 66, options [nop,nop,TS val 6421860 ecr 6421860], length 0
1450054352.935520 IP 10.1.1.1.2000 > 10.1.1.2.56705: Flags [P.], seq 1027:2053, ack 1, win 57, options [nop,nop,TS val 6421872 ecr 6421810], length 1026
1450054352.935548 IP 10.1.1.2.56705 > 10.1.1.1.2000: Flags [.], ack 2053, win 66, options [nop,nop,TS val 6421872 ecr 6421872], length 0
1450054352.985492 IP 10.1.1.1.2000 > 10.1.1.2.55311: Flags [P.], seq 1027:2053, ack 1, win 57, options [nop,nop,TS val 6421885 ecr 6421822], length 1026
1450054352.985519 IP 10.1.1.2.55311 > 10.1.1.1.2000: Flags [.], ack 2053, win 66, options [nop,nop,TS val 6421885 ecr 6421885], length 0
1450054353.035524 IP 10.1.1.1.2000 > 10.1.1.2.34920: Flags [P.], seq 1027:2053, ack 1, win 57, options [nop,nop,TS val 6421897 ecr 6421835], length 1026
1450054353.035552 IP 10.1.1.2.34920 > 10.1.1.1.2000: Flags [.], ack 2053, win 66, options [nop,nop,TS val 6421897 ecr 6421897], length 0
1450054353.085510 IP 10.1.1.1.2000 > 10.1.1.2.50225: Flags [P.], seq 2053:3079, ack 1, win 57, options [nop,nop,TS val 6421910 ecr 6421848], length 1026
1450054353.085538 IP 10.1.1.2.50225 > 10.1.1.1.2000: Flags [.], ack 3079, win 70, options [nop,nop,TS val 6421910 ecr 6421910], length 0
1450054353.135525 IP 10.1.1.1.2000 > 10.1.1.2.60653: Flags [P.], seq 2053:3079, ack 1, win 57, options [nop,nop,TS val 6421922 ecr 6421860], length 1026
1450054353.135552 IP 10.1.1.2.60653 > 10.1.1.1.2000: Flags [.], ack 3079, win 70, options [nop,nop,TS val 6421922 ecr 6421922], length 0
1450054353.185490 IP 10.1.1.1.2000 > 10.1.1.2.56705: Flags [P.], seq 2053:3079, ack 1, win 57, options [nop,nop,TS val 6421935 ecr 6421872], length 1026
1450054353.185516 IP 10.1.1.2.56705 > 10.1.1.1.2000: Flags [.], ack 3079, win 70, options [nop,nop,TS val 6421935 ecr 6421935], length 0
1450054353.235420 IP 10.1.1.1.2000 > 10.1.1.2.55311: Flags [P.], seq 2053:3079, ack 1, win 57, options [nop,nop,TS val 6421947 ecr 6421885], length 1026
1450054353.235432 IP 10.1.1.2.55311 > 10.1.1.1.2000: Flags [.], ack 3079, win 70, options [nop,nop,TS val 6421947 ecr 6421947], length 0
1450054353.285485 IP 10.1.1.1.2000 > 10.1.1.2.34920: Flags [P.], seq 2053:3079, ack 1, win 57, options [nop,nop,TS val 6421960 ecr 6421897], length 1026
1450054353.285515 IP 10.1.1.2.34920 > 10.1.1.1.2000: Flags [.], ack 3079, win 70, options [nop,nop,TS val 6421960 ecr 6421960], length 0
1450054353.335503 IP 10.1.1.1.2000 > 10.1.1.2.50225: Flags [P.], seq 3079:4105, ack 1, win 57, options [nop,nop,TS val 6421972 ecr 6421910], length 1026
1450054353.335531 IP 10.1.1.2.50225 > 10.1.1.1.2000: Flags [.], ack 4105, win 74, options [nop,nop,TS val 6421972 ecr 6421972], length 0
1450054353.385478 IP 10.1.1.1.2000 > 10.1.1.2.60653: Flags [P.], seq 3079:4105, ack 1, win 57, options [nop,nop,TS val 6421985 ecr 6421922], length 1026
1450054353.385506 IP 10.1.1.2.60653 > 10.1.1.1.2000: Flags [.], ack 4105, win 74, options [nop,nop,TS val 6421985 ecr 6421985], length 0
1450054353.435532 IP 10.1.1.1.2000 > 10.1.1.2.56705: Flags [P.], seq 3079:4105, ack 1, win 57, options [nop,nop,TS val 6421997 ecr 6421935], length 1026
1450054353.435560 IP 10.1.1.2.56705 > 10.1.1.1.2000: Flags [.], ack 4105, win 74, options [nop,nop,TS val 6421997 ecr 6421997], length 0
1450054353.485522 IP 10.1.1.1.2000 > 10.1.1.2.55311: Flags [P.], seq 3079:4105, ack 1, win 57, options [nop,nop,TS val 6422010 ecr 6421947], length 1026
1450054353.485542 IP 10.1.1.2.55311 > 10.1.1.1.2000: Flags [.], ack 4105, win 74, options [nop,nop,TS val 6422010 ecr 6422010], length 0
1450054353.535526 IP 10.1.1.1.2000 > 10.1.1.2.34920: Flags [P.], seq 3079:4105, ack 1, win 57, options [nop,nop,TS val 6422022 ecr 6421960], length 1026
1450054353.535560 IP 10.1.1.2.34920 > 10.1.1.1.2000: Flags [.], ack 4105, win 74, options [nop,nop,TS val 6422022 ecr 6422022], length 0
1450054353.585491 IP 10.1.1.1.2000 > 10.1.1.2.50225: Flags [P.], seq 4105:5131, ack 1, win 57, options [nop,nop,TS val 6422035 ecr 6421972], length 1026
1450054353.585527 IP 10.1.1.2.50225 > 10.1.1.1.2000: Flags [.], ack 5131, win 78, options [nop,nop,TS val 6422035 ecr 6422035], length 0
1450054353.635504 IP 10.1.1.1.2000 > 10.1.1.2.60653: Flags [P.], seq 4105:5131, ack 1, win 57, options [nop,nop,TS val 6422047 ecr 6421985], length 1026
1450054353.635543 IP 10.1.1.2.60653 > 10.1.1.1.2000: Flags [.], ack 5131, win 78, options [nop,nop,TS val 6422047 ecr 6422047], length 0
1450054353.685526 IP 10.1.1.1.2000 > 10.1.1.2.56705: Flags [P.], seq 4105:5131, ack 1, win 57, options [nop,nop,TS val 6422060 ecr 6421997], length 1026
1450054353.685561 IP 10.1.1.2.56705 > 10.1.1.1.2000: Flags [.], ack 5131, win 78, options [nop,nop,TS val 6422060 ecr 6422060], length 0
1450054353.735510 IP 10.1.1.1.2000 > 10.1.1.2.55311: Flags [P.], seq 4105:5131, ack 1, win 57, options [nop,nop,TS val 6422072 ecr 6422010], length 1026
1450054353.735550 IP 10.1.1.2.55311 > 10.1.1.1.2000: Flags [.], ack 5131, win 78, options [nop,nop,TS val 6422072 ecr 6422072], length 0
1450054353.785504 IP 10.1.1.1.2000 > 10.1.1.2.34920: Flags [P.], seq 4105:5131, ack 1, win 57, options [nop,nop,TS val 6422085 ecr 6422022], length 1026
1450054353.785528 IP 10.1.1.2.34920 > 10.1.1.1.2000: Flags [.], ack 5131, win 78, options [nop,nop,TS val 6422085 ecr 6422085], length 0
1450054353.835475 IP 10.1.1.1.2000 > 10.1.1.2.50225: Flags [P.], seq 5131:6157, ack 1, win 57, options [nop,nop,TS val 6422097 ecr 6422035], length 1026
1450054353.835501 IP 10.1.1.2.50225 > 10.1.1.1.2000: Flags [.], ack 6157, win 82, options [nop,nop,TS val 6422097 ecr 6422097], length 0
1450054353.885508 IP 10.1.1.1.2000 > 10.1.1.2.60653: Flags [P.], seq 5131:6157, ack 1, win 57, options [nop,nop,TS val 6422110 ecr 6422047], length 1026
1450054353.885537 IP 10.1.1.2.60653 > 10.1.1.1.2000: Flags [.], ack 6157, win 82, options [nop,nop,TS val 6422110 ecr 6422110], length 0
1450054353.935521 IP 10.1.1.1.2000 > 10.1.1.2.56705: Flags [P.], seq 5131:6157, ack 1, win 57, options [nop,nop,TS val 6422122 ecr 6422060], length 1026
1450054353.935546 IP 10.1.1.2.56705 > 10.1.1.1.2000: Flags [.], ack 6157, win 82, options [nop,nop,TS val 6422122 ecr 6422122], length 0
1450054353.985553 IP 10.1.1.1.2000 > 10.1.1.2.55311: Flags [P.], seq 5131:6157, ack 1, win 57, options [nop,nop,TS val 6422135 ecr 6422072], length 1026
1450054353.985586 IP 10.1.1.2.55311 > 10.1.1.1.2000: Flags [.], ack 6157, win 82, options [nop,nop,TS val 6422135 ecr 6422135], length 0
1450054354.035535 IP 10.1.1.1.2000 > 10.1.1.2.34920: Flags [P.], seq 5131:6157, ack 1, win 57, options [nop,nop,TS val 6422147 ecr 6422085], length 1026
1450054354.035558 IP 10.1.1.2.34920 > 10.1.1.1.2000: Flags [.], ack 6157, win 82, options [nop,nop,TS val 6422147 ecr 6422147], length 0
1450054354.085538 IP 10.1.1.1.2000 > 10.1.1.2.50225: Flags [P.], seq 6157:7183, ack 1, win 57, options [nop,nop,TS val 6422160 ecr 6422097], length 1026
1450054354.085571 IP 10.1.1.2.50225 > 10.1.1.1.2000: Flags [.], ack 7183, win 86, options [nop,nop,TS val 6422160 ecr 6422160], length 0
1450054354.135567 IP 10.1.1.1.2000 > 10.1.1.2.60653: Flags [P.], seq 6157:7183, ack 1, win 57, options [nop,nop,TS val 6422172 ecr 6422110], length 1026
1450054354.135599 IP 10.1.1.2.60653 > 10.1.1.1.2000: Flags [.], ack 7183, win 86, options [nop,nop,TS val 6422172 ecr 6422172], length 0
1450054354.185536 IP 10.1.1.1.2000 > 10.1.1.2.56705: Flags [P.], seq 6157:7183, ack 1, win 57, options [nop,nop,TS val 6422185 ecr 6422122], length 1026
1450054354.185577 IP 10.1.1.2.56705 > 10.1.1.1.2000: Flags [.], ack 7183, win 86, options [nop,nop,TS val 6422185 ecr 6422185], length 0
1450054354.235478 IP 10.1.1.1.2000 > 10.1.1.2.55311: Flags [P.], seq 6157:7183, ack 1, win 57, options [nop,nop,TS val 6422197 ecr 6422135], length 1026
1450054354.235505 IP 10.1.1.2.55311 > 10.1.1.1.2000: Flags [.], ack 7183, win 86, options [nop,nop,TS val 6422197 ecr 6422197], length 0
1450054354.285521 IP 10.1.1.1.2000 > 10.1.1.2.34920: Flags [P.], seq 6157:7183, ack 1, win 57, options [nop,nop,TS val 6422210 ecr 6422147], length 1026
1450054354.285547 IP 10.1.1.2.34920 > 10.1.1.1.2000: Flags [.], ack 7183, win 86, options [nop,nop,TS val 6422210 ecr 6422210], length 0
1450054354.335484 IP 10.1.1.1.2000 > 10.1.1.2.50225: Flags [P.], seq 7183:8209, ack 1, win 57, options [nop,nop,TS val 6422222 ecr 6422160], length 1026
1450054354.335511 IP 10.1.1.2.50225 > 10.1.1.1.2000: Flags [.], ack 8209, win 90, options [nop,nop,TS val 6422222 ecr 6422222], length 0
1450054354.385464 IP 10.1.1.1.2000 > 10.1.1.2.60653: Flags [P.], seq 7183:8209, ack 1, win 57, options [nop,nop,TS val 6422235 ecr 6422172], length 1026
1450054354.385491 IP 10.1.1.2.60653 > 10.1.1.1.2000: Flags [.], ack 8209, win 90, options [nop,nop,TS val 6422235 ecr 6422235], length 0
1450054354.435529 IP 10.1.1.1.2000 > 10.1.1.2.56705: Flags [P.], seq 7183:8209, ack 1, win 57, options [nop,nop,TS val 6422247 ecr 6422185], length 1026
1450054354.435561 IP 10.1.1.2.56705 > 10.1.1.1.2000: Flags [.], ack 8209, win 90, options [nop,nop,TS val 6422247 ecr 6422247], length 0
1450054354.485444 IP 10.1.1.1.2000 > 10.1.1.2.55311: Flags [P.], seq 7183:8209, ack 1, win 57, options [nop,nop,TS val 6422260 ecr 6422197], length 1026
1450054354.485460 IP 10.1.1.2.55311 > 10.1.1.1.2000: Flags [.], ack 8209, win 90, options [nop,nop,TS val 6422260 ecr 6422260], length 0
1450054354.535527 IP 10.1.1.1.2000 > 10.1.1.2.34920: Flags [P.], seq 7183:8209, ack 1, win 57, options [nop,nop,TS val 6422272 ecr 6422210], length 1026
1450054354.535557 IP 10.1.1.2.34920 > 10.1.1.1.2000: Flags [.], ack 8209, win 90, options [nop,nop,TS val 6422272 ecr 6422272], length 0
1450054354.585526 IP 10.1.1.1.2000 > 10.1.1.2.50225: Flags [P.], seq 8209:9235, ack 1, win 57, options [nop,nop,TS val 6422285 ecr 6422222], length 1026
1450054354.585555 IP 10.1.1.2.50225 > 10.1.1.1.2000: Flags [.], ack 9235, win 94, options [nop,nop,TS val 6422285 ecr 6422285], length 0
1450054354.635503 IP 10.1.1.1.2000 > 10.1.1.2.60653: Flags [P.], seq 8209:9235, ack 1, win 57, options [nop,nop,TS val 6422297 ecr 6422235], length 1026
1450054354.635537 IP 10.1.1.2.60653 > 10.1.1.1.2000: Flags [.], ack 9235, win 94, options [nop,nop,TS val 6422297 ecr 6422297], length 0
1450054354.685515 IP 10.1.1.1.2000 > 10.1.1.2.56705: Flags [P.], seq 8209:9235, ack 1, win 57, options [nop,nop,TS val 6422310 ecr 6422247], length 1026
1450054354.685546 IP 10.1.1.2.56705 > 10.1.1.1.2000: Flags [.], ack 9235, win 94, options [nop,nop,TS val 6422310 ecr 6422310], length 0
1450054354.735532 IP 10.1.1.1.2000 > 10.1.1.2.55311: Flags [P.], seq 8209:9235, ack 1, win 57, options [nop,nop,TS val 6422322 ecr 6422260], length 1026
1450054354.735562 IP 10.1.1.2.55311 > 10.1.1.1.2000: Flags [.], ack 9235, win 94, options [nop,nop,TS val 6422322 ecr 6422322], length 0
1450054354.785484 IP 10.1.1.1.2000 > 10.1.1.2.34920: Flags [P.], seq 8209:9235, ack 1, win 57, options [nop,nop,TS val 6422335 ecr 6422272], length 1026
1450054354.785514 IP 10.1.1.2.34920 > 10.1.1.1.2000: Flags [.], ack 9235, win 94, options [nop,nop,TS val 6422335 ecr 6422335], length 0
1450054354.835513 IP 10.1.1.1.2000 > 10.1.1.2.50225: Flags [P.], seq 9235:10261, ack 1, win 57, options [nop,nop,TS val 6422347 ecr 6422285], length 1026
1450054354.835540 IP 10.1.1.2.50225 > 10.1.1.1.2000: Flags [.], ack 10261, win 98, options [nop,nop,TS val 6422347 ecr 6422347], length 0
1450054354.885472 IP 10.1.1.1.2000 > 10.1.1.2.60653: Flags [P.], seq 9235:10261, ack 1, win 57, options [nop,nop,TS val 6422360 ecr 6422297], length 1026
1450054354.885501 IP 10.1.1.2.60653 > 10.1.1.1.2000: Flags [.], ack 10261, win 98, options [nop,nop,TS val 6422360 ecr 6422360], length 0
1450054354.935529 IP 10.1.1.1.2000 > 10.1.1.2.56705: Flags [P.], seq 9235:10261, ack 1, win 57, options [nop,nop,TS val 6422372 ecr 6422310], length 1026
1450054354.935560 IP 10.1.1.2.56705 > 10.1.1.1.2000: Flags [.], ack 10261, win 98, options [nop,nop,TS val 6422372 ecr 6422372], length 0
1450054354.985526 IP 10.1.1.1.2000 > 10.1.1.2.55311: Flags [P.], seq 9235:10261, ack 1, win 57, options [nop,nop,TS val 6422385 ecr 6422322], length 1026
1450054354.985555 IP 10.1.1.2.55311 > 10.1.1.1.2000: Flags [.], ack 10261, win 98, options [nop,nop,TS val 6422385 ecr 6422385], length 0
1450054355.035509 IP 10.1.1.1.2000 > 10.1.1.2.34920: Flags [P.], seq 9235:10261, ack 1, win 57, options [nop,nop,TS val 6422397 ecr 6422335], length 1026
1450054355.035538 IP 10.1.1.2.34920 > 10.1.1.1.2000: Flags [.], ack 10261, win 98, options [nop,nop,TS val 6422397 ecr 6422397], length 0
1450054355.085524 IP 10.1.1.1.2000 > 10.1.1.2.50225: Flags [P.], seq 10261:11287, ack 1, win 57, options [nop,nop,TS val 6422410 ecr 6422347], length 1026
1450054355.085555 IP 10.1.1.2.50225 > 10.1.1.1.2000: Flags [.], ack 11287, win 102, options [nop,nop,TS val 6422410 ecr 6422410], length 0
1450054355.135521 IP 10.1.1.1.2000 > 10.1.1.2.60653: Flags [P.], seq 10261:11287, ack 1, win 57, options [nop,nop,TS val 6422422 ecr 6422360], length 1026
1450054355.135550 IP 10.1.1.2.60653 > 10.1.1.1.2000: Flags [.], ack 11287, win 102, options [nop,nop,TS val 6422422 ecr 6422422], length 0
1450054355.185535 IP 10.1.1.1.2000 > 10.1.1.2.56705: Flags [P.], seq 10261:11287, ack 1, win 57, options [nop,nop,TS val 6422435 ecr 6422372], length 1026
1450054355.185559 IP 10.1.1.2.56705 > 10.1.1.1.2000: Flags [.], ack 11287, win 102, options [nop,nop,TS val 6422435 ecr 6422435], length 0
1450054355.235476 IP 10.1.1.1.2000 > 10.1.1.2.55311: Flags [P.], seq 10261:11287, ack 1, win 57, options [nop,nop,TS val 6422447 ecr 6422385], length 1026
1450054355.235503 IP 10.1.1.2.55311 > 10.1.1.1.2000: Flags [.], ack 11287, win 102, options [nop,nop,TS val 6422447 ecr 6422447], length 0
1450054355.285503 IP 10.1.1.1.2000 > 10.1.1.2.34920: Flags [P.], seq 10261:11287, ack 1, win 57, options [nop,nop,TS val 6422460 ecr 6422397], length 1026
1450054355.285530 IP 10.1.1.2.34920 > 10.1.1.1.2000: Flags [.], ack 11287, win 102, options [nop,nop,TS val 6422460 ecr 6422460], length 0
1450054355.335520 IP 10.1.1.1.2000 > 10.1.1.2.50225: Flags [P.], seq 11287:12313, ack 1, win 57, options [nop,nop,TS val 6422472 ecr 6422410], length 1026
1450054355.335551 IP 10.1.1.2.50225 > 10.1.1.1.2000: Flags [.], ack 12313, win 106, options [nop,nop,TS val 6422472 ecr 6422472], length 0
1450054355.385522 IP 10.1.1.1.2000 > 10.1.1.2.60653: Flags [P.], seq 11287:12313, ack 1, win 57, options [nop,nop,TS val 6422485 ecr 6422422], length 1026
1450054355.385557 IP 10.1.1.2.60653 > 10.1.1.1.2000: Flags [.], ack 12313, win 106, options [nop,nop,TS val 6422485 ecr 6422485], length 0
1450054355.435566 IP 10.1.1.1.2000 > 10.1.1.2.56705: Flags [P.], seq 11287:12313, ack 1, win 57, options [nop,nop,TS val 6422497 ecr 6422435], length 1026
1450054355.435590 IP 10.1.1.2.56705 > 10.1.1.1.2000: Flags [.], ack 12313, win 106, options [nop,nop,TS val 6422497 ecr 6422497], length 0
1450054355.485505 IP 10.1.1.1.2000 > 10.1.1.2.55311: Flags [P.], seq 11287:12313, ack 1, win 57, options [nop,nop,TS val 6422510 ecr 6422447], length 1026
1450054355.485531 IP 10.1.1.2.55311 > 10.1.1.1.2000: Flags [.], ack 12313, win 106, options [nop,nop,TS val 6422510 ecr 6422510], length 0
1450054355.535558 IP 10.1.1.1.2000 > 10.1.1.2.34920: Flags [P.], seq 11287:12313, ack 1, win 57, options [nop,nop,TS val 6422522 ecr 6422460], length 1026
1450054355.535587 IP 10.1.1.2.34920 > 10.1.1.1.2000: Flags [.], ack 12313, win 106, options [nop,nop,TS val 6422522 ecr 6422522], length 0
1450054355.585653 IP 10.1.1.1.2000 > 10.1.1.2.50225: Flags [P.], seq 12313:13339, ack 1, win 57, options [nop,nop,TS val 6422535 ecr 6422472], length 1026
1450054355.585682 IP 10.1.1.2.50225 > 10.1.1.1.2000: Flags [.], ack 13339, win 110, options [nop,nop,TS val 6422535 ecr 6422535], length 0
1450054355.635536 IP 10.1.1.1.2000 > 10.1.1.2.60653: Flags [P.], seq 12313:13339, ack 1, win 57, options [nop,nop,TS val 6422547 ecr 6422485], length 1026
1450054355.635561 IP 10.1.1.2.60653 > 10.1.1.1.2000: Flags [.], ack 13339, win 110, options [nop,nop,TS val 6422547 ecr 6422547], length 0
1450054355.685590 IP 10.1.1.1.2000 > 10.1.1.2.56705: Flags [P.], seq 12313:13339, ack 1, win 57, options [nop,nop,TS val 6422560 ecr 6422497], length 1026
1450054355.685615 IP 10.1.1.2.56705 > 10.1.1.1.2000: Flags [.], ack 13339, win 110, options [nop,nop,TS val 6422560 ecr 6422560], length 0
1450054355.735620 IP 10.1.1.1.2000 > 10.1.1.2.55311: Flags [P.], seq 12313:13339, ack 1, win 57, options [nop,nop,TS val 6422572 ecr 6422510], length 1026
1450054355.735649 IP 10.1.1.2.55311 > 10.1.1.1.2000: Flags [.], ack 13339, win 110, options [nop,nop,TS val 6422572 ecr 6422572], length 0
1450054355.785465 IP 10.1.1.1.2000 > 10.1.1.2.34920: Flags [P.], seq 12313:13339, ack 1, win 57, options [nop,nop,TS val 6422585 ecr 6422522], length 1026
1450054355.785482 IP 10.1.1.2.34920 > 10.1.1.1.2000: Flags [.], ack 13339, win 110, options [nop,nop,TS val 6422585 ecr 6422585], length 0
1450054355.835519 IP 10.1.1.1.2000 > 10.1.1.2.50225: Flags [P.], seq 13339:14365, ack 1, win 57, options [nop,nop,TS val 6422597 ecr 6422535], length 1026
1450054355.835537 IP 10.1.1.2.50225 > 10.1.1.1.2000: Flags [.], ack 14365, win 114, options [nop,nop,TS val 6422597 ecr 6422597], length 0
1450054355.885551 IP 10.1.1.1.2000 > 10.1.1.2.60653: Flags [P.], seq 13339:14365, ack 1, win 57, options [nop,nop,TS val 6422610 ecr 6422547], length 1026
1450054355.885566 IP 10.1.1.2.60653 > 10.1.1.1.2000: Flags [.], ack 14365, win 114, options [nop,nop,TS val 6422610 ecr 6422610], length 0
1450054355.935441 IP 10.1.1.1.2000 > 10.1.1.2.56705: Flags [P.], seq 13339:14365, ack 1, win 57, options [nop,nop,TS val 6422622 ecr 6422560], length 1026
1450054355.935454 IP 10.1.1.2.56705 > 10.1.1.1.2000: Flags [.], ack 14365, win 114, options [nop,nop,TS val 6422622 ecr 6422622], length 0
1450054355.985498 IP 10.1.1.1.2000 > 10.1.1.2.55311: Flags [P.], seq 13339:14365, ack 1, win 57, options [nop,nop,TS val 6422635 ecr 6422572], length 1026
1450054355.985530 IP 10.1.1.2.55311 > 10.1.1.1.2000: Flags [.], ack 14365, win 114, options [nop,nop,TS val 6422635 ecr 6422635], length 0
1450054356.035442 IP 10.1.1.1.2000 > 10.1.1.2.34920: Flags [P.], seq 13339:14365, ack 1, win 57, options [nop,nop,TS val 6422647 ecr 6422585], length 1026
1450054356.035461 IP 10.1.1.2.34920 > 10.1.1.1.2000: Flags [.], ack 14365, win 114, options [nop,nop,TS val 6422647 ecr 6422647], length 0
1450054356.085435 IP 10.1.1.1.2000 > 10.1.1.2.50225: Flags [P.], seq 14365:15391, ack 1, win 57, options [nop,nop,TS val 6422660 ecr 6422597], length 1026
1450054356.085449 IP 10.1.1.2.50225 > 10.1.1.1.2000: Flags [.], ack 15391, win 118, options [nop,nop,TS val 6422660 ecr 6422660], length 0
1450054356.135474 IP 10.1.1.1.2000 > 10.1.1.2.60653: Flags [P.], seq 14365:15391, ack 1, win 57, options [nop,nop,TS val 6422672 ecr 6422610], length 1026
1450054356.135494 IP 10.1.1.2.60653 > 10.1.1.1.2000: Flags [.], ack 15391, win 118, options [nop,nop,TS val 6422672 ecr 6422672], length 0
1450054356.185561 IP 10.1.1.1.2000 > 10.1.1.2.56705: Flags [P.], seq 14365:15391, ack 1, win 57, options [nop,nop,TS val 6422685 ecr 6422622], length 1026
1450054356.185593 IP 10.1.1.2.56705 > 10.1.1.1.2000: Flags [.], ack 15391, win 118, options [nop,nop,TS val 6422685 ecr 6422685], length 0
1450054356.235475 IP 10.1.1.1.2000 > 10.1.1.2.55311: Flags [P.], seq 14365:15391, ack 1, win 57, options [nop,nop,TS val 6422697 ecr 6422635], length 1026
1450054356.235495 IP 10.1.1.2.55311 > 10.1.1.1.2000: Flags [.], ack 15391, win 118, options [nop,nop,TS val 6422697 ecr 6422697], length 0
1450054356.285556 IP 10.1.1.1.2000 > 10.1.1.2.34920: Flags [P.], seq 14365:15391, ack 1, win 57, options [nop,nop,TS val 6422710 ecr 6422647], length 1026
1450054356.285590 IP 10.1.1.2.34920 > 10.1.1.1.2000: Flags [.], ack 15391, win 118, options [nop,nop,TS val 6422710 ecr 6422710], length 0
1450054356.335554 IP 10.1.1.1.2000 > 10.1.1.2.50225: Flags [P.], seq 15391:16417, ack 1, win 57, options [nop,nop,TS val 6422722 ecr 6422660], length 1026
1450054356.335586 IP 10.1.1.2.50225 > 10.1.1.1.2000: Flags [.], ack 16417, win 122, options [nop,nop,TS val 6422722 ecr 6422722], length 0
1450054356.385523 IP 10.1.1.1.2000 > 10.1.1.2.60653: Flags [P.], seq 15391:16417, ack 1, win 57, options [nop,nop,TS val 6422735 ecr 6422672], length 1026
1450054356.385551 IP 10.1.1.2.60653 > 10.1.1.1.2000: Flags [.], ack 16417, win 122, options [nop,nop,TS val 6422735 ecr 6422735], length 0
1450054356.435549 IP 10.1.1.1.2000 > 10.1.1.2.56705: Flags [P.], seq 15391:16417, ack 1, win 57, options [nop,nop,TS val 6422747 ecr 6422685], length 1026
1450054356.435577 IP 10.1.1.2.56705 > 10.1.1.1.2000: Flags [.], ack 16417, win 122, options [nop,nop,TS val 6422747 ecr 6422747], length 0
1450054356.485504 IP 10.1.1.1.2000 > 10.1.1.2.55311: Flags [P.], seq 15391:16417, ack 1, win 57, options [nop,nop,TS val 6422760 ecr 6422697], length 1026
1450054356.485522 IP 10.1.1.2.55311 > 10.1.1.1.2000: Flags [.], ack 16417, win 122, options [nop,nop,TS val 6422760 ecr 6422760], length 0
1450054356.535533 IP 10.1.1.1.2000 > 10.1.1.2.34920: Flags [P.], seq 15391:16417, ack 1, win 57, options [nop,nop,TS val 6422772 ecr 6422710], length 1026
1450054356.535561 IP 10.1.1.2.34920 > 10.1.1.1.2000: Flags [.], ack 16417, win 122, options [nop,nop,TS val 6422772 ecr 6422772], length 0
1450054356.585564 IP 10.1.1.1.2000 > 10.1.1.2.50225: Flags [P.], seq 16417:17443, ack 1, win 57, options [nop,nop,TS val 6422785 ecr 6422722], length 1026
1450054356.585592 IP 10.1.1.2.50225 > 10.1.1.1.2000: Flags [.], ack 17443, win 126, options [nop,nop,TS val 6422785 ecr 6422785], length 0
1450054356.635535 IP 10.1.1.1.2000 > 10.1.1.2.60653: Flags [P.], seq 16417:17443, ack 1, win 57, options [nop,nop,TS val 6422797 ecr 6422735], length 1026
1450054356.635562 IP 10.1.1.2.60653 > 10.1.1.1.2000: Flags [.], ack 17443, win 126, options [nop,nop,TS val 6422797 ecr 6422797], length 0
1450054356.685551 IP 10.1.1.1.2000 > 10.1.1.2.56705: Flags [P.], seq 16417:17443, ack 1, win 57, options [nop,nop,TS val 6422810 ecr 6422747], length 1026
1450054356.685592 IP 10.1.1.2.56705 > 10.1.1.1.2000: Flags [.], ack 17443, win 126, options [nop,nop,TS val 6422810 ecr 6422810], length 0
1450054356.735645 IP 10.1.1.1.2000 > 10.1.1.2.55311: Flags [P.], seq 16417:17443, ack 1, win 57, options [nop,nop,TS val 6422822 ecr 6422760], length 1026
1450054356.735688 IP 10.1.1.2.55311 > 10.1.1.1.2000: Flags [.], ack 17443, win 126, options [nop,nop,TS val 6422823 ecr 6422822], length 0
1450054356.785560 IP 10.1.1.1.2000 > 10.1.1.2.34920: Flags [P.], seq 16417:17443, ack 1, win 57, options [nop,nop,TS val 6422835 ecr 6422772], length 1026
1450054356.785589 IP 10.1.1.2.34920 > 10.1.1.1.2000: Flags [.], ack 17443, win 126, options [nop,nop,TS val 6422835 ecr 6422835], length 0
1450054356.835418 IP 10.1.1.1.2000 > 10.1.1.2.50225: Flags [P.], seq 17443:18469, ack 1, win 57, options [nop,nop,TS val 6422847 ecr 6422785], length 1026
1450054356.835433 IP 10.1.1.2.50225 > 10.1.1.1.2000: Flags [.], ack 18469, win 130, options [nop,nop,TS val 6422847 ecr 6422847], length 0
1450054356.885452 IP 10.1.1.1.2000 > 10.1.1.2.60653: Flags [P.], seq 17443:18469, ack 1, win 57, options [nop,nop,TS val 6422860 ecr 6422797], length 1026
1450054356.885468 IP 10.1.1.2.60653 > 10.1.1.1.2000: Flags [.], ack 18469, win 130, options [nop,nop,TS val 6422860 ecr 6422860], length 0
1450054356.935454 IP 10.1.1.1.2000 > 10.1.1.2.56705: Flags [P.], seq 17443:18469, ack 1, win 57, options [nop,nop,TS val 6422872 ecr 6422810], length 1026
1450054356.935473 IP 10.1.1.2.56705 > 10.1.1.1.2000: Flags [.], ack 18469, win 130, options [nop,nop,TS val 6422872 ecr 6422872], length 0
1450054356.985397 IP 10.1.1.1.2000 > 10.1.1.2.55311: Flags [P.], seq 17443:18469, ack 1, win 57, options [nop,nop,TS val 6422885 ecr 6422823], length 1026
1450054356.985411 IP 10.1.1.2.55311 > 10.1.1.1.2000: Flags [.], ack 18469, win 130, options [nop,nop,TS val 6422885 ecr 6422885], length 0
1450054357.035498 IP 10.1.1.1.2000 > 10.1.1.2.34920: Flags [P.], seq 17443:18469, ack 1, win 57, options [nop,nop,TS val 6422897 ecr 6422835], length 1026
1450054357.035515 IP 10.1.1.2.34920 > 10.1.1.1.2000: Flags [.], ack 18469, win 130, options [nop,nop,TS val 6422897 ecr 6422897], length 0
1450054357.085415 IP 10.1.1.1.2000 > 10.1.1.2.50225: Flags [P.], seq 18469:19495, ack 1, win 57, options [nop,nop,TS val 6422910 ecr 6422847], length 1026
1450054357.085430 IP 10.1.1.2.50225 > 10.1.1.1.2000: Flags [.], ack 19495, win 134, options [nop,nop,TS val 6422910 ecr 6422910], length 0
1450054357.135423 IP 10.1.1.1.2000 > 10.1.1.2.60653: Flags [P.], seq 18469:19495, ack 1, win 57, options [nop,nop,TS val 6422922 ecr 6422860], length 1026
1450054357.135437 IP 10.1.1.2.60653 > 10.1.1.1.2000: Flags [.], ack 19495, win 134, options [nop,nop,TS val 6422922 ecr 6422922], length 0
1450054357.185408 IP 10.1.1.1.2000 > 10.1.1.2.56705: Flags [P.], seq 18469:19495, ack 1, win 57, options [nop,nop,TS val 6422935 ecr 6422872], length 1026
1450054357.185423 IP 10.1.1.2.56705 > 10.1.1.1.2000: Flags [.], ack 19495, win 134, options [nop,nop,TS val 6422935 ecr 6422935], length 0
1450054357.235418 IP 10.1.1.1.2000 > 10.1.1.2.55311: Flags [P.], seq 18469:19495, ack 1, win 57, options [nop,nop,TS val 6422947 ecr 6422885], length 1026
1450054357.235430 IP 10.1.1.2.55311 > 10.1.1.1.2000: Flags [.], ack 19495, win 134, options [nop,nop,TS val 6422947 ecr 6422947], length 0
1450054357.285441 IP 10.1.1.1.2000 > 10.1.1.2.34920: Flags [P.], seq 18469:19495, ack 1, win 57, options [nop,nop,TS val 6422960 ecr 6422897], length 1026
1450054357.285457 IP 10.1.1.2.34920 > 10.1.1.1.2000: Flags [.], ack 19495, win 134, options [nop,nop,TS val 6422960 ecr 6422960], length 0
1450054357.335411 IP 10.1.1.1.2000 > 10.1.1.2.50225: Flags [P.], seq 19495:20521, ack 1, win 57, options [nop,nop,TS val 6422972 ecr 6422910], length 1026
1450054357.335427 IP 10.1.1.2.50225 > 10.1.1.1.2000: Flags [.], ack 20521, win 138, options [nop,nop,TS val 6422972 ecr 6422972], length 0
1450054357.385422 IP 10.1.1.1.2000 > 10.1.1.2.60653: Flags [P.], seq 19495:20521, ack 1, win 57, options [nop,nop,TS val 6422985 ecr 6422922], length 1026
1450054357.385445 IP 10.1.1.2.60653 > 10.1.1.1.2000: Flags [.], ack 20521, win 138, options [nop,nop,TS val 6422985 ecr 6422985], length 0
1450054357.435452 IP 10.1.1.1.2000 > 10.1.1.2.56705: Flags [P.], seq 19495:20521, ack 1, win 57, options [nop,nop,TS val 6422997 ecr 6422935], length 1026
1450054357.435483 IP 10.1.1.2.56705 > 10.1.1.1.2000: Flags [.], ack 20521, win 138, options [nop,nop,TS val 6422997 ecr 6422997], length 0
1450054357.485547 IP 10.1.1.1.2000 > 10.1.1.2.55311: Flags [P.], seq 19495:20521, ack 1, win 57, options [nop,nop,TS val 6423010 ecr 6422947], length 1026
1450054357.485574 IP 10.1.1.2.55311 > 10.1.1.1.2000: Flags [.], ack 20521, win 138, options [nop,nop,TS val 6423010 ecr 6423010], length 0
1450054357.535546 IP 10.1.1.1.2000 > 10.1.1.2.34920: Flags [P.], seq 19495:20521, ack 1, win 57, options [nop,nop,TS val 6423022 ecr 6422960], length 1026
1450054357.535584 IP 10.1.1.2.34920 > 10.1.1.1.2000: Flags [.], ack 20521, win 138, options [nop,nop,TS val 6423022 ecr 6423022], length 0
1450054357.539723 ARP, Request who-has 10.1.1.1 tell 10.1.1.2, length 28
1450054357.539825 ARP, Reply 10.1.1.1 is-at ca:1c:57:2f:3a:5d, length 28
1450054357.585555 IP 10.1.1.1.2000 > 10.1.1.2.50225: Flags [P.], seq 20521:21547, ack 1, win 57, options [nop,nop,TS val 6423035 ecr 6422972], length 1026
1450054357.585595 IP 10.1.1.2.50225 > 10.1.1.1.2000: Flags [.], ack 21547, win 142, options [nop,nop,TS val 6423035 ecr 6423035], length 0
1450054357.635529 IP 10.1.1.1.2000 > 10.1.1.2.60653: Flags [P.], seq 20521:21547, ack 1, win 57, options [nop,nop,TS val 6423047 ecr 6422985], length 1026
1450054357.635566 IP 10.1.1.2.60653 > 10.1.1.1.2000: Flags [.], ack 21547, win 142, options [nop,nop,TS val 6423047 ecr 6423047], length 0
1450054357.685443 IP 10.1.1.1.2000 > 10.1.1.2.56705: Flags [P.], seq 20521:21547, ack 1, win 57, options [nop,nop,TS val 6423060 ecr 6422997], length 1026
1450054357.685460 IP 10.1.1.2.56705 > 10.1.1.1.2000: Flags [.], ack 21547, win 142, options [nop,nop,TS val 6423060 ecr 6423060], length 0
1450054357.735488 IP 10.1.1.1.2000 > 10.1.1.2.55311: Flags [P.], seq 20521:21547, ack 1, win 57, options [nop,nop,TS val 6423072 ecr 6423010], length 1026
1450054357.735520 IP 10.1.1.2.55311 > 10.1.1.1.2000: Flags [.], ack 21547, win 142, options [nop,nop,TS val 6423072 ecr 6423072], length 0
1450054357.785456 IP 10.1.1.1.2000 > 10.1.1.2.34920: Flags [P.], seq 20521:21547, ack 1, win 57, options [nop,nop,TS val 6423085 ecr 6423022], length 1026
1450054357.785475 IP 10.1.1.2.34920 > 10.1.1.1.2000: Flags [.], ack 21547, win 142, options [nop,nop,TS val 6423085 ecr 6423085], length 0
1450054357.835449 IP 10.1.1.1.2000 > 10.1.1.2.50225: Flags [P.], seq 21547:22573, ack 1, win 57, options [nop,nop,TS val 6423097 ecr 6423035], length 1026
1450054357.835474 IP 10.1.1.2.50225 > 10.1.1.1.2000: Flags [.], ack 22573, win 146, options [nop,nop,TS val 6423097 ecr 6423097], length 0
1450054357.885441 IP 10.1.1.1.2000 > 10.1.1.2.60653: Flags [P.], seq 21547:22573, ack 1, win 57, options [nop,nop,TS val 6423110 ecr 6423047], length 1026
1450054357.885458 IP 10.1.1.2.60653 > 10.1.1.1.2000: Flags [.], ack 22573, win 146, options [nop,nop,TS val 6423110 ecr 6423110], length 0
1450054357.935554 IP 10.1.1.1.2000 > 10.1.1.2.56705: Flags [P.], seq 21547:22573, ack 1, win 57, options [nop,nop,TS val 6423122 ecr 6423060], length 1026
1450054357.935584 IP 10.1.1.2.56705 > 10.1.1.1.2000: Flags [.], ack 22573, win 146, options [nop,nop,TS val 6423122 ecr 6423122], length 0
1450054357.985600 IP 10.1.1.1.2000 > 10.1.1.2.55311: Flags [P.], seq 21547:22573, ack 1, win 57, options [nop,nop,TS val 6423135 ecr 6423072], length 1026
1450054357.985629 IP 10.1.1.2.55311 > 10.1.1.1.2000: Flags [.], ack 22573, win 146, options [nop,nop,TS val 6423135 ecr 6423135], length 0
1450054358.035558 IP 10.1.1.1.2000 > 10.1.1.2.34920: Flags [P.], seq 21547:22573, ack 1, win 57, options [nop,nop,TS val 6423147 ecr 6423085], length 1026
1450054358.035585 IP 10.1.1.2.34920 > 10.1.1.1.2000: Flags [.], ack 22573, win 146, options [nop,nop,TS val 6423147 ecr 6423147], length 0
1450054358.085542 IP 10.1.1.1.2000 > 10.1.1.2.50225: Flags [P.], seq 22573:23599, ack 1, win 57, options [nop,nop,TS val 6423160 ecr 6423097], length 1026
1450054358.085570 IP 10.1.1.2.50225 > 10.1.1.1.2000: Flags [.], ack 23599, win 150, options [nop,nop,TS val 6423160 ecr 6423160], length 0
1450054358.135472 IP 10.1.1.1.2000 > 10.1.1.2.60653: Flags [P.], seq 22573:23599, ack 1, win 57, options [nop,nop,TS val 6423172 ecr 6423110], length 1026
1450054358.135495 IP 10.1.1.2.60653 > 10.1.1.1.2000: Flags [.], ack 23599, win 150, options [nop,nop,TS val 6423172 ecr 6423172], length 0
1450054358.185560 IP 10.1.1.1.2000 > 10.1.1.2.56705: Flags [P.], seq 22573:23599, ack 1, win 57, options [nop,nop,TS val 6423185 ecr 6423122], length 1026
1450054358.185597 IP 10.1.1.2.56705 > 10.1.1.1.2000: Flags [.], ack 23599, win 150, options [nop,nop,TS val 6423185 ecr 6423185], length 0
1450054358.235508 IP 10.1.1.1.2000 > 10.1.1.2.55311: Flags [P.], seq 22573:23599, ack 1, win 57, options [nop,nop,TS val 6423197 ecr 6423135], length 1026
1450054358.235547 IP 10.1.1.2.55311 > 10.1.1.1.2000: Flags [.], ack 23599, win 150, options [nop,nop,TS val 6423197 ecr 6423197], length 0
1450054358.285487 IP 10.1.1.1.2000 > 10.1.1.2.34920: Flags [P.], seq 22573:23599, ack 1, win 57, options [nop,nop,TS val 6423210 ecr 6423147], length 1026
1450054358.285519 IP 10.1.1.2.34920 > 10.1.1.1.2000: Flags [.], ack 23599, win 150, options [nop,nop,TS val 6423210 ecr 6423210], length 0
1450054358.335554 IP 10.1.1.1.2000 > 10.1.1.2.50225: Flags [P.], seq 23599:24625, ack 1, win 57, options [nop,nop,TS val 6423222 ecr 6423160], length 1026
1450054358.335581 IP 10.1.1.2.50225 > 10.1.1.1.2000: Flags [.], ack 24625, win 154, options [nop,nop,TS val 6423222 ecr 6423222], length 0
1450054358.385536 IP 10.1.1.1.2000 > 10.1.1.2.60653: Flags [P.], seq 23599:24625, ack 1, win 57, options [nop,nop,TS val 6423235 ecr 6423172], length 1026
1450054358.385562 IP 10.1.1.2.60653 > 10.1.1.1.2000: Flags [.], ack 24625, win 154, options [nop,nop,TS val 6423235 ecr 6423235], length 0
1450054358.435441 IP 10.1.1.1.2000 > 10.1.1.2.56705: Flags [P.], seq 23599:24625, ack 1, win 57, options [nop,nop,TS val 6423247 ecr 6423185], length 1026
1450054358.435457 IP 10.1.1.2.56705 > 10.1.1.1.2000: Flags [.], ack 24625, win 154, options [nop,nop,TS val 6423247 ecr 6423247], length 0
1450054358.485484 IP 10.1.1.1.2000 > 10.1.1.2.55311: Flags [P.], seq 23599:24625, ack 1, win 57, options [nop,nop,TS val 6423260 ecr 6423197], length 1026
1450054358.485508 IP 10.1.1.2.55311 > 10.1.1.1.2000: Flags [.], ack 24625, win 154, options [nop,nop,TS val 6423260 ecr 6423260], length 0
1450054358.535512 IP 10.1.1.1.2000 > 10.1.1.2.34920: Flags [P.], seq 23599:24625, ack 1, win 57, options [nop,nop,TS val 6423272 ecr 6423210], length 1026
1450054358.535543 IP 10.1.1.2.34920 > 10.1.1.1.2000: Flags [.], ack 24625, win 154, options [nop,nop,TS val 6423272 ecr 6423272], length 0
1450054358.585489 IP 10.1.1.1.2000 > 10.1.1.2.50225: Flags [P.], seq 24625:25651, ack 1, win 57, options [nop,nop,TS val 6423285 ecr 6423222], length 1026
1450054358.585516 IP 10.1.1.2.50225 > 10.1.1.1.2000: Flags [.], ack 25651, win 158, options [nop,nop,TS val 6423285 ecr 6423285], length 0
1450054358.635454 IP 10.1.1.1.2000 > 10.1.1.2.60653: Flags [P.], seq 24625:25651, ack 1, win 57, options [nop,nop,TS val 6423297 ecr 6423235], length 1026
1450054358.635475 IP 10.1.1.2.60653 > 10.1.1.1.2000: Flags [.], ack 25651, win 158, options [nop,nop,TS val 6423297 ecr 6423297], length 0
1450054358.685459 IP 10.1.1.1.2000 > 10.1.1.2.56705: Flags [P.], seq 24625:25651, ack 1, win 57, options [nop,nop,TS val 6423310 ecr 6423247], length 1026
1450054358.685477 IP 10.1.1.2.56705 > 10.1.1.1.2000: Flags [.], ack 25651, win 158, options [nop,nop,TS val 6423310 ecr 6423310], length 0
1450054358.735499 IP 10.1.1.1.2000 > 10.1.1.2.55311: Flags [P.], seq 24625:25651, ack 1, win 57, options [nop,nop,TS val 6423322 ecr 6423260], length 1026
1450054358.735526 IP 10.1.1.2.55311 > 10.1.1.1.2000: Flags [.], ack 25651, win 158, options [nop,nop,TS val 6423322 ecr 6423322], length 0
1450054358.785418 IP 10.1.1.1.2000 > 10.1.1.2.34920: Flags [P.], seq 24625:25651, ack 1, win 57, options [nop,nop,TS val 6423335 ecr 6423272], length 1026
1450054358.785436 IP 10.1.1.2.34920 > 10.1.1.1.2000: Flags [.], ack 25651, win 158, options [nop,nop,TS val 6423335 ecr 6423335], length 0
1450054358.835500 IP 10.1.1.1.2000 > 10.1.1.2.50225: Flags [P.], seq 25651:26677, ack 1, win 57, options [nop,nop,TS val 6423347 ecr 6423285], length 1026
1450054358.835525 IP 10.1.1.2.50225 > 10.1.1.1.2000: Flags [.], ack 26677, win 162, options [nop,nop,TS val 6423347 ecr 6423347], length 0
1450054358.885530 IP 10.1.1.1.2000 > 10.1.1.2.60653: Flags [P.], seq 25651:26677, ack 1, win 57, options [nop,nop,TS val 6423360 ecr 6423297], length 1026
1450054358.885558 IP 10.1.1.2.60653 > 10.1.1.1.2000: Flags [.], ack 26677, win 162, options [nop,nop,TS val 6423360 ecr 6423360], length 0
