1450056058.982047 IP 10.1.1.2.17500 > 10.1.1.255.17500: UDP, length 293
1450056067.984477 IP 10.1.1.2.50628 > 10.1.1.1.2000: Flags [S], seq 4161630064, win 29200, options [mss 1460,sackOK,TS val 6850595 ecr 0,nop,wscale 9], length 0
1450056067.984527 IP 10.1.1.1.2000 > 10.1.1.2.50628: Flags [S.], seq 4183364733, ack 4161630065, win 28960, options [mss 1460,sackOK,TS val 6850635 ecr 6850595,nop,wscale 9], length 0
1450056068.144586 IP 10.1.1.2.50628 > 10.1.1.1.2000: Flags [.], ack 1, win 58, options [nop,nop,TS val 6850635 ecr 6850635], length 0
1450056068.144771 IP 10.1.1.2.58269 > 10.1.1.1.2000: Flags [S], seq 3045690609, win 29200, options [mss 1460,sackOK,TS val 6850635 ecr 0,nop,wscale 9], length 0
1450056068.144796 IP 10.1.1.1.2000 > 10.1.1.2.58269: Flags [S.], seq 1247344809, ack 3045690610, win 28960, options [mss 1460,sackOK,TS val 6850675 ecr 6850635,nop,wscale 9], length 0
1450056068.304847 IP 10.1.1.2.58269 > 10.1.1.1.2000: Flags [.], ack 1, win 58, options [nop,nop,TS val 6850675 ecr 6850675], length 0
1450056068.304963 IP 10.1.1.2.55348 > 10.1.1.1.2000: Flags [S], seq 2207245290, win 29200, options [mss 1460,sackOK,TS val 6850675 ecr 0,nop,wscale 9], length 0
1450056068.304991 IP 10.1.1.1.2000 > 10.1.1.2.55348: Flags [S.], seq 3344384677, ack 2207245291, win 28960, options [mss 1460,sackOK,TS val 6850715 ecr 6850675,nop,wscale 9], length 0
1450056068.465076 IP 10.1.1.2.55348 > 10.1.1.1.2000: Flags [.], ack 1, win 58, options [nop,nop,TS val 6850715 ecr 6850715], length 0
1450056068.465152 IP 10.1.1.2.46322 > 10.1.1.1.2000: Flags [S], seq 2075338049, win 29200, options [mss 1460,sackOK,TS val 6850715 ecr 0,nop,wscale 9], length 0
1450056068.465177 IP 10.1.1.1.2000 > 10.1.1.2.46322: Flags [S.], seq 643922301, ack 2075338050, win 28960, options [mss 1460,sackOK,TS val 6850755 ecr 6850715,nop,wscale 9], length 0
1450056068.625223 IP 10.1.1.2.46322 > 10.1.1.1.2000: Flags [.], ack 1, win 58, options [nop,nop,TS val 6850755 ecr 6850755], length 0
1450056068.625340 IP 10.1.1.2.39166 > 10.1.1.1.2000: Flags [S], seq 3354855404, win 29200, options [mss 1460,sackOK,TS val 6850755 ecr 0,nop,wscale 9], length 0
1450056068.625365 IP 10.1.1.1.2000 > 10.1.1.2.39166: Flags [S.], seq 1775515896, ack 3354855405, win 28960, options [mss 1460,sackOK,TS val 6850795 ecr 6850755,nop,wscale 9], length 0
1450056068.785412 IP 10.1.1.2.39166 > 10.1.1.1.2000: Flags [.], ack 1, win 58, options [nop,nop,TS val 6850795 ecr 6850795], length 0
1450056068.835954 IP 10.1.1.1.2000 > 10.1.1.2.50628: Flags [P.], seq 1:1027, ack 1, win 57, options [nop,nop,TS val 6850848 ecr 6850635], length 1026
1450056068.885922 IP 10.1.1.1.2000 > 10.1.1.2.58269: Flags [P.], seq 1:1027, ack 1, win 57, options [nop,nop,TS val 6850860 ecr 6850675], length 1026
1450056068.935792 IP 10.1.1.1.2000 > 10.1.1.2.55348: Flags [P.], seq 1:1027, ack 1, win 57, options [nop,nop,TS val 6850873 ecr 6850715], length 1026
1450056068.985779 IP 10.1.1.1.2000 > 10.1.1.2.46322: Flags [P.], seq 1:1027, ack 1, win 57, options [nop,nop,TS val 6850885 ecr 6850755], length 1026
1450056068.996007 IP 10.1.1.2.50628 > 10.1.1.1.2000: Flags [.], ack 1027, win 62, options [nop,nop,TS val 6850848 ecr 6850848], length 0
1450056069.035815 IP 10.1.1.1.2000 > 10.1.1.2.39166: Flags [P.], seq 1:1027, ack 1, win 57, options [nop,nop,TS val 6850898 ecr 6850795], length 1026
1450056069.045984 IP 10.1.1.2.58269 > 10.1.1.1.2000: Flags [.], ack 1027, win 62, options [nop,nop,TS val 6850860 ecr 6850860], length 0
1450056069.085804 IP 10.1.1.1.2000 > 10.1.1.2.50628: Flags [P.], seq 1027:2053, ack 1, win 57, options [nop,nop,TS val 6850910 ecr 6850848], length 1026
1450056069.095850 IP 10.1.1.2.55348 > 10.1.1.1.2000: Flags [.], ack 1027, win 62, options [nop,nop,TS val 6850873 ecr 6850873], length 0
1450056069.135774 IP 10.1.1.1.2000 > 10.1.1.2.58269: Flags [P.], seq 1027:2053, ack 1, win 57, options [nop,nop,TS val 6850923 ecr 6850860], length 1026
1450056069.145841 IP 10.1.1.2.46322 > 10.1.1.1.2000: Flags [.], ack 1027, win 62, options [nop,nop,TS val 6850885 ecr 6850885], length 0
1450056069.185871 IP 10.1.1.1.2000 > 10.1.1.2.55348: Flags [P.], seq 1027:2053, ack 1, win 57, options [nop,nop,TS val 6850935 ecr 6850873], length 1026
1450056069.195898 IP 10.1.1.2.39166 > 10.1.1.1.2000: Flags [.], ack 1027, win 62, options [nop,nop,TS val 6850898 ecr 6850898], length 0
1450056069.235877 IP 10.1.1.1.2000 > 10.1.1.2.46322: Flags [P.], seq 1027:2053, ack 1, win 57, options [nop,nop,TS val 6850948 ecr 6850885], length 1026
1450056069.245902 IP 10.1.1.2.50628 > 10.1.1.1.2000: Flags [.], ack 2053, win 66, options [nop,nop,TS val 6850910 ecr 6850910], length 0
1450056069.285784 IP 10.1.1.1.2000 > 10.1.1.2.39166: Flags [P.], seq 1027:2053, ack 1, win 57, options [nop,nop,TS val 6850960 ecr 6850898], length 1026
1450056069.295840 IP 10.1.1.2.58269 > 10.1.1.1.2000: Flags [.], ack 2053, win 66, options [nop,nop,TS val 6850923 ecr 6850923], length 0
1450056069.335774 IP 10.1.1.1.2000 > 10.1.1.2.50628: Flags [P.], seq 2053:3079, ack 1, win 57, options [nop,nop,TS val 6850973 ecr 6850910], length 1026
1450056069.345960 IP 10.1.1.2.55348 > 10.1.1.1.2000: Flags [.], ack 2053, win 66, options [nop,nop,TS val 6850935 ecr 6850935], length 0
1450056069.385738 IP 10.1.1.1.2000 > 10.1.1.2.58269: Flags [P.], seq 2053:3079, ack 1, win 57, options [nop,nop,TS val 6850985 ecr 6850923], length 1026
1450056069.395940 IP 10.1.1.2.46322 > 10.1.1.1.2000: Flags [.], ack 2053, win 66, options [nop,nop,TS val 6850948 ecr 6850948], length 0
1450056069.435841 IP 10.1.1.1.2000 > 10.1.1.2.55348: Flags [P.], seq 2053:3079, ack 1, win 57, options [nop,nop,TS val 6850998 ecr 6850935], length 1026
1450056069.445831 IP 10.1.1.2.39166 > 10.1.1.1.2000: Flags [.], ack 2053, win 66, options [nop,nop,TS val 6850960 ecr 6850960], length 0
1450056069.485782 IP 10.1.1.1.2000 > 10.1.1.2.46322: Flags [P.], seq 2053:3079, ack 1, win 57, options [nop,nop,TS val 6851010 ecr 6850948], length 1026
1450056069.495823 IP 10.1.1.2.50628 > 10.1.1.1.2000: Flags [.], ack 3079, win 70, options [nop,nop,TS val 6850973 ecr 6850973], length 0
1450056069.535793 IP 10.1.1.1.2000 > 10.1.1.2.39166: Flags [P.], seq 2053:3079, ack 1, win 57, options [nop,nop,TS val 6851023 ecr 6850960], length 1026
1450056069.545781 IP 10.1.1.2.58269 > 10.1.1.1.2000: Flags [.], ack 3079, win 70, options [nop,nop,TS val 6850985 ecr 6850985], length 0
1450056069.585775 IP 10.1.1.1.2000 > 10.1.1.2.50628: Flags [P.], seq 3079:4105, ack 1, win 57, options [nop,nop,TS val 6851035 ecr 6850973], length 1026
1450056069.595894 IP 10.1.1.2.55348 > 10.1.1.1.2000: Flags [.], ack 3079, win 70, options [nop,nop,TS val 6850998 ecr 6850998], length 0
1450056069.635878 IP 10.1.1.1.2000 > 10.1.1.2.58269: Flags [P.], seq 3079:4105, ack 1, win 57, options [nop,nop,TS val 6851048 ecr 6850985], length 1026
1450056069.645899 IP 10.1.1.2.46322 > 10.1.1.1.2000: Flags [.], ack 3079, win 70, options [nop,nop,TS val 6851010 ecr 6851010], length 0
1450056069.685879 IP 10.1.1.1.2000 > 10.1.1.2.55348: Flags [P.], seq 3079:4105, ack 1, win 57, options [nop,nop,TS val 6851060 ecr 6850998], length 1026
1450056069.695855 IP 10.1.1.2.39166 > 10.1.1.1.2000: Flags [.], ack 3079, win 70, options [nop,nop,TS val 6851023 ecr 6851023], length 0
1450056069.735783 IP 10.1.1.1.2000 > 10.1.1.2.46322: Flags [P.], seq 3079:4105, ack 1, win 57, options [nop,nop,TS val 6851073 ecr 6851010], length 1026
1450056069.745833 IP 10.1.1.2.50628 > 10.1.1.1.2000: Flags [.], ack 4105, win 74, options [nop,nop,TS val 6851035 ecr 6851035], length 0
1450056069.785825 IP 10.1.1.1.2000 > 10.1.1.2.39166: Flags [P.], seq 3079:4105, ack 1, win 57, options [nop,nop,TS val 6851085 ecr 6851023], length 1026
1450056069.795936 IP 10.1.1.2.58269 > 10.1.1.1.2000: Flags [.], ack 4105, win 74, options [nop,nop,TS val 6851048 ecr 6851048], length 0
1450056069.835791 IP 10.1.1.1.2000 > 10.1.1.2.50628: Flags [P.], seq 4105:5131, ack 1, win 57, options [nop,nop,TS val 6851098 ecr 6851035], length 1026
1450056069.885877 IP 10.1.1.1.2000 > 10.1.1.2.58269: Flags [P.], seq 4105:5131, ack 1, win 57, options [nop,nop,TS val 6851110 ecr 6851048], length 1026
1450056069.895850 IP 10.1.1.2.46322 > 10.1.1.1.2000: Flags [.], ack 4105, win 74, options [nop,nop,TS val 6851073 ecr 6851073], length 0
1450056069.935881 IP 10.1.1.1.2000 > 10.1.1.2.55348: Flags [P.], seq 4105:5131, ack 1, win 57, options [nop,nop,TS val 6851123 ecr 6850998], length 1026
1450056069.945885 IP 10.1.1.2.39166 > 10.1.1.1.2000: Flags [.], ack 4105, win 74, options [nop,nop,TS val 6851085 ecr 6851085], length 0
1450056069.985783 IP 10.1.1.1.2000 > 10.1.1.2.46322: Flags [P.], seq 4105:5131, ack 1, win 57, options [nop,nop,TS val 6851135 ecr 6851073], length 1026
1450056069.995850 IP 10.1.1.2.50628 > 10.1.1.1.2000: Flags [.], ack 5131, win 78, options [nop,nop,TS val 6851098 ecr 6851098], length 0
1450056070.035783 IP 10.1.1.1.2000 > 10.1.1.2.39166: Flags [P.], seq 4105:5131, ack 1, win 57, options [nop,nop,TS val 6851148 ecr 6851085], length 1026
1450056070.045944 IP 10.1.1.2.58269 > 10.1.1.1.2000: Flags [.], ack 5131, win 78, options [nop,nop,TS val 6851110 ecr 6851110], length 0
1450056070.085773 IP 10.1.1.1.2000 > 10.1.1.2.50628: Flags [P.], seq 5131:6157, ack 1, win 57, options [nop,nop,TS val 6851160 ecr 6851098], length 1026
1450056070.095940 IP 10.1.1.2.55348 > 10.1.1.1.2000: Flags [.], ack 5131, win 78, options [nop,nop,TS val 6851123 ecr 6851123], length 0
1450056070.136083 IP 10.1.1.1.2000 > 10.1.1.2.58269: Flags [P.], seq 5131:6157, ack 1, win 57, options [nop,nop,TS val 6851173 ecr 6851110], length 1026
1450056070.145851 IP 10.1.1.2.46322 > 10.1.1.1.2000: Flags [.], ack 5131, win 78, options [nop,nop,TS val 6851135 ecr 6851135], length 0
1450056070.185789 IP 10.1.1.1.2000 > 10.1.1.2.55348: Flags [P.], seq 5131:6157, ack 1, win 57, options [nop,nop,TS val 6851185 ecr 6851123], length 1026
1450056070.195844 IP 10.1.1.2.39166 > 10.1.1.1.2000: Flags [.], ack 5131, win 78, options [nop,nop,TS val 6851148 ecr 6851148], length 0
1450056070.235768 IP 10.1.1.1.2000 > 10.1.1.2.46322: Flags [P.], seq 5131:6157, ack 1, win 57, options [nop,nop,TS val 6851198 ecr 6851135], length 1026
1450056070.245815 IP 10.1.1.2.50628 > 10.1.1.1.2000: Flags [.], ack 6157, win 82, options [nop,nop,TS val 6851160 ecr 6851160], length 0
1450056070.285780 IP 10.1.1.1.2000 > 10.1.1.2.39166: Flags [P.], seq 5131:6157, ack 1, win 57, options [nop,nop,TS val 6851210 ecr 6851148], length 1026
1450056070.296134 IP 10.1.1.2.58269 > 10.1.1.1.2000: Flags [.], ack 6157, win 82, options [nop,nop,TS val 6851173 ecr 6851173], length 0
1450056070.335863 IP 10.1.1.1.2000 > 10.1.1.2.50628: Flags [P.], seq 6157:7183, ack 1, win 57, options [nop,nop,TS val 6851223 ecr 6851160], length 1026
1450056070.345887 IP 10.1.1.2.55348 > 10.1.1.1.2000: Flags [.], ack 6157, win 82, options [nop,nop,TS val 6851185 ecr 6851185], length 0
1450056070.385805 IP 10.1.1.1.2000 > 10.1.1.2.58269: Flags [P.], seq 6157:7183, ack 1, win 57, options [nop,nop,TS val 6851235 ecr 6851173], length 1026
1450056070.395810 IP 10.1.1.2.46322 > 10.1.1.1.2000: Flags [.], ack 6157, win 82, options [nop,nop,TS val 6851198 ecr 6851198], length 0
1450056070.435746 IP 10.1.1.1.2000 > 10.1.1.2.55348: Flags [P.], seq 6157:7183, ack 1, win 57, options [nop,nop,TS val 6851248 ecr 6851185], length 1026
1450056070.485772 IP 10.1.1.1.2000 > 10.1.1.2.46322: Flags [P.], seq 6157:7183, ack 1, win 57, options [nop,nop,TS val 6851260 ecr 6851198], length 1026
1450056070.495894 IP 10.1.1.2.50628 > 10.1.1.1.2000: Flags [.], ack 7183, win 86, options [nop,nop,TS val 6851223 ecr 6851223], length 0
1450056070.535856 IP 10.1.1.1.2000 > 10.1.1.2.39166: Flags [P.], seq 6157:7183, ack 1, win 57, options [nop,nop,TS val 6851273 ecr 6851148], length 1026
1450056070.545852 IP 10.1.1.2.58269 > 10.1.1.1.2000: Flags [.], ack 7183, win 86, options [nop,nop,TS val 6851235 ecr 6851235], length 0
1450056070.585772 IP 10.1.1.1.2000 > 10.1.1.2.50628: Flags [P.], seq 7183:8209, ack 1, win 57, options [nop,nop,TS val 6851285 ecr 6851223], length 1026
1450056070.595779 IP 10.1.1.2.55348 > 10.1.1.1.2000: Flags [.], ack 7183, win 86, options [nop,nop,TS val 6851248 ecr 6851248], length 0
1450056070.635801 IP 10.1.1.1.2000 > 10.1.1.2.58269: Flags [P.], seq 7183:8209, ack 1, win 57, options [nop,nop,TS val 6851298 ecr 6851235], length 1026
1450056070.645812 IP 10.1.1.2.46322 > 10.1.1.1.2000: Flags [.], ack 7183, win 86, options [nop,nop,TS val 6851260 ecr 6851260], length 0
1450056070.685765 IP 10.1.1.1.2000 > 10.1.1.2.55348: Flags [P.], seq 7183:8209, ack 1, win 57, options [nop,nop,TS val 6851310 ecr 6851248], length 1026
1450056070.687668 IP 10.1.1.1.2000 > 10.1.1.2.39166: Flags [P.], seq 6157:7183, ack 1, win 57, options [nop,nop,TS val 6851311 ecr 6851148], length 1026
1450056070.695887 IP 10.1.1.2.39166 > 10.1.1.1.2000: Flags [.], ack 7183, win 86, options [nop,nop,TS val 6851273 ecr 6851273], length 0
1450056070.735733 IP 10.1.1.1.2000 > 10.1.1.2.46322: Flags [P.], seq 7183:8209, ack 1, win 57, options [nop,nop,TS val 6851323 ecr 6851260], length 1026
1450056070.745809 IP 10.1.1.2.50628 > 10.1.1.1.2000: Flags [.], ack 8209, win 90, options [nop,nop,TS val 6851285 ecr 6851285], length 0
1450056070.785743 IP 10.1.1.1.2000 > 10.1.1.2.39166: Flags [P.], seq 7183:8209, ack 1, win 57, options [nop,nop,TS val 6851335 ecr 6851273], length 1026
1450056070.795858 IP 10.1.1.2.58269 > 10.1.1.1.2000: Flags [.], ack 8209, win 90, options [nop,nop,TS val 6851298 ecr 6851298], length 0
1450056070.835804 IP 10.1.1.1.2000 > 10.1.1.2.50628: Flags [P.], seq 8209:9235, ack 1, win 57, options [nop,nop,TS val 6851348 ecr 6851285], length 1026
1450056070.845796 IP 10.1.1.2.55348 > 10.1.1.1.2000: Flags [.], ack 8209, win 90, options [nop,nop,TS val 6851310 ecr 6851310], length 0
1450056070.847701 IP 10.1.1.2.39166 > 10.1.1.1.2000: Flags [.], ack 7183, win 86, options [nop,nop,TS val 6851311 ecr 6851311,nop,nop,sack 1 {6157:7183}], length 0
1450056070.885735 IP 10.1.1.1.2000 > 10.1.1.2.58269: Flags [P.], seq 8209:9235, ack 1, win 57, options [nop,nop,TS val 6851360 ecr 6851298], length 1026
1450056070.895769 IP 10.1.1.2.46322 > 10.1.1.1.2000: Flags [.], ack 8209, win 90, options [nop,nop,TS val 6851323 ecr 6851323], length 0
1450056070.935869 IP 10.1.1.1.2000 > 10.1.1.2.55348: Flags [P.], seq 8209:9235, ack 1, win 57, options [nop,nop,TS val 6851373 ecr 6851310], length 1026
1450056070.945782 IP 10.1.1.2.39166 > 10.1.1.1.2000: Flags [.], ack 8209, win 90, options [nop,nop,TS val 6851335 ecr 6851335], length 0
1450056070.985799 IP 10.1.1.1.2000 > 10.1.1.2.46322: Flags [P.], seq 8209:9235, ack 1, win 57, options [nop,nop,TS val 6851385 ecr 6851323], length 1026
1450056070.995837 IP 10.1.1.2.50628 > 10.1.1.1.2000: Flags [.], ack 9235, win 94, options [nop,nop,TS val 6851348 ecr 6851348], length 0
1450056071.035787 IP 10.1.1.1.2000 > 10.1.1.2.39166: Flags [P.], seq 8209:9235, ack 1, win 57, options [nop,nop,TS val 6851398 ecr 6851335], length 1026
1450056071.045777 IP 10.1.1.2.58269 > 10.1.1.1.2000: Flags [.], ack 9235, win 94, options [nop,nop,TS val 6851360 ecr 6851360], length 0
1450056071.085799 IP 10.1.1.1.2000 > 10.1.1.2.50628: Flags [P.], seq 9235:10261, ack 1, win 57, options [nop,nop,TS val 6851410 ecr 6851348], length 1026
1450056071.095923 IP 10.1.1.2.55348 > 10.1.1.1.2000: Flags [.], ack 9235, win 94, options [nop,nop,TS val 6851373 ecr 6851373], length 0
1450056071.135799 IP 10.1.1.1.2000 > 10.1.1.2.58269: Flags [P.], seq 9235:10261, ack 1, win 57, options [nop,nop,TS val 6851423 ecr 6851360], length 1026
1450056071.145856 IP 10.1.1.2.46322 > 10.1.1.1.2000: Flags [.], ack 9235, win 94, options [nop,nop,TS val 6851385 ecr 6851385], length 0
1450056071.185810 IP 10.1.1.1.2000 > 10.1.1.2.55348: Flags [P.], seq 9235:10261, ack 1, win 57, options [nop,nop,TS val 6851435 ecr 6851373], length 1026
1450056071.195857 IP 10.1.1.2.39166 > 10.1.1.1.2000: Flags [.], ack 9235, win 94, options [nop,nop,TS val 6851398 ecr 6851398], length 0
1450056071.235706 IP 10.1.1.1.2000 > 10.1.1.2.46322: Flags [P.], seq 9235:10261, ack 1, win 57, options [nop,nop,TS val 6851448 ecr 6851385], length 1026
1450056071.245846 IP 10.1.1.2.50628 > 10.1.1.1.2000: Flags [.], ack 10261, win 98, options [nop,nop,TS val 6851410 ecr 6851410], length 0
1450056071.285843 IP 10.1.1.1.2000 > 10.1.1.2.39166: Flags [P.], seq 9235:10261, ack 1, win 57, options [nop,nop,TS val 6851460 ecr 6851398], length 1026
1450056071.295867 IP 10.1.1.2.58269 > 10.1.1.1.2000: Flags [.], ack 10261, win 98, options [nop,nop,TS val 6851423 ecr 6851423], length 0
1450056071.335800 IP 10.1.1.1.2000 > 10.1.1.2.50628: Flags [P.], seq 10261:11287, ack 1, win 57, options [nop,nop,TS val 6851473 ecr 6851410], length 1026
1450056071.345873 IP 10.1.1.2.55348 > 10.1.1.1.2000: Flags [.], ack 10261, win 98, options [nop,nop,TS val 6851435 ecr 6851435], length 0
1450056071.385827 IP 10.1.1.1.2000 > 10.1.1.2.58269: Flags [P.], seq 10261:11287, ack 1, win 57, options [nop,nop,TS val 6851485 ecr 6851423], length 1026
1450056071.395786 IP 10.1.1.2.46322 > 10.1.1.1.2000: Flags [.], ack 10261, win 98, options [nop,nop,TS val 6851448 ecr 6851448], length 0
1450056071.435801 IP 10.1.1.1.2000 > 10.1.1.2.55348: Flags [P.], seq 10261:11287, ack 1, win 57, options [nop,nop,TS val 6851498 ecr 6851435], length 1026
1450056071.445894 IP 10.1.1.2.39166 > 10.1.1.1.2000: Flags [.], ack 10261, win 98, options [nop,nop,TS val 6851460 ecr 6851460], length 0
1450056071.485765 IP 10.1.1.1.2000 > 10.1.1.2.46322: Flags [P.], seq 10261:11287, ack 1, win 57, options [nop,nop,TS val 6851510 ecr 6851448], length 1026
1450056071.495846 IP 10.1.1.2.50628 > 10.1.1.1.2000: Flags [.], ack 11287, win 102, options [nop,nop,TS val 6851473 ecr 6851473], length 0
1450056071.535742 IP 10.1.1.1.2000 > 10.1.1.2.39166: Flags [P.], seq 10261:11287, ack 1, win 57, options [nop,nop,TS val 6851523 ecr 6851460], length 1026
1450056071.545864 IP 10.1.1.2.58269 > 10.1.1.1.2000: Flags [.], ack 11287, win 102, options [nop,nop,TS val 6851485 ecr 6851485], length 0
1450056071.585747 IP 10.1.1.1.2000 > 10.1.1.2.50628: Flags [P.], seq 11287:12313, ack 1, win 57, options [nop,nop,TS val 6851535 ecr 6851473], length 1026
1450056071.595841 IP 10.1.1.2.55348 > 10.1.1.1.2000: Flags [.], ack 11287, win 102, options [nop,nop,TS val 6851498 ecr 6851498], length 0
1450056071.635772 IP 10.1.1.1.2000 > 10.1.1.2.58269: Flags [P.], seq 11287:12313, ack 1, win 57, options [nop,nop,TS val 6851548 ecr 6851485], length 1026
1450056071.645797 IP 10.1.1.2.46322 > 10.1.1.1.2000: Flags [.], ack 11287, win 102, options [nop,nop,TS val 6851510 ecr 6851510], length 0
1450056071.685788 IP 10.1.1.1.2000 > 10.1.1.2.55348: Flags [P.], seq 11287:12313, ack 1, win 57, options [nop,nop,TS val 6851560 ecr 6851498], length 1026
1450056071.695783 IP 10.1.1.2.39166 > 10.1.1.1.2000: Flags [.], ack 11287, win 102, options [nop,nop,TS val 6851523 ecr 6851523], length 0
1450056071.735700 IP 10.1.1.1.2000 > 10.1.1.2.46322: Flags [P.], seq 11287:12313, ack 1, win 57, options [nop,nop,TS val 6851573 ecr 6851510], length 1026
1450056071.745780 IP 10.1.1.2.50628 > 10.1.1.1.2000: Flags [.], ack 12313, win 106, options [nop,nop,TS val 6851535 ecr 6851535], length 0
1450056071.785892 IP 10.1.1.1.2000 > 10.1.1.2.39166: Flags [P.], seq 11287:12313, ack 1, win 57, options [nop,nop,TS val 6851585 ecr 6851523], length 1026
1450056071.795835 IP 10.1.1.2.58269 > 10.1.1.1.2000: Flags [.], ack 12313, win 106, options [nop,nop,TS val 6851548 ecr 6851548], length 0
1450056071.835783 IP 10.1.1.1.2000 > 10.1.1.2.50628: Flags [P.], seq 12313:13339, ack 1, win 57, options [nop,nop,TS val 6851598 ecr 6851535], length 1026
1450056071.845845 IP 10.1.1.2.55348 > 10.1.1.1.2000: Flags [.], ack 12313, win 106, options [nop,nop,TS val 6851560 ecr 6851560], length 0
1450056071.885827 IP 10.1.1.1.2000 > 10.1.1.2.58269: Flags [P.], seq 12313:13339, ack 1, win 57, options [nop,nop,TS val 6851610 ecr 6851548], length 1026
1450056071.895750 IP 10.1.1.2.46322 > 10.1.1.1.2000: Flags [.], ack 12313, win 106, options [nop,nop,TS val 6851573 ecr 6851573], length 0
1450056071.935818 IP 10.1.1.1.2000 > 10.1.1.2.55348: Flags [P.], seq 12313:13339, ack 1, win 57, options [nop,nop,TS val 6851623 ecr 6851560], length 1026
1450056071.945944 IP 10.1.1.2.39166 > 10.1.1.1.2000: Flags [.], ack 12313, win 106, options [nop,nop,TS val 6851585 ecr 6851585], length 0
1450056071.985799 IP 10.1.1.1.2000 > 10.1.1.2.46322: Flags [P.], seq 12313:13339, ack 1, win 57, options [nop,nop,TS val 6851635 ecr 6851573], length 1026
1450056071.995841 IP 10.1.1.2.50628 > 10.1.1.1.2000: Flags [.], ack 13339, win 110, options [nop,nop,TS val 6851598 ecr 6851598], length 0
1450056072.035786 IP 10.1.1.1.2000 > 10.1.1.2.39166: Flags [P.], seq 12313:13339, ack 1, win 57, options [nop,nop,TS val 6851648 ecr 6851585], length 1026
1450056072.045890 IP 10.1.1.2.58269 > 10.1.1.1.2000: Flags [.], ack 13339, win 110, options [nop,nop,TS val 6851610 ecr 6851610], length 0
1450056072.085767 IP 10.1.1.1.2000 > 10.1.1.2.50628: Flags [P.], seq 13339:14365, ack 1, win 57, options [nop,nop,TS val 6851660 ecr 6851598], length 1026
1450056072.095883 IP 10.1.1.2.55348 > 10.1.1.1.2000: Flags [.], ack 13339, win 110, options [nop,nop,TS val 6851623 ecr 6851623], length 0
1450056072.135788 IP 10.1.1.1.2000 > 10.1.1.2.58269: Flags [P.], seq 13339:14365, ack 1, win 57, options [nop,nop,TS val 6851673 ecr 6851610], length 1026
1450056072.185782 IP 10.1.1.1.2000 > 10.1.1.2.55348: Flags [P.], seq 13339:14365, ack 1, win 57, options [nop,nop,TS val 6851685 ecr 6851623], length 1026
1450056072.195843 IP 10.1.1.2.39166 > 10.1.1.1.2000: Flags [.], ack 13339, win 110, options [nop,nop,TS val 6851648 ecr 6851648], length 0
1450056072.235756 IP 10.1.1.1.2000 > 10.1.1.2.46322: Flags [P.], seq 13339:14365, ack 1, win 57, options [nop,nop,TS val 6851698 ecr 6851573], length 1026
1450056072.245810 IP 10.1.1.2.50628 > 10.1.1.1.2000: Flags [.], ack 14365, win 114, options [nop,nop,TS val 6851660 ecr 6851660], length 0
1450056072.285785 IP 10.1.1.1.2000 > 10.1.1.2.39166: Flags [P.], seq 13339:14365, ack 1, win 57, options [nop,nop,TS val 6851710 ecr 6851648], length 1026
1450056072.295836 IP 10.1.1.2.58269 > 10.1.1.1.2000: Flags [.], ack 14365, win 114, options [nop,nop,TS val 6851673 ecr 6851673], length 0
1450056072.335810 IP 10.1.1.1.2000 > 10.1.1.2.50628: Flags [P.], seq 14365:15391, ack 1, win 57, options [nop,nop,TS val 6851723 ecr 6851660], length 1026
1450056072.345835 IP 10.1.1.2.55348 > 10.1.1.1.2000: Flags [.], ack 14365, win 114, options [nop,nop,TS val 6851685 ecr 6851685], length 0
1450056072.355685 IP 10.1.1.1.2000 > 10.1.1.2.46322: Flags [P.], seq 13339:14365, ack 1, win 57, options [nop,nop,TS val 6851728 ecr 6851573], length 1026
1450056072.385810 IP 10.1.1.1.2000 > 10.1.1.2.58269: Flags [P.], seq 14365:15391, ack 1, win 57, options [nop,nop,TS val 6851735 ecr 6851673], length 1026
1450056072.395813 IP 10.1.1.2.46322 > 10.1.1.1.2000: Flags [.], ack 14365, win 114, options [nop,nop,TS val 6851698 ecr 6851698], length 0
1450056072.435793 IP 10.1.1.1.2000 > 10.1.1.2.55348: Flags [P.], seq 14365:15391, ack 1, win 57, options [nop,nop,TS val 6851748 ecr 6851685], length 1026
1450056072.445842 IP 10.1.1.2.39166 > 10.1.1.1.2000: Flags [.], ack 14365, win 114, options [nop,nop,TS val 6851710 ecr 6851710], length 0
1450056072.485803 IP 10.1.1.1.2000 > 10.1.1.2.46322: Flags [P.], seq 14365:15391, ack 1, win 57, options [nop,nop,TS val 6851760 ecr 6851698], length 1026
1450056072.495861 IP 10.1.1.2.50628 > 10.1.1.1.2000: Flags [.], ack 15391, win 118, options [nop,nop,TS val 6851723 ecr 6851723], length 0
1450056072.515754 IP 10.1.1.2.46322 > 10.1.1.1.2000: Flags [.], ack 14365, win 114, options [nop,nop,TS val 6851728 ecr 6851728,nop,nop,sack 1 {13339:14365}], length 0
1450056072.535816 IP 10.1.1.1.2000 > 10.1.1.2.39166: Flags [P.], seq 14365:15391, ack 1, win 57, options [nop,nop,TS val 6851773 ecr 6851710], length 1026
1450056072.545862 IP 10.1.1.2.58269 > 10.1.1.1.2000: Flags [.], ack 15391, win 118, options [nop,nop,TS val 6851735 ecr 6851735], length 0
1450056072.585786 IP 10.1.1.1.2000 > 10.1.1.2.50628: Flags [P.], seq 15391:16417, ack 1, win 57, options [nop,nop,TS val 6851785 ecr 6851723], length 1026
1450056072.595845 IP 10.1.1.2.55348 > 10.1.1.1.2000: Flags [.], ack 15391, win 118, options [nop,nop,TS val 6851748 ecr 6851748], length 0
1450056072.635885 IP 10.1.1.1.2000 > 10.1.1.2.58269: Flags [P.], seq 15391:16417, ack 1, win 57, options [nop,nop,TS val 6851798 ecr 6851735], length 1026
1450056072.645907 IP 10.1.1.2.46322 > 10.1.1.1.2000: Flags [.], ack 15391, win 118, options [nop,nop,TS val 6851760 ecr 6851760], length 0
1450056072.685747 IP 10.1.1.1.2000 > 10.1.1.2.55348: Flags [P.], seq 15391:16417, ack 1, win 57, options [nop,nop,TS val 6851810 ecr 6851748], length 1026
1450056072.695874 IP 10.1.1.2.39166 > 10.1.1.1.2000: Flags [.], ack 15391, win 118, options [nop,nop,TS val 6851773 ecr 6851773], length 0
1450056072.735859 IP 10.1.1.1.2000 > 10.1.1.2.46322: Flags [P.], seq 15391:16417, ack 1, win 57, options [nop,nop,TS val 6851823 ecr 6851760], length 1026
1450056072.745840 IP 10.1.1.2.50628 > 10.1.1.1.2000: Flags [.], ack 16417, win 122, options [nop,nop,TS val 6851785 ecr 6851785], length 0
1450056072.785761 IP 10.1.1.1.2000 > 10.1.1.2.39166: Flags [P.], seq 15391:16417, ack 1, win 57, options [nop,nop,TS val 6851835 ecr 6851773], length 1026
1450056072.795959 IP 10.1.1.2.58269 > 10.1.1.1.2000: Flags [.], ack 16417, win 122, options [nop,nop,TS val 6851798 ecr 6851798], length 0
1450056072.835807 IP 10.1.1.1.2000 > 10.1.1.2.50628: Flags [P.], seq 16417:17443, ack 1, win 57, options [nop,nop,TS val 6851848 ecr 6851785], length 1026
1450056072.845785 IP 10.1.1.2.55348 > 10.1.1.1.2000: Flags [.], ack 16417, win 122, options [nop,nop,TS val 6851810 ecr 6851810], length 0
1450056072.885861 IP 10.1.1.1.2000 > 10.1.1.2.58269: Flags [P.], seq 16417:17443, ack 1, win 57, options [nop,nop,TS val 6851860 ecr 6851798], length 1026
1450056072.895925 IP 10.1.1.2.46322 > 10.1.1.1.2000: Flags [.], ack 16417, win 122, options [nop,nop,TS val 6851823 ecr 6851823], length 0
1450056072.935732 IP 10.1.1.1.2000 > 10.1.1.2.55348: Flags [P.], seq 16417:17443, ack 1, win 57, options [nop,nop,TS val 6851873 ecr 6851810], length 1026
1450056072.945810 IP 10.1.1.2.39166 > 10.1.1.1.2000: Flags [.], ack 16417, win 122, options [nop,nop,TS val 6851835 ecr 6851835], length 0
1450056072.985781 IP 10.1.1.1.2000 > 10.1.1.2.46322: Flags [P.], seq 16417:17443, ack 1, win 57, options [nop,nop,TS val 6851885 ecr 6851823], length 1026
1450056072.995861 IP 10.1.1.2.50628 > 10.1.1.1.2000: Flags [.], ack 17443, win 126, options [nop,nop,TS val 6851848 ecr 6851848], length 0
1450056073.035757 IP 10.1.1.1.2000 > 10.1.1.2.39166: Flags [P.], seq 16417:17443, ack 1, win 57, options [nop,nop,TS val 6851898 ecr 6851835], length 1026
1450056073.045919 IP 10.1.1.2.58269 > 10.1.1.1.2000: Flags [.], ack 17443, win 126, options [nop,nop,TS val 6851860 ecr 6851860], length 0
1450056073.085849 IP 10.1.1.1.2000 > 10.1.1.2.50628: Flags [P.], seq 17443:18469, ack 1, win 57, options [nop,nop,TS val 6851910 ecr 6851848], length 1026
1450056073.095776 IP 10.1.1.2.55348 > 10.1.1.1.2000: Flags [.], ack 17443, win 126, options [nop,nop,TS val 6851873 ecr 6851873], length 0
1450056073.135823 IP 10.1.1.1.2000 > 10.1.1.2.58269: Flags [P.], seq 17443:18469, ack 1, win 57, options [nop,nop,TS val 6851923 ecr 6851860], length 1026
1450056073.145834 IP 10.1.1.2.46322 > 10.1.1.1.2000: Flags [.], ack 17443, win 126, options [nop,nop,TS val 6851885 ecr 6851885], length 0
1450056073.185843 IP 10.1.1.1.2000 > 10.1.1.2.55348: Flags [P.], seq 17443:18469, ack 1, win 57, options [nop,nop,TS val 6851935 ecr 6851873], length 1026
1450056073.195813 IP 10.1.1.2.39166 > 10.1.1.1.2000: Flags [.], ack 17443, win 126, options [nop,nop,TS val 6851898 ecr 6851898], length 0
1450056073.235763 IP 10.1.1.1.2000 > 10.1.1.2.46322: Flags [P.], seq 17443:18469, ack 1, win 57, options [nop,nop,TS val 6851948 ecr 6851885], length 1026
1450056073.245904 IP 10.1.1.2.50628 > 10.1.1.1.2000: Flags [.], ack 18469, win 130, options [nop,nop,TS val 6851910 ecr 6851910], length 0
1450056073.285876 IP 10.1.1.1.2000 > 10.1.1.2.39166: Flags [P.], seq 17443:18469, ack 1, win 57, options [nop,nop,TS val 6851960 ecr 6851898], length 1026
1450056073.295872 IP 10.1.1.2.58269 > 10.1.1.1.2000: Flags [.], ack 18469, win 130, options [nop,nop,TS val 6851923 ecr 6851923], length 0
1450056073.335793 IP 10.1.1.1.2000 > 10.1.1.2.50628: Flags [P.], seq 18469:19495, ack 1, win 57, options [nop,nop,TS val 6851973 ecr 6851910], length 1026
1450056073.345901 IP 10.1.1.2.55348 > 10.1.1.1.2000: Flags [.], ack 18469, win 130, options [nop,nop,TS val 6851935 ecr 6851935], length 0
1450056073.385779 IP 10.1.1.1.2000 > 10.1.1.2.58269: Flags [P.], seq 18469:19495, ack 1, win 57, options [nop,nop,TS val 6851985 ecr 6851923], length 1026
1450056073.395832 IP 10.1.1.2.46322 > 10.1.1.1.2000: Flags [.], ack 18469, win 130, options [nop,nop,TS val 6851948 ecr 6851948], length 0
1450056073.435874 IP 10.1.1.1.2000 > 10.1.1.2.55348: Flags [P.], seq 18469:19495, ack 1, win 57, options [nop,nop,TS val 6851998 ecr 6851935], length 1026
1450056073.485790 IP 10.1.1.1.2000 > 10.1.1.2.46322: Flags [P.], seq 18469:19495, ack 1, win 57, options [nop,nop,TS val 6852010 ecr 6851948], length 1026
1450056073.495852 IP 10.1.1.2.50628 > 10.1.1.1.2000: Flags [.], ack 19495, win 134, options [nop,nop,TS val 6851973 ecr 6851973], length 0
1450056073.535857 IP 10.1.1.1.2000 > 10.1.1.2.39166: Flags [P.], seq 18469:19495, ack 1, win 57, options [nop,nop,TS val 6852023 ecr 6851898], length 1026
1450056073.545827 IP 10.1.1.2.58269 > 10.1.1.1.2000: Flags [.], ack 19495, win 134, options [nop,nop,TS val 6851985 ecr 6851985], length 0
1450056073.585790 IP 10.1.1.1.2000 > 10.1.1.2.50628: Flags [P.], seq 19495:20521, ack 1, win 57, options [nop,nop,TS val 6852035 ecr 6851973], length 1026
1450056073.595945 IP 10.1.1.2.55348 > 10.1.1.1.2000: Flags [.], ack 19495, win 134, options [nop,nop,TS val 6851998 ecr 6851998], length 0
1450056073.635808 IP 10.1.1.1.2000 > 10.1.1.2.58269: Flags [P.], seq 19495:20521, ack 1, win 57, options [nop,nop,TS val 6852048 ecr 6851985], length 1026
1450056073.645853 IP 10.1.1.2.46322 > 10.1.1.1.2000: Flags [.], ack 19495, win 134, options [nop,nop,TS val 6852010 ecr 6852010], length 0
1450056073.663681 IP 10.1.1.1.2000 > 10.1.1.2.39166: Flags [P.], seq 18469:19495, ack 1, win 57, options [nop,nop,TS val 6852055 ecr 6851898], length 1026
1450056073.685777 IP 10.1.1.1.2000 > 10.1.1.2.55348: Flags [P.], seq 19495:20521, ack 1, win 57, options [nop,nop,TS val 6852060 ecr 6851998], length 1026
1450056073.695915 IP 10.1.1.2.39166 > 10.1.1.1.2000: Flags [.], ack 19495, win 134, options [nop,nop,TS val 6852023 ecr 6852023], length 0
1450056073.735794 IP 10.1.1.1.2000 > 10.1.1.2.46322: Flags [P.], seq 19495:20521, ack 1, win 57, options [nop,nop,TS val 6852073 ecr 6852010], length 1026
1450056073.745859 IP 10.1.1.2.50628 > 10.1.1.1.2000: Flags [.], ack 20521, win 138, options [nop,nop,TS val 6852035 ecr 6852035], length 0
1450056073.785783 IP 10.1.1.1.2000 > 10.1.1.2.39166: Flags [P.], seq 19495:20521, ack 1, win 57, options [nop,nop,TS val 6852085 ecr 6852023], length 1026
1450056073.795868 IP 10.1.1.2.58269 > 10.1.1.1.2000: Flags [.], ack 20521, win 138, options [nop,nop,TS val 6852048 ecr 6852048], length 0
1450056073.823752 IP 10.1.1.2.39166 > 10.1.1.1.2000: Flags [.], ack 19495, win 134, options [nop,nop,TS val 6852055 ecr 6852055,nop,nop,sack 1 {18469:19495}], length 0
1450056073.835777 IP 10.1.1.1.2000 > 10.1.1.2.50628: Flags [P.], seq 20521:21547, ack 1, win 57, options [nop,nop,TS val 6852098 ecr 6852035], length 1026
1450056073.845830 IP 10.1.1.2.55348 > 10.1.1.1.2000: Flags [.], ack 20521, win 138, options [nop,nop,TS val 6852060 ecr 6852060], length 0
1450056073.885762 IP 10.1.1.1.2000 > 10.1.1.2.58269: Flags [P.], seq 20521:21547, ack 1, win 57, options [nop,nop,TS val 6852110 ecr 6852048], length 1026
1450056073.895865 IP 10.1.1.2.46322 > 10.1.1.1.2000: Flags [.], ack 20521, win 138, options [nop,nop,TS val 6852073 ecr 6852073], length 0
1450056073.935853 IP 10.1.1.1.2000 > 10.1.1.2.55348: Flags [P.], seq 20521:21547, ack 1, win 57, options [nop,nop,TS val 6852123 ecr 6852060], length 1026
1450056073.945832 IP 10.1.1.2.39166 > 10.1.1.1.2000: Flags [.], ack 20521, win 138, options [nop,nop,TS val 6852085 ecr 6852085], length 0
1450056073.985791 IP 10.1.1.1.2000 > 10.1.1.2.46322: Flags [P.], seq 20521:21547, ack 1, win 57, options [nop,nop,TS val 6852135 ecr 6852073], length 1026
1450056073.995867 IP 10.1.1.2.50628 > 10.1.1.1.2000: Flags [.], ack 21547, win 142, options [nop,nop,TS val 6852098 ecr 6852098], length 0
1450056074.035826 IP 10.1.1.1.2000 > 10.1.1.2.39166: Flags [P.], seq 20521:21547, ack 1, win 57, options [nop,nop,TS val 6852148 ecr 6852085], length 1026
1450056074.045811 IP 10.1.1.2.58269 > 10.1.1.1.2000: Flags [.], ack 21547, win 142, options [nop,nop,TS val 6852110 ecr 6852110], length 0
1450056074.085784 IP 10.1.1.1.2000 > 10.1.1.2.50628: Flags [P.], seq 21547:22573, ack 1, win 57, options [nop,nop,TS val 6852160 ecr 6852098], length 1026
1450056074.095922 IP 10.1.1.2.55348 > 10.1.1.1.2000: Flags [.], ack 21547, win 142, options [nop,nop,TS val 6852123 ecr 6852123], length 0
1450056074.135822 IP 10.1.1.1.2000 > 10.1.1.2.58269: Flags [P.], seq 21547:22573, ack 1, win 57, options [nop,nop,TS val 6852173 ecr 6852110], length 1026
1450056074.145842 IP 10.1.1.2.46322 > 10.1.1.1.2000: Flags [.], ack 21547, win 142, options [nop,nop,TS val 6852135 ecr 6852135], length 0
1450056074.185819 IP 10.1.1.1.2000 > 10.1.1.2.55348: Flags [P.], seq 21547:22573, ack 1, win 57, options [nop,nop,TS val 6852185 ecr 6852123], length 1026
1450056074.195889 IP 10.1.1.2.39166 > 10.1.1.1.2000: Flags [.], ack 21547, win 142, options [nop,nop,TS val 6852148 ecr 6852148], length 0
1450056074.235895 IP 10.1.1.1.2000 > 10.1.1.2.46322: Flags [P.], seq 21547:22573, ack 1, win 57, options [nop,nop,TS val 6852198 ecr 6852135], length 1026
1450056074.245838 IP 10.1.1.2.50628 > 10.1.1.1.2000: Flags [.], ack 22573, win 146, options [nop,nop,TS val 6852160 ecr 6852160], length 0
1450056074.285886 IP 10.1.1.1.2000 > 10.1.1.2.39166: Flags [P.], seq 21547:22573, ack 1, win 57, options [nop,nop,TS val 6852210 ecr 6852148], length 1026
1450056074.295924 IP 10.1.1.2.58269 > 10.1.1.1.2000: Flags [.], ack 22573, win 146, options [nop,nop,TS val 6852173 ecr 6852173], length 0
1450056074.335903 IP 10.1.1.1.2000 > 10.1.1.2.50628: Flags [P.], seq 22573:23599, ack 1, win 57, options [nop,nop,TS val 6852223 ecr 6852160], length 1026
1450056074.345914 IP 10.1.1.2.55348 > 10.1.1.1.2000: Flags [.], ack 22573, win 146, options [nop,nop,TS val 6852185 ecr 6852185], length 0
1450056074.385879 IP 10.1.1.1.2000 > 10.1.1.2.58269: Flags [P.], seq 22573:23599, ack 1, win 57, options [nop,nop,TS val 6852235 ecr 6852173], length 1026
1450056074.395967 IP 10.1.1.2.46322 > 10.1.1.1.2000: Flags [.], ack 22573, win 146, options [nop,nop,TS val 6852198 ecr 6852198], length 0
1450056074.435791 IP 10.1.1.1.2000 > 10.1.1.2.55348: Flags [P.], seq 22573:23599, ack 1, win 57, options [nop,nop,TS val 6852248 ecr 6852185], length 1026
1450056074.445945 IP 10.1.1.2.39166 > 10.1.1.1.2000: Flags [.], ack 22573, win 146, options [nop,nop,TS val 6852210 ecr 6852210], length 0
1450056074.485780 IP 10.1.1.1.2000 > 10.1.1.2.46322: Flags [P.], seq 22573:23599, ack 1, win 57, options [nop,nop,TS val 6852260 ecr 6852198], length 1026
1450056074.495975 IP 10.1.1.2.50628 > 10.1.1.1.2000: Flags [.], ack 23599, win 150, options [nop,nop,TS val 6852223 ecr 6852223], length 0
1450056074.535795 IP 10.1.1.1.2000 > 10.1.1.2.39166: Flags [P.], seq 22573:23599, ack 1, win 57, options [nop,nop,TS val 6852273 ecr 6852210], length 1026
1450056074.545984 IP 10.1.1.2.58269 > 10.1.1.1.2000: Flags [.], ack 23599, win 150, options [nop,nop,TS val 6852235 ecr 6852235], length 0
1450056074.585845 IP 10.1.1.1.2000 > 10.1.1.2.50628: Flags [P.], seq 23599:24625, ack 1, win 57, options [nop,nop,TS val 6852285 ecr 6852223], length 1026
1450056074.595838 IP 10.1.1.2.55348 > 10.1.1.1.2000: Flags [.], ack 23599, win 150, options [nop,nop,TS val 6852248 ecr 6852248], length 0
1450056074.635803 IP 10.1.1.1.2000 > 10.1.1.2.58269: Flags [P.], seq 23599:24625, ack 1, win 57, options [nop,nop,TS val 6852298 ecr 6852235], length 1026
1450056074.645833 IP 10.1.1.2.46322 > 10.1.1.1.2000: Flags [.], ack 23599, win 150, options [nop,nop,TS val 6852260 ecr 6852260], length 0
1450056074.685795 IP 10.1.1.1.2000 > 10.1.1.2.55348: Flags [P.], seq 23599:24625, ack 1, win 57, options [nop,nop,TS val 6852310 ecr 6852248], length 1026
1450056074.695850 IP 10.1.1.2.39166 > 10.1.1.1.2000: Flags [.], ack 23599, win 150, options [nop,nop,TS val 6852273 ecr 6852273], length 0
1450056074.735790 IP 10.1.1.1.2000 > 10.1.1.2.46322: Flags [P.], seq 23599:24625, ack 1, win 57, options [nop,nop,TS val 6852323 ecr 6852260], length 1026
1450056074.745906 IP 10.1.1.2.50628 > 10.1.1.1.2000: Flags [.], ack 24625, win 154, options [nop,nop,TS val 6852285 ecr 6852285], length 0
1450056074.785762 IP 10.1.1.1.2000 > 10.1.1.2.39166: Flags [P.], seq 23599:24625, ack 1, win 57, options [nop,nop,TS val 6852335 ecr 6852273], length 1026
1450056074.795853 IP 10.1.1.2.58269 > 10.1.1.1.2000: Flags [.], ack 24625, win 154, options [nop,nop,TS val 6852298 ecr 6852298], length 0
1450056074.835831 IP 10.1.1.1.2000 > 10.1.1.2.50628: Flags [P.], seq 24625:25651, ack 1, win 57, options [nop,nop,TS val 6852348 ecr 6852285], length 1026
1450056074.845841 IP 10.1.1.2.55348 > 10.1.1.1.2000: Flags [.], ack 24625, win 154, options [nop,nop,TS val 6852310 ecr 6852310], length 0
1450056074.885736 IP 10.1.1.1.2000 > 10.1.1.2.58269: Flags [P.], seq 24625:25651, ack 1, win 57, options [nop,nop,TS val 6852360 ecr 6852298], length 1026
1450056074.895832 IP 10.1.1.2.46322 > 10.1.1.1.2000: Flags [.], ack 24625, win 154, options [nop,nop,TS val 6852323 ecr 6852323], length 0
1450056074.935769 IP 10.1.1.1.2000 > 10.1.1.2.55348: Flags [P.], seq 24625:25651, ack 1, win 57, options [nop,nop,TS val 6852373 ecr 6852310], length 1026
1450056074.945792 IP 10.1.1.2.39166 > 10.1.1.1.2000: Flags [.], ack 24625, win 154, options [nop,nop,TS val 6852335 ecr 6852335], length 0
1450056074.985775 IP 10.1.1.1.2000 > 10.1.1.2.46322: Flags [P.], seq 24625:25651, ack 1, win 57, options [nop,nop,TS val 6852385 ecr 6852323], length 1026
1450056074.995887 IP 10.1.1.2.50628 > 10.1.1.1.2000: Flags [.], ack 25651, win 158, options [nop,nop,TS val 6852348 ecr 6852348], length 0
1450056075.035797 IP 10.1.1.1.2000 > 10.1.1.2.39166: Flags [P.], seq 24625:25651, ack 1, win 57, options [nop,nop,TS val 6852398 ecr 6852335], length 1026
1450056075.045767 IP 10.1.1.2.58269 > 10.1.1.1.2000: Flags [.], ack 25651, win 158, options [nop,nop,TS val 6852360 ecr 6852360], length 0
1450056075.085829 IP 10.1.1.1.2000 > 10.1.1.2.50628: Flags [P.], seq 25651:26677, ack 1, win 57, options [nop,nop,TS val 6852410 ecr 6852348], length 1026
1450056075.095812 IP 10.1.1.2.55348 > 10.1.1.1.2000: Flags [.], ack 25651, win 158, options [nop,nop,TS val 6852373 ecr 6852373], length 0
1450056075.135800 IP 10.1.1.1.2000 > 10.1.1.2.58269: Flags [P.], seq 25651:26677, ack 1, win 57, options [nop,nop,TS val 6852423 ecr 6852360], length 1026
1450056075.145832 IP 10.1.1.2.46322 > 10.1.1.1.2000: Flags [.], ack 25651, win 158, options [nop,nop,TS val 6852385 ecr 6852385], length 0
1450056075.185840 IP 10.1.1.1.2000 > 10.1.1.2.55348: Flags [P.], seq 25651:26677, ack 1, win 57, options [nop,nop,TS val 6852435 ecr 6852373], length 1026
1450056075.195867 IP 10.1.1.2.39166 > 10.1.1.1.2000: Flags [.], ack 25651, win 158, options [nop,nop,TS val 6852398 ecr 6852398], length 0
