1450051795.875023 IP 10.1.1.2.17500 > 10.1.1.255.17500: UDP, length 293
1450051817.999261 IP 10.1.1.2.138 > 10.1.1.255.138: NBT UDP PACKET(138)
1450051817.999298 IP 10.1.1.2.138 > 10.1.1.255.138: NBT UDP PACKET(138)
1450051825.306283 IP 10.1.1.2.2000 > 10.1.1.1.2000: Flags [S], seq 1903518480, win 29200, options [mss 1460,sackOK,TS val 5789965 ecr 0,nop,wscale 9], length 0
1450051825.306313 IP 10.1.1.1.2000 > 10.1.1.2.2000: Flags [S.], seq 3076021054, ack 1903518481, win 28960, options [mss 1460,sackOK,TS val 5789965 ecr 5789965,nop,wscale 9], length 0
1450051825.306344 IP 10.1.1.2.2000 > 10.1.1.1.2000: Flags [.], ack 1, win 58, options [nop,nop,TS val 5789965 ecr 5789965], length 0
1450051825.356955 IP 10.1.1.1.2000 > 10.1.1.2.2000: Flags [P.], seq 1:1027, ack 1, win 57, options [nop,nop,TS val 5789978 ecr 5789965], length 1026
1450051825.357041 IP 10.1.1.2.2000 > 10.1.1.1.2000: Flags [.], ack 1027, win 62, options [nop,nop,TS val 5789978 ecr 5789978], length 0
1450051825.406909 IP 10.1.1.1.2000 > 10.1.1.2.2000: Flags [P.], seq 1027:2053, ack 1, win 57, options [nop,nop,TS val 5789990 ecr 5789978], length 1026
1450051825.406960 IP 10.1.1.2.2000 > 10.1.1.1.2000: Flags [.], ack 2053, win 66, options [nop,nop,TS val 5789990 ecr 5789990], length 0
1450051825.456746 IP 10.1.1.1.2000 > 10.1.1.2.2000: Flags [P.], seq 2053:3079, ack 1, win 57, options [nop,nop,TS val 5790003 ecr 5789990], length 1026
1450051825.456801 IP 10.1.1.2.2000 > 10.1.1.1.2000: Flags [.], ack 3079, win 70, options [nop,nop,TS val 5790003 ecr 5790003], length 0
1450051825.506720 IP 10.1.1.1.2000 > 10.1.1.2.2000: Flags [P.], seq 3079:4105, ack 1, win 57, options [nop,nop,TS val 5790015 ecr 5790003], length 1026
1450051825.506764 IP 10.1.1.2.2000 > 10.1.1.1.2000: Flags [.], ack 4105, win 74, options [nop,nop,TS val 5790015 ecr 5790015], length 0
1450051825.556733 IP 10.1.1.1.2000 > 10.1.1.2.2000: Flags [P.], seq 4105:5131, ack 1, win 57, options [nop,nop,TS val 5790028 ecr 5790015], length 1026
1450051825.556788 IP 10.1.1.2.2000 > 10.1.1.1.2000: Flags [.], ack 5131, win 78, options [nop,nop,TS val 5790028 ecr 5790028], length 0
1450051825.606841 IP 10.1.1.1.2000 > 10.1.1.2.2000: Flags [P.], seq 5131:6157, ack 1, win 57, options [nop,nop,TS val 5790040 ecr 5790028], length 1026
1450051825.606889 IP 10.1.1.2.2000 > 10.1.1.1.2000: Flags [.], ack 6157, win 82, options [nop,nop,TS val 5790040 ecr 5790040], length 0
1450051825.656772 IP 10.1.1.1.2000 > 10.1.1.2.2000: Flags [P.], seq 6157:7183, ack 1, win 57, options [nop,nop,TS val 5790053 ecr 5790040], length 1026
1450051825.656840 IP 10.1.1.2.2000 > 10.1.1.1.2000: Flags [.], ack 7183, win 86, options [nop,nop,TS val 5790053 ecr 5790053], length 0
1450051825.706792 IP 10.1.1.1.2000 > 10.1.1.2.2000: Flags [P.], seq 7183:8209, ack 1, win 57, options [nop,nop,TS val 5790065 ecr 5790053], length 1026
1450051825.706847 IP 10.1.1.2.2000 > 10.1.1.1.2000: Flags [.], ack 8209, win 90, options [nop,nop,TS val 5790065 ecr 5790065], length 0
1450051825.756795 IP 10.1.1.1.2000 > 10.1.1.2.2000: Flags [P.], seq 8209:9235, ack 1, win 57, options [nop,nop,TS val 5790078 ecr 5790065], length 1026
1450051825.756851 IP 10.1.1.2.2000 > 10.1.1.1.2000: Flags [.], ack 9235, win 94, options [nop,nop,TS val 5790078 ecr 5790078], length 0
1450051825.806751 IP 10.1.1.1.2000 > 10.1.1.2.2000: Flags [P.], seq 9235:10261, ack 1, win 57, options [nop,nop,TS val 5790090 ecr 5790078], length 1026
1450051825.806806 IP 10.1.1.2.2000 > 10.1.1.1.2000: Flags [.], ack 10261, win 98, options [nop,nop,TS val 5790090 ecr 5790090], length 0
1450051825.856748 IP 10.1.1.1.2000 > 10.1.1.2.2000: Flags [P.], seq 10261:11287, ack 1, win 57, options [nop,nop,TS val 5790103 ecr 5790090], length 1026
1450051825.856801 IP 10.1.1.2.2000 > 10.1.1.1.2000: Flags [.], ack 11287, win 102, options [nop,nop,TS val 5790103 ecr 5790103], length 0
1450051825.900575 IP 10.1.1.2.17500 > 10.1.1.255.17500: UDP, length 293
1450051825.906705 IP 10.1.1.1.2000 > 10.1.1.2.2000: Flags [P.], seq 11287:12313, ack 1, win 57, options [nop,nop,TS val 5790115 ecr 5790103], length 1026
1450051825.906783 IP 10.1.1.2.2000 > 10.1.1.1.2000: Flags [.], ack 12313, win 106, options [nop,nop,TS val 5790115 ecr 5790115], length 0
1450051825.957057 IP 10.1.1.1.2000 > 10.1.1.2.2000: Flags [P.], seq 12313:13339, ack 1, win 57, options [nop,nop,TS val 5790128 ecr 5790115], length 1026
1450051825.957102 IP 10.1.1.2.2000 > 10.1.1.1.2000: Flags [.], ack 13339, win 110, options [nop,nop,TS val 5790128 ecr 5790128], length 0
1450051826.006779 IP 10.1.1.1.2000 > 10.1.1.2.2000: Flags [P.], seq 13339:14365, ack 1, win 57, options [nop,nop,TS val 5790140 ecr 5790128], length 1026
1450051826.006834 IP 10.1.1.2.2000 > 10.1.1.1.2000: Flags [.], ack 14365, win 114, options [nop,nop,TS val 5790140 ecr 5790140], length 0
1450051826.056797 IP 10.1.1.1.2000 > 10.1.1.2.2000: Flags [P.], seq 14365:15391, ack 1, win 57, options [nop,nop,TS val 5790153 ecr 5790140], length 1026
1450051826.056852 IP 10.1.1.2.2000 > 10.1.1.1.2000: Flags [.], ack 15391, win 118, options [nop,nop,TS val 5790153 ecr 5790153], length 0
1450051826.106732 IP 10.1.1.1.2000 > 10.1.1.2.2000: Flags [P.], seq 15391:16417, ack 1, win 57, options [nop,nop,TS val 5790165 ecr 5790153], length 1026
1450051826.106784 IP 10.1.1.2.2000 > 10.1.1.1.2000: Flags [.], ack 16417, win 122, options [nop,nop,TS val 5790165 ecr 5790165], length 0
1450051826.156736 IP 10.1.1.1.2000 > 10.1.1.2.2000: Flags [P.], seq 16417:17443, ack 1, win 57, options [nop,nop,TS val 5790178 ecr 5790165], length 1026
1450051826.156788 IP 10.1.1.2.2000 > 10.1.1.1.2000: Flags [.], ack 17443, win 126, options [nop,nop,TS val 5790178 ecr 5790178], length 0
1450051826.206799 IP 10.1.1.1.2000 > 10.1.1.2.2000: Flags [P.], seq 17443:18469, ack 1, win 57, options [nop,nop,TS val 5790190 ecr 5790178], length 1026
1450051826.206854 IP 10.1.1.2.2000 > 10.1.1.1.2000: Flags [.], ack 18469, win 130, options [nop,nop,TS val 5790190 ecr 5790190], length 0
1450051826.256756 IP 10.1.1.1.2000 > 10.1.1.2.2000: Flags [P.], seq 18469:19495, ack 1, win 57, options [nop,nop,TS val 5790203 ecr 5790190], length 1026
1450051826.256808 IP 10.1.1.2.2000 > 10.1.1.1.2000: Flags [.], ack 19495, win 134, options [nop,nop,TS val 5790203 ecr 5790203], length 0
1450051826.306792 IP 10.1.1.1.2000 > 10.1.1.2.2000: Flags [P.], seq 19495:20521, ack 1, win 57, options [nop,nop,TS val 5790215 ecr 5790203], length 1026
1450051826.306851 IP 10.1.1.2.2000 > 10.1.1.1.2000: Flags [.], ack 20521, win 138, options [nop,nop,TS val 5790215 ecr 5790215], length 0
1450051826.356713 IP 10.1.1.1.2000 > 10.1.1.2.2000: Flags [P.], seq 20521:21547, ack 1, win 57, options [nop,nop,TS val 5790228 ecr 5790215], length 1026
1450051826.356766 IP 10.1.1.2.2000 > 10.1.1.1.2000: Flags [.], ack 21547, win 142, options [nop,nop,TS val 5790228 ecr 5790228], length 0
1450051826.406763 IP 10.1.1.1.2000 > 10.1.1.2.2000: Flags [P.], seq 21547:22573, ack 1, win 57, options [nop,nop,TS val 5790240 ecr 5790228], length 1026
1450051826.406812 IP 10.1.1.2.2000 > 10.1.1.1.2000: Flags [.], ack 22573, win 146, options [nop,nop,TS val 5790240 ecr 5790240], length 0
1450051826.456756 IP 10.1.1.1.2000 > 10.1.1.2.2000: Flags [P.], seq 22573:23599, ack 1, win 57, options [nop,nop,TS val 5790253 ecr 5790240], length 1026
1450051826.456811 IP 10.1.1.2.2000 > 10.1.1.1.2000: Flags [.], ack 23599, win 150, options [nop,nop,TS val 5790253 ecr 5790253], length 0
1450051826.506685 IP 10.1.1.1.2000 > 10.1.1.2.2000: Flags [P.], seq 23599:24625, ack 1, win 57, options [nop,nop,TS val 5790265 ecr 5790253], length 1026
1450051826.506728 IP 10.1.1.2.2000 > 10.1.1.1.2000: Flags [.], ack 24625, win 154, options [nop,nop,TS val 5790265 ecr 5790265], length 0
1450051826.556669 IP 10.1.1.1.2000 > 10.1.1.2.2000: Flags [P.], seq 24625:25651, ack 1, win 57, options [nop,nop,TS val 5790278 ecr 5790265], length 1026
1450051826.556711 IP 10.1.1.2.2000 > 10.1.1.1.2000: Flags [.], ack 25651, win 158, options [nop,nop,TS val 5790278 ecr 5790278], length 0
1450051826.606746 IP 10.1.1.1.2000 > 10.1.1.2.2000: Flags [P.], seq 25651:26677, ack 1, win 57, options [nop,nop,TS val 5790290 ecr 5790278], length 1026
1450051826.606795 IP 10.1.1.2.2000 > 10.1.1.1.2000: Flags [.], ack 26677, win 162, options [nop,nop,TS val 5790290 ecr 5790290], length 0
1450051826.656721 IP 10.1.1.1.2000 > 10.1.1.2.2000: Flags [P.], seq 26677:27703, ack 1, win 57, options [nop,nop,TS val 5790303 ecr 5790290], length 1026
1450051826.656767 IP 10.1.1.2.2000 > 10.1.1.1.2000: Flags [.], ack 27703, win 166, options [nop,nop,TS val 5790303 ecr 5790303], length 0
1450051826.706665 IP 10.1.1.1.2000 > 10.1.1.2.2000: Flags [P.], seq 27703:28729, ack 1, win 57, options [nop,nop,TS val 5790315 ecr 5790303], length 1026
1450051826.706689 IP 10.1.1.2.2000 > 10.1.1.1.2000: Flags [.], ack 28729, win 170, options [nop,nop,TS val 5790315 ecr 5790315], length 0
1450051826.756708 IP 10.1.1.1.2000 > 10.1.1.2.2000: Flags [P.], seq 28729:29755, ack 1, win 57, options [nop,nop,TS val 5790328 ecr 5790315], length 1026
1450051826.756772 IP 10.1.1.2.2000 > 10.1.1.1.2000: Flags [.], ack 29755, win 174, options [nop,nop,TS val 5790328 ecr 5790328], length 0
1450051826.806762 IP 10.1.1.1.2000 > 10.1.1.2.2000: Flags [P.], seq 29755:30781, ack 1, win 57, options [nop,nop,TS val 5790340 ecr 5790328], length 1026
1450051826.806809 IP 10.1.1.2.2000 > 10.1.1.1.2000: Flags [.], ack 30781, win 178, options [nop,nop,TS val 5790340 ecr 5790340], length 0
1450051826.856659 IP 10.1.1.1.2000 > 10.1.1.2.2000: Flags [P.], seq 30781:31807, ack 1, win 57, options [nop,nop,TS val 5790353 ecr 5790340], length 1026
1450051826.856685 IP 10.1.1.2.2000 > 10.1.1.1.2000: Flags [.], ack 31807, win 182, options [nop,nop,TS val 5790353 ecr 5790353], length 0
1450051826.906748 IP 10.1.1.1.2000 > 10.1.1.2.2000: Flags [P.], seq 31807:32833, ack 1, win 57, options [nop,nop,TS val 5790365 ecr 5790353], length 1026
1450051826.906795 IP 10.1.1.2.2000 > 10.1.1.1.2000: Flags [.], ack 32833, win 186, options [nop,nop,TS val 5790365 ecr 5790365], length 0
1450051826.956754 IP 10.1.1.1.2000 > 10.1.1.2.2000: Flags [P.], seq 32833:33859, ack 1, win 57, options [nop,nop,TS val 5790378 ecr 5790365], length 1026
1450051826.956811 IP 10.1.1.2.2000 > 10.1.1.1.2000: Flags [.], ack 33859, win 190, options [nop,nop,TS val 5790378 ecr 5790378], length 0
1450051827.006753 IP 10.1.1.1.2000 > 10.1.1.2.2000: Flags [P.], seq 33859:34885, ack 1, win 57, options [nop,nop,TS val 5790390 ecr 5790378], length 1026
1450051827.006808 IP 10.1.1.2.2000 > 10.1.1.1.2000: Flags [.], ack 34885, win 194, options [nop,nop,TS val 5790390 ecr 5790390], length 0
1450051827.056755 IP 10.1.1.1.2000 > 10.1.1.2.2000: Flags [P.], seq 34885:35911, ack 1, win 57, options [nop,nop,TS val 5790403 ecr 5790390], length 1026
1450051827.056809 IP 10.1.1.2.2000 > 10.1.1.1.2000: Flags [.], ack 35911, win 198, options [nop,nop,TS val 5790403 ecr 5790403], length 0
1450051827.106709 IP 10.1.1.1.2000 > 10.1.1.2.2000: Flags [P.], seq 35911:36937, ack 1, win 57, options [nop,nop,TS val 5790415 ecr 5790403], length 1026
1450051827.106757 IP 10.1.1.2.2000 > 10.1.1.1.2000: Flags [.], ack 36937, win 202, options [nop,nop,TS val 5790415 ecr 5790415], length 0
1450051827.156753 IP 10.1.1.1.2000 > 10.1.1.2.2000: Flags [P.], seq 36937:37963, ack 1, win 57, options [nop,nop,TS val 5790428 ecr 5790415], length 1026
1450051827.156808 IP 10.1.1.2.2000 > 10.1.1.1.2000: Flags [.], ack 37963, win 206, options [nop,nop,TS val 5790428 ecr 5790428], length 0
1450051827.206753 IP 10.1.1.1.2000 > 10.1.1.2.2000: Flags [P.], seq 37963:38989, ack 1, win 57, options [nop,nop,TS val 5790440 ecr 5790428], length 1026
1450051827.206809 IP 10.1.1.2.2000 > 10.1.1.1.2000: Flags [.], ack 38989, win 210, options [nop,nop,TS val 5790440 ecr 5790440], length 0
1450051827.256694 IP 10.1.1.1.2000 > 10.1.1.2.2000: Flags [P.], seq 38989:40015, ack 1, win 57, options [nop,nop,TS val 5790453 ecr 5790440], length 1026
1450051827.256728 IP 10.1.1.2.2000 > 10.1.1.1.2000: Flags [.], ack 40015, win 214, options [nop,nop,TS val 5790453 ecr 5790453], length 0
1450051827.306742 IP 10.1.1.1.2000 > 10.1.1.2.2000: Flags [P.], seq 40015:41041, ack 1, win 57, options [nop,nop,TS val 5790465 ecr 5790453], length 1026
1450051827.306796 IP 10.1.1.2.2000 > 10.1.1.1.2000: Flags [.], ack 41041, win 218, options [nop,nop,TS val 5790465 ecr 5790465], length 0
1450051827.356738 IP 10.1.1.1.2000 > 10.1.1.2.2000: Flags [P.], seq 41041:42067, ack 1, win 57, options [nop,nop,TS val 5790478 ecr 5790465], length 1026
1450051827.356788 IP 10.1.1.2.2000 > 10.1.1.1.2000: Flags [.], ack 42067, win 222, options [nop,nop,TS val 5790478 ecr 5790478], length 0
1450051827.406637 IP 10.1.1.1.2000 > 10.1.1.2.2000: Flags [P.], seq 42067:43093, ack 1, win 57, options [nop,nop,TS val 5790490 ecr 5790478], length 1026
1450051827.406662 IP 10.1.1.2.2000 > 10.1.1.1.2000: Flags [.], ack 43093, win 226, options [nop,nop,TS val 5790490 ecr 5790490], length 0
1450051827.456637 IP 10.1.1.1.2000 > 10.1.1.2.2000: Flags [P.], seq 43093:44119, ack 1, win 57, options [nop,nop,TS val 5790503 ecr 5790490], length 1026
1450051827.456669 IP 10.1.1.2.2000 > 10.1.1.1.2000: Flags [.], ack 44119, win 230, options [nop,nop,TS val 5790503 ecr 5790503], length 0
1450051827.506688 IP 10.1.1.1.2000 > 10.1.1.2.2000: Flags [P.], seq 44119:45145, ack 1, win 57, options [nop,nop,TS val 5790515 ecr 5790503], length 1026
1450051827.506716 IP 10.1.1.2.2000 > 10.1.1.1.2000: Flags [.], ack 45145, win 234, options [nop,nop,TS val 5790515 ecr 5790515], length 0
1450051827.556720 IP 10.1.1.1.2000 > 10.1.1.2.2000: Flags [P.], seq 45145:46171, ack 1, win 57, options [nop,nop,TS val 5790528 ecr 5790515], length 1026
1450051827.556773 IP 10.1.1.2.2000 > 10.1.1.1.2000: Flags [.], ack 46171, win 238, options [nop,nop,TS val 5790528 ecr 5790528], length 0
1450051827.606675 IP 10.1.1.1.2000 > 10.1.1.2.2000: Flags [P.], seq 46171:47197, ack 1, win 57, options [nop,nop,TS val 5790540 ecr 5790528], length 1026
1450051827.606700 IP 10.1.1.2.2000 > 10.1.1.1.2000: Flags [.], ack 47197, win 242, options [nop,nop,TS val 5790540 ecr 5790540], length 0
1450051827.656684 IP 10.1.1.1.2000 > 10.1.1.2.2000: Flags [P.], seq 47197:48223, ack 1, win 57, options [nop,nop,TS val 5790553 ecr 5790540], length 1026
1450051827.656724 IP 10.1.1.2.2000 > 10.1.1.1.2000: Flags [.], ack 48223, win 246, options [nop,nop,TS val 5790553 ecr 5790553], length 0
1450051827.706751 IP 10.1.1.1.2000 > 10.1.1.2.2000: Flags [P.], seq 48223:49249, ack 1, win 57, options [nop,nop,TS val 5790565 ecr 5790553], length 1026
1450051827.706797 IP 10.1.1.2.2000 > 10.1.1.1.2000: Flags [.], ack 49249, win 250, options [nop,nop,TS val 5790565 ecr 5790565], length 0
1450051827.756723 IP 10.1.1.1.2000 > 10.1.1.2.2000: Flags [P.], seq 49249:50275, ack 1, win 57, options [nop,nop,TS val 5790578 ecr 5790565], length 1026
1450051827.756779 IP 10.1.1.2.2000 > 10.1.1.1.2000: Flags [.], ack 50275, win 254, options [nop,nop,TS val 5790578 ecr 5790578], length 0
1450051827.806750 IP 10.1.1.1.2000 > 10.1.1.2.2000: Flags [P.], seq 50275:51301, ack 1, win 57, options [nop,nop,TS val 5790590 ecr 5790578], length 1026
1450051827.806805 IP 10.1.1.2.2000 > 10.1.1.1.2000: Flags [.], ack 51301, win 258, options [nop,nop,TS val 5790590 ecr 5790590], length 0
1450051827.856745 IP 10.1.1.1.2000 > 10.1.1.2.2000: Flags [P.], seq 51301:52327, ack 1, win 57, options [nop,nop,TS val 5790603 ecr 5790590], length 1026
1450051827.856798 IP 10.1.1.2.2000 > 10.1.1.1.2000: Flags [.], ack 52327, win 262, options [nop,nop,TS val 5790603 ecr 5790603], length 0
1450051827.906653 IP 10.1.1.1.2000 > 10.1.1.2.2000: Flags [P.], seq 52327:53353, ack 1, win 57, options [nop,nop,TS val 5790615 ecr 5790603], length 1026
1450051827.906684 IP 10.1.1.2.2000 > 10.1.1.1.2000: Flags [.], ack 53353, win 266, options [nop,nop,TS val 5790615 ecr 5790615], length 0
1450051827.956763 IP 10.1.1.1.2000 > 10.1.1.2.2000: Flags [P.], seq 53353:54379, ack 1, win 57, options [nop,nop,TS val 5790628 ecr 5790615], length 1026
1450051827.956810 IP 10.1.1.2.2000 > 10.1.1.1.2000: Flags [.], ack 54379, win 270, options [nop,nop,TS val 5790628 ecr 5790628], length 0
1450051828.006765 IP 10.1.1.1.2000 > 10.1.1.2.2000: Flags [P.], seq 54379:55405, ack 1, win 57, options [nop,nop,TS val 5790640 ecr 5790628], length 1026
1450051828.006810 IP 10.1.1.2.2000 > 10.1.1.1.2000: Flags [.], ack 55405, win 274, options [nop,nop,TS val 5790640 ecr 5790640], length 0
1450051828.056736 IP 10.1.1.1.2000 > 10.1.1.2.2000: Flags [P.], seq 55405:56431, ack 1, win 57, options [nop,nop,TS val 5790653 ecr 5790640], length 1026
1450051828.056785 IP 10.1.1.2.2000 > 10.1.1.1.2000: Flags [.], ack 56431, win 278, options [nop,nop,TS val 5790653 ecr 5790653], length 0
1450051828.106763 IP 10.1.1.1.2000 > 10.1.1.2.2000: Flags [P.], seq 56431:57457, ack 1, win 57, options [nop,nop,TS val 5790665 ecr 5790653], length 1026
1450051828.106841 IP 10.1.1.2.2000 > 10.1.1.1.2000: Flags [.], ack 57457, win 282, options [nop,nop,TS val 5790665 ecr 5790665], length 0
1450051828.156739 IP 10.1.1.1.2000 > 10.1.1.2.2000: Flags [P.], seq 57457:58483, ack 1, win 57, options [nop,nop,TS val 5790678 ecr 5790665], length 1026
1450051828.156786 IP 10.1.1.2.2000 > 10.1.1.1.2000: Flags [.], ack 58483, win 286, options [nop,nop,TS val 5790678 ecr 5790678], length 0
1450051828.194416 IP 10.1.1.2.5353 > 224.0.0.251.5353: 0 [2q] PTR (QM)? _ipps._tcp.local. PTR (QM)? _ipp._tcp.local. (45)
1450051828.206741 IP 10.1.1.1.2000 > 10.1.1.2.2000: Flags [P.], seq 58483:59509, ack 1, win 57, options [nop,nop,TS val 5790690 ecr 5790678], length 1026
1450051828.206786 IP 10.1.1.2.2000 > 10.1.1.1.2000: Flags [.], ack 59509, win 290, options [nop,nop,TS val 5790690 ecr 5790690], length 0
1450051828.256753 IP 10.1.1.1.2000 > 10.1.1.2.2000: Flags [P.], seq 59509:60535, ack 1, win 57, options [nop,nop,TS val 5790703 ecr 5790690], length 1026
1450051828.256801 IP 10.1.1.2.2000 > 10.1.1.1.2000: Flags [.], ack 60535, win 294, options [nop,nop,TS val 5790703 ecr 5790703], length 0
1450051828.306770 IP 10.1.1.1.2000 > 10.1.1.2.2000: Flags [P.], seq 60535:61561, ack 1, win 57, options [nop,nop,TS val 5790715 ecr 5790703], length 1026
1450051828.306819 IP 10.1.1.2.2000 > 10.1.1.1.2000: Flags [.], ack 61561, win 298, options [nop,nop,TS val 5790715 ecr 5790715], length 0
1450051828.356749 IP 10.1.1.1.2000 > 10.1.1.2.2000: Flags [P.], seq 61561:62587, ack 1, win 57, options [nop,nop,TS val 5790728 ecr 5790715], length 1026
1450051828.356810 IP 10.1.1.2.2000 > 10.1.1.1.2000: Flags [.], ack 62587, win 302, options [nop,nop,TS val 5790728 ecr 5790728], length 0
1450051828.406707 IP 10.1.1.1.2000 > 10.1.1.2.2000: Flags [P.], seq 62587:63613, ack 1, win 57, options [nop,nop,TS val 5790740 ecr 5790728], length 1026
1450051828.406772 IP 10.1.1.2.2000 > 10.1.1.1.2000: Flags [.], ack 63613, win 306, options [nop,nop,TS val 5790740 ecr 5790740], length 0
1450051828.456741 IP 10.1.1.1.2000 > 10.1.1.2.2000: Flags [P.], seq 63613:64639, ack 1, win 57, options [nop,nop,TS val 5790753 ecr 5790740], length 1026
1450051828.456789 IP 10.1.1.2.2000 > 10.1.1.1.2000: Flags [.], ack 64639, win 310, options [nop,nop,TS val 5790753 ecr 5790753], length 0
1450051828.506761 IP 10.1.1.1.2000 > 10.1.1.2.2000: Flags [P.], seq 64639:65665, ack 1, win 57, options [nop,nop,TS val 5790765 ecr 5790753], length 1026
1450051828.506827 IP 10.1.1.2.2000 > 10.1.1.1.2000: Flags [.], ack 65665, win 314, options [nop,nop,TS val 5790765 ecr 5790765], length 0
1450051828.556764 IP 10.1.1.1.2000 > 10.1.1.2.2000: Flags [P.], seq 65665:66691, ack 1, win 57, options [nop,nop,TS val 5790778 ecr 5790765], length 1026
1450051828.556832 IP 10.1.1.2.2000 > 10.1.1.1.2000: Flags [.], ack 66691, win 318, options [nop,nop,TS val 5790778 ecr 5790778], length 0
1450051828.606739 IP 10.1.1.1.2000 > 10.1.1.2.2000: Flags [P.], seq 66691:67717, ack 1, win 57, options [nop,nop,TS val 5790790 ecr 5790778], length 1026
1450051828.606786 IP 10.1.1.2.2000 > 10.1.1.1.2000: Flags [.], ack 67717, win 322, options [nop,nop,TS val 5790790 ecr 5790790], length 0
1450051828.656748 IP 10.1.1.1.2000 > 10.1.1.2.2000: Flags [P.], seq 67717:68743, ack 1, win 57, options [nop,nop,TS val 5790803 ecr 5790790], length 1026
1450051828.656806 IP 10.1.1.2.2000 > 10.1.1.1.2000: Flags [.], ack 68743, win 326, options [nop,nop,TS val 5790803 ecr 5790803], length 0
1450051828.706717 IP 10.1.1.1.2000 > 10.1.1.2.2000: Flags [P.], seq 68743:69769, ack 1, win 57, options [nop,nop,TS val 5790815 ecr 5790803], length 1026
1450051828.706764 IP 10.1.1.2.2000 > 10.1.1.1.2000: Flags [.], ack 69769, win 330, options [nop,nop,TS val 5790815 ecr 5790815], length 0
1450051828.756662 IP 10.1.1.1.2000 > 10.1.1.2.2000: Flags [P.], seq 69769:70795, ack 1, win 57, options [nop,nop,TS val 5790828 ecr 5790815], length 1026
1450051828.756691 IP 10.1.1.2.2000 > 10.1.1.1.2000: Flags [.], ack 70795, win 334, options [nop,nop,TS val 5790828 ecr 5790828], length 0
1450051828.806751 IP 10.1.1.1.2000 > 10.1.1.2.2000: Flags [P.], seq 70795:71821, ack 1, win 57, options [nop,nop,TS val 5790840 ecr 5790828], length 1026
1450051828.806800 IP 10.1.1.2.2000 > 10.1.1.1.2000: Flags [.], ack 71821, win 338, options [nop,nop,TS val 5790840 ecr 5790840], length 0
1450051828.856803 IP 10.1.1.1.2000 > 10.1.1.2.2000: Flags [P.], seq 71821:72847, ack 1, win 57, options [nop,nop,TS val 5790853 ecr 5790840], length 1026
1450051828.856851 IP 10.1.1.2.2000 > 10.1.1.1.2000: Flags [.], ack 72847, win 342, options [nop,nop,TS val 5790853 ecr 5790853], length 0
1450051828.906761 IP 10.1.1.1.2000 > 10.1.1.2.2000: Flags [P.], seq 72847:73873, ack 1, win 57, options [nop,nop,TS val 5790865 ecr 5790853], length 1026
1450051828.906826 IP 10.1.1.2.2000 > 10.1.1.1.2000: Flags [.], ack 73873, win 346, options [nop,nop,TS val 5790865 ecr 5790865], length 0
1450051828.956666 IP 10.1.1.1.2000 > 10.1.1.2.2000: Flags [P.], seq 73873:74899, ack 1, win 57, options [nop,nop,TS val 5790878 ecr 5790865], length 1026
1450051828.956707 IP 10.1.1.2.2000 > 10.1.1.1.2000: Flags [.], ack 74899, win 350, options [nop,nop,TS val 5790878 ecr 5790878], length 0
1450051829.006738 IP 10.1.1.1.2000 > 10.1.1.2.2000: Flags [P.], seq 74899:75925, ack 1, win 57, options [nop,nop,TS val 5790890 ecr 5790878], length 1026
1450051829.006809 IP 10.1.1.2.2000 > 10.1.1.1.2000: Flags [.], ack 75925, win 354, options [nop,nop,TS val 5790890 ecr 5790890], length 0
1450051829.056758 IP 10.1.1.1.2000 > 10.1.1.2.2000: Flags [P.], seq 75925:76951, ack 1, win 57, options [nop,nop,TS val 5790903 ecr 5790890], length 1026
1450051829.056817 IP 10.1.1.2.2000 > 10.1.1.1.2000: Flags [.], ack 76951, win 358, options [nop,nop,TS val 5790903 ecr 5790903], length 0
1450051829.106663 IP 10.1.1.1.2000 > 10.1.1.2.2000: Flags [P.], seq 76951:77977, ack 1, win 57, options [nop,nop,TS val 5790915 ecr 5790903], length 1026
1450051829.106686 IP 10.1.1.2.2000 > 10.1.1.1.2000: Flags [.], ack 77977, win 361, options [nop,nop,TS val 5790915 ecr 5790915], length 0
1450051829.156664 IP 10.1.1.1.2000 > 10.1.1.2.2000: Flags [P.], seq 77977:79003, ack 1, win 57, options [nop,nop,TS val 5790928 ecr 5790915], length 1026
1450051829.156688 IP 10.1.1.2.2000 > 10.1.1.1.2000: Flags [.], ack 79003, win 361, options [nop,nop,TS val 5790928 ecr 5790928], length 0
1450051829.206720 IP 10.1.1.1.2000 > 10.1.1.2.2000: Flags [P.], seq 79003:80029, ack 1, win 57, options [nop,nop,TS val 5790940 ecr 5790928], length 1026
1450051829.206772 IP 10.1.1.2.2000 > 10.1.1.1.2000: Flags [.], ack 80029, win 361, options [nop,nop,TS val 5790940 ecr 5790940], length 0
1450051829.256693 IP 10.1.1.1.2000 > 10.1.1.2.2000: Flags [P.], seq 80029:81055, ack 1, win 57, options [nop,nop,TS val 5790953 ecr 5790940], length 1026
1450051829.256729 IP 10.1.1.2.2000 > 10.1.1.1.2000: Flags [.], ack 81055, win 361, options [nop,nop,TS val 5790953 ecr 5790953], length 0
1450051829.306653 IP 10.1.1.1.2000 > 10.1.1.2.2000: Flags [P.], seq 81055:82081, ack 1, win 57, options [nop,nop,TS val 5790965 ecr 5790953], length 1026
1450051829.306682 IP 10.1.1.2.2000 > 10.1.1.1.2000: Flags [.], ack 82081, win 361, options [nop,nop,TS val 5790965 ecr 5790965], length 0
1450051829.356747 IP 10.1.1.1.2000 > 10.1.1.2.2000: Flags [P.], seq 82081:83107, ack 1, win 57, options [nop,nop,TS val 5790978 ecr 5790965], length 1026
1450051829.356805 IP 10.1.1.2.2000 > 10.1.1.1.2000: Flags [.], ack 83107, win 361, options [nop,nop,TS val 5790978 ecr 5790978], length 0
1450051829.406649 IP 10.1.1.1.2000 > 10.1.1.2.2000: Flags [P.], seq 83107:84133, ack 1, win 57, options [nop,nop,TS val 5790990 ecr 5790978], length 1026
1450051829.406680 IP 10.1.1.2.2000 > 10.1.1.1.2000: Flags [.], ack 84133, win 361, options [nop,nop,TS val 5790990 ecr 5790990], length 0
1450051829.456695 IP 10.1.1.1.2000 > 10.1.1.2.2000: Flags [P.], seq 84133:85159, ack 1, win 57, options [nop,nop,TS val 5791003 ecr 5790990], length 1026
1450051829.456722 IP 10.1.1.2.2000 > 10.1.1.1.2000: Flags [.], ack 85159, win 361, options [nop,nop,TS val 5791003 ecr 5791003], length 0
1450051829.506709 IP 10.1.1.1.2000 > 10.1.1.2.2000: Flags [P.], seq 85159:86185, ack 1, win 57, options [nop,nop,TS val 5791015 ecr 5791003], length 1026
1450051829.506755 IP 10.1.1.2.2000 > 10.1.1.1.2000: Flags [.], ack 86185, win 361, options [nop,nop,TS val 5791015 ecr 5791015], length 0
1450051829.556672 IP 10.1.1.1.2000 > 10.1.1.2.2000: Flags [P.], seq 86185:87211, ack 1, win 57, options [nop,nop,TS val 5791028 ecr 5791015], length 1026
1450051829.556694 IP 10.1.1.2.2000 > 10.1.1.1.2000: Flags [.], ack 87211, win 361, options [nop,nop,TS val 5791028 ecr 5791028], length 0
1450051829.606649 IP 10.1.1.1.2000 > 10.1.1.2.2000: Flags [P.], seq 87211:88237, ack 1, win 57, options [nop,nop,TS val 5791040 ecr 5791028], length 1026
1450051829.606680 IP 10.1.1.2.2000 > 10.1.1.1.2000: Flags [.], ack 88237, win 361, options [nop,nop,TS val 5791040 ecr 5791040], length 0
1450051829.656717 IP 10.1.1.1.2000 > 10.1.1.2.2000: Flags [P.], seq 88237:89263, ack 1, win 57, options [nop,nop,TS val 5791053 ecr 5791040], length 1026
1450051829.656759 IP 10.1.1.2.2000 > 10.1.1.1.2000: Flags [.], ack 89263, win 361, options [nop,nop,TS val 5791053 ecr 5791053], length 0
1450051829.706728 IP 10.1.1.1.2000 > 10.1.1.2.2000: Flags [P.], seq 89263:90289, ack 1, win 57, options [nop,nop,TS val 5791065 ecr 5791053], length 1026
1450051829.706775 IP 10.1.1.2.2000 > 10.1.1.1.2000: Flags [.], ack 90289, win 361, options [nop,nop,TS val 5791065 ecr 5791065], length 0
1450051829.756650 IP 10.1.1.1.2000 > 10.1.1.2.2000: Flags [P.], seq 90289:91315, ack 1, win 57, options [nop,nop,TS val 5791078 ecr 5791065], length 1026
1450051829.756685 IP 10.1.1.2.2000 > 10.1.1.1.2000: Flags [.], ack 91315, win 361, options [nop,nop,TS val 5791078 ecr 5791078], length 0
1450051829.806765 IP 10.1.1.1.2000 > 10.1.1.2.2000: Flags [P.], seq 91315:92341, ack 1, win 57, options [nop,nop,TS val 5791090 ecr 5791078], length 1026
1450051829.806813 IP 10.1.1.2.2000 > 10.1.1.1.2000: Flags [.], ack 92341, win 361, options [nop,nop,TS val 5791090 ecr 5791090], length 0
1450051829.856745 IP 10.1.1.1.2000 > 10.1.1.2.2000: Flags [P.], seq 92341:93367, ack 1, win 57, options [nop,nop,TS val 5791103 ecr 5791090], length 1026
1450051829.895730 IP 10.1.1.2.2000 > 10.1.1.1.2000: Flags [.], ack 93367, win 361, options [nop,nop,TS val 5791113 ecr 5791103], length 0
1450051829.906762 IP 10.1.1.1.2000 > 10.1.1.2.2000: Flags [P.], seq 93367:94393, ack 1, win 57, options [nop,nop,TS val 5791115 ecr 5791113], length 1026
1450051829.943702 IP 10.1.1.2.2000 > 10.1.1.1.2000: Flags [.], ack 94393, win 361, options [nop,nop,TS val 5791125 ecr 5791115], length 0
1450051829.956706 IP 10.1.1.1.2000 > 10.1.1.2.2000: Flags [P.], seq 94393:95419, ack 1, win 57, options [nop,nop,TS val 5791128 ecr 5791125], length 1026
1450051829.995701 IP 10.1.1.2.2000 > 10.1.1.1.2000: Flags [.], ack 95419, win 361, options [nop,nop,TS val 5791138 ecr 5791128], length 0
1450051830.000818 IP6 fe80::e464:50ff:fe22:54e8.5353 > ff02::fb.5353: 0 [2q] PTR (QM)? _ipps._tcp.local. PTR (QM)? _ipp._tcp.local. (45)
1450051830.006743 IP 10.1.1.1.2000 > 10.1.1.2.2000: Flags [P.], seq 95419:96445, ack 1, win 57, options [nop,nop,TS val 5791140 ecr 5791138], length 1026
1450051830.043746 IP 10.1.1.2.2000 > 10.1.1.1.2000: Flags [.], ack 96445, win 361, options [nop,nop,TS val 5791150 ecr 5791140], length 0
1450051830.056782 IP 10.1.1.1.2000 > 10.1.1.2.2000: Flags [P.], seq 96445:97471, ack 1, win 57, options [nop,nop,TS val 5791153 ecr 5791150], length 1026
1450051830.095700 IP 10.1.1.2.2000 > 10.1.1.1.2000: Flags [.], ack 97471, win 361, options [nop,nop,TS val 5791163 ecr 5791153], length 0
1450051830.106758 IP 10.1.1.1.2000 > 10.1.1.2.2000: Flags [P.], seq 97471:98497, ack 1, win 57, options [nop,nop,TS val 5791165 ecr 5791163], length 1026
1450051830.143745 IP 10.1.1.2.2000 > 10.1.1.1.2000: Flags [.], ack 98497, win 361, options [nop,nop,TS val 5791175 ecr 5791165], length 0
1450051830.156764 IP 10.1.1.1.2000 > 10.1.1.2.2000: Flags [P.], seq 98497:99523, ack 1, win 57, options [nop,nop,TS val 5791178 ecr 5791175], length 1026
1450051830.195702 IP 10.1.1.2.2000 > 10.1.1.1.2000: Flags [.], ack 99523, win 361, options [nop,nop,TS val 5791188 ecr 5791178], length 0
1450051830.206762 IP 10.1.1.1.2000 > 10.1.1.2.2000: Flags [P.], seq 99523:100549, ack 1, win 57, options [nop,nop,TS val 5791190 ecr 5791188], length 1026
1450051830.243715 IP 10.1.1.2.2000 > 10.1.1.1.2000: Flags [.], ack 100549, win 361, options [nop,nop,TS val 5791200 ecr 5791190], length 0
1450051830.256768 IP 10.1.1.1.2000 > 10.1.1.2.2000: Flags [P.], seq 100549:101575, ack 1, win 57, options [nop,nop,TS val 5791203 ecr 5791200], length 1026
1450051830.295716 IP 10.1.1.2.2000 > 10.1.1.1.2000: Flags [.], ack 101575, win 361, options [nop,nop,TS val 5791213 ecr 5791203], length 0
1450051830.306761 IP 10.1.1.1.2000 > 10.1.1.2.2000: Flags [P.], seq 101575:102601, ack 1, win 57, options [nop,nop,TS val 5791215 ecr 5791213], length 1026
1450051830.307697 ARP, Request who-has 10.1.1.1 tell 10.1.1.2, length 28
1450051830.307746 ARP, Reply 10.1.1.1 is-at ca:1c:57:2f:3a:5d, length 28
1450051830.343742 IP 10.1.1.2.2000 > 10.1.1.1.2000: Flags [.], ack 102601, win 361, options [nop,nop,TS val 5791225 ecr 5791215], length 0
1450051830.356741 IP 10.1.1.1.2000 > 10.1.1.2.2000: Flags [P.], seq 102601:103627, ack 1, win 57, options [nop,nop,TS val 5791228 ecr 5791225], length 1026
1450051830.395707 IP 10.1.1.2.2000 > 10.1.1.1.2000: Flags [.], ack 103627, win 361, options [nop,nop,TS val 5791238 ecr 5791228], length 0
1450051830.406672 IP 10.1.1.1.2000 > 10.1.1.2.2000: Flags [P.], seq 103627:104653, ack 1, win 57, options [nop,nop,TS val 5791240 ecr 5791238], length 1026
1450051830.443699 IP 10.1.1.2.2000 > 10.1.1.1.2000: Flags [.], ack 104653, win 361, options [nop,nop,TS val 5791250 ecr 5791240], length 0
1450051830.456765 IP 10.1.1.1.2000 > 10.1.1.2.2000: Flags [P.], seq 104653:105679, ack 1, win 57, options [nop,nop,TS val 5791253 ecr 5791250], length 1026
1450051830.495726 IP 10.1.1.2.2000 > 10.1.1.1.2000: Flags [.], ack 105679, win 361, options [nop,nop,TS val 5791263 ecr 5791253], length 0
1450051830.506769 IP 10.1.1.1.2000 > 10.1.1.2.2000: Flags [P.], seq 105679:106705, ack 1, win 57, options [nop,nop,TS val 5791265 ecr 5791263], length 1026
1450051830.543742 IP 10.1.1.2.2000 > 10.1.1.1.2000: Flags [.], ack 106705, win 361, options [nop,nop,TS val 5791275 ecr 5791265], length 0
1450051830.556752 IP 10.1.1.1.2000 > 10.1.1.2.2000: Flags [P.], seq 106705:107731, ack 1, win 57, options [nop,nop,TS val 5791278 ecr 5791275], length 1026
1450051830.595706 IP 10.1.1.2.2000 > 10.1.1.1.2000: Flags [.], ack 107731, win 361, options [nop,nop,TS val 5791288 ecr 5791278], length 0
1450051830.606710 IP 10.1.1.1.2000 > 10.1.1.2.2000: Flags [P.], seq 107731:108757, ack 1, win 57, options [nop,nop,TS val 5791290 ecr 5791288], length 1026
1450051830.643677 IP 10.1.1.2.2000 > 10.1.1.1.2000: Flags [.], ack 108757, win 361, options [nop,nop,TS val 5791300 ecr 5791290], length 0
1450051830.656657 IP 10.1.1.1.2000 > 10.1.1.2.2000: Flags [P.], seq 108757:109783, ack 1, win 57, options [nop,nop,TS val 5791303 ecr 5791300], length 1026
1450051830.695677 IP 10.1.1.2.2000 > 10.1.1.1.2000: Flags [.], ack 109783, win 361, options [nop,nop,TS val 5791313 ecr 5791303], length 0
1450051830.706648 IP 10.1.1.1.2000 > 10.1.1.2.2000: Flags [P.], seq 109783:110809, ack 1, win 57, options [nop,nop,TS val 5791315 ecr 5791313], length 1026
1450051830.743677 IP 10.1.1.2.2000 > 10.1.1.1.2000: Flags [.], ack 110809, win 361, options [nop,nop,TS val 5791325 ecr 5791315], length 0
1450051830.756663 IP 10.1.1.1.2000 > 10.1.1.2.2000: Flags [P.], seq 110809:111835, ack 1, win 57, options [nop,nop,TS val 5791328 ecr 5791325], length 1026
1450051830.795685 IP 10.1.1.2.2000 > 10.1.1.1.2000: Flags [.], ack 111835, win 361, options [nop,nop,TS val 5791338 ecr 5791328], length 0
1450051830.806625 IP 10.1.1.1.2000 > 10.1.1.2.2000: Flags [P.], seq 111835:112861, ack 1, win 57, options [nop,nop,TS val 5791340 ecr 5791338], length 1026
1450051830.843674 IP 10.1.1.2.2000 > 10.1.1.1.2000: Flags [.], ack 112861, win 361, options [nop,nop,TS val 5791350 ecr 5791340], length 0
1450051830.856647 IP 10.1.1.1.2000 > 10.1.1.2.2000: Flags [P.], seq 112861:113887, ack 1, win 57, options [nop,nop,TS val 5791353 ecr 5791350], length 1026
1450051830.895706 IP 10.1.1.2.2000 > 10.1.1.1.2000: Flags [.], ack 113887, win 361, options [nop,nop,TS val 5791363 ecr 5791353], length 0
1450051830.906731 IP 10.1.1.1.2000 > 10.1.1.2.2000: Flags [P.], seq 113887:114913, ack 1, win 57, options [nop,nop,TS val 5791365 ecr 5791363], length 1026
1450051830.943681 IP 10.1.1.2.2000 > 10.1.1.1.2000: Flags [.], ack 114913, win 361, options [nop,nop,TS val 5791375 ecr 5791365], length 0
1450051830.956695 IP 10.1.1.1.2000 > 10.1.1.2.2000: Flags [P.], seq 114913:115939, ack 1, win 57, options [nop,nop,TS val 5791378 ecr 5791375], length 1026
1450051830.995699 IP 10.1.1.2.2000 > 10.1.1.1.2000: Flags [.], ack 115939, win 361, options [nop,nop,TS val 5791388 ecr 5791378], length 0
1450051831.006674 IP 10.1.1.1.2000 > 10.1.1.2.2000: Flags [P.], seq 115939:116965, ack 1, win 57, options [nop,nop,TS val 5791390 ecr 5791388], length 1026
1450051831.043675 IP 10.1.1.2.2000 > 10.1.1.1.2000: Flags [.], ack 116965, win 361, options [nop,nop,TS val 5791400 ecr 5791390], length 0
1450051831.056665 IP 10.1.1.1.2000 > 10.1.1.2.2000: Flags [P.], seq 116965:117991, ack 1, win 57, options [nop,nop,TS val 5791403 ecr 5791400], length 1026
1450051831.095683 IP 10.1.1.2.2000 > 10.1.1.1.2000: Flags [.], ack 117991, win 361, options [nop,nop,TS val 5791413 ecr 5791403], length 0
1450051831.106672 IP 10.1.1.1.2000 > 10.1.1.2.2000: Flags [P.], seq 117991:119017, ack 1, win 57, options [nop,nop,TS val 5791415 ecr 5791413], length 1026
1450051831.143705 IP 10.1.1.2.2000 > 10.1.1.1.2000: Flags [.], ack 119017, win 361, options [nop,nop,TS val 5791425 ecr 5791415], length 0
1450051831.156713 IP 10.1.1.1.2000 > 10.1.1.2.2000: Flags [P.], seq 119017:120043, ack 1, win 57, options [nop,nop,TS val 5791428 ecr 5791425], length 1026
1450051831.195705 IP 10.1.1.2.2000 > 10.1.1.1.2000: Flags [.], ack 120043, win 361, options [nop,nop,TS val 5791438 ecr 5791428], length 0
1450051831.206727 IP 10.1.1.1.2000 > 10.1.1.2.2000: Flags [P.], seq 120043:121069, ack 1, win 57, options [nop,nop,TS val 5791440 ecr 5791438], length 1026
1450051831.243749 IP 10.1.1.2.2000 > 10.1.1.1.2000: Flags [.], ack 121069, win 361, options [nop,nop,TS val 5791450 ecr 5791440], length 0
1450051831.256739 IP 10.1.1.1.2000 > 10.1.1.2.2000: Flags [P.], seq 121069:122095, ack 1, win 57, options [nop,nop,TS val 5791453 ecr 5791450], length 1026
1450051831.295713 IP 10.1.1.2.2000 > 10.1.1.1.2000: Flags [.], ack 122095, win 361, options [nop,nop,TS val 5791463 ecr 5791453], length 0
1450051831.306712 IP 10.1.1.1.2000 > 10.1.1.2.2000: Flags [P.], seq 122095:123121, ack 1, win 57, options [nop,nop,TS val 5791465 ecr 5791463], length 1026
1450051831.343689 IP 10.1.1.2.2000 > 10.1.1.1.2000: Flags [.], ack 123121, win 361, options [nop,nop,TS val 5791475 ecr 5791465], length 0
1450051831.356637 IP 10.1.1.1.2000 > 10.1.1.2.2000: Flags [P.], seq 123121:124147, ack 1, win 57, options [nop,nop,TS val 5791478 ecr 5791475], length 1026
1450051831.395708 IP 10.1.1.2.2000 > 10.1.1.1.2000: Flags [.], ack 124147, win 361, options [nop,nop,TS val 5791488 ecr 5791478], length 0
1450051831.406689 IP 10.1.1.1.2000 > 10.1.1.2.2000: Flags [P.], seq 124147:125173, ack 1, win 57, options [nop,nop,TS val 5791490 ecr 5791488], length 1026
1450051831.443674 IP 10.1.1.2.2000 > 10.1.1.1.2000: Flags [.], ack 125173, win 361, options [nop,nop,TS val 5791500 ecr 5791490], length 0
1450051831.456658 IP 10.1.1.1.2000 > 10.1.1.2.2000: Flags [P.], seq 125173:126199, ack 1, win 57, options [nop,nop,TS val 5791503 ecr 5791500], length 1026
1450051831.495684 IP 10.1.1.2.2000 > 10.1.1.1.2000: Flags [.], ack 126199, win 361, options [nop,nop,TS val 5791513 ecr 5791503], length 0
1450051831.506644 IP 10.1.1.1.2000 > 10.1.1.2.2000: Flags [P.], seq 126199:127225, ack 1, win 57, options [nop,nop,TS val 5791515 ecr 5791513], length 1026
1450051831.543675 IP 10.1.1.2.2000 > 10.1.1.1.2000: Flags [.], ack 127225, win 361, options [nop,nop,TS val 5791525 ecr 5791515], length 0
1450051831.556651 IP 10.1.1.1.2000 > 10.1.1.2.2000: Flags [P.], seq 127225:128251, ack 1, win 57, options [nop,nop,TS val 5791528 ecr 5791525], length 1026
1450051831.595677 IP 10.1.1.2.2000 > 10.1.1.1.2000: Flags [.], ack 128251, win 361, options [nop,nop,TS val 5791538 ecr 5791528], length 0
1450051831.606652 IP 10.1.1.1.2000 > 10.1.1.2.2000: Flags [P.], seq 128251:129277, ack 1, win 57, options [nop,nop,TS val 5791540 ecr 5791538], length 1026
1450051831.643675 IP 10.1.1.2.2000 > 10.1.1.1.2000: Flags [.], ack 129277, win 361, options [nop,nop,TS val 5791550 ecr 5791540], length 0
1450051831.656647 IP 10.1.1.1.2000 > 10.1.1.2.2000: Flags [P.], seq 129277:130303, ack 1, win 57, options [nop,nop,TS val 5791553 ecr 5791550], length 1026
1450051831.695681 IP 10.1.1.2.2000 > 10.1.1.1.2000: Flags [.], ack 130303, win 361, options [nop,nop,TS val 5791563 ecr 5791553], length 0
1450051831.706624 IP 10.1.1.1.2000 > 10.1.1.2.2000: Flags [P.], seq 130303:131329, ack 1, win 57, options [nop,nop,TS val 5791565 ecr 5791563], length 1026
1450051831.743677 IP 10.1.1.2.2000 > 10.1.1.1.2000: Flags [.], ack 131329, win 361, options [nop,nop,TS val 5791575 ecr 5791565], length 0
1450051831.756644 IP 10.1.1.1.2000 > 10.1.1.2.2000: Flags [P.], seq 131329:132355, ack 1, win 57, options [nop,nop,TS val 5791578 ecr 5791575], length 1026
1450051831.795687 IP 10.1.1.2.2000 > 10.1.1.1.2000: Flags [.], ack 132355, win 361, options [nop,nop,TS val 5791588 ecr 5791578], length 0
1450051831.806647 IP 10.1.1.1.2000 > 10.1.1.2.2000: Flags [P.], seq 132355:133381, ack 1, win 57, options [nop,nop,TS val 5791590 ecr 5791588], length 1026
1450051831.843678 IP 10.1.1.2.2000 > 10.1.1.1.2000: Flags [.], ack 133381, win 361, options [nop,nop,TS val 5791600 ecr 5791590], length 0
1450051831.856627 IP 10.1.1.1.2000 > 10.1.1.2.2000: Flags [P.], seq 133381:134407, ack 1, win 57, options [nop,nop,TS val 5791603 ecr 5791600], length 1026
1450051831.895679 IP 10.1.1.2.2000 > 10.1.1.1.2000: Flags [.], ack 134407, win 361, options [nop,nop,TS val 5791613 ecr 5791603], length 0
1450051831.906632 IP 10.1.1.1.2000 > 10.1.1.2.2000: Flags [P.], seq 134407:135433, ack 1, win 57, options [nop,nop,TS val 5791615 ecr 5791613], length 1026
1450051831.943680 IP 10.1.1.2.2000 > 10.1.1.1.2000: Flags [.], ack 135433, win 361, options [nop,nop,TS val 5791625 ecr 5791615], length 0
1450051831.956622 IP 10.1.1.1.2000 > 10.1.1.2.2000: Flags [P.], seq 135433:136459, ack 1, win 57, options [nop,nop,TS val 5791628 ecr 5791625], length 1026
