1450054317.649686 IP 10.1.1.2.17500 > 10.1.1.255.17500: UDP, length 293
1450054347.673504 IP 10.1.1.2.17500 > 10.1.1.255.17500: UDP, length 293
1450054352.534088 IP 10.1.1.2.50225 > 10.1.1.1.2000: Flags [S], seq 1598197867, win 29200, options [mss 1460,sackOK,TS val 6421772 ecr 0,nop,wscale 9], length 0
1450054352.534121 IP 10.1.1.1.2000 > 10.1.1.2.50225: Flags [S.], seq 3858951956, ack 1598197868, win 28960, options [mss 1460,sackOK,TS val 6421772 ecr 6421772,nop,wscale 9], length 0
1450054352.534162 IP 10.1.1.2.50225 > 10.1.1.1.2000: Flags [.], ack 1, win 58, options [nop,nop,TS val 6421772 ecr 6421772], length 0
1450054352.534738 IP 10.1.1.2.60653 > 10.1.1.1.2000: Flags [S], seq 2780604521, win 29200, options [mss 1460,sackOK,TS val 6421772 ecr 0,nop,wscale 9], length 0
1450054352.534759 IP 10.1.1.1.2000 > 10.1.1.2.60653: Flags [S.], seq 530474537, ack 2780604522, win 28960, options [mss 1460,sackOK,TS val 6421772 ecr 6421772,nop,wscale 9], length 0
1450054352.534781 IP 10.1.1.2.60653 > 10.1.1.1.2000: Flags [.], ack 1, win 58, options [nop,nop,TS val 6421772 ecr 6421772], length 0
1450054352.534886 IP 10.1.1.2.56705 > 10.1.1.1.2000: Flags [S], seq 4011828993, win 29200, options [mss 1460,sackOK,TS val 6421772 ecr 0,nop,wscale 9], length 0
1450054352.534902 IP 10.1.1.1.2000 > 10.1.1.2.56705: Flags [S.], seq 166478232, ack 4011828994, win 28960, options [mss 1460,sackOK,TS val 6421772 ecr 6421772,nop,wscale 9], length 0
1450054352.534928 IP 10.1.1.2.56705 > 10.1.1.1.2000: Flags [.], ack 1, win 58, options [nop,nop,TS val 6421772 ecr 6421772], length 0
1450054352.535040 IP 10.1.1.2.55311 > 10.1.1.1.2000: Flags [S], seq 3780407267, win 29200, options [mss 1460,sackOK,TS val 6421772 ecr 0,nop,wscale 9], length 0
1450054352.535056 IP 10.1.1.1.2000 > 10.1.1.2.55311: Flags [S.], seq 4094482197, ack 3780407268, win 28960, options [mss 1460,sackOK,TS val 6421772 ecr 6421772,nop,wscale 9], length 0
1450054352.535085 IP 10.1.1.2.55311 > 10.1.1.1.2000: Flags [.], ack 1, win 58, options [nop,nop,TS val 6421772 ecr 6421772], length 0
1450054352.535169 IP 10.1.1.2.34920 > 10.1.1.1.2000: Flags [S], seq 1432288415, win 29200, options [mss 1460,sackOK,TS val 6421772 ecr 0,nop,wscale 9], length 0
1450054352.535180 IP 10.1.1.1.2000 > 10.1.1.2.34920: Flags [S.], seq 49243394, ack 1432288416, win 28960, options [mss 1460,sackOK,TS val 6421772 ecr 6421772,nop,wscale 9], length 0
1450054352.535201 IP 10.1.1.2.34920 > 10.1.1.1.2000: Flags [.], ack 1, win 58, options [nop,nop,TS val 6421772 ecr 6421772], length 0
1450054352.585655 IP 10.1.1.1.2000 > 10.1.1.2.50225: Flags [P.], seq 1:1027, ack 1, win 57, options [nop,nop,TS val 6421785 ecr 6421772], length 1026
1450054352.585723 IP 10.1.1.2.50225 > 10.1.1.1.2000: Flags [.], ack 1027, win 62, options [nop,nop,TS val 6421785 ecr 6421785], length 0
1450054352.635700 IP 10.1.1.1.2000 > 10.1.1.2.60653: Flags [P.], seq 1:1027, ack 1, win 57, options [nop,nop,TS val 6421798 ecr 6421772], length 1026
1450054352.635760 IP 10.1.1.2.60653 > 10.1.1.1.2000: Flags [.], ack 1027, win 62, options [nop,nop,TS val 6421798 ecr 6421798], length 0
1450054352.685540 IP 10.1.1.1.2000 > 10.1.1.2.56705: Flags [P.], seq 1:1027, ack 1, win 57, options [nop,nop,TS val 6421810 ecr 6421772], length 1026
1450054352.685599 IP 10.1.1.2.56705 > 10.1.1.1.2000: Flags [.], ack 1027, win 62, options [nop,nop,TS val 6421810 ecr 6421810], length 0
1450054352.735512 IP 10.1.1.1.2000 > 10.1.1.2.55311: Flags [P.], seq 1:1027, ack 1, win 57, options [nop,nop,TS val 6421822 ecr 6421772], length 1026
1450054352.735567 IP 10.1.1.2.55311 > 10.1.1.1.2000: Flags [.], ack 1027, win 62, options [nop,nop,TS val 6421822 ecr 6421822], length 0
1450054352.785544 IP 10.1.1.1.2000 > 10.1.1.2.34920: Flags [P.], seq 1:1027, ack 1, win 57, options [nop,nop,TS val 6421835 ecr 6421772], length 1026
1450054352.785600 IP 10.1.1.2.34920 > 10.1.1.1.2000: Flags [.], ack 1027, win 62, options [nop,nop,TS val 6421835 ecr 6421835], length 0
1450054352.835932 IP 10.1.1.1.2000 > 10.1.1.2.50225: Flags [P.], seq 1027:2053, ack 1, win 57, options [nop,nop,TS val 6421848 ecr 6421785], length 1026
1450054352.835980 IP 10.1.1.2.50225 > 10.1.1.1.2000: Flags [.], ack 2053, win 66, options [nop,nop,TS val 6421848 ecr 6421848], length 0
1450054352.885495 IP 10.1.1.1.2000 > 10.1.1.2.60653: Flags [P.], seq 1027:2053, ack 1, win 57, options [nop,nop,TS val 6421860 ecr 6421798], length 1026
1450054352.885542 IP 10.1.1.2.60653 > 10.1.1.1.2000: Flags [.], ack 2053, win 66, options [nop,nop,TS val 6421860 ecr 6421860], length 0
1450054352.935504 IP 10.1.1.1.2000 > 10.1.1.2.56705: Flags [P.], seq 1027:2053, ack 1, win 57, options [nop,nop,TS val 6421872 ecr 6421810], length 1026
1450054352.935549 IP 10.1.1.2.56705 > 10.1.1.1.2000: Flags [.], ack 2053, win 66, options [nop,nop,TS val 6421872 ecr 6421872], length 0
1450054352.985477 IP 10.1.1.1.2000 > 10.1.1.2.55311: Flags [P.], seq 1027:2053, ack 1, win 57, options [nop,nop,TS val 6421885 ecr 6421822], length 1026
1450054352.985521 IP 10.1.1.2.55311 > 10.1.1.1.2000: Flags [.], ack 2053, win 66, options [nop,nop,TS val 6421885 ecr 6421885], length 0
1450054353.035508 IP 10.1.1.1.2000 > 10.1.1.2.34920: Flags [P.], seq 1027:2053, ack 1, win 57, options [nop,nop,TS val 6421897 ecr 6421835], length 1026
1450054353.035560 IP 10.1.1.2.34920 > 10.1.1.1.2000: Flags [.], ack 2053, win 66, options [nop,nop,TS val 6421897 ecr 6421897], length 0
1450054353.085495 IP 10.1.1.1.2000 > 10.1.1.2.50225: Flags [P.], seq 2053:3079, ack 1, win 57, options [nop,nop,TS val 6421910 ecr 6421848], length 1026
1450054353.085540 IP 10.1.1.2.50225 > 10.1.1.1.2000: Flags [.], ack 3079, win 70, options [nop,nop,TS val 6421910 ecr 6421910], length 0
1450054353.135509 IP 10.1.1.1.2000 > 10.1.1.2.60653: Flags [P.], seq 2053:3079, ack 1, win 57, options [nop,nop,TS val 6421922 ecr 6421860], length 1026
1450054353.135554 IP 10.1.1.2.60653 > 10.1.1.1.2000: Flags [.], ack 3079, win 70, options [nop,nop,TS val 6421922 ecr 6421922], length 0
1450054353.185475 IP 10.1.1.1.2000 > 10.1.1.2.56705: Flags [P.], seq 2053:3079, ack 1, win 57, options [nop,nop,TS val 6421935 ecr 6421872], length 1026
1450054353.185518 IP 10.1.1.2.56705 > 10.1.1.1.2000: Flags [.], ack 3079, win 70, options [nop,nop,TS val 6421935 ecr 6421935], length 0
1450054353.235414 IP 10.1.1.1.2000 > 10.1.1.2.55311: Flags [P.], seq 2053:3079, ack 1, win 57, options [nop,nop,TS val 6421947 ecr 6421885], length 1026
1450054353.235436 IP 10.1.1.2.55311 > 10.1.1.1.2000: Flags [.], ack 3079, win 70, options [nop,nop,TS val 6421947 ecr 6421947], length 0
1450054353.285471 IP 10.1.1.1.2000 > 10.1.1.2.34920: Flags [P.], seq 2053:3079, ack 1, win 57, options [nop,nop,TS val 6421960 ecr 6421897], length 1026
1450054353.285518 IP 10.1.1.2.34920 > 10.1.1.1.2000: Flags [.], ack 3079, win 70, options [nop,nop,TS val 6421960 ecr 6421960], length 0
1450054353.335487 IP 10.1.1.1.2000 > 10.1.1.2.50225: Flags [P.], seq 3079:4105, ack 1, win 57, options [nop,nop,TS val 6421972 ecr 6421910], length 1026
1450054353.335533 IP 10.1.1.2.50225 > 10.1.1.1.2000: Flags [.], ack 4105, win 74, options [nop,nop,TS val 6421972 ecr 6421972], length 0
1450054353.385464 IP 10.1.1.1.2000 > 10.1.1.2.60653: Flags [P.], seq 3079:4105, ack 1, win 57, options [nop,nop,TS val 6421985 ecr 6421922], length 1026
1450054353.385528 IP 10.1.1.2.60653 > 10.1.1.1.2000: Flags [.], ack 4105, win 74, options [nop,nop,TS val 6421985 ecr 6421985], length 0
1450054353.435516 IP 10.1.1.1.2000 > 10.1.1.2.56705: Flags [P.], seq 3079:4105, ack 1, win 57, options [nop,nop,TS val 6421997 ecr 6421935], length 1026
1450054353.435562 IP 10.1.1.2.56705 > 10.1.1.1.2000: Flags [.], ack 4105, win 74, options [nop,nop,TS val 6421997 ecr 6421997], length 0
1450054353.485511 IP 10.1.1.1.2000 > 10.1.1.2.55311: Flags [P.], seq 3079:4105, ack 1, win 57, options [nop,nop,TS val 6422010 ecr 6421947], length 1026
1450054353.485544 IP 10.1.1.2.55311 > 10.1.1.1.2000: Flags [.], ack 4105, win 74, options [nop,nop,TS val 6422010 ecr 6422010], length 0
1450054353.535510 IP 10.1.1.1.2000 > 10.1.1.2.34920: Flags [P.], seq 3079:4105, ack 1, win 57, options [nop,nop,TS val 6422022 ecr 6421960], length 1026
1450054353.535562 IP 10.1.1.2.34920 > 10.1.1.1.2000: Flags [.], ack 4105, win 74, options [nop,nop,TS val 6422022 ecr 6422022], length 0
1450054353.585475 IP 10.1.1.1.2000 > 10.1.1.2.50225: Flags [P.], seq 4105:5131, ack 1, win 57, options [nop,nop,TS val 6422035 ecr 6421972], length 1026
1450054353.585529 IP 10.1.1.2.50225 > 10.1.1.1.2000: Flags [.], ack 5131, win 78, options [nop,nop,TS val 6422035 ecr 6422035], length 0
1450054353.635485 IP 10.1.1.1.2000 > 10.1.1.2.60653: Flags [P.], seq 4105:5131, ack 1, win 57, options [nop,nop,TS val 6422047 ecr 6421985], length 1026
1450054353.635545 IP 10.1.1.2.60653 > 10.1.1.1.2000: Flags [.], ack 5131, win 78, options [nop,nop,TS val 6422047 ecr 6422047], length 0
1450054353.685510 IP 10.1.1.1.2000 > 10.1.1.2.56705: Flags [P.], seq 4105:5131, ack 1, win 57, options [nop,nop,TS val 6422060 ecr 6421997], length 1026
1450054353.685563 IP 10.1.1.2.56705 > 10.1.1.1.2000: Flags [.], ack 5131, win 78, options [nop,nop,TS val 6422060 ecr 6422060], length 0
1450054353.735492 IP 10.1.1.1.2000 > 10.1.1.2.55311: Flags [P.], seq 4105:5131, ack 1, win 57, options [nop,nop,TS val 6422072 ecr 6422010], length 1026
1450054353.735553 IP 10.1.1.2.55311 > 10.1.1.1.2000: Flags [.], ack 5131, win 78, options [nop,nop,TS val 6422072 ecr 6422072], length 0
1450054353.785491 IP 10.1.1.1.2000 > 10.1.1.2.34920: Flags [P.], seq 4105:5131, ack 1, win 57, options [nop,nop,TS val 6422085 ecr 6422022], length 1026
1450054353.785530 IP 10.1.1.2.34920 > 10.1.1.1.2000: Flags [.], ack 5131, win 78, options [nop,nop,TS val 6422085 ecr 6422085], length 0
1450054353.835461 IP 10.1.1.1.2000 > 10.1.1.2.50225: Flags [P.], seq 5131:6157, ack 1, win 57, options [nop,nop,TS val 6422097 ecr 6422035], length 1026
1450054353.835502 IP 10.1.1.2.50225 > 10.1.1.1.2000: Flags [.], ack 6157, win 82, options [nop,nop,TS val 6422097 ecr 6422097], length 0
1450054353.885494 IP 10.1.1.1.2000 > 10.1.1.2.60653: Flags [P.], seq 5131:6157, ack 1, win 57, options [nop,nop,TS val 6422110 ecr 6422047], length 1026
1450054353.885539 IP 10.1.1.2.60653 > 10.1.1.1.2000: Flags [.], ack 6157, win 82, options [nop,nop,TS val 6422110 ecr 6422110], length 0
1450054353.935506 IP 10.1.1.1.2000 > 10.1.1.2.56705: Flags [P.], seq 5131:6157, ack 1, win 57, options [nop,nop,TS val 6422122 ecr 6422060], length 1026
1450054353.935548 IP 10.1.1.2.56705 > 10.1.1.1.2000: Flags [.], ack 6157, win 82, options [nop,nop,TS val 6422122 ecr 6422122], length 0
1450054353.985537 IP 10.1.1.1.2000 > 10.1.1.2.55311: Flags [P.], seq 5131:6157, ack 1, win 57, options [nop,nop,TS val 6422135 ecr 6422072], length 1026
1450054353.985589 IP 10.1.1.2.55311 > 10.1.1.1.2000: Flags [.], ack 6157, win 82, options [nop,nop,TS val 6422135 ecr 6422135], length 0
1450054354.035521 IP 10.1.1.1.2000 > 10.1.1.2.34920: Flags [P.], seq 5131:6157, ack 1, win 57, options [nop,nop,TS val 6422147 ecr 6422085], length 1026
1450054354.035571 IP 10.1.1.2.34920 > 10.1.1.1.2000: Flags [.], ack 6157, win 82, options [nop,nop,TS val 6422147 ecr 6422147], length 0
1450054354.085519 IP 10.1.1.1.2000 > 10.1.1.2.50225: Flags [P.], seq 6157:7183, ack 1, win 57, options [nop,nop,TS val 6422160 ecr 6422097], length 1026
1450054354.085588 IP 10.1.1.2.50225 > 10.1.1.1.2000: Flags [.], ack 7183, win 86, options [nop,nop,TS val 6422160 ecr 6422160], length 0
1450054354.135538 IP 10.1.1.1.2000 > 10.1.1.2.60653: Flags [P.], seq 6157:7183, ack 1, win 57, options [nop,nop,TS val 6422172 ecr 6422110], length 1026
1450054354.135614 IP 10.1.1.2.60653 > 10.1.1.1.2000: Flags [.], ack 7183, win 86, options [nop,nop,TS val 6422172 ecr 6422172], length 0
1450054354.185513 IP 10.1.1.1.2000 > 10.1.1.2.56705: Flags [P.], seq 6157:7183, ack 1, win 57, options [nop,nop,TS val 6422185 ecr 6422122], length 1026
1450054354.185583 IP 10.1.1.2.56705 > 10.1.1.1.2000: Flags [.], ack 7183, win 86, options [nop,nop,TS val 6422185 ecr 6422185], length 0
1450054354.235463 IP 10.1.1.1.2000 > 10.1.1.2.55311: Flags [P.], seq 6157:7183, ack 1, win 57, options [nop,nop,TS val 6422197 ecr 6422135], length 1026
1450054354.235508 IP 10.1.1.2.55311 > 10.1.1.1.2000: Flags [.], ack 7183, win 86, options [nop,nop,TS val 6422197 ecr 6422197], length 0
1450054354.285505 IP 10.1.1.1.2000 > 10.1.1.2.34920: Flags [P.], seq 6157:7183, ack 1, win 57, options [nop,nop,TS val 6422210 ecr 6422147], length 1026
1450054354.285549 IP 10.1.1.2.34920 > 10.1.1.1.2000: Flags [.], ack 7183, win 86, options [nop,nop,TS val 6422210 ecr 6422210], length 0
1450054354.335471 IP 10.1.1.1.2000 > 10.1.1.2.50225: Flags [P.], seq 7183:8209, ack 1, win 57, options [nop,nop,TS val 6422222 ecr 6422160], length 1026
1450054354.335518 IP 10.1.1.2.50225 > 10.1.1.1.2000: Flags [.], ack 8209, win 90, options [nop,nop,TS val 6422222 ecr 6422222], length 0
1450054354.385450 IP 10.1.1.1.2000 > 10.1.1.2.60653: Flags [P.], seq 7183:8209, ack 1, win 57, options [nop,nop,TS val 6422235 ecr 6422172], length 1026
1450054354.385496 IP 10.1.1.2.60653 > 10.1.1.1.2000: Flags [.], ack 8209, win 90, options [nop,nop,TS val 6422235 ecr 6422235], length 0
1450054354.435513 IP 10.1.1.1.2000 > 10.1.1.2.56705: Flags [P.], seq 7183:8209, ack 1, win 57, options [nop,nop,TS val 6422247 ecr 6422185], length 1026
1450054354.435570 IP 10.1.1.2.56705 > 10.1.1.1.2000: Flags [.], ack 8209, win 90, options [nop,nop,TS val 6422247 ecr 6422247], length 0
1450054354.485435 IP 10.1.1.1.2000 > 10.1.1.2.55311: Flags [P.], seq 7183:8209, ack 1, win 57, options [nop,nop,TS val 6422260 ecr 6422197], length 1026
1450054354.485466 IP 10.1.1.2.55311 > 10.1.1.1.2000: Flags [.], ack 8209, win 90, options [nop,nop,TS val 6422260 ecr 6422260], length 0
1450054354.535511 IP 10.1.1.1.2000 > 10.1.1.2.34920: Flags [P.], seq 7183:8209, ack 1, win 57, options [nop,nop,TS val 6422272 ecr 6422210], length 1026
1450054354.535568 IP 10.1.1.2.34920 > 10.1.1.1.2000: Flags [.], ack 8209, win 90, options [nop,nop,TS val 6422272 ecr 6422272], length 0
1450054354.585510 IP 10.1.1.1.2000 > 10.1.1.2.50225: Flags [P.], seq 8209:9235, ack 1, win 57, options [nop,nop,TS val 6422285 ecr 6422222], length 1026
1450054354.585563 IP 10.1.1.2.50225 > 10.1.1.1.2000: Flags [.], ack 9235, win 94, options [nop,nop,TS val 6422285 ecr 6422285], length 0
1450054354.635489 IP 10.1.1.1.2000 > 10.1.1.2.60653: Flags [P.], seq 8209:9235, ack 1, win 57, options [nop,nop,TS val 6422297 ecr 6422235], length 1026
1450054354.635541 IP 10.1.1.2.60653 > 10.1.1.1.2000: Flags [.], ack 9235, win 94, options [nop,nop,TS val 6422297 ecr 6422297], length 0
1450054354.685499 IP 10.1.1.1.2000 > 10.1.1.2.56705: Flags [P.], seq 8209:9235, ack 1, win 57, options [nop,nop,TS val 6422310 ecr 6422247], length 1026
1450054354.685552 IP 10.1.1.2.56705 > 10.1.1.1.2000: Flags [.], ack 9235, win 94, options [nop,nop,TS val 6422310 ecr 6422310], length 0
1450054354.735515 IP 10.1.1.1.2000 > 10.1.1.2.55311: Flags [P.], seq 8209:9235, ack 1, win 57, options [nop,nop,TS val 6422322 ecr 6422260], length 1026
1450054354.735569 IP 10.1.1.2.55311 > 10.1.1.1.2000: Flags [.], ack 9235, win 94, options [nop,nop,TS val 6422322 ecr 6422322], length 0
1450054354.785469 IP 10.1.1.1.2000 > 10.1.1.2.34920: Flags [P.], seq 8209:9235, ack 1, win 57, options [nop,nop,TS val 6422335 ecr 6422272], length 1026
1450054354.785522 IP 10.1.1.2.34920 > 10.1.1.1.2000: Flags [.], ack 9235, win 94, options [nop,nop,TS val 6422335 ecr 6422335], length 0
1450054354.835499 IP 10.1.1.1.2000 > 10.1.1.2.50225: Flags [P.], seq 9235:10261, ack 1, win 57, options [nop,nop,TS val 6422347 ecr 6422285], length 1026
1450054354.835548 IP 10.1.1.2.50225 > 10.1.1.1.2000: Flags [.], ack 10261, win 98, options [nop,nop,TS val 6422347 ecr 6422347], length 0
1450054354.885458 IP 10.1.1.1.2000 > 10.1.1.2.60653: Flags [P.], seq 9235:10261, ack 1, win 57, options [nop,nop,TS val 6422360 ecr 6422297], length 1026
1450054354.885509 IP 10.1.1.2.60653 > 10.1.1.1.2000: Flags [.], ack 10261, win 98, options [nop,nop,TS val 6422360 ecr 6422360], length 0
1450054354.935513 IP 10.1.1.1.2000 > 10.1.1.2.56705: Flags [P.], seq 9235:10261, ack 1, win 57, options [nop,nop,TS val 6422372 ecr 6422310], length 1026
1450054354.935569 IP 10.1.1.2.56705 > 10.1.1.1.2000: Flags [.], ack 10261, win 98, options [nop,nop,TS val 6422372 ecr 6422372], length 0
1450054354.985510 IP 10.1.1.1.2000 > 10.1.1.2.55311: Flags [P.], seq 9235:10261, ack 1, win 57, options [nop,nop,TS val 6422385 ecr 6422322], length 1026
1450054354.985557 IP 10.1.1.2.55311 > 10.1.1.1.2000: Flags [.], ack 10261, win 98, options [nop,nop,TS val 6422385 ecr 6422385], length 0
1450054355.035493 IP 10.1.1.1.2000 > 10.1.1.2.34920: Flags [P.], seq 9235:10261, ack 1, win 57, options [nop,nop,TS val 6422397 ecr 6422335], length 1026
1450054355.035545 IP 10.1.1.2.34920 > 10.1.1.1.2000: Flags [.], ack 10261, win 98, options [nop,nop,TS val 6422397 ecr 6422397], length 0
1450054355.085507 IP 10.1.1.1.2000 > 10.1.1.2.50225: Flags [P.], seq 10261:11287, ack 1, win 57, options [nop,nop,TS val 6422410 ecr 6422347], length 1026
1450054355.085563 IP 10.1.1.2.50225 > 10.1.1.1.2000: Flags [.], ack 11287, win 102, options [nop,nop,TS val 6422410 ecr 6422410], length 0
1450054355.135505 IP 10.1.1.1.2000 > 10.1.1.2.60653: Flags [P.], seq 10261:11287, ack 1, win 57, options [nop,nop,TS val 6422422 ecr 6422360], length 1026
1450054355.135559 IP 10.1.1.2.60653 > 10.1.1.1.2000: Flags [.], ack 11287, win 102, options [nop,nop,TS val 6422422 ecr 6422422], length 0
1450054355.185510 IP 10.1.1.1.2000 > 10.1.1.2.56705: Flags [P.], seq 10261:11287, ack 1, win 57, options [nop,nop,TS val 6422435 ecr 6422372], length 1026
1450054355.185562 IP 10.1.1.2.56705 > 10.1.1.1.2000: Flags [.], ack 11287, win 102, options [nop,nop,TS val 6422435 ecr 6422435], length 0
1450054355.235462 IP 10.1.1.1.2000 > 10.1.1.2.55311: Flags [P.], seq 10261:11287, ack 1, win 57, options [nop,nop,TS val 6422447 ecr 6422385], length 1026
1450054355.235508 IP 10.1.1.2.55311 > 10.1.1.1.2000: Flags [.], ack 11287, win 102, options [nop,nop,TS val 6422447 ecr 6422447], length 0
1450054355.285489 IP 10.1.1.1.2000 > 10.1.1.2.34920: Flags [P.], seq 10261:11287, ack 1, win 57, options [nop,nop,TS val 6422460 ecr 6422397], length 1026
1450054355.285535 IP 10.1.1.2.34920 > 10.1.1.1.2000: Flags [.], ack 11287, win 102, options [nop,nop,TS val 6422460 ecr 6422460], length 0
1450054355.335506 IP 10.1.1.1.2000 > 10.1.1.2.50225: Flags [P.], seq 11287:12313, ack 1, win 57, options [nop,nop,TS val 6422472 ecr 6422410], length 1026
1450054355.335566 IP 10.1.1.2.50225 > 10.1.1.1.2000: Flags [.], ack 12313, win 106, options [nop,nop,TS val 6422472 ecr 6422472], length 0
1450054355.385507 IP 10.1.1.1.2000 > 10.1.1.2.60653: Flags [P.], seq 11287:12313, ack 1, win 57, options [nop,nop,TS val 6422485 ecr 6422422], length 1026
1450054355.385558 IP 10.1.1.2.60653 > 10.1.1.1.2000: Flags [.], ack 12313, win 106, options [nop,nop,TS val 6422485 ecr 6422485], length 0
1450054355.435543 IP 10.1.1.1.2000 > 10.1.1.2.56705: Flags [P.], seq 11287:12313, ack 1, win 57, options [nop,nop,TS val 6422497 ecr 6422435], length 1026
1450054355.435599 IP 10.1.1.2.56705 > 10.1.1.1.2000: Flags [.], ack 12313, win 106, options [nop,nop,TS val 6422497 ecr 6422497], length 0
1450054355.485490 IP 10.1.1.1.2000 > 10.1.1.2.55311: Flags [P.], seq 11287:12313, ack 1, win 57, options [nop,nop,TS val 6422510 ecr 6422447], length 1026
1450054355.485535 IP 10.1.1.2.55311 > 10.1.1.1.2000: Flags [.], ack 12313, win 106, options [nop,nop,TS val 6422510 ecr 6422510], length 0
1450054355.535541 IP 10.1.1.1.2000 > 10.1.1.2.34920: Flags [P.], seq 11287:12313, ack 1, win 57, options [nop,nop,TS val 6422522 ecr 6422460], length 1026
1450054355.535589 IP 10.1.1.2.34920 > 10.1.1.1.2000: Flags [.], ack 12313, win 106, options [nop,nop,TS val 6422522 ecr 6422522], length 0
1450054355.585638 IP 10.1.1.1.2000 > 10.1.1.2.50225: Flags [P.], seq 12313:13339, ack 1, win 57, options [nop,nop,TS val 6422535 ecr 6422472], length 1026
1450054355.585683 IP 10.1.1.2.50225 > 10.1.1.1.2000: Flags [.], ack 13339, win 110, options [nop,nop,TS val 6422535 ecr 6422535], length 0
1450054355.635521 IP 10.1.1.1.2000 > 10.1.1.2.60653: Flags [P.], seq 12313:13339, ack 1, win 57, options [nop,nop,TS val 6422547 ecr 6422485], length 1026
1450054355.635563 IP 10.1.1.2.60653 > 10.1.1.1.2000: Flags [.], ack 13339, win 110, options [nop,nop,TS val 6422547 ecr 6422547], length 0
1450054355.685576 IP 10.1.1.1.2000 > 10.1.1.2.56705: Flags [P.], seq 12313:13339, ack 1, win 57, options [nop,nop,TS val 6422560 ecr 6422497], length 1026
1450054355.685617 IP 10.1.1.2.56705 > 10.1.1.1.2000: Flags [.], ack 13339, win 110, options [nop,nop,TS val 6422560 ecr 6422560], length 0
1450054355.735603 IP 10.1.1.1.2000 > 10.1.1.2.55311: Flags [P.], seq 12313:13339, ack 1, win 57, options [nop,nop,TS val 6422572 ecr 6422510], length 1026
1450054355.735650 IP 10.1.1.2.55311 > 10.1.1.1.2000: Flags [.], ack 13339, win 110, options [nop,nop,TS val 6422572 ecr 6422572], length 0
1450054355.785455 IP 10.1.1.1.2000 > 10.1.1.2.34920: Flags [P.], seq 12313:13339, ack 1, win 57, options [nop,nop,TS val 6422585 ecr 6422522], length 1026
1450054355.785483 IP 10.1.1.2.34920 > 10.1.1.1.2000: Flags [.], ack 13339, win 110, options [nop,nop,TS val 6422585 ecr 6422585], length 0
1450054355.835510 IP 10.1.1.1.2000 > 10.1.1.2.50225: Flags [P.], seq 13339:14365, ack 1, win 57, options [nop,nop,TS val 6422597 ecr 6422535], length 1026
1450054355.835543 IP 10.1.1.2.50225 > 10.1.1.1.2000: Flags [.], ack 14365, win 114, options [nop,nop,TS val 6422597 ecr 6422597], length 0
1450054355.885526 IP 10.1.1.1.2000 > 10.1.1.2.60653: Flags [P.], seq 13339:14365, ack 1, win 57, options [nop,nop,TS val 6422610 ecr 6422547], length 1026
1450054355.885568 IP 10.1.1.2.60653 > 10.1.1.1.2000: Flags [.], ack 14365, win 114, options [nop,nop,TS val 6422610 ecr 6422610], length 0
1450054355.935434 IP 10.1.1.1.2000 > 10.1.1.2.56705: Flags [P.], seq 13339:14365, ack 1, win 57, options [nop,nop,TS val 6422622 ecr 6422560], length 1026
1450054355.935456 IP 10.1.1.2.56705 > 10.1.1.1.2000: Flags [.], ack 14365, win 114, options [nop,nop,TS val 6422622 ecr 6422622], length 0
1450054355.985483 IP 10.1.1.1.2000 > 10.1.1.2.55311: Flags [P.], seq 13339:14365, ack 1, win 57, options [nop,nop,TS val 6422635 ecr 6422572], length 1026
1450054355.985532 IP 10.1.1.2.55311 > 10.1.1.1.2000: Flags [.], ack 14365, win 114, options [nop,nop,TS val 6422635 ecr 6422635], length 0
1450054356.035433 IP 10.1.1.1.2000 > 10.1.1.2.34920: Flags [P.], seq 13339:14365, ack 1, win 57, options [nop,nop,TS val 6422647 ecr 6422585], length 1026
1450054356.035465 IP 10.1.1.2.34920 > 10.1.1.1.2000: Flags [.], ack 14365, win 114, options [nop,nop,TS val 6422647 ecr 6422647], length 0
1450054356.085429 IP 10.1.1.1.2000 > 10.1.1.2.50225: Flags [P.], seq 14365:15391, ack 1, win 57, options [nop,nop,TS val 6422660 ecr 6422597], length 1026
1450054356.085452 IP 10.1.1.2.50225 > 10.1.1.1.2000: Flags [.], ack 15391, win 118, options [nop,nop,TS val 6422660 ecr 6422660], length 0
1450054356.135464 IP 10.1.1.1.2000 > 10.1.1.2.60653: Flags [P.], seq 14365:15391, ack 1, win 57, options [nop,nop,TS val 6422672 ecr 6422610], length 1026
1450054356.135502 IP 10.1.1.2.60653 > 10.1.1.1.2000: Flags [.], ack 15391, win 118, options [nop,nop,TS val 6422672 ecr 6422672], length 0
1450054356.185543 IP 10.1.1.1.2000 > 10.1.1.2.56705: Flags [P.], seq 14365:15391, ack 1, win 57, options [nop,nop,TS val 6422685 ecr 6422622], length 1026
1450054356.185615 IP 10.1.1.2.56705 > 10.1.1.1.2000: Flags [.], ack 15391, win 118, options [nop,nop,TS val 6422685 ecr 6422685], length 0
1450054356.235466 IP 10.1.1.1.2000 > 10.1.1.2.55311: Flags [P.], seq 14365:15391, ack 1, win 57, options [nop,nop,TS val 6422697 ecr 6422635], length 1026
1450054356.235503 IP 10.1.1.2.55311 > 10.1.1.1.2000: Flags [.], ack 15391, win 118, options [nop,nop,TS val 6422697 ecr 6422697], length 0
1450054356.285538 IP 10.1.1.1.2000 > 10.1.1.2.34920: Flags [P.], seq 14365:15391, ack 1, win 57, options [nop,nop,TS val 6422710 ecr 6422647], length 1026
1450054356.285606 IP 10.1.1.2.34920 > 10.1.1.1.2000: Flags [.], ack 15391, win 118, options [nop,nop,TS val 6422710 ecr 6422710], length 0
1450054356.335535 IP 10.1.1.1.2000 > 10.1.1.2.50225: Flags [P.], seq 15391:16417, ack 1, win 57, options [nop,nop,TS val 6422722 ecr 6422660], length 1026
1450054356.335605 IP 10.1.1.2.50225 > 10.1.1.1.2000: Flags [.], ack 16417, win 122, options [nop,nop,TS val 6422722 ecr 6422722], length 0
1450054356.385506 IP 10.1.1.1.2000 > 10.1.1.2.60653: Flags [P.], seq 15391:16417, ack 1, win 57, options [nop,nop,TS val 6422735 ecr 6422672], length 1026
1450054356.385553 IP 10.1.1.2.60653 > 10.1.1.1.2000: Flags [.], ack 16417, win 122, options [nop,nop,TS val 6422735 ecr 6422735], length 0
1450054356.435531 IP 10.1.1.1.2000 > 10.1.1.2.56705: Flags [P.], seq 15391:16417, ack 1, win 57, options [nop,nop,TS val 6422747 ecr 6422685], length 1026
1450054356.435592 IP 10.1.1.2.56705 > 10.1.1.1.2000: Flags [.], ack 16417, win 122, options [nop,nop,TS val 6422747 ecr 6422747], length 0
1450054356.485493 IP 10.1.1.1.2000 > 10.1.1.2.55311: Flags [P.], seq 15391:16417, ack 1, win 57, options [nop,nop,TS val 6422760 ecr 6422697], length 1026
1450054356.485523 IP 10.1.1.2.55311 > 10.1.1.1.2000: Flags [.], ack 16417, win 122, options [nop,nop,TS val 6422760 ecr 6422760], length 0
1450054356.535518 IP 10.1.1.1.2000 > 10.1.1.2.34920: Flags [P.], seq 15391:16417, ack 1, win 57, options [nop,nop,TS val 6422772 ecr 6422710], length 1026
1450054356.535562 IP 10.1.1.2.34920 > 10.1.1.1.2000: Flags [.], ack 16417, win 122, options [nop,nop,TS val 6422772 ecr 6422772], length 0
1450054356.585547 IP 10.1.1.1.2000 > 10.1.1.2.50225: Flags [P.], seq 16417:17443, ack 1, win 57, options [nop,nop,TS val 6422785 ecr 6422722], length 1026
1450054356.585594 IP 10.1.1.2.50225 > 10.1.1.1.2000: Flags [.], ack 17443, win 126, options [nop,nop,TS val 6422785 ecr 6422785], length 0
1450054356.635518 IP 10.1.1.1.2000 > 10.1.1.2.60653: Flags [P.], seq 16417:17443, ack 1, win 57, options [nop,nop,TS val 6422797 ecr 6422735], length 1026
1450054356.635564 IP 10.1.1.2.60653 > 10.1.1.1.2000: Flags [.], ack 17443, win 126, options [nop,nop,TS val 6422797 ecr 6422797], length 0
1450054356.685529 IP 10.1.1.1.2000 > 10.1.1.2.56705: Flags [P.], seq 16417:17443, ack 1, win 57, options [nop,nop,TS val 6422810 ecr 6422747], length 1026
1450054356.685603 IP 10.1.1.2.56705 > 10.1.1.1.2000: Flags [.], ack 17443, win 126, options [nop,nop,TS val 6422810 ecr 6422810], length 0
1450054356.735627 IP 10.1.1.1.2000 > 10.1.1.2.55311: Flags [P.], seq 16417:17443, ack 1, win 57, options [nop,nop,TS val 6422822 ecr 6422760], length 1026
1450054356.735693 IP 10.1.1.2.55311 > 10.1.1.1.2000: Flags [.], ack 17443, win 126, options [nop,nop,TS val 6422823 ecr 6422822], length 0
1450054356.785542 IP 10.1.1.1.2000 > 10.1.1.2.34920: Flags [P.], seq 16417:17443, ack 1, win 57, options [nop,nop,TS val 6422835 ecr 6422772], length 1026
1450054356.785597 IP 10.1.1.2.34920 > 10.1.1.1.2000: Flags [.], ack 17443, win 126, options [nop,nop,TS val 6422835 ecr 6422835], length 0
1450054356.835409 IP 10.1.1.1.2000 > 10.1.1.2.50225: Flags [P.], seq 17443:18469, ack 1, win 57, options [nop,nop,TS val 6422847 ecr 6422785], length 1026
1450054356.835434 IP 10.1.1.2.50225 > 10.1.1.1.2000: Flags [.], ack 18469, win 130, options [nop,nop,TS val 6422847 ecr 6422847], length 0
1450054356.885444 IP 10.1.1.1.2000 > 10.1.1.2.60653: Flags [P.], seq 17443:18469, ack 1, win 57, options [nop,nop,TS val 6422860 ecr 6422797], length 1026
1450054356.885475 IP 10.1.1.2.60653 > 10.1.1.1.2000: Flags [.], ack 18469, win 130, options [nop,nop,TS val 6422860 ecr 6422860], length 0
1450054356.935445 IP 10.1.1.1.2000 > 10.1.1.2.56705: Flags [P.], seq 17443:18469, ack 1, win 57, options [nop,nop,TS val 6422872 ecr 6422810], length 1026
1450054356.935481 IP 10.1.1.2.56705 > 10.1.1.1.2000: Flags [.], ack 18469, win 130, options [nop,nop,TS val 6422872 ecr 6422872], length 0
1450054356.985391 IP 10.1.1.1.2000 > 10.1.1.2.55311: Flags [P.], seq 17443:18469, ack 1, win 57, options [nop,nop,TS val 6422885 ecr 6422823], length 1026
1450054356.985412 IP 10.1.1.2.55311 > 10.1.1.1.2000: Flags [.], ack 18469, win 130, options [nop,nop,TS val 6422885 ecr 6422885], length 0
1450054357.035492 IP 10.1.1.1.2000 > 10.1.1.2.34920: Flags [P.], seq 17443:18469, ack 1, win 57, options [nop,nop,TS val 6422897 ecr 6422835], length 1026
1450054357.035520 IP 10.1.1.2.34920 > 10.1.1.1.2000: Flags [.], ack 18469, win 130, options [nop,nop,TS val 6422897 ecr 6422897], length 0
1450054357.085407 IP 10.1.1.1.2000 > 10.1.1.2.50225: Flags [P.], seq 18469:19495, ack 1, win 57, options [nop,nop,TS val 6422910 ecr 6422847], length 1026
1450054357.085433 IP 10.1.1.2.50225 > 10.1.1.1.2000: Flags [.], ack 19495, win 134, options [nop,nop,TS val 6422910 ecr 6422910], length 0
1450054357.135417 IP 10.1.1.1.2000 > 10.1.1.2.60653: Flags [P.], seq 18469:19495, ack 1, win 57, options [nop,nop,TS val 6422922 ecr 6422860], length 1026
1450054357.135439 IP 10.1.1.2.60653 > 10.1.1.1.2000: Flags [.], ack 19495, win 134, options [nop,nop,TS val 6422922 ecr 6422922], length 0
1450054357.185401 IP 10.1.1.1.2000 > 10.1.1.2.56705: Flags [P.], seq 18469:19495, ack 1, win 57, options [nop,nop,TS val 6422935 ecr 6422872], length 1026
1450054357.185428 IP 10.1.1.2.56705 > 10.1.1.1.2000: Flags [.], ack 19495, win 134, options [nop,nop,TS val 6422935 ecr 6422935], length 0
1450054357.235411 IP 10.1.1.1.2000 > 10.1.1.2.55311: Flags [P.], seq 18469:19495, ack 1, win 57, options [nop,nop,TS val 6422947 ecr 6422885], length 1026
1450054357.235431 IP 10.1.1.2.55311 > 10.1.1.1.2000: Flags [.], ack 19495, win 134, options [nop,nop,TS val 6422947 ecr 6422947], length 0
1450054357.285433 IP 10.1.1.1.2000 > 10.1.1.2.34920: Flags [P.], seq 18469:19495, ack 1, win 57, options [nop,nop,TS val 6422960 ecr 6422897], length 1026
1450054357.285458 IP 10.1.1.2.34920 > 10.1.1.1.2000: Flags [.], ack 19495, win 134, options [nop,nop,TS val 6422960 ecr 6422960], length 0
1450054357.335402 IP 10.1.1.1.2000 > 10.1.1.2.50225: Flags [P.], seq 19495:20521, ack 1, win 57, options [nop,nop,TS val 6422972 ecr 6422910], length 1026
1450054357.335428 IP 10.1.1.2.50225 > 10.1.1.1.2000: Flags [.], ack 20521, win 138, options [nop,nop,TS val 6422972 ecr 6422972], length 0
1450054357.385415 IP 10.1.1.1.2000 > 10.1.1.2.60653: Flags [P.], seq 19495:20521, ack 1, win 57, options [nop,nop,TS val 6422985 ecr 6422922], length 1026
1450054357.385447 IP 10.1.1.2.60653 > 10.1.1.1.2000: Flags [.], ack 20521, win 138, options [nop,nop,TS val 6422985 ecr 6422985], length 0
1450054357.435435 IP 10.1.1.1.2000 > 10.1.1.2.56705: Flags [P.], seq 19495:20521, ack 1, win 57, options [nop,nop,TS val 6422997 ecr 6422935], length 1026
1450054357.435491 IP 10.1.1.2.56705 > 10.1.1.1.2000: Flags [.], ack 20521, win 138, options [nop,nop,TS val 6422997 ecr 6422997], length 0
1450054357.485528 IP 10.1.1.1.2000 > 10.1.1.2.55311: Flags [P.], seq 19495:20521, ack 1, win 57, options [nop,nop,TS val 6423010 ecr 6422947], length 1026
1450054357.485576 IP 10.1.1.2.55311 > 10.1.1.1.2000: Flags [.], ack 20521, win 138, options [nop,nop,TS val 6423010 ecr 6423010], length 0
1450054357.535528 IP 10.1.1.1.2000 > 10.1.1.2.34920: Flags [P.], seq 19495:20521, ack 1, win 57, options [nop,nop,TS val 6423022 ecr 6422960], length 1026
1450054357.535603 IP 10.1.1.2.34920 > 10.1.1.1.2000: Flags [.], ack 20521, win 138, options [nop,nop,TS val 6423022 ecr 6423022], length 0
1450054357.539739 ARP, Request who-has 10.1.1.1 tell 10.1.1.2, length 28
1450054357.539811 ARP, Reply 10.1.1.1 is-at ca:1c:57:2f:3a:5d, length 28
1450054357.585536 IP 10.1.1.1.2000 > 10.1.1.2.50225: Flags [P.], seq 20521:21547, ack 1, win 57, options [nop,nop,TS val 6423035 ecr 6422972], length 1026
1450054357.585596 IP 10.1.1.2.50225 > 10.1.1.1.2000: Flags [.], ack 21547, win 142, options [nop,nop,TS val 6423035 ecr 6423035], length 0
1450054357.635511 IP 10.1.1.1.2000 > 10.1.1.2.60653: Flags [P.], seq 20521:21547, ack 1, win 57, options [nop,nop,TS val 6423047 ecr 6422985], length 1026
1450054357.635569 IP 10.1.1.2.60653 > 10.1.1.1.2000: Flags [.], ack 21547, win 142, options [nop,nop,TS val 6423047 ecr 6423047], length 0
1450054357.685436 IP 10.1.1.1.2000 > 10.1.1.2.56705: Flags [P.], seq 20521:21547, ack 1, win 57, options [nop,nop,TS val 6423060 ecr 6422997], length 1026
1450054357.685461 IP 10.1.1.2.56705 > 10.1.1.1.2000: Flags [.], ack 21547, win 142, options [nop,nop,TS val 6423060 ecr 6423060], length 0
1450054357.735472 IP 10.1.1.1.2000 > 10.1.1.2.55311: Flags [P.], seq 20521:21547, ack 1, win 57, options [nop,nop,TS val 6423072 ecr 6423010], length 1026
1450054357.735537 IP 10.1.1.2.55311 > 10.1.1.1.2000: Flags [.], ack 21547, win 142, options [nop,nop,TS val 6423072 ecr 6423072], length 0
1450054357.785448 IP 10.1.1.1.2000 > 10.1.1.2.34920: Flags [P.], seq 20521:21547, ack 1, win 57, options [nop,nop,TS val 6423085 ecr 6423022], length 1026
1450054357.785476 IP 10.1.1.2.34920 > 10.1.1.1.2000: Flags [.], ack 21547, win 142, options [nop,nop,TS val 6423085 ecr 6423085], length 0
1450054357.835438 IP 10.1.1.1.2000 > 10.1.1.2.50225: Flags [P.], seq 21547:22573, ack 1, win 57, options [nop,nop,TS val 6423097 ecr 6423035], length 1026
1450054357.835476 IP 10.1.1.2.50225 > 10.1.1.1.2000: Flags [.], ack 22573, win 146, options [nop,nop,TS val 6423097 ecr 6423097], length 0
1450054357.885432 IP 10.1.1.1.2000 > 10.1.1.2.60653: Flags [P.], seq 21547:22573, ack 1, win 57, options [nop,nop,TS val 6423110 ecr 6423047], length 1026
1450054357.885459 IP 10.1.1.2.60653 > 10.1.1.1.2000: Flags [.], ack 22573, win 146, options [nop,nop,TS val 6423110 ecr 6423110], length 0
1450054357.935537 IP 10.1.1.1.2000 > 10.1.1.2.56705: Flags [P.], seq 21547:22573, ack 1, win 57, options [nop,nop,TS val 6423122 ecr 6423060], length 1026
1450054357.935585 IP 10.1.1.2.56705 > 10.1.1.1.2000: Flags [.], ack 22573, win 146, options [nop,nop,TS val 6423122 ecr 6423122], length 0
1450054357.985582 IP 10.1.1.1.2000 > 10.1.1.2.55311: Flags [P.], seq 21547:22573, ack 1, win 57, options [nop,nop,TS val 6423135 ecr 6423072], length 1026
1450054357.985631 IP 10.1.1.2.55311 > 10.1.1.1.2000: Flags [.], ack 22573, win 146, options [nop,nop,TS val 6423135 ecr 6423135], length 0
1450054358.035540 IP 10.1.1.1.2000 > 10.1.1.2.34920: Flags [P.], seq 21547:22573, ack 1, win 57, options [nop,nop,TS val 6423147 ecr 6423085], length 1026
1450054358.035587 IP 10.1.1.2.34920 > 10.1.1.1.2000: Flags [.], ack 22573, win 146, options [nop,nop,TS val 6423147 ecr 6423147], length 0
1450054358.085525 IP 10.1.1.1.2000 > 10.1.1.2.50225: Flags [P.], seq 22573:23599, ack 1, win 57, options [nop,nop,TS val 6423160 ecr 6423097], length 1026
1450054358.085572 IP 10.1.1.2.50225 > 10.1.1.1.2000: Flags [.], ack 23599, win 150, options [nop,nop,TS val 6423160 ecr 6423160], length 0
1450054358.135461 IP 10.1.1.1.2000 > 10.1.1.2.60653: Flags [P.], seq 22573:23599, ack 1, win 57, options [nop,nop,TS val 6423172 ecr 6423110], length 1026
1450054358.135497 IP 10.1.1.2.60653 > 10.1.1.1.2000: Flags [.], ack 23599, win 150, options [nop,nop,TS val 6423172 ecr 6423172], length 0
1450054358.185543 IP 10.1.1.1.2000 > 10.1.1.2.56705: Flags [P.], seq 22573:23599, ack 1, win 57, options [nop,nop,TS val 6423185 ecr 6423122], length 1026
1450054358.185598 IP 10.1.1.2.56705 > 10.1.1.1.2000: Flags [.], ack 23599, win 150, options [nop,nop,TS val 6423185 ecr 6423185], length 0
1450054358.235493 IP 10.1.1.1.2000 > 10.1.1.2.55311: Flags [P.], seq 22573:23599, ack 1, win 57, options [nop,nop,TS val 6423197 ecr 6423135], length 1026
1450054358.235550 IP 10.1.1.2.55311 > 10.1.1.1.2000: Flags [.], ack 23599, win 150, options [nop,nop,TS val 6423197 ecr 6423197], length 0
1450054358.285468 IP 10.1.1.1.2000 > 10.1.1.2.34920: Flags [P.], seq 22573:23599, ack 1, win 57, options [nop,nop,TS val 6423210 ecr 6423147], length 1026
1450054358.285521 IP 10.1.1.2.34920 > 10.1.1.1.2000: Flags [.], ack 23599, win 150, options [nop,nop,TS val 6423210 ecr 6423210], length 0
1450054358.335534 IP 10.1.1.1.2000 > 10.1.1.2.50225: Flags [P.], seq 23599:24625, ack 1, win 57, options [nop,nop,TS val 6423222 ecr 6423160], length 1026
1450054358.335582 IP 10.1.1.2.50225 > 10.1.1.1.2000: Flags [.], ack 24625, win 154, options [nop,nop,TS val 6423222 ecr 6423222], length 0
1450054358.385518 IP 10.1.1.1.2000 > 10.1.1.2.60653: Flags [P.], seq 23599:24625, ack 1, win 57, options [nop,nop,TS val 6423235 ecr 6423172], length 1026
1450054358.385564 IP 10.1.1.2.60653 > 10.1.1.1.2000: Flags [.], ack 24625, win 154, options [nop,nop,TS val 6423235 ecr 6423235], length 0
1450054358.435433 IP 10.1.1.1.2000 > 10.1.1.2.56705: Flags [P.], seq 23599:24625, ack 1, win 57, options [nop,nop,TS val 6423247 ecr 6423185], length 1026
1450054358.435462 IP 10.1.1.2.56705 > 10.1.1.1.2000: Flags [.], ack 24625, win 154, options [nop,nop,TS val 6423247 ecr 6423247], length 0
1450054358.485470 IP 10.1.1.1.2000 > 10.1.1.2.55311: Flags [P.], seq 23599:24625, ack 1, win 57, options [nop,nop,TS val 6423260 ecr 6423197], length 1026
1450054358.485524 IP 10.1.1.2.55311 > 10.1.1.1.2000: Flags [.], ack 24625, win 154, options [nop,nop,TS val 6423260 ecr 6423260], length 0
1450054358.535497 IP 10.1.1.1.2000 > 10.1.1.2.34920: Flags [P.], seq 23599:24625, ack 1, win 57, options [nop,nop,TS val 6423272 ecr 6423210], length 1026
1450054358.535549 IP 10.1.1.2.34920 > 10.1.1.1.2000: Flags [.], ack 24625, win 154, options [nop,nop,TS val 6423272 ecr 6423272], length 0
1450054358.585473 IP 10.1.1.1.2000 > 10.1.1.2.50225: Flags [P.], seq 24625:25651, ack 1, win 57, options [nop,nop,TS val 6423285 ecr 6423222], length 1026
1450054358.585520 IP 10.1.1.2.50225 > 10.1.1.1.2000: Flags [.], ack 25651, win 158, options [nop,nop,TS val 6423285 ecr 6423285], length 0
1450054358.635444 IP 10.1.1.1.2000 > 10.1.1.2.60653: Flags [P.], seq 24625:25651, ack 1, win 57, options [nop,nop,TS val 6423297 ecr 6423235], length 1026
1450054358.635477 IP 10.1.1.2.60653 > 10.1.1.1.2000: Flags [.], ack 25651, win 158, options [nop,nop,TS val 6423297 ecr 6423297], length 0
1450054358.685449 IP 10.1.1.1.2000 > 10.1.1.2.56705: Flags [P.], seq 24625:25651, ack 1, win 57, options [nop,nop,TS val 6423310 ecr 6423247], length 1026
1450054358.685478 IP 10.1.1.2.56705 > 10.1.1.1.2000: Flags [.], ack 25651, win 158, options [nop,nop,TS val 6423310 ecr 6423310], length 0
1450054358.735483 IP 10.1.1.1.2000 > 10.1.1.2.55311: Flags [P.], seq 24625:25651, ack 1, win 57, options [nop,nop,TS val 6423322 ecr 6423260], length 1026
1450054358.735530 IP 10.1.1.2.55311 > 10.1.1.1.2000: Flags [.], ack 25651, win 158, options [nop,nop,TS val 6423322 ecr 6423322], length 0
1450054358.785410 IP 10.1.1.1.2000 > 10.1.1.2.34920: Flags [P.], seq 24625:25651, ack 1, win 57, options [nop,nop,TS val 6423335 ecr 6423272], length 1026
1450054358.785437 IP 10.1.1.2.34920 > 10.1.1.1.2000: Flags [.], ack 25651, win 158, options [nop,nop,TS val 6423335 ecr 6423335], length 0
1450054358.835485 IP 10.1.1.1.2000 > 10.1.1.2.50225: Flags [P.], seq 25651:26677, ack 1, win 57, options [nop,nop,TS val 6423347 ecr 6423285], length 1026
1450054358.835532 IP 10.1.1.2.50225 > 10.1.1.1.2000: Flags [.], ack 26677, win 162, options [nop,nop,TS val 6423347 ecr 6423347], length 0
1450054358.885513 IP 10.1.1.1.2000 > 10.1.1.2.60653: Flags [P.], seq 25651:26677, ack 1, win 57, options [nop,nop,TS val 6423360 ecr 6423297], length 1026
1450054358.885560 IP 10.1.1.2.60653 > 10.1.1.1.2000: Flags [.], ack 26677, win 162, options [nop,nop,TS val 6423360 ecr 6423360], length 0
1450054358.935421 IP 10.1.1.1.2000 > 10.1.1.2.56705: Flags [P.], seq 25651:26677, ack 1, win 57, options [nop,nop,TS val 6423372 ecr 6423310], length 1026
