1450051765.851527 IP 10.1.1.2.17500 > 10.1.1.255.17500: UDP, length 293
1450051795.875013 IP 10.1.1.2.17500 > 10.1.1.255.17500: UDP, length 293
1450051817.999250 IP 10.1.1.2.138 > 10.1.1.255.138: NBT UDP PACKET(138)
1450051817.999296 IP 10.1.1.2.138 > 10.1.1.255.138: NBT UDP PACKET(138)
1450051825.306269 IP 10.1.1.2.2000 > 10.1.1.1.2000: Flags [S], seq 1903518480, win 29200, options [mss 1460,sackOK,TS val 5789965 ecr 0,nop,wscale 9], length 0
1450051825.306315 IP 10.1.1.1.2000 > 10.1.1.2.2000: Flags [S.], seq 3076021054, ack 1903518481, win 28960, options [mss 1460,sackOK,TS val 5789965 ecr 5789965,nop,wscale 9], length 0
1450051825.306336 IP 10.1.1.2.2000 > 10.1.1.1.2000: Flags [.], ack 1, win 58, options [nop,nop,TS val 5789965 ecr 5789965], length 0
1450051825.356976 IP 10.1.1.1.2000 > 10.1.1.2.2000: Flags [P.], seq 1:1027, ack 1, win 57, options [nop,nop,TS val 5789978 ecr 5789965], length 1026
1450051825.357032 IP 10.1.1.2.2000 > 10.1.1.1.2000: Flags [.], ack 1027, win 62, options [nop,nop,TS val 5789978 ecr 5789978], length 0
1450051825.406927 IP 10.1.1.1.2000 > 10.1.1.2.2000: Flags [P.], seq 1027:2053, ack 1, win 57, options [nop,nop,TS val 5789990 ecr 5789978], length 1026
1450051825.406958 IP 10.1.1.2.2000 > 10.1.1.1.2000: Flags [.], ack 2053, win 66, options [nop,nop,TS val 5789990 ecr 5789990], length 0
1450051825.456763 IP 10.1.1.1.2000 > 10.1.1.2.2000: Flags [P.], seq 2053:3079, ack 1, win 57, options [nop,nop,TS val 5790003 ecr 5789990], length 1026
1450051825.456800 IP 10.1.1.2.2000 > 10.1.1.1.2000: Flags [.], ack 3079, win 70, options [nop,nop,TS val 5790003 ecr 5790003], length 0
1450051825.506736 IP 10.1.1.1.2000 > 10.1.1.2.2000: Flags [P.], seq 3079:4105, ack 1, win 57, options [nop,nop,TS val 5790015 ecr 5790003], length 1026
1450051825.506762 IP 10.1.1.2.2000 > 10.1.1.1.2000: Flags [.], ack 4105, win 74, options [nop,nop,TS val 5790015 ecr 5790015], length 0
1450051825.556750 IP 10.1.1.1.2000 > 10.1.1.2.2000: Flags [P.], seq 4105:5131, ack 1, win 57, options [nop,nop,TS val 5790028 ecr 5790015], length 1026
1450051825.556785 IP 10.1.1.2.2000 > 10.1.1.1.2000: Flags [.], ack 5131, win 78, options [nop,nop,TS val 5790028 ecr 5790028], length 0
1450051825.606859 IP 10.1.1.1.2000 > 10.1.1.2.2000: Flags [P.], seq 5131:6157, ack 1, win 57, options [nop,nop,TS val 5790040 ecr 5790028], length 1026
1450051825.606887 IP 10.1.1.2.2000 > 10.1.1.1.2000: Flags [.], ack 6157, win 82, options [nop,nop,TS val 5790040 ecr 5790040], length 0
1450051825.656790 IP 10.1.1.1.2000 > 10.1.1.2.2000: Flags [P.], seq 6157:7183, ack 1, win 57, options [nop,nop,TS val 5790053 ecr 5790040], length 1026
1450051825.656820 IP 10.1.1.2.2000 > 10.1.1.1.2000: Flags [.], ack 7183, win 86, options [nop,nop,TS val 5790053 ecr 5790053], length 0
1450051825.706809 IP 10.1.1.1.2000 > 10.1.1.2.2000: Flags [P.], seq 7183:8209, ack 1, win 57, options [nop,nop,TS val 5790065 ecr 5790053], length 1026
1450051825.706844 IP 10.1.1.2.2000 > 10.1.1.1.2000: Flags [.], ack 8209, win 90, options [nop,nop,TS val 5790065 ecr 5790065], length 0
1450051825.756812 IP 10.1.1.1.2000 > 10.1.1.2.2000: Flags [P.], seq 8209:9235, ack 1, win 57, options [nop,nop,TS val 5790078 ecr 5790065], length 1026
1450051825.756848 IP 10.1.1.2.2000 > 10.1.1.1.2000: Flags [.], ack 9235, win 94, options [nop,nop,TS val 5790078 ecr 5790078], length 0
1450051825.806767 IP 10.1.1.1.2000 > 10.1.1.2.2000: Flags [P.], seq 9235:10261, ack 1, win 57, options [nop,nop,TS val 5790090 ecr 5790078], length 1026
1450051825.806803 IP 10.1.1.2.2000 > 10.1.1.1.2000: Flags [.], ack 10261, win 98, options [nop,nop,TS val 5790090 ecr 5790090], length 0
1450051825.856763 IP 10.1.1.1.2000 > 10.1.1.2.2000: Flags [P.], seq 10261:11287, ack 1, win 57, options [nop,nop,TS val 5790103 ecr 5790090], length 1026
1450051825.856798 IP 10.1.1.2.2000 > 10.1.1.1.2000: Flags [.], ack 11287, win 102, options [nop,nop,TS val 5790103 ecr 5790103], length 0
1450051825.900565 IP 10.1.1.2.17500 > 10.1.1.255.17500: UDP, length 293
1450051825.906722 IP 10.1.1.1.2000 > 10.1.1.2.2000: Flags [P.], seq 11287:12313, ack 1, win 57, options [nop,nop,TS val 5790115 ecr 5790103], length 1026
1450051825.906758 IP 10.1.1.2.2000 > 10.1.1.1.2000: Flags [.], ack 12313, win 106, options [nop,nop,TS val 5790115 ecr 5790115], length 0
1450051825.957072 IP 10.1.1.1.2000 > 10.1.1.2.2000: Flags [P.], seq 12313:13339, ack 1, win 57, options [nop,nop,TS val 5790128 ecr 5790115], length 1026
1450051825.957099 IP 10.1.1.2.2000 > 10.1.1.1.2000: Flags [.], ack 13339, win 110, options [nop,nop,TS val 5790128 ecr 5790128], length 0
1450051826.006797 IP 10.1.1.1.2000 > 10.1.1.2.2000: Flags [P.], seq 13339:14365, ack 1, win 57, options [nop,nop,TS val 5790140 ecr 5790128], length 1026
1450051826.006831 IP 10.1.1.2.2000 > 10.1.1.1.2000: Flags [.], ack 14365, win 114, options [nop,nop,TS val 5790140 ecr 5790140], length 0
1450051826.056815 IP 10.1.1.1.2000 > 10.1.1.2.2000: Flags [P.], seq 14365:15391, ack 1, win 57, options [nop,nop,TS val 5790153 ecr 5790140], length 1026
1450051826.056850 IP 10.1.1.2.2000 > 10.1.1.1.2000: Flags [.], ack 15391, win 118, options [nop,nop,TS val 5790153 ecr 5790153], length 0
1450051826.106748 IP 10.1.1.1.2000 > 10.1.1.2.2000: Flags [P.], seq 15391:16417, ack 1, win 57, options [nop,nop,TS val 5790165 ecr 5790153], length 1026
1450051826.106781 IP 10.1.1.2.2000 > 10.1.1.1.2000: Flags [.], ack 16417, win 122, options [nop,nop,TS val 5790165 ecr 5790165], length 0
1450051826.156752 IP 10.1.1.1.2000 > 10.1.1.2.2000: Flags [P.], seq 16417:17443, ack 1, win 57, options [nop,nop,TS val 5790178 ecr 5790165], length 1026
1450051826.156785 IP 10.1.1.2.2000 > 10.1.1.1.2000: Flags [.], ack 17443, win 126, options [nop,nop,TS val 5790178 ecr 5790178], length 0
1450051826.206816 IP 10.1.1.1.2000 > 10.1.1.2.2000: Flags [P.], seq 17443:18469, ack 1, win 57, options [nop,nop,TS val 5790190 ecr 5790178], length 1026
1450051826.206852 IP 10.1.1.2.2000 > 10.1.1.1.2000: Flags [.], ack 18469, win 130, options [nop,nop,TS val 5790190 ecr 5790190], length 0
1450051826.256773 IP 10.1.1.1.2000 > 10.1.1.2.2000: Flags [P.], seq 18469:19495, ack 1, win 57, options [nop,nop,TS val 5790203 ecr 5790190], length 1026
1450051826.256805 IP 10.1.1.2.2000 > 10.1.1.1.2000: Flags [.], ack 19495, win 134, options [nop,nop,TS val 5790203 ecr 5790203], length 0
1450051826.306807 IP 10.1.1.1.2000 > 10.1.1.2.2000: Flags [P.], seq 19495:20521, ack 1, win 57, options [nop,nop,TS val 5790215 ecr 5790203], length 1026
1450051826.306849 IP 10.1.1.2.2000 > 10.1.1.1.2000: Flags [.], ack 20521, win 138, options [nop,nop,TS val 5790215 ecr 5790215], length 0
1450051826.356729 IP 10.1.1.1.2000 > 10.1.1.2.2000: Flags [P.], seq 20521:21547, ack 1, win 57, options [nop,nop,TS val 5790228 ecr 5790215], length 1026
1450051826.356763 IP 10.1.1.2.2000 > 10.1.1.1.2000: Flags [.], ack 21547, win 142, options [nop,nop,TS val 5790228 ecr 5790228], length 0
1450051826.406778 IP 10.1.1.1.2000 > 10.1.1.2.2000: Flags [P.], seq 21547:22573, ack 1, win 57, options [nop,nop,TS val 5790240 ecr 5790228], length 1026
1450051826.406809 IP 10.1.1.2.2000 > 10.1.1.1.2000: Flags [.], ack 22573, win 146, options [nop,nop,TS val 5790240 ecr 5790240], length 0
1450051826.456772 IP 10.1.1.1.2000 > 10.1.1.2.2000: Flags [P.], seq 22573:23599, ack 1, win 57, options [nop,nop,TS val 5790253 ecr 5790240], length 1026
1450051826.456808 IP 10.1.1.2.2000 > 10.1.1.1.2000: Flags [.], ack 23599, win 150, options [nop,nop,TS val 5790253 ecr 5790253], length 0
1450051826.506700 IP 10.1.1.1.2000 > 10.1.1.2.2000: Flags [P.], seq 23599:24625, ack 1, win 57, options [nop,nop,TS val 5790265 ecr 5790253], length 1026
1450051826.506726 IP 10.1.1.2.2000 > 10.1.1.1.2000: Flags [.], ack 24625, win 154, options [nop,nop,TS val 5790265 ecr 5790265], length 0
1450051826.556679 IP 10.1.1.1.2000 > 10.1.1.2.2000: Flags [P.], seq 24625:25651, ack 1, win 57, options [nop,nop,TS val 5790278 ecr 5790265], length 1026
1450051826.556709 IP 10.1.1.2.2000 > 10.1.1.1.2000: Flags [.], ack 25651, win 158, options [nop,nop,TS val 5790278 ecr 5790278], length 0
1450051826.606763 IP 10.1.1.1.2000 > 10.1.1.2.2000: Flags [P.], seq 25651:26677, ack 1, win 57, options [nop,nop,TS val 5790290 ecr 5790278], length 1026
1450051826.606793 IP 10.1.1.2.2000 > 10.1.1.1.2000: Flags [.], ack 26677, win 162, options [nop,nop,TS val 5790290 ecr 5790290], length 0
1450051826.656735 IP 10.1.1.1.2000 > 10.1.1.2.2000: Flags [P.], seq 26677:27703, ack 1, win 57, options [nop,nop,TS val 5790303 ecr 5790290], length 1026
1450051826.656766 IP 10.1.1.2.2000 > 10.1.1.1.2000: Flags [.], ack 27703, win 166, options [nop,nop,TS val 5790303 ecr 5790303], length 0
1450051826.706671 IP 10.1.1.1.2000 > 10.1.1.2.2000: Flags [P.], seq 27703:28729, ack 1, win 57, options [nop,nop,TS val 5790315 ecr 5790303], length 1026
1450051826.706686 IP 10.1.1.2.2000 > 10.1.1.1.2000: Flags [.], ack 28729, win 170, options [nop,nop,TS val 5790315 ecr 5790315], length 0
1450051826.756725 IP 10.1.1.1.2000 > 10.1.1.2.2000: Flags [P.], seq 28729:29755, ack 1, win 57, options [nop,nop,TS val 5790328 ecr 5790315], length 1026
1450051826.756753 IP 10.1.1.2.2000 > 10.1.1.1.2000: Flags [.], ack 29755, win 174, options [nop,nop,TS val 5790328 ecr 5790328], length 0
1450051826.806778 IP 10.1.1.1.2000 > 10.1.1.2.2000: Flags [P.], seq 29755:30781, ack 1, win 57, options [nop,nop,TS val 5790340 ecr 5790328], length 1026
1450051826.806807 IP 10.1.1.2.2000 > 10.1.1.1.2000: Flags [.], ack 30781, win 178, options [nop,nop,TS val 5790340 ecr 5790340], length 0
1450051826.856667 IP 10.1.1.1.2000 > 10.1.1.2.2000: Flags [P.], seq 30781:31807, ack 1, win 57, options [nop,nop,TS val 5790353 ecr 5790340], length 1026
1450051826.856682 IP 10.1.1.2.2000 > 10.1.1.1.2000: Flags [.], ack 31807, win 182, options [nop,nop,TS val 5790353 ecr 5790353], length 0
1450051826.906765 IP 10.1.1.1.2000 > 10.1.1.2.2000: Flags [P.], seq 31807:32833, ack 1, win 57, options [nop,nop,TS val 5790365 ecr 5790353], length 1026
1450051826.906794 IP 10.1.1.2.2000 > 10.1.1.1.2000: Flags [.], ack 32833, win 186, options [nop,nop,TS val 5790365 ecr 5790365], length 0
1450051826.956771 IP 10.1.1.1.2000 > 10.1.1.2.2000: Flags [P.], seq 32833:33859, ack 1, win 57, options [nop,nop,TS val 5790378 ecr 5790365], length 1026
1450051826.956809 IP 10.1.1.2.2000 > 10.1.1.1.2000: Flags [.], ack 33859, win 190, options [nop,nop,TS val 5790378 ecr 5790378], length 0
1450051827.006771 IP 10.1.1.1.2000 > 10.1.1.2.2000: Flags [P.], seq 33859:34885, ack 1, win 57, options [nop,nop,TS val 5790390 ecr 5790378], length 1026
1450051827.006805 IP 10.1.1.2.2000 > 10.1.1.1.2000: Flags [.], ack 34885, win 194, options [nop,nop,TS val 5790390 ecr 5790390], length 0
1450051827.056772 IP 10.1.1.1.2000 > 10.1.1.2.2000: Flags [P.], seq 34885:35911, ack 1, win 57, options [nop,nop,TS val 5790403 ecr 5790390], length 1026
1450051827.056806 IP 10.1.1.2.2000 > 10.1.1.1.2000: Flags [.], ack 35911, win 198, options [nop,nop,TS val 5790403 ecr 5790403], length 0
1450051827.106723 IP 10.1.1.1.2000 > 10.1.1.2.2000: Flags [P.], seq 35911:36937, ack 1, win 57, options [nop,nop,TS val 5790415 ecr 5790403], length 1026
1450051827.106755 IP 10.1.1.2.2000 > 10.1.1.1.2000: Flags [.], ack 36937, win 202, options [nop,nop,TS val 5790415 ecr 5790415], length 0
1450051827.156770 IP 10.1.1.1.2000 > 10.1.1.2.2000: Flags [P.], seq 36937:37963, ack 1, win 57, options [nop,nop,TS val 5790428 ecr 5790415], length 1026
1450051827.156805 IP 10.1.1.2.2000 > 10.1.1.1.2000: Flags [.], ack 37963, win 206, options [nop,nop,TS val 5790428 ecr 5790428], length 0
1450051827.206771 IP 10.1.1.1.2000 > 10.1.1.2.2000: Flags [P.], seq 37963:38989, ack 1, win 57, options [nop,nop,TS val 5790440 ecr 5790428], length 1026
1450051827.206807 IP 10.1.1.2.2000 > 10.1.1.1.2000: Flags [.], ack 38989, win 210, options [nop,nop,TS val 5790440 ecr 5790440], length 0
1450051827.256703 IP 10.1.1.1.2000 > 10.1.1.2.2000: Flags [P.], seq 38989:40015, ack 1, win 57, options [nop,nop,TS val 5790453 ecr 5790440], length 1026
1450051827.256727 IP 10.1.1.2.2000 > 10.1.1.1.2000: Flags [.], ack 40015, win 214, options [nop,nop,TS val 5790453 ecr 5790453], length 0
1450051827.306760 IP 10.1.1.1.2000 > 10.1.1.2.2000: Flags [P.], seq 40015:41041, ack 1, win 57, options [nop,nop,TS val 5790465 ecr 5790453], length 1026
1450051827.306793 IP 10.1.1.2.2000 > 10.1.1.1.2000: Flags [.], ack 41041, win 218, options [nop,nop,TS val 5790465 ecr 5790465], length 0
1450051827.356755 IP 10.1.1.1.2000 > 10.1.1.2.2000: Flags [P.], seq 41041:42067, ack 1, win 57, options [nop,nop,TS val 5790478 ecr 5790465], length 1026
1450051827.356785 IP 10.1.1.2.2000 > 10.1.1.1.2000: Flags [.], ack 42067, win 222, options [nop,nop,TS val 5790478 ecr 5790478], length 0
1450051827.406645 IP 10.1.1.1.2000 > 10.1.1.2.2000: Flags [P.], seq 42067:43093, ack 1, win 57, options [nop,nop,TS val 5790490 ecr 5790478], length 1026
1450051827.406660 IP 10.1.1.2.2000 > 10.1.1.1.2000: Flags [.], ack 43093, win 226, options [nop,nop,TS val 5790490 ecr 5790490], length 0
1450051827.456647 IP 10.1.1.1.2000 > 10.1.1.2.2000: Flags [P.], seq 43093:44119, ack 1, win 57, options [nop,nop,TS val 5790503 ecr 5790490], length 1026
1450051827.456667 IP 10.1.1.2.2000 > 10.1.1.1.2000: Flags [.], ack 44119, win 230, options [nop,nop,TS val 5790503 ecr 5790503], length 0
1450051827.506696 IP 10.1.1.1.2000 > 10.1.1.2.2000: Flags [P.], seq 44119:45145, ack 1, win 57, options [nop,nop,TS val 5790515 ecr 5790503], length 1026
1450051827.506714 IP 10.1.1.2.2000 > 10.1.1.1.2000: Flags [.], ack 45145, win 234, options [nop,nop,TS val 5790515 ecr 5790515], length 0
1450051827.556737 IP 10.1.1.1.2000 > 10.1.1.2.2000: Flags [P.], seq 45145:46171, ack 1, win 57, options [nop,nop,TS val 5790528 ecr 5790515], length 1026
1450051827.556768 IP 10.1.1.2.2000 > 10.1.1.1.2000: Flags [.], ack 46171, win 238, options [nop,nop,TS val 5790528 ecr 5790528], length 0
1450051827.606684 IP 10.1.1.1.2000 > 10.1.1.2.2000: Flags [P.], seq 46171:47197, ack 1, win 57, options [nop,nop,TS val 5790540 ecr 5790528], length 1026
1450051827.606699 IP 10.1.1.2.2000 > 10.1.1.1.2000: Flags [.], ack 47197, win 242, options [nop,nop,TS val 5790540 ecr 5790540], length 0
1450051827.656698 IP 10.1.1.1.2000 > 10.1.1.2.2000: Flags [P.], seq 47197:48223, ack 1, win 57, options [nop,nop,TS val 5790553 ecr 5790540], length 1026
1450051827.656722 IP 10.1.1.2.2000 > 10.1.1.1.2000: Flags [.], ack 48223, win 246, options [nop,nop,TS val 5790553 ecr 5790553], length 0
1450051827.706766 IP 10.1.1.1.2000 > 10.1.1.2.2000: Flags [P.], seq 48223:49249, ack 1, win 57, options [nop,nop,TS val 5790565 ecr 5790553], length 1026
1450051827.706796 IP 10.1.1.2.2000 > 10.1.1.1.2000: Flags [.], ack 49249, win 250, options [nop,nop,TS val 5790565 ecr 5790565], length 0
1450051827.756738 IP 10.1.1.1.2000 > 10.1.1.2.2000: Flags [P.], seq 49249:50275, ack 1, win 57, options [nop,nop,TS val 5790578 ecr 5790565], length 1026
1450051827.756778 IP 10.1.1.2.2000 > 10.1.1.1.2000: Flags [.], ack 50275, win 254, options [nop,nop,TS val 5790578 ecr 5790578], length 0
1450051827.806773 IP 10.1.1.1.2000 > 10.1.1.2.2000: Flags [P.], seq 50275:51301, ack 1, win 57, options [nop,nop,TS val 5790590 ecr 5790578], length 1026
1450051827.806804 IP 10.1.1.2.2000 > 10.1.1.1.2000: Flags [.], ack 51301, win 258, options [nop,nop,TS val 5790590 ecr 5790590], length 0
1450051827.856762 IP 10.1.1.1.2000 > 10.1.1.2.2000: Flags [P.], seq 51301:52327, ack 1, win 57, options [nop,nop,TS val 5790603 ecr 5790590], length 1026
1450051827.856797 IP 10.1.1.2.2000 > 10.1.1.1.2000: Flags [.], ack 52327, win 262, options [nop,nop,TS val 5790603 ecr 5790603], length 0
1450051827.906660 IP 10.1.1.1.2000 > 10.1.1.2.2000: Flags [P.], seq 52327:53353, ack 1, win 57, options [nop,nop,TS val 5790615 ecr 5790603], length 1026
1450051827.906683 IP 10.1.1.2.2000 > 10.1.1.1.2000: Flags [.], ack 53353, win 266, options [nop,nop,TS val 5790615 ecr 5790615], length 0
1450051827.956781 IP 10.1.1.1.2000 > 10.1.1.2.2000: Flags [P.], seq 53353:54379, ack 1, win 57, options [nop,nop,TS val 5790628 ecr 5790615], length 1026
1450051827.956807 IP 10.1.1.2.2000 > 10.1.1.1.2000: Flags [.], ack 54379, win 270, options [nop,nop,TS val 5790628 ecr 5790628], length 0
1450051828.006782 IP 10.1.1.1.2000 > 10.1.1.2.2000: Flags [P.], seq 54379:55405, ack 1, win 57, options [nop,nop,TS val 5790640 ecr 5790628], length 1026
1450051828.006808 IP 10.1.1.2.2000 > 10.1.1.1.2000: Flags [.], ack 55405, win 274, options [nop,nop,TS val 5790640 ecr 5790640], length 0
1450051828.056755 IP 10.1.1.1.2000 > 10.1.1.2.2000: Flags [P.], seq 55405:56431, ack 1, win 57, options [nop,nop,TS val 5790653 ecr 5790640], length 1026
1450051828.056784 IP 10.1.1.2.2000 > 10.1.1.1.2000: Flags [.], ack 56431, win 278, options [nop,nop,TS val 5790653 ecr 5790653], length 0
1450051828.106782 IP 10.1.1.1.2000 > 10.1.1.2.2000: Flags [P.], seq 56431:57457, ack 1, win 57, options [nop,nop,TS val 5790665 ecr 5790653], length 1026
1450051828.106820 IP 10.1.1.2.2000 > 10.1.1.1.2000: Flags [.], ack 57457, win 282, options [nop,nop,TS val 5790665 ecr 5790665], length 0
1450051828.156757 IP 10.1.1.1.2000 > 10.1.1.2.2000: Flags [P.], seq 57457:58483, ack 1, win 57, options [nop,nop,TS val 5790678 ecr 5790665], length 1026
1450051828.156784 IP 10.1.1.2.2000 > 10.1.1.1.2000: Flags [.], ack 58483, win 286, options [nop,nop,TS val 5790678 ecr 5790678], length 0
1450051828.194402 IP 10.1.1.2.5353 > 224.0.0.251.5353: 0 [2q] PTR (QM)? _ipps._tcp.local. PTR (QM)? _ipp._tcp.local. (45)
1450051828.206756 IP 10.1.1.1.2000 > 10.1.1.2.2000: Flags [P.], seq 58483:59509, ack 1, win 57, options [nop,nop,TS val 5790690 ecr 5790678], length 1026
1450051828.206782 IP 10.1.1.2.2000 > 10.1.1.1.2000: Flags [.], ack 59509, win 290, options [nop,nop,TS val 5790690 ecr 5790690], length 0
1450051828.256770 IP 10.1.1.1.2000 > 10.1.1.2.2000: Flags [P.], seq 59509:60535, ack 1, win 57, options [nop,nop,TS val 5790703 ecr 5790690], length 1026
1450051828.256798 IP 10.1.1.2.2000 > 10.1.1.1.2000: Flags [.], ack 60535, win 294, options [nop,nop,TS val 5790703 ecr 5790703], length 0
1450051828.306789 IP 10.1.1.1.2000 > 10.1.1.2.2000: Flags [P.], seq 60535:61561, ack 1, win 57, options [nop,nop,TS val 5790715 ecr 5790703], length 1026
1450051828.306817 IP 10.1.1.2.2000 > 10.1.1.1.2000: Flags [.], ack 61561, win 298, options [nop,nop,TS val 5790715 ecr 5790715], length 0
1450051828.356767 IP 10.1.1.1.2000 > 10.1.1.2.2000: Flags [P.], seq 61561:62587, ack 1, win 57, options [nop,nop,TS val 5790728 ecr 5790715], length 1026
1450051828.356795 IP 10.1.1.2.2000 > 10.1.1.1.2000: Flags [.], ack 62587, win 302, options [nop,nop,TS val 5790728 ecr 5790728], length 0
1450051828.406731 IP 10.1.1.1.2000 > 10.1.1.2.2000: Flags [P.], seq 62587:63613, ack 1, win 57, options [nop,nop,TS val 5790740 ecr 5790728], length 1026
1450051828.406757 IP 10.1.1.2.2000 > 10.1.1.1.2000: Flags [.], ack 63613, win 306, options [nop,nop,TS val 5790740 ecr 5790740], length 0
1450051828.456758 IP 10.1.1.1.2000 > 10.1.1.2.2000: Flags [P.], seq 63613:64639, ack 1, win 57, options [nop,nop,TS val 5790753 ecr 5790740], length 1026
1450051828.456786 IP 10.1.1.2.2000 > 10.1.1.1.2000: Flags [.], ack 64639, win 310, options [nop,nop,TS val 5790753 ecr 5790753], length 0
1450051828.506779 IP 10.1.1.1.2000 > 10.1.1.2.2000: Flags [P.], seq 64639:65665, ack 1, win 57, options [nop,nop,TS val 5790765 ecr 5790753], length 1026
1450051828.506807 IP 10.1.1.2.2000 > 10.1.1.1.2000: Flags [.], ack 65665, win 314, options [nop,nop,TS val 5790765 ecr 5790765], length 0
1450051828.556782 IP 10.1.1.1.2000 > 10.1.1.2.2000: Flags [P.], seq 65665:66691, ack 1, win 57, options [nop,nop,TS val 5790778 ecr 5790765], length 1026
1450051828.556810 IP 10.1.1.2.2000 > 10.1.1.1.2000: Flags [.], ack 66691, win 318, options [nop,nop,TS val 5790778 ecr 5790778], length 0
1450051828.606756 IP 10.1.1.1.2000 > 10.1.1.2.2000: Flags [P.], seq 66691:67717, ack 1, win 57, options [nop,nop,TS val 5790790 ecr 5790778], length 1026
1450051828.606783 IP 10.1.1.2.2000 > 10.1.1.1.2000: Flags [.], ack 67717, win 322, options [nop,nop,TS val 5790790 ecr 5790790], length 0
1450051828.656763 IP 10.1.1.1.2000 > 10.1.1.2.2000: Flags [P.], seq 67717:68743, ack 1, win 57, options [nop,nop,TS val 5790803 ecr 5790790], length 1026
1450051828.656788 IP 10.1.1.2.2000 > 10.1.1.1.2000: Flags [.], ack 68743, win 326, options [nop,nop,TS val 5790803 ecr 5790803], length 0
1450051828.706734 IP 10.1.1.1.2000 > 10.1.1.2.2000: Flags [P.], seq 68743:69769, ack 1, win 57, options [nop,nop,TS val 5790815 ecr 5790803], length 1026
1450051828.706762 IP 10.1.1.2.2000 > 10.1.1.1.2000: Flags [.], ack 69769, win 330, options [nop,nop,TS val 5790815 ecr 5790815], length 0
1450051828.756668 IP 10.1.1.1.2000 > 10.1.1.2.2000: Flags [P.], seq 69769:70795, ack 1, win 57, options [nop,nop,TS val 5790828 ecr 5790815], length 1026
1450051828.756690 IP 10.1.1.2.2000 > 10.1.1.1.2000: Flags [.], ack 70795, win 334, options [nop,nop,TS val 5790828 ecr 5790828], length 0
1450051828.806768 IP 10.1.1.1.2000 > 10.1.1.2.2000: Flags [P.], seq 70795:71821, ack 1, win 57, options [nop,nop,TS val 5790840 ecr 5790828], length 1026
1450051828.806797 IP 10.1.1.2.2000 > 10.1.1.1.2000: Flags [.], ack 71821, win 338, options [nop,nop,TS val 5790840 ecr 5790840], length 0
1450051828.856818 IP 10.1.1.1.2000 > 10.1.1.2.2000: Flags [P.], seq 71821:72847, ack 1, win 57, options [nop,nop,TS val 5790853 ecr 5790840], length 1026
1450051828.856848 IP 10.1.1.2.2000 > 10.1.1.1.2000: Flags [.], ack 72847, win 342, options [nop,nop,TS val 5790853 ecr 5790853], length 0
1450051828.906777 IP 10.1.1.1.2000 > 10.1.1.2.2000: Flags [P.], seq 72847:73873, ack 1, win 57, options [nop,nop,TS val 5790865 ecr 5790853], length 1026
1450051828.906816 IP 10.1.1.2.2000 > 10.1.1.1.2000: Flags [.], ack 73873, win 346, options [nop,nop,TS val 5790865 ecr 5790865], length 0
1450051828.956677 IP 10.1.1.1.2000 > 10.1.1.2.2000: Flags [P.], seq 73873:74899, ack 1, win 57, options [nop,nop,TS val 5790878 ecr 5790865], length 1026
1450051828.956701 IP 10.1.1.2.2000 > 10.1.1.1.2000: Flags [.], ack 74899, win 350, options [nop,nop,TS val 5790878 ecr 5790878], length 0
1450051829.006755 IP 10.1.1.1.2000 > 10.1.1.2.2000: Flags [P.], seq 74899:75925, ack 1, win 57, options [nop,nop,TS val 5790890 ecr 5790878], length 1026
1450051829.006788 IP 10.1.1.2.2000 > 10.1.1.1.2000: Flags [.], ack 75925, win 354, options [nop,nop,TS val 5790890 ecr 5790890], length 0
1450051829.056774 IP 10.1.1.1.2000 > 10.1.1.2.2000: Flags [P.], seq 75925:76951, ack 1, win 57, options [nop,nop,TS val 5790903 ecr 5790890], length 1026
1450051829.056803 IP 10.1.1.2.2000 > 10.1.1.1.2000: Flags [.], ack 76951, win 358, options [nop,nop,TS val 5790903 ecr 5790903], length 0
1450051829.106670 IP 10.1.1.1.2000 > 10.1.1.2.2000: Flags [P.], seq 76951:77977, ack 1, win 57, options [nop,nop,TS val 5790915 ecr 5790903], length 1026
1450051829.106684 IP 10.1.1.2.2000 > 10.1.1.1.2000: Flags [.], ack 77977, win 361, options [nop,nop,TS val 5790915 ecr 5790915], length 0
1450051829.156671 IP 10.1.1.1.2000 > 10.1.1.2.2000: Flags [P.], seq 77977:79003, ack 1, win 57, options [nop,nop,TS val 5790928 ecr 5790915], length 1026
1450051829.156685 IP 10.1.1.2.2000 > 10.1.1.1.2000: Flags [.], ack 79003, win 361, options [nop,nop,TS val 5790928 ecr 5790928], length 0
1450051829.206734 IP 10.1.1.1.2000 > 10.1.1.2.2000: Flags [P.], seq 79003:80029, ack 1, win 57, options [nop,nop,TS val 5790940 ecr 5790928], length 1026
1450051829.206760 IP 10.1.1.2.2000 > 10.1.1.1.2000: Flags [.], ack 80029, win 361, options [nop,nop,TS val 5790940 ecr 5790940], length 0
1450051829.256706 IP 10.1.1.1.2000 > 10.1.1.2.2000: Flags [P.], seq 80029:81055, ack 1, win 57, options [nop,nop,TS val 5790953 ecr 5790940], length 1026
1450051829.256728 IP 10.1.1.2.2000 > 10.1.1.1.2000: Flags [.], ack 81055, win 361, options [nop,nop,TS val 5790953 ecr 5790953], length 0
1450051829.306660 IP 10.1.1.1.2000 > 10.1.1.2.2000: Flags [P.], seq 81055:82081, ack 1, win 57, options [nop,nop,TS val 5790965 ecr 5790953], length 1026
1450051829.306682 IP 10.1.1.2.2000 > 10.1.1.1.2000: Flags [.], ack 82081, win 361, options [nop,nop,TS val 5790965 ecr 5790965], length 0
1450051829.356761 IP 10.1.1.1.2000 > 10.1.1.2.2000: Flags [P.], seq 82081:83107, ack 1, win 57, options [nop,nop,TS val 5790978 ecr 5790965], length 1026
1450051829.356789 IP 10.1.1.2.2000 > 10.1.1.1.2000: Flags [.], ack 83107, win 361, options [nop,nop,TS val 5790978 ecr 5790978], length 0
1450051829.406656 IP 10.1.1.1.2000 > 10.1.1.2.2000: Flags [P.], seq 83107:84133, ack 1, win 57, options [nop,nop,TS val 5790990 ecr 5790978], length 1026
1450051829.406679 IP 10.1.1.2.2000 > 10.1.1.1.2000: Flags [.], ack 84133, win 361, options [nop,nop,TS val 5790990 ecr 5790990], length 0
1450051829.456703 IP 10.1.1.1.2000 > 10.1.1.2.2000: Flags [P.], seq 84133:85159, ack 1, win 57, options [nop,nop,TS val 5791003 ecr 5790990], length 1026
1450051829.456720 IP 10.1.1.2.2000 > 10.1.1.1.2000: Flags [.], ack 85159, win 361, options [nop,nop,TS val 5791003 ecr 5791003], length 0
1450051829.506725 IP 10.1.1.1.2000 > 10.1.1.2.2000: Flags [P.], seq 85159:86185, ack 1, win 57, options [nop,nop,TS val 5791015 ecr 5791003], length 1026
1450051829.506753 IP 10.1.1.2.2000 > 10.1.1.1.2000: Flags [.], ack 86185, win 361, options [nop,nop,TS val 5791015 ecr 5791015], length 0
1450051829.556679 IP 10.1.1.1.2000 > 10.1.1.2.2000: Flags [P.], seq 86185:87211, ack 1, win 57, options [nop,nop,TS val 5791028 ecr 5791015], length 1026
1450051829.556692 IP 10.1.1.2.2000 > 10.1.1.1.2000: Flags [.], ack 87211, win 361, options [nop,nop,TS val 5791028 ecr 5791028], length 0
1450051829.606656 IP 10.1.1.1.2000 > 10.1.1.2.2000: Flags [P.], seq 87211:88237, ack 1, win 57, options [nop,nop,TS val 5791040 ecr 5791028], length 1026
1450051829.606677 IP 10.1.1.2.2000 > 10.1.1.1.2000: Flags [.], ack 88237, win 361, options [nop,nop,TS val 5791040 ecr 5791040], length 0
1450051829.656732 IP 10.1.1.1.2000 > 10.1.1.2.2000: Flags [P.], seq 88237:89263, ack 1, win 57, options [nop,nop,TS val 5791053 ecr 5791040], length 1026
1450051829.656757 IP 10.1.1.2.2000 > 10.1.1.1.2000: Flags [.], ack 89263, win 361, options [nop,nop,TS val 5791053 ecr 5791053], length 0
1450051829.706743 IP 10.1.1.1.2000 > 10.1.1.2.2000: Flags [P.], seq 89263:90289, ack 1, win 57, options [nop,nop,TS val 5791065 ecr 5791053], length 1026
1450051829.706772 IP 10.1.1.2.2000 > 10.1.1.1.2000: Flags [.], ack 90289, win 361, options [nop,nop,TS val 5791065 ecr 5791065], length 0
1450051829.756658 IP 10.1.1.1.2000 > 10.1.1.2.2000: Flags [P.], seq 90289:91315, ack 1, win 57, options [nop,nop,TS val 5791078 ecr 5791065], length 1026
1450051829.756684 IP 10.1.1.2.2000 > 10.1.1.1.2000: Flags [.], ack 91315, win 361, options [nop,nop,TS val 5791078 ecr 5791078], length 0
1450051829.806783 IP 10.1.1.1.2000 > 10.1.1.2.2000: Flags [P.], seq 91315:92341, ack 1, win 57, options [nop,nop,TS val 5791090 ecr 5791078], length 1026
1450051829.806812 IP 10.1.1.2.2000 > 10.1.1.1.2000: Flags [.], ack 92341, win 361, options [nop,nop,TS val 5791090 ecr 5791090], length 0
1450051829.856761 IP 10.1.1.1.2000 > 10.1.1.2.2000: Flags [P.], seq 92341:93367, ack 1, win 57, options [nop,nop,TS val 5791103 ecr 5791090], length 1026
1450051829.895711 IP 10.1.1.2.2000 > 10.1.1.1.2000: Flags [.], ack 93367, win 361, options [nop,nop,TS val 5791113 ecr 5791103], length 0
1450051829.906780 IP 10.1.1.1.2000 > 10.1.1.2.2000: Flags [P.], seq 93367:94393, ack 1, win 57, options [nop,nop,TS val 5791115 ecr 5791113], length 1026
1450051829.943695 IP 10.1.1.2.2000 > 10.1.1.1.2000: Flags [.], ack 94393, win 361, options [nop,nop,TS val 5791125 ecr 5791115], length 0
1450051829.956720 IP 10.1.1.1.2000 > 10.1.1.2.2000: Flags [P.], seq 94393:95419, ack 1, win 57, options [nop,nop,TS val 5791128 ecr 5791125], length 1026
1450051829.995687 IP 10.1.1.2.2000 > 10.1.1.1.2000: Flags [.], ack 95419, win 361, options [nop,nop,TS val 5791138 ecr 5791128], length 0
1450051830.000799 IP6 fe80::e464:50ff:fe22:54e8.5353 > ff02::fb.5353: 0 [2q] PTR (QM)? _ipps._tcp.local. PTR (QM)? _ipp._tcp.local. (45)
1450051830.006759 IP 10.1.1.1.2000 > 10.1.1.2.2000: Flags [P.], seq 95419:96445, ack 1, win 57, options [nop,nop,TS val 5791140 ecr 5791138], length 1026
1450051830.043730 IP 10.1.1.2.2000 > 10.1.1.1.2000: Flags [.], ack 96445, win 361, options [nop,nop,TS val 5791150 ecr 5791140], length 0
1450051830.056800 IP 10.1.1.1.2000 > 10.1.1.2.2000: Flags [P.], seq 96445:97471, ack 1, win 57, options [nop,nop,TS val 5791153 ecr 5791150], length 1026
1450051830.095686 IP 10.1.1.2.2000 > 10.1.1.1.2000: Flags [.], ack 97471, win 361, options [nop,nop,TS val 5791163 ecr 5791153], length 0
1450051830.106777 IP 10.1.1.1.2000 > 10.1.1.2.2000: Flags [P.], seq 97471:98497, ack 1, win 57, options [nop,nop,TS val 5791165 ecr 5791163], length 1026
1450051830.143729 IP 10.1.1.2.2000 > 10.1.1.1.2000: Flags [.], ack 98497, win 361, options [nop,nop,TS val 5791175 ecr 5791165], length 0
1450051830.156782 IP 10.1.1.1.2000 > 10.1.1.2.2000: Flags [P.], seq 98497:99523, ack 1, win 57, options [nop,nop,TS val 5791178 ecr 5791175], length 1026
1450051830.195687 IP 10.1.1.2.2000 > 10.1.1.1.2000: Flags [.], ack 99523, win 361, options [nop,nop,TS val 5791188 ecr 5791178], length 0
1450051830.206780 IP 10.1.1.1.2000 > 10.1.1.2.2000: Flags [P.], seq 99523:100549, ack 1, win 57, options [nop,nop,TS val 5791190 ecr 5791188], length 1026
1450051830.243699 IP 10.1.1.2.2000 > 10.1.1.1.2000: Flags [.], ack 100549, win 361, options [nop,nop,TS val 5791200 ecr 5791190], length 0
1450051830.256786 IP 10.1.1.1.2000 > 10.1.1.2.2000: Flags [P.], seq 100549:101575, ack 1, win 57, options [nop,nop,TS val 5791203 ecr 5791200], length 1026
1450051830.295703 IP 10.1.1.2.2000 > 10.1.1.1.2000: Flags [.], ack 101575, win 361, options [nop,nop,TS val 5791213 ecr 5791203], length 0
1450051830.306779 IP 10.1.1.1.2000 > 10.1.1.2.2000: Flags [P.], seq 101575:102601, ack 1, win 57, options [nop,nop,TS val 5791215 ecr 5791213], length 1026
1450051830.307686 ARP, Request who-has 10.1.1.1 tell 10.1.1.2, length 28
1450051830.307749 ARP, Reply 10.1.1.1 is-at ca:1c:57:2f:3a:5d, length 28
1450051830.343725 IP 10.1.1.2.2000 > 10.1.1.1.2000: Flags [.], ack 102601, win 361, options [nop,nop,TS val 5791225 ecr 5791215], length 0
1450051830.356760 IP 10.1.1.1.2000 > 10.1.1.2.2000: Flags [P.], seq 102601:103627, ack 1, win 57, options [nop,nop,TS val 5791228 ecr 5791225], length 1026
1450051830.395691 IP 10.1.1.2.2000 > 10.1.1.1.2000: Flags [.], ack 103627, win 361, options [nop,nop,TS val 5791238 ecr 5791228], length 0
1450051830.406679 IP 10.1.1.1.2000 > 10.1.1.2.2000: Flags [P.], seq 103627:104653, ack 1, win 57, options [nop,nop,TS val 5791240 ecr 5791238], length 1026
1450051830.443688 IP 10.1.1.2.2000 > 10.1.1.1.2000: Flags [.], ack 104653, win 361, options [nop,nop,TS val 5791250 ecr 5791240], length 0
1450051830.456784 IP 10.1.1.1.2000 > 10.1.1.2.2000: Flags [P.], seq 104653:105679, ack 1, win 57, options [nop,nop,TS val 5791253 ecr 5791250], length 1026
1450051830.495710 IP 10.1.1.2.2000 > 10.1.1.1.2000: Flags [.], ack 105679, win 361, options [nop,nop,TS val 5791263 ecr 5791253], length 0
1450051830.506788 IP 10.1.1.1.2000 > 10.1.1.2.2000: Flags [P.], seq 105679:106705, ack 1, win 57, options [nop,nop,TS val 5791265 ecr 5791263], length 1026
1450051830.543725 IP 10.1.1.2.2000 > 10.1.1.1.2000: Flags [.], ack 106705, win 361, options [nop,nop,TS val 5791275 ecr 5791265], length 0
1450051830.556770 IP 10.1.1.1.2000 > 10.1.1.2.2000: Flags [P.], seq 106705:107731, ack 1, win 57, options [nop,nop,TS val 5791278 ecr 5791275], length 1026
1450051830.595693 IP 10.1.1.2.2000 > 10.1.1.1.2000: Flags [.], ack 107731, win 361, options [nop,nop,TS val 5791288 ecr 5791278], length 0
1450051830.606725 IP 10.1.1.1.2000 > 10.1.1.2.2000: Flags [P.], seq 107731:108757, ack 1, win 57, options [nop,nop,TS val 5791290 ecr 5791288], length 1026
1450051830.643671 IP 10.1.1.2.2000 > 10.1.1.1.2000: Flags [.], ack 108757, win 361, options [nop,nop,TS val 5791300 ecr 5791290], length 0
1450051830.656664 IP 10.1.1.1.2000 > 10.1.1.2.2000: Flags [P.], seq 108757:109783, ack 1, win 57, options [nop,nop,TS val 5791303 ecr 5791300], length 1026
1450051830.695670 IP 10.1.1.2.2000 > 10.1.1.1.2000: Flags [.], ack 109783, win 361, options [nop,nop,TS val 5791313 ecr 5791303], length 0
1450051830.706654 IP 10.1.1.1.2000 > 10.1.1.2.2000: Flags [P.], seq 109783:110809, ack 1, win 57, options [nop,nop,TS val 5791315 ecr 5791313], length 1026
1450051830.743671 IP 10.1.1.2.2000 > 10.1.1.1.2000: Flags [.], ack 110809, win 361, options [nop,nop,TS val 5791325 ecr 5791315], length 0
1450051830.756669 IP 10.1.1.1.2000 > 10.1.1.2.2000: Flags [P.], seq 110809:111835, ack 1, win 57, options [nop,nop,TS val 5791328 ecr 5791325], length 1026
1450051830.795675 IP 10.1.1.2.2000 > 10.1.1.1.2000: Flags [.], ack 111835, win 361, options [nop,nop,TS val 5791338 ecr 5791328], length 0
1450051830.806630 IP 10.1.1.1.2000 > 10.1.1.2.2000: Flags [P.], seq 111835:112861, ack 1, win 57, options [nop,nop,TS val 5791340 ecr 5791338], length 1026
1450051830.843668 IP 10.1.1.2.2000 > 10.1.1.1.2000: Flags [.], ack 112861, win 361, options [nop,nop,TS val 5791350 ecr 5791340], length 0
1450051830.856654 IP 10.1.1.1.2000 > 10.1.1.2.2000: Flags [P.], seq 112861:113887, ack 1, win 57, options [nop,nop,TS val 5791353 ecr 5791350], length 1026
1450051830.895693 IP 10.1.1.2.2000 > 10.1.1.1.2000: Flags [.], ack 113887, win 361, options [nop,nop,TS val 5791363 ecr 5791353], length 0
1450051830.906746 IP 10.1.1.1.2000 > 10.1.1.2.2000: Flags [P.], seq 113887:114913, ack 1, win 57, options [nop,nop,TS val 5791365 ecr 5791363], length 1026
1450051830.943675 IP 10.1.1.2.2000 > 10.1.1.1.2000: Flags [.], ack 114913, win 361, options [nop,nop,TS val 5791375 ecr 5791365], length 0
1450051830.956708 IP 10.1.1.1.2000 > 10.1.1.2.2000: Flags [P.], seq 114913:115939, ack 1, win 57, options [nop,nop,TS val 5791378 ecr 5791375], length 1026
1450051830.995686 IP 10.1.1.2.2000 > 10.1.1.1.2000: Flags [.], ack 115939, win 361, options [nop,nop,TS val 5791388 ecr 5791378], length 0
1450051831.006685 IP 10.1.1.1.2000 > 10.1.1.2.2000: Flags [P.], seq 115939:116965, ack 1, win 57, options [nop,nop,TS val 5791390 ecr 5791388], length 1026
1450051831.043668 IP 10.1.1.2.2000 > 10.1.1.1.2000: Flags [.], ack 116965, win 361, options [nop,nop,TS val 5791400 ecr 5791390], length 0
1450051831.056675 IP 10.1.1.1.2000 > 10.1.1.2.2000: Flags [P.], seq 116965:117991, ack 1, win 57, options [nop,nop,TS val 5791403 ecr 5791400], length 1026
1450051831.095676 IP 10.1.1.2.2000 > 10.1.1.1.2000: Flags [.], ack 117991, win 361, options [nop,nop,TS val 5791413 ecr 5791403], length 0
1450051831.106680 IP 10.1.1.1.2000 > 10.1.1.2.2000: Flags [P.], seq 117991:119017, ack 1, win 57, options [nop,nop,TS val 5791415 ecr 5791413], length 1026
1450051831.143692 IP 10.1.1.2.2000 > 10.1.1.1.2000: Flags [.], ack 119017, win 361, options [nop,nop,TS val 5791425 ecr 5791415], length 0
1450051831.156727 IP 10.1.1.1.2000 > 10.1.1.2.2000: Flags [P.], seq 119017:120043, ack 1, win 57, options [nop,nop,TS val 5791428 ecr 5791425], length 1026
1450051831.195693 IP 10.1.1.2.2000 > 10.1.1.1.2000: Flags [.], ack 120043, win 361, options [nop,nop,TS val 5791438 ecr 5791428], length 0
1450051831.206744 IP 10.1.1.1.2000 > 10.1.1.2.2000: Flags [P.], seq 120043:121069, ack 1, win 57, options [nop,nop,TS val 5791440 ecr 5791438], length 1026
1450051831.243739 IP 10.1.1.2.2000 > 10.1.1.1.2000: Flags [.], ack 121069, win 361, options [nop,nop,TS val 5791450 ecr 5791440], length 0
1450051831.256753 IP 10.1.1.1.2000 > 10.1.1.2.2000: Flags [P.], seq 121069:122095, ack 1, win 57, options [nop,nop,TS val 5791453 ecr 5791450], length 1026
1450051831.295696 IP 10.1.1.2.2000 > 10.1.1.1.2000: Flags [.], ack 122095, win 361, options [nop,nop,TS val 5791463 ecr 5791453], length 0
1450051831.306726 IP 10.1.1.1.2000 > 10.1.1.2.2000: Flags [P.], seq 122095:123121, ack 1, win 57, options [nop,nop,TS val 5791465 ecr 5791463], length 1026
1450051831.343678 IP 10.1.1.2.2000 > 10.1.1.1.2000: Flags [.], ack 123121, win 361, options [nop,nop,TS val 5791475 ecr 5791465], length 0
1450051831.356646 IP 10.1.1.1.2000 > 10.1.1.2.2000: Flags [P.], seq 123121:124147, ack 1, win 57, options [nop,nop,TS val 5791478 ecr 5791475], length 1026
1450051831.395692 IP 10.1.1.2.2000 > 10.1.1.1.2000: Flags [.], ack 124147, win 361, options [nop,nop,TS val 5791488 ecr 5791478], length 0
1450051831.406700 IP 10.1.1.1.2000 > 10.1.1.2.2000: Flags [P.], seq 124147:125173, ack 1, win 57, options [nop,nop,TS val 5791490 ecr 5791488], length 1026
1450051831.443669 IP 10.1.1.2.2000 > 10.1.1.1.2000: Flags [.], ack 125173, win 361, options [nop,nop,TS val 5791500 ecr 5791490], length 0
1450051831.456664 IP 10.1.1.1.2000 > 10.1.1.2.2000: Flags [P.], seq 125173:126199, ack 1, win 57, options [nop,nop,TS val 5791503 ecr 5791500], length 1026
1450051831.495675 IP 10.1.1.2.2000 > 10.1.1.1.2000: Flags [.], ack 126199, win 361, options [nop,nop,TS val 5791513 ecr 5791503], length 0
1450051831.506650 IP 10.1.1.1.2000 > 10.1.1.2.2000: Flags [P.], seq 126199:127225, ack 1, win 57, options [nop,nop,TS val 5791515 ecr 5791513], length 1026
1450051831.543670 IP 10.1.1.2.2000 > 10.1.1.1.2000: Flags [.], ack 127225, win 361, options [nop,nop,TS val 5791525 ecr 5791515], length 0
1450051831.556657 IP 10.1.1.1.2000 > 10.1.1.2.2000: Flags [P.], seq 127225:128251, ack 1, win 57, options [nop,nop,TS val 5791528 ecr 5791525], length 1026
1450051831.595672 IP 10.1.1.2.2000 > 10.1.1.1.2000: Flags [.], ack 128251, win 361, options [nop,nop,TS val 5791538 ecr 5791528], length 0
1450051831.606659 IP 10.1.1.1.2000 > 10.1.1.2.2000: Flags [P.], seq 128251:129277, ack 1, win 57, options [nop,nop,TS val 5791540 ecr 5791538], length 1026
1450051831.643668 IP 10.1.1.2.2000 > 10.1.1.1.2000: Flags [.], ack 129277, win 361, options [nop,nop,TS val 5791550 ecr 5791540], length 0
1450051831.656654 IP 10.1.1.1.2000 > 10.1.1.2.2000: Flags [P.], seq 129277:130303, ack 1, win 57, options [nop,nop,TS val 5791553 ecr 5791550], length 1026
1450051831.695673 IP 10.1.1.2.2000 > 10.1.1.1.2000: Flags [.], ack 130303, win 361, options [nop,nop,TS val 5791563 ecr 5791553], length 0
1450051831.706632 IP 10.1.1.1.2000 > 10.1.1.2.2000: Flags [P.], seq 130303:131329, ack 1, win 57, options [nop,nop,TS val 5791565 ecr 5791563], length 1026
1450051831.743671 IP 10.1.1.2.2000 > 10.1.1.1.2000: Flags [.], ack 131329, win 361, options [nop,nop,TS val 5791575 ecr 5791565], length 0
1450051831.756650 IP 10.1.1.1.2000 > 10.1.1.2.2000: Flags [P.], seq 131329:132355, ack 1, win 57, options [nop,nop,TS val 5791578 ecr 5791575], length 1026
1450051831.795677 IP 10.1.1.2.2000 > 10.1.1.1.2000: Flags [.], ack 132355, win 361, options [nop,nop,TS val 5791588 ecr 5791578], length 0
1450051831.806656 IP 10.1.1.1.2000 > 10.1.1.2.2000: Flags [P.], seq 132355:133381, ack 1, win 57, options [nop,nop,TS val 5791590 ecr 5791588], length 1026
1450051831.843673 IP 10.1.1.2.2000 > 10.1.1.1.2000: Flags [.], ack 133381, win 361, options [nop,nop,TS val 5791600 ecr 5791590], length 0
1450051831.856632 IP 10.1.1.1.2000 > 10.1.1.2.2000: Flags [P.], seq 133381:134407, ack 1, win 57, options [nop,nop,TS val 5791603 ecr 5791600], length 1026
1450051831.895671 IP 10.1.1.2.2000 > 10.1.1.1.2000: Flags [.], ack 134407, win 361, options [nop,nop,TS val 5791613 ecr 5791603], length 0
1450051831.906638 IP 10.1.1.1.2000 > 10.1.1.2.2000: Flags [P.], seq 134407:135433, ack 1, win 57, options [nop,nop,TS val 5791615 ecr 5791613], length 1026
1450051831.943673 IP 10.1.1.2.2000 > 10.1.1.1.2000: Flags [.], ack 135433, win 361, options [nop,nop,TS val 5791625 ecr 5791615], length 0
