1449991988.815403 IP localhost.58646 > localhost.http-alt: Flags [S], seq 3067215775, win 43690, options [mss 65495,sackOK,TS val 5074555 ecr 0,nop,wscale 7], length 0
1449991988.815611 IP localhost.http-alt > localhost.58646: Flags [S.], seq 3269718781, ack 3067215776, win 43690, options [mss 65495,sackOK,TS val 5074555 ecr 5074555,nop,wscale 7], length 0
1449991988.815818 IP localhost.58646 > localhost.http-alt: Flags [.], ack 1, win 342, options [nop,nop,TS val 5074555 ecr 5074555], length 0
1449991988.816233 IP localhost.58647 > localhost.http-alt: Flags [S], seq 611706786, win 43690, options [mss 65495,sackOK,TS val 5074555 ecr 0,nop,wscale 7], length 0
1449991988.816448 IP localhost.http-alt > localhost.58647: Flags [S.], seq 4281200751, ack 611706787, win 43690, options [mss 65495,sackOK,TS val 5074555 ecr 5074555,nop,wscale 7], length 0
1449991988.816651 IP localhost.58647 > localhost.http-alt: Flags [.], ack 1, win 342, options [nop,nop,TS val 5074555 ecr 5074555], length 0
1449991988.817002 IP localhost.58648 > localhost.http-alt: Flags [S], seq 431655102, win 43690, options [mss 65495,sackOK,TS val 5074555 ecr 0,nop,wscale 7], length 0
1449991988.817209 IP localhost.http-alt > localhost.58648: Flags [S.], seq 2865316327, ack 431655103, win 43690, options [mss 65495,sackOK,TS val 5074555 ecr 5074555,nop,wscale 7], length 0
1449991988.817404 IP localhost.58648 > localhost.http-alt: Flags [.], ack 1, win 342, options [nop,nop,TS val 5074555 ecr 5074555], length 0
1449991988.817757 IP localhost.58649 > localhost.http-alt: Flags [S], seq 2105606980, win 43690, options [mss 65495,sackOK,TS val 5074555 ecr 0,nop,wscale 7], length 0
1449991988.817946 IP localhost.http-alt > localhost.58649: Flags [S.], seq 2686809917, ack 2105606981, win 43690, options [mss 65495,sackOK,TS val 5074555 ecr 5074555,nop,wscale 7], length 0
1449991988.818141 IP localhost.58649 > localhost.http-alt: Flags [.], ack 1, win 342, options [nop,nop,TS val 5074555 ecr 5074555], length 0
1449991988.818449 IP localhost.58650 > localhost.http-alt: Flags [S], seq 75533438, win 43690, options [mss 65495,sackOK,TS val 5074556 ecr 0,nop,wscale 7], length 0
1449991988.818541 IP localhost.http-alt > localhost.58650: Flags [S.], seq 1268535439, ack 75533439, win 43690, options [mss 65495,sackOK,TS val 5074556 ecr 5074556,nop,wscale 7], length 0
1449991988.818634 IP localhost.58650 > localhost.http-alt: Flags [.], ack 1, win 342, options [nop,nop,TS val 5074556 ecr 5074556], length 0
1449991988.868845 IP localhost.http-alt > localhost.58646: Flags [P.], seq 1:1027, ack 1, win 342, options [nop,nop,TS val 5074568 ecr 5074555], length 1026
1449991988.869223 IP localhost.58646 > localhost.http-alt: Flags [.], ack 1027, win 358, options [nop,nop,TS val 5074568 ecr 5074568], length 0
1449991988.918928 IP localhost.http-alt > localhost.58647: Flags [P.], seq 1:1027, ack 1, win 342, options [nop,nop,TS val 5074581 ecr 5074555], length 1026
1449991988.919453 IP localhost.58647 > localhost.http-alt: Flags [.], ack 1027, win 358, options [nop,nop,TS val 5074581 ecr 5074581], length 0
1449991988.968835 IP localhost.http-alt > localhost.58648: Flags [P.], seq 1:1027, ack 1, win 342, options [nop,nop,TS val 5074593 ecr 5074555], length 1026
1449991988.969046 IP localhost.58648 > localhost.http-alt: Flags [.], ack 1027, win 358, options [nop,nop,TS val 5074593 ecr 5074593], length 0
1449991989.018865 IP localhost.http-alt > localhost.58649: Flags [P.], seq 1:1027, ack 1, win 342, options [nop,nop,TS val 5074606 ecr 5074555], length 1026
1449991989.019291 IP localhost.58649 > localhost.http-alt: Flags [.], ack 1027, win 358, options [nop,nop,TS val 5074606 ecr 5074606], length 0
1449991989.068920 IP localhost.http-alt > localhost.58650: Flags [P.], seq 1:1027, ack 1, win 342, options [nop,nop,TS val 5074618 ecr 5074556], length 1026
1449991989.069367 IP localhost.58650 > localhost.http-alt: Flags [.], ack 1027, win 358, options [nop,nop,TS val 5074618 ecr 5074618], length 0
1449991989.118950 IP localhost.http-alt > localhost.58646: Flags [P.], seq 1027:2053, ack 1, win 342, options [nop,nop,TS val 5074631 ecr 5074568], length 1026
1449991989.119419 IP localhost.58646 > localhost.http-alt: Flags [.], ack 2053, win 374, options [nop,nop,TS val 5074631 ecr 5074631], length 0
1449991989.168865 IP localhost.http-alt > localhost.58647: Flags [P.], seq 1027:2053, ack 1, win 342, options [nop,nop,TS val 5074643 ecr 5074581], length 1026
1449991989.169228 IP localhost.58647 > localhost.http-alt: Flags [.], ack 2053, win 374, options [nop,nop,TS val 5074643 ecr 5074643], length 0
1449991989.218848 IP localhost.http-alt > localhost.58648: Flags [P.], seq 1027:2053, ack 1, win 342, options [nop,nop,TS val 5074656 ecr 5074593], length 1026
1449991989.219163 IP localhost.58648 > localhost.http-alt: Flags [.], ack 2053, win 374, options [nop,nop,TS val 5074656 ecr 5074656], length 0
1449991989.268845 IP localhost.http-alt > localhost.58649: Flags [P.], seq 1027:2053, ack 1, win 342, options [nop,nop,TS val 5074668 ecr 5074606], length 1026
1449991989.269160 IP localhost.58649 > localhost.http-alt: Flags [.], ack 2053, win 374, options [nop,nop,TS val 5074668 ecr 5074668], length 0
1449991989.318845 IP localhost.http-alt > localhost.58650: Flags [P.], seq 1027:2053, ack 1, win 342, options [nop,nop,TS val 5074681 ecr 5074618], length 1026
1449991989.319168 IP localhost.58650 > localhost.http-alt: Flags [.], ack 2053, win 374, options [nop,nop,TS val 5074681 ecr 5074681], length 0
1449991989.368843 IP localhost.http-alt > localhost.58646: Flags [P.], seq 2053:3079, ack 1, win 342, options [nop,nop,TS val 5074693 ecr 5074631], length 1026
1449991989.369176 IP localhost.58646 > localhost.http-alt: Flags [.], ack 3079, win 390, options [nop,nop,TS val 5074693 ecr 5074693], length 0
1449991989.418844 IP localhost.http-alt > localhost.58647: Flags [P.], seq 2053:3079, ack 1, win 342, options [nop,nop,TS val 5074706 ecr 5074643], length 1026
1449991989.419181 IP localhost.58647 > localhost.http-alt: Flags [.], ack 3079, win 390, options [nop,nop,TS val 5074706 ecr 5074706], length 0
1449991989.468937 IP localhost.http-alt > localhost.58648: Flags [P.], seq 2053:3079, ack 1, win 342, options [nop,nop,TS val 5074718 ecr 5074656], length 1026
1449991989.469415 IP localhost.58648 > localhost.http-alt: Flags [.], ack 3079, win 390, options [nop,nop,TS val 5074718 ecr 5074718], length 0
1449991989.518895 IP localhost.http-alt > localhost.58649: Flags [P.], seq 2053:3079, ack 1, win 342, options [nop,nop,TS val 5074731 ecr 5074668], length 1026
1449991989.519355 IP localhost.58649 > localhost.http-alt: Flags [.], ack 3079, win 390, options [nop,nop,TS val 5074731 ecr 5074731], length 0
1449991989.568858 IP localhost.http-alt > localhost.58650: Flags [P.], seq 2053:3079, ack 1, win 342, options [nop,nop,TS val 5074743 ecr 5074681], length 1026
1449991989.569199 IP localhost.58650 > localhost.http-alt: Flags [.], ack 3079, win 390, options [nop,nop,TS val 5074743 ecr 5074743], length 0
1449991989.618856 IP localhost.http-alt > localhost.58646: Flags [P.], seq 3079:4105, ack 1, win 342, options [nop,nop,TS val 5074756 ecr 5074693], length 1026
1449991989.619215 IP localhost.58646 > localhost.http-alt: Flags [.], ack 4105, win 406, options [nop,nop,TS val 5074756 ecr 5074756], length 0
1449991989.668841 IP localhost.http-alt > localhost.58647: Flags [P.], seq 3079:4105, ack 1, win 342, options [nop,nop,TS val 5074768 ecr 5074706], length 1026
1449991989.669036 IP localhost.58647 > localhost.http-alt: Flags [.], ack 4105, win 406, options [nop,nop,TS val 5074768 ecr 5074768], length 0
1449991989.718848 IP localhost.http-alt > localhost.58648: Flags [P.], seq 3079:4105, ack 1, win 342, options [nop,nop,TS val 5074781 ecr 5074718], length 1026
1449991989.719039 IP localhost.58648 > localhost.http-alt: Flags [.], ack 4105, win 406, options [nop,nop,TS val 5074781 ecr 5074781], length 0
1449991989.768867 IP localhost.http-alt > localhost.58649: Flags [P.], seq 3079:4105, ack 1, win 342, options [nop,nop,TS val 5074793 ecr 5074731], length 1026
1449991989.769321 IP localhost.58649 > localhost.http-alt: Flags [.], ack 4105, win 406, options [nop,nop,TS val 5074793 ecr 5074793], length 0
1449991989.818874 IP localhost.http-alt > localhost.58650: Flags [P.], seq 3079:4105, ack 1, win 342, options [nop,nop,TS val 5074806 ecr 5074743], length 1026
1449991989.819178 IP localhost.58650 > localhost.http-alt: Flags [.], ack 4105, win 406, options [nop,nop,TS val 5074806 ecr 5074806], length 0
1449991989.868851 IP localhost.http-alt > localhost.58646: Flags [P.], seq 4105:5131, ack 1, win 342, options [nop,nop,TS val 5074818 ecr 5074756], length 1026
1449991989.869173 IP localhost.58646 > localhost.http-alt: Flags [.], ack 5131, win 422, options [nop,nop,TS val 5074818 ecr 5074818], length 0
1449991989.918845 IP localhost.http-alt > localhost.58647: Flags [P.], seq 4105:5131, ack 1, win 342, options [nop,nop,TS val 5074831 ecr 5074768], length 1026
1449991989.919172 IP localhost.58647 > localhost.http-alt: Flags [.], ack 5131, win 422, options [nop,nop,TS val 5074831 ecr 5074831], length 0
1449991989.968845 IP localhost.http-alt > localhost.58648: Flags [P.], seq 4105:5131, ack 1, win 342, options [nop,nop,TS val 5074843 ecr 5074781], length 1026
1449991989.969175 IP localhost.58648 > localhost.http-alt: Flags [.], ack 5131, win 422, options [nop,nop,TS val 5074843 ecr 5074843], length 0
1449991990.018817 IP localhost.http-alt > localhost.58649: Flags [P.], seq 4105:5131, ack 1, win 342, options [nop,nop,TS val 5074856 ecr 5074793], length 1026
1449991990.019098 IP localhost.58649 > localhost.http-alt: Flags [.], ack 5131, win 422, options [nop,nop,TS val 5074856 ecr 5074856], length 0
1449991990.068841 IP localhost.http-alt > localhost.58650: Flags [P.], seq 4105:5131, ack 1, win 342, options [nop,nop,TS val 5074868 ecr 5074806], length 1026
1449991990.069172 IP localhost.58650 > localhost.http-alt: Flags [.], ack 5131, win 422, options [nop,nop,TS val 5074868 ecr 5074868], length 0
1449991990.118849 IP localhost.http-alt > localhost.58646: Flags [P.], seq 5131:6157, ack 1, win 342, options [nop,nop,TS val 5074881 ecr 5074818], length 1026
1449991990.119126 IP localhost.58646 > localhost.http-alt: Flags [.], ack 6157, win 438, options [nop,nop,TS val 5074881 ecr 5074881], length 0
1449991990.168869 IP localhost.http-alt > localhost.58647: Flags [P.], seq 5131:6157, ack 1, win 342, options [nop,nop,TS val 5074893 ecr 5074831], length 1026
1449991990.169233 IP localhost.58647 > localhost.http-alt: Flags [.], ack 6157, win 438, options [nop,nop,TS val 5074893 ecr 5074893], length 0
1449991990.218864 IP localhost.http-alt > localhost.58648: Flags [P.], seq 5131:6157, ack 1, win 342, options [nop,nop,TS val 5074906 ecr 5074843], length 1026
1449991990.219082 IP localhost.58648 > localhost.http-alt: Flags [.], ack 6157, win 438, options [nop,nop,TS val 5074906 ecr 5074906], length 0
1449991990.268862 IP localhost.http-alt > localhost.58649: Flags [P.], seq 5131:6157, ack 1, win 342, options [nop,nop,TS val 5074918 ecr 5074856], length 1026
1449991990.269230 IP localhost.58649 > localhost.http-alt: Flags [.], ack 6157, win 438, options [nop,nop,TS val 5074918 ecr 5074918], length 0
1449991990.318898 IP localhost.http-alt > localhost.58650: Flags [P.], seq 5131:6157, ack 1, win 342, options [nop,nop,TS val 5074931 ecr 5074868], length 1026
1449991990.319249 IP localhost.58650 > localhost.http-alt: Flags [.], ack 6157, win 438, options [nop,nop,TS val 5074931 ecr 5074931], length 0
1449991990.368835 IP localhost.http-alt > localhost.58646: Flags [P.], seq 6157:7183, ack 1, win 342, options [nop,nop,TS val 5074943 ecr 5074881], length 1026
1449991990.369154 IP localhost.58646 > localhost.http-alt: Flags [.], ack 7183, win 454, options [nop,nop,TS val 5074943 ecr 5074943], length 0
1449991990.418874 IP localhost.http-alt > localhost.58647: Flags [P.], seq 6157:7183, ack 1, win 342, options [nop,nop,TS val 5074956 ecr 5074893], length 1026
1449991990.419198 IP localhost.58647 > localhost.http-alt: Flags [.], ack 7183, win 454, options [nop,nop,TS val 5074956 ecr 5074956], length 0
1449991990.468838 IP localhost.http-alt > localhost.58648: Flags [P.], seq 6157:7183, ack 1, win 342, options [nop,nop,TS val 5074968 ecr 5074906], length 1026
1449991990.469147 IP localhost.58648 > localhost.http-alt: Flags [.], ack 7183, win 454, options [nop,nop,TS val 5074968 ecr 5074968], length 0
1449991990.518972 IP localhost.http-alt > localhost.58649: Flags [P.], seq 6157:7183, ack 1, win 342, options [nop,nop,TS val 5074981 ecr 5074918], length 1026
1449991990.519305 IP localhost.58649 > localhost.http-alt: Flags [.], ack 7183, win 454, options [nop,nop,TS val 5074981 ecr 5074981], length 0
1449991990.568881 IP localhost.http-alt > localhost.58650: Flags [P.], seq 6157:7183, ack 1, win 342, options [nop,nop,TS val 5074993 ecr 5074931], length 1026
1449991990.569271 IP localhost.58650 > localhost.http-alt: Flags [.], ack 7183, win 454, options [nop,nop,TS val 5074993 ecr 5074993], length 0
1449991990.618871 IP localhost.http-alt > localhost.58646: Flags [P.], seq 7183:8209, ack 1, win 342, options [nop,nop,TS val 5075006 ecr 5074943], length 1026
1449991990.619232 IP localhost.58646 > localhost.http-alt: Flags [.], ack 8209, win 470, options [nop,nop,TS val 5075006 ecr 5075006], length 0
1449991990.668935 IP localhost.http-alt > localhost.58647: Flags [P.], seq 7183:8209, ack 1, win 342, options [nop,nop,TS val 5075018 ecr 5074956], length 1026
1449991990.669437 IP localhost.58647 > localhost.http-alt: Flags [.], ack 8209, win 470, options [nop,nop,TS val 5075018 ecr 5075018], length 0
1449991990.718888 IP localhost.http-alt > localhost.58648: Flags [P.], seq 7183:8209, ack 1, win 342, options [nop,nop,TS val 5075031 ecr 5074968], length 1026
1449991990.719254 IP localhost.58648 > localhost.http-alt: Flags [.], ack 8209, win 470, options [nop,nop,TS val 5075031 ecr 5075031], length 0
1449991990.768863 IP localhost.http-alt > localhost.58649: Flags [P.], seq 7183:8209, ack 1, win 342, options [nop,nop,TS val 5075043 ecr 5074981], length 1026
1449991990.769209 IP localhost.58649 > localhost.http-alt: Flags [.], ack 8209, win 470, options [nop,nop,TS val 5075043 ecr 5075043], length 0
1449991990.818939 IP localhost.http-alt > localhost.58650: Flags [P.], seq 7183:8209, ack 1, win 342, options [nop,nop,TS val 5075056 ecr 5074993], length 1026
1449991990.819433 IP localhost.58650 > localhost.http-alt: Flags [.], ack 8209, win 470, options [nop,nop,TS val 5075056 ecr 5075056], length 0
1449991990.868893 IP localhost.http-alt > localhost.58646: Flags [P.], seq 8209:9235, ack 1, win 342, options [nop,nop,TS val 5075068 ecr 5075006], length 1026
1449991990.869264 IP localhost.58646 > localhost.http-alt: Flags [.], ack 9235, win 486, options [nop,nop,TS val 5075068 ecr 5075068], length 0
1449991990.918915 IP localhost.http-alt > localhost.58647: Flags [P.], seq 8209:9235, ack 1, win 342, options [nop,nop,TS val 5075081 ecr 5075018], length 1026
1449991990.919434 IP localhost.58647 > localhost.http-alt: Flags [.], ack 9235, win 486, options [nop,nop,TS val 5075081 ecr 5075081], length 0
1449991990.968858 IP localhost.http-alt > localhost.58648: Flags [P.], seq 8209:9235, ack 1, win 342, options [nop,nop,TS val 5075093 ecr 5075031], length 1026
1449991990.969242 IP localhost.58648 > localhost.http-alt: Flags [.], ack 9235, win 486, options [nop,nop,TS val 5075093 ecr 5075093], length 0
1449991991.018923 IP localhost.http-alt > localhost.58649: Flags [P.], seq 8209:9235, ack 1, win 342, options [nop,nop,TS val 5075106 ecr 5075043], length 1026
1449991991.019387 IP localhost.58649 > localhost.http-alt: Flags [.], ack 9235, win 486, options [nop,nop,TS val 5075106 ecr 5075106], length 0
1449991991.068824 IP localhost.http-alt > localhost.58650: Flags [P.], seq 8209:9235, ack 1, win 342, options [nop,nop,TS val 5075118 ecr 5075056], length 1026
1449991991.069041 IP localhost.58650 > localhost.http-alt: Flags [.], ack 9235, win 486, options [nop,nop,TS val 5075118 ecr 5075118], length 0
1449991991.118852 IP localhost.http-alt > localhost.58646: Flags [P.], seq 9235:10261, ack 1, win 342, options [nop,nop,TS val 5075131 ecr 5075068], length 1026
1449991991.119033 IP localhost.58646 > localhost.http-alt: Flags [.], ack 10261, win 502, options [nop,nop,TS val 5075131 ecr 5075131], length 0
1449991991.168938 IP localhost.http-alt > localhost.58647: Flags [P.], seq 9235:10261, ack 1, win 342, options [nop,nop,TS val 5075143 ecr 5075081], length 1026
1449991991.169454 IP localhost.58647 > localhost.http-alt: Flags [.], ack 10261, win 502, options [nop,nop,TS val 5075143 ecr 5075143], length 0
1449991991.218872 IP localhost.http-alt > localhost.58648: Flags [P.], seq 9235:10261, ack 1, win 342, options [nop,nop,TS val 5075156 ecr 5075093], length 1026
1449991991.219229 IP localhost.58648 > localhost.http-alt: Flags [.], ack 10261, win 502, options [nop,nop,TS val 5075156 ecr 5075156], length 0
1449991991.268827 IP localhost.http-alt > localhost.58649: Flags [P.], seq 9235:10261, ack 1, win 342, options [nop,nop,TS val 5075168 ecr 5075106], length 1026
1449991991.269027 IP localhost.58649 > localhost.http-alt: Flags [.], ack 10261, win 502, options [nop,nop,TS val 5075168 ecr 5075168], length 0
1449991991.318853 IP localhost.http-alt > localhost.58650: Flags [P.], seq 9235:10261, ack 1, win 342, options [nop,nop,TS val 5075181 ecr 5075118], length 1026
1449991991.319159 IP localhost.58650 > localhost.http-alt: Flags [.], ack 10261, win 502, options [nop,nop,TS val 5075181 ecr 5075181], length 0
1449991991.368836 IP localhost.http-alt > localhost.58646: Flags [P.], seq 10261:11287, ack 1, win 342, options [nop,nop,TS val 5075193 ecr 5075131], length 1026
1449991991.369138 IP localhost.58646 > localhost.http-alt: Flags [.], ack 11287, win 518, options [nop,nop,TS val 5075193 ecr 5075193], length 0
1449991991.418843 IP localhost.http-alt > localhost.58647: Flags [P.], seq 10261:11287, ack 1, win 342, options [nop,nop,TS val 5075206 ecr 5075143], length 1026
1449991991.419206 IP localhost.58647 > localhost.http-alt: Flags [.], ack 11287, win 518, options [nop,nop,TS val 5075206 ecr 5075206], length 0
1449991991.468925 IP localhost.http-alt > localhost.58648: Flags [P.], seq 10261:11287, ack 1, win 342, options [nop,nop,TS val 5075218 ecr 5075156], length 1026
1449991991.469392 IP localhost.58648 > localhost.http-alt: Flags [.], ack 11287, win 518, options [nop,nop,TS val 5075218 ecr 5075218], length 0
1449991991.518838 IP localhost.http-alt > localhost.58649: Flags [P.], seq 10261:11287, ack 1, win 342, options [nop,nop,TS val 5075231 ecr 5075168], length 1026
1449991991.519049 IP localhost.58649 > localhost.http-alt: Flags [.], ack 11287, win 518, options [nop,nop,TS val 5075231 ecr 5075231], length 0
1449991991.568914 IP localhost.http-alt > localhost.58650: Flags [P.], seq 10261:11287, ack 1, win 342, options [nop,nop,TS val 5075243 ecr 5075181], length 1026
1449991991.569287 IP localhost.58650 > localhost.http-alt: Flags [.], ack 11287, win 518, options [nop,nop,TS val 5075243 ecr 5075243], length 0
1449991991.618847 IP localhost.http-alt > localhost.58646: Flags [P.], seq 11287:12313, ack 1, win 342, options [nop,nop,TS val 5075256 ecr 5075193], length 1026
1449991991.619192 IP localhost.58646 > localhost.http-alt: Flags [.], ack 12313, win 534, options [nop,nop,TS val 5075256 ecr 5075256], length 0
1449991991.668835 IP localhost.http-alt > localhost.58647: Flags [P.], seq 11287:12313, ack 1, win 342, options [nop,nop,TS val 5075268 ecr 5075206], length 1026
1449991991.669045 IP localhost.58647 > localhost.http-alt: Flags [.], ack 12313, win 534, options [nop,nop,TS val 5075268 ecr 5075268], length 0
1449991991.718874 IP localhost.http-alt > localhost.58648: Flags [P.], seq 11287:12313, ack 1, win 342, options [nop,nop,TS val 5075281 ecr 5075218], length 1026
1449991991.719264 IP localhost.58648 > localhost.http-alt: Flags [.], ack 12313, win 534, options [nop,nop,TS val 5075281 ecr 5075281], length 0
1449991991.768850 IP localhost.http-alt > localhost.58649: Flags [P.], seq 11287:12313, ack 1, win 342, options [nop,nop,TS val 5075293 ecr 5075231], length 1026
1449991991.769131 IP localhost.58649 > localhost.http-alt: Flags [.], ack 12313, win 534, options [nop,nop,TS val 5075293 ecr 5075293], length 0
1449991991.818831 IP localhost.http-alt > localhost.58650: Flags [P.], seq 11287:12313, ack 1, win 342, options [nop,nop,TS val 5075306 ecr 5075243], length 1026
1449991991.819049 IP localhost.58650 > localhost.http-alt: Flags [.], ack 12313, win 534, options [nop,nop,TS val 5075306 ecr 5075306], length 0
1449991991.868832 IP localhost.http-alt > localhost.58646: Flags [P.], seq 12313:13339, ack 1, win 342, options [nop,nop,TS val 5075318 ecr 5075256], length 1026
1449991991.869023 IP localhost.58646 > localhost.http-alt: Flags [.], ack 13339, win 550, options [nop,nop,TS val 5075318 ecr 5075318], length 0
1449991991.918840 IP localhost.http-alt > localhost.58647: Flags [P.], seq 12313:13339, ack 1, win 342, options [nop,nop,TS val 5075331 ecr 5075268], length 1026
1449991991.919107 IP localhost.58647 > localhost.http-alt: Flags [.], ack 13339, win 550, options [nop,nop,TS val 5075331 ecr 5075331], length 0
1449991991.968836 IP localhost.http-alt > localhost.58648: Flags [P.], seq 12313:13339, ack 1, win 342, options [nop,nop,TS val 5075343 ecr 5075281], length 1026
1449991991.969056 IP localhost.58648 > localhost.http-alt: Flags [.], ack 13339, win 550, options [nop,nop,TS val 5075343 ecr 5075343], length 0
1449991992.018863 IP localhost.http-alt > localhost.58649: Flags [P.], seq 12313:13339, ack 1, win 342, options [nop,nop,TS val 5075356 ecr 5075293], length 1026
1449991992.019124 IP localhost.58649 > localhost.http-alt: Flags [.], ack 13339, win 550, options [nop,nop,TS val 5075356 ecr 5075356], length 0
1449991992.068890 IP localhost.http-alt > localhost.58650: Flags [P.], seq 12313:13339, ack 1, win 342, options [nop,nop,TS val 5075368 ecr 5075306], length 1026
1449991992.069125 IP localhost.58650 > localhost.http-alt: Flags [.], ack 13339, win 550, options [nop,nop,TS val 5075368 ecr 5075368], length 0
1449991992.118912 IP localhost.http-alt > localhost.58646: Flags [P.], seq 13339:14365, ack 1, win 342, options [nop,nop,TS val 5075381 ecr 5075318], length 1026
1449991992.119387 IP localhost.58646 > localhost.http-alt: Flags [.], ack 14365, win 566, options [nop,nop,TS val 5075381 ecr 5075381], length 0
1449991992.168867 IP localhost.http-alt > localhost.58647: Flags [P.], seq 13339:14365, ack 1, win 342, options [nop,nop,TS val 5075393 ecr 5075331], length 1026
1449991992.169258 IP localhost.58647 > localhost.http-alt: Flags [.], ack 14365, win 566, options [nop,nop,TS val 5075393 ecr 5075393], length 0
1449991992.218855 IP localhost.http-alt > localhost.58648: Flags [P.], seq 13339:14365, ack 1, win 342, options [nop,nop,TS val 5075406 ecr 5075343], length 1026
1449991992.219195 IP localhost.58648 > localhost.http-alt: Flags [.], ack 14365, win 566, options [nop,nop,TS val 5075406 ecr 5075406], length 0
1449991992.268869 IP localhost.http-alt > localhost.58649: Flags [P.], seq 13339:14365, ack 1, win 342, options [nop,nop,TS val 5075418 ecr 5075356], length 1026
1449991992.269247 IP localhost.58649 > localhost.http-alt: Flags [.], ack 14365, win 566, options [nop,nop,TS val 5075418 ecr 5075418], length 0
1449991992.318848 IP localhost.http-alt > localhost.58650: Flags [P.], seq 13339:14365, ack 1, win 342, options [nop,nop,TS val 5075431 ecr 5075368], length 1026
1449991992.319208 IP localhost.58650 > localhost.http-alt: Flags [.], ack 14365, win 566, options [nop,nop,TS val 5075431 ecr 5075431], length 0
1449991992.368877 IP localhost.http-alt > localhost.58646: Flags [P.], seq 14365:15391, ack 1, win 342, options [nop,nop,TS val 5075443 ecr 5075381], length 1026
1449991992.369275 IP localhost.58646 > localhost.http-alt: Flags [.], ack 15391, win 582, options [nop,nop,TS val 5075443 ecr 5075443], length 0
1449991992.418877 IP localhost.http-alt > localhost.58647: Flags [P.], seq 14365:15391, ack 1, win 342, options [nop,nop,TS val 5075456 ecr 5075393], length 1026
1449991992.419265 IP localhost.58647 > localhost.http-alt: Flags [.], ack 15391, win 582, options [nop,nop,TS val 5075456 ecr 5075456], length 0
1449991992.468845 IP localhost.http-alt > localhost.58648: Flags [P.], seq 14365:15391, ack 1, win 342, options [nop,nop,TS val 5075468 ecr 5075406], length 1026
1449991992.469166 IP localhost.58648 > localhost.http-alt: Flags [.], ack 15391, win 582, options [nop,nop,TS val 5075468 ecr 5075468], length 0
1449991992.518826 IP localhost.http-alt > localhost.58649: Flags [P.], seq 14365:15391, ack 1, win 342, options [nop,nop,TS val 5075481 ecr 5075418], length 1026
1449991992.519013 IP localhost.58649 > localhost.http-alt: Flags [.], ack 15391, win 582, options [nop,nop,TS val 5075481 ecr 5075481], length 0
1449991992.568871 IP localhost.http-alt > localhost.58650: Flags [P.], seq 14365:15391, ack 1, win 342, options [nop,nop,TS val 5075493 ecr 5075431], length 1026
1449991992.569304 IP localhost.58650 > localhost.http-alt: Flags [.], ack 15391, win 582, options [nop,nop,TS val 5075493 ecr 5075493], length 0
1449991992.618875 IP localhost.http-alt > localhost.58646: Flags [P.], seq 15391:16417, ack 1, win 342, options [nop,nop,TS val 5075506 ecr 5075443], length 1026
1449991992.619213 IP localhost.58646 > localhost.http-alt: Flags [.], ack 16417, win 598, options [nop,nop,TS val 5075506 ecr 5075506], length 0
1449991992.668836 IP localhost.http-alt > localhost.58647: Flags [P.], seq 15391:16417, ack 1, win 342, options [nop,nop,TS val 5075518 ecr 5075456], length 1026
1449991992.669057 IP localhost.58647 > localhost.http-alt: Flags [.], ack 16417, win 598, options [nop,nop,TS val 5075518 ecr 5075518], length 0
1449991992.718872 IP localhost.http-alt > localhost.58648: Flags [P.], seq 15391:16417, ack 1, win 342, options [nop,nop,TS val 5075531 ecr 5075468], length 1026
1449991992.719253 IP localhost.58648 > localhost.http-alt: Flags [.], ack 16417, win 598, options [nop,nop,TS val 5075531 ecr 5075531], length 0
1449991992.768912 IP localhost.http-alt > localhost.58649: Flags [P.], seq 15391:16417, ack 1, win 342, options [nop,nop,TS val 5075543 ecr 5075481], length 1026
1449991992.769444 IP localhost.58649 > localhost.http-alt: Flags [.], ack 16417, win 598, options [nop,nop,TS val 5075543 ecr 5075543], length 0
1449991992.818868 IP localhost.http-alt > localhost.58650: Flags [P.], seq 15391:16417, ack 1, win 342, options [nop,nop,TS val 5075556 ecr 5075493], length 1026
1449991992.819226 IP localhost.58650 > localhost.http-alt: Flags [.], ack 16417, win 598, options [nop,nop,TS val 5075556 ecr 5075556], length 0
1449991992.868859 IP localhost.http-alt > localhost.58646: Flags [P.], seq 16417:17443, ack 1, win 342, options [nop,nop,TS val 5075568 ecr 5075506], length 1026
1449991992.869236 IP localhost.58646 > localhost.http-alt: Flags [.], ack 17443, win 614, options [nop,nop,TS val 5075568 ecr 5075568], length 0
1449991992.918902 IP localhost.http-alt > localhost.58647: Flags [P.], seq 16417:17443, ack 1, win 342, options [nop,nop,TS val 5075581 ecr 5075518], length 1026
1449991992.919320 IP localhost.58647 > localhost.http-alt: Flags [.], ack 17443, win 614, options [nop,nop,TS val 5075581 ecr 5075581], length 0
1449991992.968950 IP localhost.http-alt > localhost.58648: Flags [P.], seq 16417:17443, ack 1, win 342, options [nop,nop,TS val 5075593 ecr 5075531], length 1026
1449991992.969456 IP localhost.58648 > localhost.http-alt: Flags [.], ack 17443, win 614, options [nop,nop,TS val 5075593 ecr 5075593], length 0
1449991993.018886 IP localhost.http-alt > localhost.58649: Flags [P.], seq 16417:17443, ack 1, win 342, options [nop,nop,TS val 5075606 ecr 5075543], length 1026
1449991993.019232 IP localhost.58649 > localhost.http-alt: Flags [.], ack 17443, win 614, options [nop,nop,TS val 5075606 ecr 5075606], length 0
1449991993.068854 IP localhost.http-alt > localhost.58650: Flags [P.], seq 16417:17443, ack 1, win 342, options [nop,nop,TS val 5075618 ecr 5075556], length 1026
1449991993.069050 IP localhost.58650 > localhost.http-alt: Flags [.], ack 17443, win 614, options [nop,nop,TS val 5075618 ecr 5075618], length 0
1449991993.118936 IP localhost.http-alt > localhost.58646: Flags [P.], seq 17443:18469, ack 1, win 342, options [nop,nop,TS val 5075631 ecr 5075568], length 1026
1449991993.119408 IP localhost.58646 > localhost.http-alt: Flags [.], ack 18469, win 630, options [nop,nop,TS val 5075631 ecr 5075631], length 0
1449991993.168949 IP localhost.http-alt > localhost.58647: Flags [P.], seq 17443:18469, ack 1, win 342, options [nop,nop,TS val 5075643 ecr 5075581], length 1026
1449991993.169454 IP localhost.58647 > localhost.http-alt: Flags [.], ack 18469, win 630, options [nop,nop,TS val 5075643 ecr 5075643], length 0
1449991993.218867 IP localhost.http-alt > localhost.58648: Flags [P.], seq 17443:18469, ack 1, win 342, options [nop,nop,TS val 5075656 ecr 5075593], length 1026
1449991993.219079 IP localhost.58648 > localhost.http-alt: Flags [.], ack 18469, win 630, options [nop,nop,TS val 5075656 ecr 5075656], length 0
1449991993.268885 IP localhost.http-alt > localhost.58649: Flags [P.], seq 17443:18469, ack 1, win 342, options [nop,nop,TS val 5075668 ecr 5075606], length 1026
1449991993.269276 IP localhost.58649 > localhost.http-alt: Flags [.], ack 18469, win 630, options [nop,nop,TS val 5075668 ecr 5075668], length 0
1449991993.318897 IP localhost.http-alt > localhost.58650: Flags [P.], seq 17443:18469, ack 1, win 342, options [nop,nop,TS val 5075681 ecr 5075618], length 1026
1449991993.319271 IP localhost.58650 > localhost.http-alt: Flags [.], ack 18469, win 630, options [nop,nop,TS val 5075681 ecr 5075681], length 0
1449991993.368885 IP localhost.http-alt > localhost.58646: Flags [P.], seq 18469:19495, ack 1, win 342, options [nop,nop,TS val 5075693 ecr 5075631], length 1026
1449991993.369289 IP localhost.58646 > localhost.http-alt: Flags [.], ack 19495, win 646, options [nop,nop,TS val 5075693 ecr 5075693], length 0
1449991993.418854 IP localhost.http-alt > localhost.58647: Flags [P.], seq 18469:19495, ack 1, win 342, options [nop,nop,TS val 5075706 ecr 5075643], length 1026
1449991993.419214 IP localhost.58647 > localhost.http-alt: Flags [.], ack 19495, win 646, options [nop,nop,TS val 5075706 ecr 5075706], length 0
1449991993.468850 IP localhost.http-alt > localhost.58648: Flags [P.], seq 18469:19495, ack 1, win 342, options [nop,nop,TS val 5075718 ecr 5075656], length 1026
1449991993.469071 IP localhost.58648 > localhost.http-alt: Flags [.], ack 19495, win 646, options [nop,nop,TS val 5075718 ecr 5075718], length 0
1449991993.518850 IP localhost.http-alt > localhost.58649: Flags [P.], seq 18469:19495, ack 1, win 342, options [nop,nop,TS val 5075731 ecr 5075668], length 1026
1449991993.519043 IP localhost.58649 > localhost.http-alt: Flags [.], ack 19495, win 646, options [nop,nop,TS val 5075731 ecr 5075731], length 0
1449991993.568846 IP localhost.http-alt > localhost.58650: Flags [P.], seq 18469:19495, ack 1, win 342, options [nop,nop,TS val 5075743 ecr 5075681], length 1026
1449991993.569047 IP localhost.58650 > localhost.http-alt: Flags [.], ack 19495, win 646, options [nop,nop,TS val 5075743 ecr 5075743], length 0
1449991993.618903 IP localhost.http-alt > localhost.58646: Flags [P.], seq 19495:20521, ack 1, win 342, options [nop,nop,TS val 5075756 ecr 5075693], length 1026
1449991993.619303 IP localhost.58646 > localhost.http-alt: Flags [.], ack 20521, win 662, options [nop,nop,TS val 5075756 ecr 5075756], length 0
1449991993.668948 IP localhost.http-alt > localhost.58647: Flags [P.], seq 19495:20521, ack 1, win 342, options [nop,nop,TS val 5075768 ecr 5075706], length 1026
1449991993.669447 IP localhost.58647 > localhost.http-alt: Flags [.], ack 20521, win 662, options [nop,nop,TS val 5075768 ecr 5075768], length 0
1449991993.718855 IP localhost.http-alt > localhost.58648: Flags [P.], seq 19495:20521, ack 1, win 342, options [nop,nop,TS val 5075781 ecr 5075718], length 1026
1449991993.719063 IP localhost.58648 > localhost.http-alt: Flags [.], ack 20521, win 662, options [nop,nop,TS val 5075781 ecr 5075781], length 0
1449991993.768879 IP localhost.http-alt > localhost.58649: Flags [P.], seq 19495:20521, ack 1, win 342, options [nop,nop,TS val 5075793 ecr 5075731], length 1026
1449991993.769214 IP localhost.58649 > localhost.http-alt: Flags [.], ack 20521, win 662, options [nop,nop,TS val 5075793 ecr 5075793], length 0
1449991993.818900 IP localhost.http-alt > localhost.58650: Flags [P.], seq 19495:20521, ack 1, win 342, options [nop,nop,TS val 5075806 ecr 5075743], length 1026
1449991993.819398 IP localhost.58650 > localhost.http-alt: Flags [.], ack 20521, win 662, options [nop,nop,TS val 5075806 ecr 5075806], length 0
1449991993.868820 IP localhost.http-alt > localhost.58646: Flags [P.], seq 20521:21547, ack 1, win 342, options [nop,nop,TS val 5075818 ecr 5075756], length 1026
1449991993.869028 IP localhost.58646 > localhost.http-alt: Flags [.], ack 21547, win 678, options [nop,nop,TS val 5075818 ecr 5075818], length 0
1449991993.919031 IP localhost.http-alt > localhost.58647: Flags [P.], seq 20521:21547, ack 1, win 342, options [nop,nop,TS val 5075831 ecr 5075768], length 1026
1449991993.919218 IP localhost.58647 > localhost.http-alt: Flags [.], ack 21547, win 678, options [nop,nop,TS val 5075831 ecr 5075831], length 0
1449991993.968905 IP localhost.http-alt > localhost.58648: Flags [P.], seq 20521:21547, ack 1, win 342, options [nop,nop,TS val 5075843 ecr 5075781], length 1026
1449991993.969259 IP localhost.58648 > localhost.http-alt: Flags [.], ack 21547, win 678, options [nop,nop,TS val 5075843 ecr 5075843], length 0
1449991994.018838 IP localhost.http-alt > localhost.58649: Flags [P.], seq 20521:21547, ack 1, win 342, options [nop,nop,TS val 5075856 ecr 5075793], length 1026
1449991994.019037 IP localhost.58649 > localhost.http-alt: Flags [.], ack 21547, win 678, options [nop,nop,TS val 5075856 ecr 5075856], length 0
1449991994.068845 IP localhost.http-alt > localhost.58650: Flags [P.], seq 20521:21547, ack 1, win 342, options [nop,nop,TS val 5075868 ecr 5075806], length 1026
1449991994.069120 IP localhost.58650 > localhost.http-alt: Flags [.], ack 21547, win 678, options [nop,nop,TS val 5075868 ecr 5075868], length 0
1449991994.118837 IP localhost.http-alt > localhost.58646: Flags [P.], seq 21547:22573, ack 1, win 342, options [nop,nop,TS val 5075881 ecr 5075818], length 1026
1449991994.119124 IP localhost.58646 > localhost.http-alt: Flags [.], ack 22573, win 695, options [nop,nop,TS val 5075881 ecr 5075881], length 0
1449991994.168873 IP localhost.http-alt > localhost.58647: Flags [P.], seq 21547:22573, ack 1, win 342, options [nop,nop,TS val 5075893 ecr 5075831], length 1026
1449991994.169078 IP localhost.58647 > localhost.http-alt: Flags [.], ack 22573, win 695, options [nop,nop,TS val 5075893 ecr 5075893], length 0
1449991994.218865 IP localhost.http-alt > localhost.58648: Flags [P.], seq 21547:22573, ack 1, win 342, options [nop,nop,TS val 5075906 ecr 5075843], length 1026
1449991994.219236 IP localhost.58648 > localhost.http-alt: Flags [.], ack 22573, win 695, options [nop,nop,TS val 5075906 ecr 5075906], length 0
1449991994.268839 IP localhost.http-alt > localhost.58649: Flags [P.], seq 21547:22573, ack 1, win 342, options [nop,nop,TS val 5075918 ecr 5075856], length 1026
1449991994.269169 IP localhost.58649 > localhost.http-alt: Flags [.], ack 22573, win 695, options [nop,nop,TS val 5075918 ecr 5075918], length 0
1449991994.318837 IP localhost.http-alt > localhost.58650: Flags [P.], seq 21547:22573, ack 1, win 342, options [nop,nop,TS val 5075931 ecr 5075868], length 1026
1449991994.319198 IP localhost.58650 > localhost.http-alt: Flags [.], ack 22573, win 695, options [nop,nop,TS val 5075931 ecr 5075931], length 0
1449991994.368868 IP localhost.http-alt > localhost.58646: Flags [P.], seq 22573:23599, ack 1, win 342, options [nop,nop,TS val 5075943 ecr 5075881], length 1026
1449991994.369193 IP localhost.58646 > localhost.http-alt: Flags [.], ack 23599, win 711, options [nop,nop,TS val 5075943 ecr 5075943], length 0
1449991994.418837 IP localhost.http-alt > localhost.58647: Flags [P.], seq 22573:23599, ack 1, win 342, options [nop,nop,TS val 5075956 ecr 5075893], length 1026
1449991994.419168 IP localhost.58647 > localhost.http-alt: Flags [.], ack 23599, win 711, options [nop,nop,TS val 5075956 ecr 5075956], length 0
1449991994.468868 IP localhost.http-alt > localhost.58648: Flags [P.], seq 22573:23599, ack 1, win 342, options [nop,nop,TS val 5075968 ecr 5075906], length 1026
1449991994.469222 IP localhost.58648 > localhost.http-alt: Flags [.], ack 23599, win 711, options [nop,nop,TS val 5075968 ecr 5075968], length 0
1449991994.518832 IP localhost.http-alt > localhost.58649: Flags [P.], seq 22573:23599, ack 1, win 342, options [nop,nop,TS val 5075981 ecr 5075918], length 1026
1449991994.519158 IP localhost.58649 > localhost.http-alt: Flags [.], ack 23599, win 711, options [nop,nop,TS val 5075981 ecr 5075981], length 0
1449991994.568839 IP localhost.http-alt > localhost.58650: Flags [P.], seq 22573:23599, ack 1, win 342, options [nop,nop,TS val 5075993 ecr 5075931], length 1026
1449991994.569138 IP localhost.58650 > localhost.http-alt: Flags [.], ack 23599, win 711, options [nop,nop,TS val 5075993 ecr 5075993], length 0
1449991994.618833 IP localhost.http-alt > localhost.58646: Flags [P.], seq 23599:24625, ack 1, win 342, options [nop,nop,TS val 5076006 ecr 5075943], length 1026
1449991994.619167 IP localhost.58646 > localhost.http-alt: Flags [.], ack 24625, win 727, options [nop,nop,TS val 5076006 ecr 5076006], length 0
1449991994.668830 IP localhost.http-alt > localhost.58647: Flags [P.], seq 23599:24625, ack 1, win 342, options [nop,nop,TS val 5076018 ecr 5075956], length 1026
1449991994.669157 IP localhost.58647 > localhost.http-alt: Flags [.], ack 24625, win 727, options [nop,nop,TS val 5076018 ecr 5076018], length 0
1449991994.718860 IP localhost.http-alt > localhost.58648: Flags [P.], seq 23599:24625, ack 1, win 342, options [nop,nop,TS val 5076031 ecr 5075968], length 1026
1449991994.719219 IP localhost.58648 > localhost.http-alt: Flags [.], ack 24625, win 727, options [nop,nop,TS val 5076031 ecr 5076031], length 0
1449991994.768832 IP localhost.http-alt > localhost.58649: Flags [P.], seq 23599:24625, ack 1, win 342, options [nop,nop,TS val 5076043 ecr 5075981], length 1026
1449991994.769150 IP localhost.58649 > localhost.http-alt: Flags [.], ack 24625, win 727, options [nop,nop,TS val 5076043 ecr 5076043], length 0
1449991994.818836 IP localhost.http-alt > localhost.58650: Flags [P.], seq 23599:24625, ack 1, win 342, options [nop,nop,TS val 5076056 ecr 5075993], length 1026
1449991994.819170 IP localhost.58650 > localhost.http-alt: Flags [.], ack 24625, win 727, options [nop,nop,TS val 5076056 ecr 5076056], length 0
1449991994.868815 IP localhost.http-alt > localhost.58646: Flags [P.], seq 24625:25651, ack 1, win 342, options [nop,nop,TS val 5076068 ecr 5076006], length 1026
1449991994.869122 IP localhost.58646 > localhost.http-alt: Flags [.], ack 25651, win 743, options [nop,nop,TS val 5076068 ecr 5076068], length 0
1449991994.918832 IP localhost.http-alt > localhost.58647: Flags [P.], seq 24625:25651, ack 1, win 342, options [nop,nop,TS val 5076081 ecr 5076018], length 1026
1449991994.919150 IP localhost.58647 > localhost.http-alt: Flags [.], ack 25651, win 743, options [nop,nop,TS val 5076081 ecr 5076081], length 0
1449991994.968841 IP localhost.http-alt > localhost.58648: Flags [P.], seq 24625:25651, ack 1, win 342, options [nop,nop,TS val 5076093 ecr 5076031], length 1026
